date,username,to,replies,retweets,favorites,text,geo,mentions,hashtags,id,permalink
2020-06-20 18:48:08,_blinkonchesdl,"ANYONE DESERVES A GRAMMY",https://twitter.com/_blinkonchesdl/status/1274413741942210567
2020-06-20 18:48:07,DennisWaldron10,"As soon as the collective IQ reaches 100 the gates will be closed again because the arena will be full.",https://twitter.com/DennisWaldron10/status/1274413739836493824
2020-06-20 18:48:06,TheLizLincoln,"Wait, you can? That’s a game changer.",https://twitter.com/TheLizLincoln/status/1274413735902425093
2020-06-20 18:48:01,Samalynnroots89,"@LZZYHALE @TheJoeStorm @Halestorm thanks for making corntin' more bearable. Til we meet again my friends pic.twitter.com/LpnjecxqhI",https://twitter.com/Samalynnroots89/status/1274413713454444546
2020-06-20 18:47:49,VitormanoelCom,"Download Voicemod now for FREE! The best weapon for players and content creators -> - The best real-time Voice Changer - Amazing Soundboard - Collection of over 70 original voices - Voice Maker Troll like a PRO! http://bit.ly/2PO8Qj0 #Voicechanger",https://twitter.com/VitormanoelCom/status/1274413662028156929
2020-06-20 18:47:47,mishaley,"This is bonkers. The system watched video of people playing Pac-Man and then WROTE THE GAME IN CODE https://twitter.com/twominutepapers/status/1274336546481680384 …",https://twitter.com/mishaley/status/1274413655451287552
2020-06-20 18:47:41,mollythroupx,"Lily missed her nap today because we went to a house viewing and it’s safe to say she is not ready for no naps. Tantrum galore from 4 o’clock then sparked out at 7",https://twitter.com/mollythroupx/status/1274413627878105090
2020-06-20 18:47:37,thotlisaa,"Their notifications",https://twitter.com/thotlisaa/status/1274413611704700929
2020-06-20 18:47:35,PintoGotABag,"Just got a call from a unsaved number that read 773-Dis-YoEx",https://twitter.com/PintoGotABag/status/1274413604419272705
2020-06-20 18:47:29,Ranplimo,"Hello, I herb ... I ordered your application 17 days ago, the request was not updated, and SMSA says it has not been received, when will it be updated? Application No. 412840338",https://twitter.com/Ranplimo/status/1274413579186458628
2020-06-20 18:47:27,EdTechHawk,"This is PERFECT!!! Using linked slides as a digital planner @mrs_alireams @jjmathrocks @JJP_Tech @RISDiTeam @AGallo0821 @kimperclefarias @MsDavisClass3 @ariannakcooper @MsBowlesRWJHhttps://twitter.com/SlidesManiaSM/status/1274381140313477120 …",https://twitter.com/EdTechHawk/status/1274413572349743105
2020-06-20 18:47:25,Anesu_Madz97,"Wondering why I've never noticed girls that run track",https://twitter.com/Anesu_Madz97/status/1274413561830346752
2020-06-20 18:47:21,SebastianAthea,"That's you don't need them",https://twitter.com/SebastianAthea/status/1274413544130392064
2020-06-20 18:47:19,_TomLFC,"Wow... this looks amazing #cybertruckhttps://twitter.com/cybertrucktesla/status/1274399506851926019 …",https://twitter.com/_TomLFC/status/1274413537239105537
2020-06-20 18:46:59,xmewgulfiex,"i wanna boyfriend because i am lonely and i want kisses and hugs from my boyfriend but i don't have boyfriend bye",https://twitter.com/xmewgulfiex/status/1274413455634808834
2020-06-20 18:46:57,chelseatayl0r,"alright I think I like the ordinary more than drunk elephant and it’s like 10% of the price!!",https://twitter.com/chelseatayl0r/status/1274413447476678656
2020-06-20 18:46:46,jill_silverman_,"Nobody tells you a scientist writes & meets",https://twitter.com/jill_silverman_/status/1274413397564551168
2020-06-20 18:46:43,DevilinMaBrain,"Wait wait wait... So Liam slept with him, k worded his girlfriend and then slept with him again?",https://twitter.com/DevilinMaBrain/status/1274413387800338433
2020-06-20 18:46:41,longa_lokuyu,"Yeah, shooters shoot.",https://twitter.com/longa_lokuyu/status/1274413379180994565
2020-06-20 18:46:39,Briankimathi45,"A pussy is the only cat that vomits milk",https://twitter.com/Briankimathi45/status/1274413370926665729
2020-06-20 18:46:25,4evaMook,"we sending 223s u bet not sneeze or my niggas goin bless u",https://twitter.com/4evaMook/status/1274413309857579009
2020-06-20 18:46:24,__kingkittyy,"You do NOT have experiences as a black person, you have experiences as a MIXED person & if you’re still checking off “black” on a census then you’re being dishonest. All of this gaslighting because y’all can never just truly accept who you are is ASTRONOMICAL!",https://twitter.com/__kingkittyy/status/1274413307672305665
2020-06-20 18:46:24,whyinmybld,"city girls",https://twitter.com/whyinmybld/status/1274413305931718656
2020-06-20 18:46:23,Ozzie_Osburn,"That was deep bro https://twitter.com/legalintent/status/1274402322307862531 …",https://twitter.com/Ozzie_Osburn/status/1274413302689550337
2020-06-20 18:46:22,BarsOfTheBest,"This 2 Chainz feature goes way too hard pic.twitter.com/Rdf1JbAq3R",https://twitter.com/BarsOfTheBest/status/1274413299795460099
2020-06-20 18:46:19,Jory_712,"You have a beautiful smile",https://twitter.com/Jory_712/status/1274413285329317889
2020-06-20 18:46:19,robiG12,"Surreal...they go like lambs to the slaughter",https://twitter.com/robiG12/status/1274413284096004101
2020-06-20 18:46:14,monsterazzi,"I just finished the last episode of Love Victor and CAN I SAY IM SHOOK?!!!",https://twitter.com/monsterazzi/status/1274413264672296961
2020-06-20 18:46:12,smmashhleeyyy,"This made my brain hurt https://twitter.com/aravosis/status/1274355082402955269 …",https://twitter.com/smmashhleeyyy/status/1274413255700574208
2020-06-20 18:46:09,philmor38386543,"NO DISCUSSION... RACISM MUST END !!! HOWEVER WHEN THE FLAG IS THE FOCUS OF ANGER PROTEST TURNS TRAGIC FLAG IS THE SYMBOL FOR ALL AMERICANS REPRESENTS FREEDOM & LIBERTY FOR AMERICA IS NOT THE PROBLEM TO BE DESTROYED PROTEST RACISM",https://twitter.com/philmor38386543/status/1274413245928026115
2020-06-20 18:46:09,ConmanSir,"Bloody hell, theve nicked the Vicar's Bike. . Awful .",https://twitter.com/ConmanSir/status/1274413243193311234
2020-06-20 18:46:01,Jinjar247,"That blew his mind",https://twitter.com/Jinjar247/status/1274413212289699843
2020-06-20 18:45:59,MrSirGuy1,"Download Voicemod now for FREE! The best weapon for players and content creators -> - The best real-time Voice Changer - Amazing Soundboard - Collection of over 70 original voices - Voice Maker Troll like a PRO! http://bit.ly/2PO8Qj0 #Voicechanger",https://twitter.com/MrSirGuy1/status/1274413201824890882
2020-06-20 18:45:54,_blinkonchesdl,"ANYONE DESERVES A GRAMMY",https://twitter.com/_blinkonchesdl/status/1274413182623322114
2020-06-20 18:45:50,username0x0a,"There was beer and food containers, no boxed veggie stuff and Odwalla.",https://twitter.com/username0x0a/status/1274413166404001793
2020-06-20 18:45:49,M_i_k_e_20,"I like it kells hope you had a good time going out",https://twitter.com/M_i_k_e_20/status/1274413159290265600
2020-06-20 18:45:49,MadiTaylorX,"Wait this is a thing???",https://twitter.com/MadiTaylorX/status/1274413158464212999
2020-06-20 18:45:47,BkzThuggPassion,"Come and see Kakess 's LIVE in #BIGOLIVE: Missed your slice? https://slink.bigovideo.tv/qadxcz pic.twitter.com/E8c984cH3K",https://twitter.com/BkzThuggPassion/status/1274413152973832197
2020-06-20 18:45:46,DallasTechGirl,"You wove that??? WOWZERS it is enchanting. Do you have any hustle secrets for other mom entrepreneurs?",https://twitter.com/DallasTechGirl/status/1274413145843552257
2020-06-20 18:45:43,snowhunnithedon,"being pathetic enough to publicly claim a dude who knowingly cheats on you, admits they use you for money and rides, but still have the nerve to think bitches want him like that and be mad at the BITCHES for showing you receipts on “YOUR” dude, embarrassed for y’all",https://twitter.com/snowhunnithedon/status/1274413135558918144
2020-06-20 18:45:38,_zeexual,"oh good Lord stop pouring more fuel and wood to the fire can we just rest for a while? kahit saglit lang? matuto muna magfact-check and never let your emotions dictate your words pic.twitter.com/Q8ddlAi8iB",https://twitter.com/_zeexual/status/1274413113148706816
2020-06-20 18:45:19,jnsovI,"I WAS KIDDING i voted funny",https://twitter.com/jnsovI/status/1274413035868827650
2020-06-20 18:45:19,arrenervated,"We know kakie https://twitter.com/kakiep83/status/1274307495117242368 …",https://twitter.com/arrenervated/status/1274413034220355584
2020-06-20 18:45:16,tydimaano,"her mind https://twitter.com/daya_betty417/status/1274408399720067072 …",https://twitter.com/tydimaano/status/1274413023503847424
2020-06-20 18:45:16,Game_pusher,"These are the most beautiful bubbles everrrrrrr SO PRETTYYYYY",https://twitter.com/Game_pusher/status/1274413022291820545
2020-06-20 18:45:09,Dafneconefe,"What?! https://twitter.com/DanannRock/status/1274132539096158208 …",https://twitter.com/Dafneconefe/status/1274412990968860673
2020-06-20 18:45:05,undftd_rEEZ,"Imagine if he never got hurt or never played while hurt ... https://twitter.com/slamrewind/status/1274363881935142913 …",https://twitter.com/undftd_rEEZ/status/1274412973625192448
2020-06-20 18:44:55,StarNichole2,"I just be clownin y'all! Dont be so serious",https://twitter.com/StarNichole2/status/1274412934995697665
2020-06-20 18:44:53,MythSerene,"You really can’t make it up. (It’s almost unbelievable. Almost.) I know I’m just repeating you, Grandpa, but wth. https://twitter.com/mythserene/status/1274412479813206016?s=21 …https://twitter.com/mythserene/status/1274412479813206016 …",https://twitter.com/MythSerene/status/1274412924908568578
2020-06-20 18:44:50,WestonJK,"Already reported that six staffers at the hate rally tested positive for COVID. Let the games begin.",https://twitter.com/WestonJK/status/1274412912283578368
2020-06-20 18:44:46,MoeTasticJr,"I’ve gained 5 lbs.... since high school",https://twitter.com/MoeTasticJr/status/1274412895993028608
2020-06-20 18:44:43,yiizo,"Education, fun AND employment? Take my money https://twitter.com/docspitsfire06/status/1274408663202086912 …",https://twitter.com/yiizo/status/1274412884601081856
2020-06-20 18:44:42,nmadzenga,"6 Men fathered 87 children with 50 different women. pic.twitter.com/l4zUpi7pyc",https://twitter.com/nmadzenga/status/1274412880985800704
2020-06-20 18:44:41,kimfairybjb,"heyaaaa! can yall send me your most fave pic of your bias in #iKON? need it for science. lol, yall know its for an AU.",https://twitter.com/kimfairybjb/status/1274412876296368128
2020-06-20 18:44:40,keloswavy,"Shocking",https://twitter.com/keloswavy/status/1274412870038675457
2020-06-20 18:44:32,tameroncate,"being a Leo is such a flex",https://twitter.com/tameroncate/status/1274412837151150082
2020-06-20 18:44:30,pandaunrevealed,"I didn't know there is a ""Yes or No 2.5""",https://twitter.com/pandaunrevealed/status/1274412827755687937
2020-06-20 18:44:28,Nelzzzzz32,"Ainno way it’s only 2:44 in the afternoon lolz",https://twitter.com/Nelzzzzz32/status/1274412818369052673
2020-06-20 18:44:26,Ibrahim70605554,"Now I like you",https://twitter.com/Ibrahim70605554/status/1274412813742727170
2020-06-20 18:44:24,hellosunschein,"If you highlight emojis in a tweet on a mac, the emoji turns into the regular mac one ! pic.twitter.com/UqPej3D3VP",https://twitter.com/hellosunschein/status/1274412804775297025
2020-06-20 18:44:21,SadZerrr,"Who tf eats pizza without ketchup? https://twitter.com/ch3rxy/status/1274386856264818694 …",https://twitter.com/SadZerrr/status/1274412790070083587
2020-06-20 18:44:09,guerraalfonso,"Reposted from nbaoncourt Cousins... Imagine if they stayed on the SAME team - #regrann https://www.instagram.com/p/CBqtrdCFIcJQcrG9Eder2X6p1FXRq4uci9C1Vg0/?igshid=bub434t1drww …",https://twitter.com/guerraalfonso/status/1274412741340643330
2020-06-20 18:44:07,Rileyoss,"So I just watched a Cravity video for the first time and Hyeong-Jun looks awful lot like the boy from X1 pic.twitter.com/tfuUCIpPFJ",https://twitter.com/Rileyoss/status/1274412730615816193
2020-06-20 18:44:06,mickeydadoll_,"thanks for pmo cuz I will never type a story again",https://twitter.com/mickeydadoll_/status/1274412726358609920
2020-06-20 18:44:04,jimmyliy,"Download Voicemod now for FREE! The best weapon for players and content creators -> - The best real-time Voice Changer - Amazing Soundboard - Collection of over 70 original voices - Voice Maker Troll like a PRO! http://bit.ly/2PO8Qj0 #Voicechanger",https://twitter.com/jimmyliy/status/1274412721350598656
2020-06-20 18:44:00,MimiRossiJ,"Brexiteers never ask themselves why Farage the Fascist was desperate to leave EU with Le Pen & other fascists. Why does far right want to destroy EU? They hope to install their Fascist Order but UK is alone no EU countries followed. UK now whipping boy for USA/China/Russia!",https://twitter.com/MimiRossiJ/status/1274412704732721157
2020-06-20 18:43:59,Patrick76330578,"Thanks",https://twitter.com/Patrick76330578/status/1274412700710383617
2020-06-20 18:43:59,EugeneSona2,"So it can be destroyed without commotion.",https://twitter.com/EugeneSona2/status/1274412699431194630
2020-06-20 18:43:55,abby_bradyx,"It's doing my head in!! All for a socially distance mate date, but when everyone's cuddled up in a pic ?! Miss you so much!!",https://twitter.com/abby_bradyx/status/1274412683065012226
2020-06-20 18:43:55,JoshSimmons_cds,"This nigga Future really be spittin pic.twitter.com/cFWZVKKMw2",https://twitter.com/JoshSimmons_cds/status/1274412680443498496
2020-06-20 18:43:54,TaverleyDungeon,"bet y’all didn’t know the toosie slide is the moonwalk",https://twitter.com/TaverleyDungeon/status/1274412677188784131
2020-06-20 18:43:50,I_Hate_Tra,"Whole lotta pressure in my presence",https://twitter.com/I_Hate_Tra/status/1274412662462562304
2020-06-20 18:43:49,robiG12,"Exactly!! They have completely flipped their script",https://twitter.com/robiG12/status/1274412657085480960
2020-06-20 18:43:49,KestreaI,"I just got told I was a snake by a girl that posted a old friends nudes",https://twitter.com/KestreaI/status/1274412656972009472
2020-06-20 18:43:49,bbexyyy,"not to be dramatic but why isn’t anyone making me food and/or buying me food and delivering it to me in bed rn?",https://twitter.com/bbexyyy/status/1274412656162635779
2020-06-20 18:43:48,DambisaD,"What are these https://twitter.com/_YandzMan/status/1274394861291126785 …",https://twitter.com/DambisaD/status/1274412651330879489
2020-06-20 18:43:47,M_i_k_e_20,"Oh my goodness her outfit haha",https://twitter.com/M_i_k_e_20/status/1274412647220273152
2020-06-20 18:43:44,migolocoporvida,"My brain hurts, yet I don't even have one",https://twitter.com/migolocoporvida/status/1274412635694395392
2020-06-20 18:43:37,beelzbub666,"Nope still can't find you",https://twitter.com/beelzbub666/status/1274412606191788032
2020-06-20 18:43:35,TylerVizza222,"y'all remember when @Subtronics dropped lotus eater and that gas in the same set",https://twitter.com/TylerVizza222/status/1274412599854186496
2020-06-20 18:43:30,Gorgeousmi_,"The level of frustration I feel today is insane",https://twitter.com/Gorgeousmi_/status/1274412575233540097
2020-06-20 18:43:26,purplejiminie13,"you think he’d pull an agust d? we weren’t ready for that, imagine when this one eventually drops",https://twitter.com/purplejiminie13/status/1274412560041644032
2020-06-20 18:43:24,MiaHoneyLondon,"This girl got me! https://twitter.com/SerenaSahirNYC/status/1274405403850190848 …",https://twitter.com/MiaHoneyLondon/status/1274412552953438219
2020-06-20 18:43:22,Cereena_Jayyy,"@citygirls went tf crazyyyy",https://twitter.com/Cereena_Jayyy/status/1274412544258535424
2020-06-20 18:43:22,Trooper_,"This is my first time at a @microcenter store... HOLY SHIT I had no idea they were this OP pic.twitter.com/LLrrds56ST",https://twitter.com/Trooper_/status/1274412542518013957
2020-06-20 18:43:22,OfficialJKate_,"Got like 10 massages to do I should’ve choose sleep over entertainment last night #Exhausted",https://twitter.com/OfficialJKate_/status/1274412542031429632
2020-06-20 18:43:21,AnnaHenschel,"Really intense. Kudos for listening on your commute!",https://twitter.com/AnnaHenschel/status/1274412537971380224
2020-06-20 18:43:21,TheOnlyKiiNG,"I can’t trust no one I can’t even trust myself",https://twitter.com/TheOnlyKiiNG/status/1274412537627447296
2020-06-20 18:43:18,EazyPZA,"Imagine Salah wearing out defenders for 80 mins then chucking Traore on for the last 10 mins",https://twitter.com/EazyPZA/status/1274412528563519490
2020-06-20 18:43:16,CharisHamilton8,"Unnecessary tragedy to come, all because we have inept leadership at the top.",https://twitter.com/CharisHamilton8/status/1274412517234806784
2020-06-20 18:43:16,bryanbrinkman,"An audio/visual experience! https://twitter.com/annrongg/status/1274412164628054016 …",https://twitter.com/bryanbrinkman/status/1274412516513284099
2020-06-20 18:43:14,timthorne_,"Purchase the Phone Flipping Academy for only $55 going back up to $97 and you get a chance to win $350!! Only have till 12 midnight! Use code ‘WEALTH’ Get it here: https://gumroad.com/a/485258355",https://twitter.com/timthorne_/status/1274412511815708675
2020-06-20 18:43:14,convaiI,"Keep wtf why would u scrap that",https://twitter.com/convaiI/status/1274412508464455681
2020-06-20 18:43:13,nelson_vvs,"This fucking song https://music.apple.com/ng/album/reality/1515401941?i=1515402149 …",https://twitter.com/nelson_vvs/status/1274412506564440065
2020-06-20 18:43:09,Jupetweets,"Download Voicemod now for FREE! The best weapon for players and content creators -> - The best real-time Voice Changer - Amazing Soundboard - Collection of over 70 original voices - Voice Maker Troll like a PRO! http://bit.ly/2PO8Qj0 #Voicechanger",https://twitter.com/Jupetweets/status/1274412488344211456
2020-06-20 18:43:03,triefox_,"Download Voicemod now for FREE! The best weapon for players and content creators -> - The best real-time Voice Changer - Amazing Soundboard - Collection of over 70 original voices - Voice Maker Troll like a PRO! http://bit.ly/2PO8Qj0 #Voicechanger",https://twitter.com/triefox_/status/1274412464952803330
2020-06-20 18:43:03,TrpxMr,"EPIC BRO https://twitter.com/fazeclan/status/1274098058675052544 …",https://twitter.com/TrpxMr/status/1274412464302628865
2020-06-20 18:42:55,tearinmyhxxart,"this means that i am ʟᴀʀʀʏ... sooo it’s real pic.twitter.com/INxUjpTun1",https://twitter.com/tearinmyhxxart/status/1274412430840475649
2020-06-20 18:42:55,harmonoff,"Bouncin my head off the wall ...",https://twitter.com/harmonoff/status/1274412428537839617
2020-06-20 18:42:53,Patrick46983728,"We did NOT know that the daytime and the nighttime videos were two different objects until MUFON confirmed via email that they were not the same.",https://twitter.com/Patrick46983728/status/1274412423433183232
2020-06-20 18:42:41,MissAshes92,"That's awesome! See I haven't done a ton of EQ prep so that's actually a new one for me.",https://twitter.com/MissAshes92/status/1274412372271206400
2020-06-20 18:42:41,brxxzeway_,"You know you are terrible person when NO ONE is on your side...sis even the devil has advocates",https://twitter.com/brxxzeway_/status/1274412370446737412
2020-06-20 18:42:33,Only1Garrett,"Keeping past statements and billing statements from years ago. Why do it keep it? Finally shredding!",https://twitter.com/Only1Garrett/status/1274412339278708736
2020-06-20 18:42:31,yngwolf7,"Thank you! https://www.macrovoices.com/guest-content/list-guest-publications/3502-the-allegory-of-the-hawk-and-serpent/file …",https://twitter.com/yngwolf7/status/1274412328554049539
2020-06-20 18:42:29,SomoneH,"Let’s goooo.. pic.twitter.com/6vV3stP9Rf",https://twitter.com/SomoneH/status/1274412321138302977
2020-06-20 18:42:27,_brau1589,"im sure he has a rotation he wears out here and there... suk every time is like",https://twitter.com/_brau1589/status/1274412314561781762
2020-06-20 18:42:22,therealni__,"this girl still dm me 45 mins later , bye I caught you & you cant make it make sense at alllll",https://twitter.com/therealni__/status/1274412292998860802
2020-06-20 18:42:22,journsmama,"it’s crazy out here",https://twitter.com/journsmama/status/1274412291232915456
2020-06-20 18:42:20,worshipagustd2,"biologically a true god https://twitter.com/sirfkfc/status/1274010645592190977 …",https://twitter.com/worshipagustd2/status/1274412282978676737
2020-06-20 18:42:17,Imdpkthakur,"#solareclipse -21June #FathersDay -21June #YogaDay -21June #Longestday -21June #Duniya_kab_khatam_hogi -21Junepic.twitter.com/SNr55fvwK3",https://twitter.com/Imdpkthakur/status/1274412269657624576
2020-06-20 18:42:03,Eric71340540,"@chillthrill709 hi chill, I can't do ring quest in new update it's out of bound and jet explode",https://twitter.com/Eric71340540/status/1274412211113361408
2020-06-20 18:42:00,RossKnight97,"Find it crazy the way we played when almost half our team was academy graduates",https://twitter.com/RossKnight97/status/1274412198257983490
2020-06-20 18:41:59,AidenPrettii,"Having claws and jerking off, looks like a handjob from a bad Bitch. Just saying. New nails btw pic.twitter.com/TFgsOdhrBj",https://twitter.com/AidenPrettii/status/1274412197331054593
2020-06-20 18:41:50,BrendonArkless,"Been bit busy me past week or two. Time to retire.",https://twitter.com/BrendonArkless/status/1274412159183785991
2020-06-20 18:41:39,ScottGr75010621,"Huh? There is crime there too?",https://twitter.com/ScottGr75010621/status/1274412113361014786
2020-06-20 18:41:39,mickeydadoll_,"brooo telling a whole story",https://twitter.com/mickeydadoll_/status/1274412109766557697
2020-06-20 18:41:29,fiorehobi,"right?? it’s so GOOD like they all went off",https://twitter.com/fiorehobi/status/1274412068997935106
2020-06-20 18:41:26,TheHaraBand,"When I look back at some of the stuff we’ve done the past two years I am overwhelmed by so much of it like, what we’ve acheaved in such little time Makes me soooo hungry and inspired to keep going -Jack",https://twitter.com/TheHaraBand/status/1274412057627176963
2020-06-20 18:41:26,hongjoshie,"well the possibility of him wearing that outfit is HIGH so we need to prepare.. SHORTS and HEADBAND that’s a double kill",https://twitter.com/hongjoshie/status/1274412056133787649
2020-06-20 18:41:23,KindleNChill,"It does make 50 shades look like Disney...... https://twitter.com/cxmartini/status/1271482359997763592 …",https://twitter.com/KindleNChill/status/1274412046428393477
2020-06-20 18:41:22,MBarone,"Book recommendation: FINAL CUTS, short horror fiction centered around film and edited by the great @EllenDatlow, is one of the best anthologies I’ve read in years. Not a single weak story. There’s one particular story about a fictional never-released Herzog documentary that’s pic.twitter.com/Bqy9hWP81P",https://twitter.com/MBarone/status/1274412041458114560
2020-06-20 18:41:17,Dr_Strick,"That Black Lip Bastard Remix....whew!",https://twitter.com/Dr_Strick/status/1274412020754980867
2020-06-20 18:41:17,aalaiwa_,"Girl are you okay there",https://twitter.com/aalaiwa_/status/1274412019538464768
2020-06-20 18:41:16,Boss45I,"Download Voicemod now for FREE! The best weapon for players and content creators -> - The best real-time Voice Changer - Amazing Soundboard - Collection of over 70 original voices - Voice Maker Troll like a PRO! http://bit.ly/2PO8Qj0 #Voicechanger",https://twitter.com/Boss45I/status/1274412014622908416
2020-06-20 18:41:13,officialgoogly,"Very much missing cricket today, as I’m sure many others are as well. Absolutely mad to think that this happened in 2020... Crawley x Stokes pic.twitter.com/aT1TZiE2P7",https://twitter.com/officialgoogly/status/1274412001301848065
2020-06-20 18:41:11,_DeloSteezy,"I love my car but these $100 oil changes",https://twitter.com/_DeloSteezy/status/1274411995534680064
2020-06-20 18:41:07,bbogurn,"fuck tummy, why you have to hungry at this hour.",https://twitter.com/bbogurn/status/1274411977910087680
2020-06-20 18:41:04,RandomTasha,"How many BLM protesters were positive for coronavirus? Oh wait, that had nothing to do with @realDonaldTrump so it wasn’t relevant on Cabal News Network ... my bad!",https://twitter.com/RandomTasha/status/1274411965620813825
2020-06-20 18:41:04,staycationtg,"Woah woah woah woah woah hold up https://twitter.com/playapex/status/1274403407516913664 …",https://twitter.com/staycationtg/status/1274411963595063300
2020-06-20 18:41:02,____BOSSladyyy,"Both of my phones ringing off the hook right now",https://twitter.com/____BOSSladyyy/status/1274411955999080450
2020-06-20 18:40:56,acallan1,"Killing off your own supporters to own the libs",https://twitter.com/acallan1/status/1274411929671475202
2020-06-20 18:40:56,callumisbest123,"Yea I know it wrong they had a tranny kill one of the best characters of the past 2 generations, this is the start of the end",https://twitter.com/callumisbest123/status/1274411929600172032
2020-06-20 18:40:55,PShiffner,"Dayam Danno. Mind blowing. Finally, connecting to the DUMBS. Thank You. https://twitter.com/snarkishdanno/status/1274161267746328576 …",https://twitter.com/PShiffner/status/1274411926072811520
2020-06-20 18:40:55,BL352,"This man just dropped straight facts. I am an urban planning student at the university and we talk abt this ALL the time! https://twitter.com/borghettiyeti/status/1273357634507325442 …",https://twitter.com/BL352/status/1274411925116538881
2020-06-20 18:40:54,Wizvrdkellz,"Kings Killing Kings We Da KKK",https://twitter.com/Wizvrdkellz/status/1274411924386701312
2020-06-20 18:40:51,COR3Y__,"Don’t let me lose you, I’m not tryna confuse you when I let loose with this uzi, and just shoot through your Isuzu",https://twitter.com/COR3Y__/status/1274411908754530309
2020-06-20 18:40:49,dakuyadoesit,"Dealt with my first Karen at work",https://twitter.com/dakuyadoesit/status/1274411900051132418
2020-06-20 18:40:43,shabba025,"his Lyrics are underrated and need more appreciation",https://twitter.com/shabba025/status/1274411875137196032
