date,username,to,replies,retweets,favorites,text,geo,mentions,hashtags,id,permalink
2020-06-20 16:52:54,melissasee,"I worked in my college's radio station and also know what popping your p's refers to, so I'd used lowercase!",https://twitter.com/melissasee/status/1274384744789270528
2020-06-20 16:52:54,Randi_86618,"Follow The Path Your Heart Leads You On. pic.twitter.com/l78nzsjFuz",https://twitter.com/Randi_86618/status/1274384744558583809
2020-06-20 16:52:53,BubbIeRBLX,"OMG THEY ARE AMAZING!!! THEY KINDA LOOK LIKE THE HARMONIX HEELS! WE LOVE U MATT U ARE AMAZING! pic.twitter.com/cEwk5LQnxv",https://twitter.com/BubbIeRBLX/status/1274384740737593344
2020-06-20 16:52:53,renjeoImi,"gemeeeesss https://twitter.com/jenrenoshi/status/1254047987979792386 …",https://twitter.com/renjeoImi/status/1274384739755950080
2020-06-20 16:52:53,letslove_nine,"21/Junio/2020 Day 452 ""You're my honeybunch, sugar plum, pumpy-umpy-umpkin... You're my sweetie pie"" @weareoneEXOpic.twitter.com/Yiee9ZjZIP",https://twitter.com/letslove_nine/status/1274384739533799425
2020-06-20 16:52:53,llqlovely,"Thank you for your music and thank you for sharing it with us. Much love @Nifrapic.twitter.com/ZdmyjMavQG",https://twitter.com/llqlovely/status/1274384737629384704
2020-06-20 16:52:51,coolestflex,"I don’t get it, everyone on here is making fun of a girl with a genetic disorder who can’t choose what she looks like then get mad at a guy making a joke relating to race, something you also can’t control, and then freak out. You guys are hypocrites. Don’t dish what u can’t take.",https://twitter.com/coolestflex/status/1274384731958849540
2020-06-20 16:52:51,stripthatwalls,"YAS QUEEN WE PROUD",https://twitter.com/stripthatwalls/status/1274384731661107201
2020-06-20 16:52:51,lostjnromance,"THE CUTEST OMG",https://twitter.com/lostjnromance/status/1274384731040354304
2020-06-20 16:52:51,kirchbabe,"I would LOVE to be at a Trump Rally. But so many reasons I can't, not least of which is I could never stand up for 2 hours. But I'm quite content to be seated on my recliner with a cocktail enjoying watching THE BEST PRESIDENT IN MY 68 YEARS OF LIFE. #Trump2020Landslide",https://twitter.com/kirchbabe/status/1274384731036176384
2020-06-20 16:52:50,jisooangelx,"Awww how cute",https://twitter.com/jisooangelx/status/1274384725474304003
2020-06-20 16:52:50,sweet_mvgnolia,"U been looking snatched girly. But fr take a break from it for like a week or so so u don't have any permanent damage",https://twitter.com/sweet_mvgnolia/status/1274384725180919809
2020-06-20 16:52:49,chenderylvr,"WE LOVE YOU!",https://twitter.com/chenderylvr/status/1274384724534988807
2020-06-20 16:52:49,laurapridgeon,"you’ve done amazing sweetie !!! no one should have to go through stuff like that and even feel the need to hide the fact it happened. so proud",https://twitter.com/laurapridgeon/status/1274384724514004998
2020-06-20 16:52:49,momosweetx,"block her, don't let her ruin your hard work thank you for subbing always so fast, you're the best",https://twitter.com/momosweetx/status/1274384723373182977
2020-06-20 16:52:49,MerkYaWithLove,"Look at what my girlfriend made me for Father's day!!!! pic.twitter.com/AdgZ3OEyr9",https://twitter.com/MerkYaWithLove/status/1274384722337161216
2020-06-20 16:52:48,Katrina_87259,"Honey.. pic.twitter.com/L1rYjyv50U",https://twitter.com/Katrina_87259/status/1274384717979226112
2020-06-20 16:52:48,sportsbysabrina,"MY COUSIN HAD HER BABY!!! SHES HEALTHY AND ABSOLUTELY BEAUTIFUL!! AHHHHHHHH CANT CONTAIN MY EXCITEMENT FOR HER FAMILY",https://twitter.com/sportsbysabrina/status/1274384716708245506
2020-06-20 16:52:48,AliceEgorp,"We go love oo",https://twitter.com/AliceEgorp/status/1274384716590911488
2020-06-20 16:52:47,THICCLING,"Free cookie and I got the rarest item !!!! Hell yeahpic.twitter.com/VSVivCZ6C9",https://twitter.com/THICCLING/status/1274384715273945094
2020-06-20 16:52:46,srkajolthings,"IMO, they are the greatest",https://twitter.com/srkajolthings/status/1274384711989596160
2020-06-20 16:52:46,sarahmhop,"To the new artists out there: Shift key make line go straight ur welcome",https://twitter.com/sarahmhop/status/1274384711167729664
2020-06-20 16:52:46,torimani_,"Sports team fans can be cult-like. People in baptist churches can mimic cult-like behavior. That doesn’t make it a cult, just reflecting the behaviors of groupthink and group mimicry.",https://twitter.com/torimani_/status/1274384709309599744
2020-06-20 16:52:46,ShanieDOfficial,"Your very welcome sis!",https://twitter.com/ShanieDOfficial/status/1274384708269486081
2020-06-20 16:52:45,teodoratautan,"Thank you Pulhy ily2",https://twitter.com/teodoratautan/status/1274384705840963584
2020-06-20 16:52:45,softkyuu_,"I MISS YOU",https://twitter.com/softkyuu_/status/1274384705505366021
2020-06-20 16:52:45,heavnlymarklee,"if this happens, we owe you the world https://twitter.com/LucasWYH_/status/1274347769507926017 …",https://twitter.com/heavnlymarklee/status/1274384705094209536
2020-06-20 16:52:44,myrthena,"Thank you",https://twitter.com/myrthena/status/1274384703840083974
2020-06-20 16:52:44,nurelle00,"YALL DID AMAZING!! please rest well!",https://twitter.com/nurelle00/status/1274384703793971207
2020-06-20 16:52:44,Randi_86618,"If You Haven't Found It, Keep Looking. pic.twitter.com/5Khgkh0use",https://twitter.com/Randi_86618/status/1274384702200299521
2020-06-20 16:52:44,sigler76,"beautiful #usa #swfl #beach #morning #lovingthemoment #flowers #thankful #everydayisagift #passionate #life #inspiration #photographylovers #beautiful #artistsoninstagram #beautifulcreation… https://www.instagram.com/p/CBqg7JQhFam/?igshid=bpevp082oezx …",https://twitter.com/sigler76/status/1274384700195459072
2020-06-20 16:52:43,_eternalgalaxy,"I FINALLY GOT A SAMATOKI SSR",https://twitter.com/_eternalgalaxy/status/1274384699406848003
2020-06-20 16:52:43,rachelleteoxon_,"Imissyou chalkzy! pic.twitter.com/yLGZeKdVgp",https://twitter.com/rachelleteoxon_/status/1274384698836267008
2020-06-20 16:52:43,COccupants79,"Goodmorning sweet Betsy..! Have a lovely Saturday sweet sister..! Hugs and ..! pic.twitter.com/0AkoCiqB3A",https://twitter.com/COccupants79/status/1274384698287022087
2020-06-20 16:52:43,BQPublic1,"I will join you in the #BoycottFood #FoodIsRacist campaign! We Must stick together! You just made my morning so I'll go eat my cardboard now. Thank you, Again! Much love!",https://twitter.com/BQPublic1/status/1274384697917833221
2020-06-20 16:52:42,AurieleFayme,"thanks Kaine i hope you are too!",https://twitter.com/AurieleFayme/status/1274384693971095557
2020-06-20 16:52:42,ice_is_love,"Ohhh Wish you a very Happy Birthday Rae",https://twitter.com/ice_is_love/status/1274384692817485829
2020-06-20 16:52:41,MerveAmaBMYFC,"Thanks baby",https://twitter.com/MerveAmaBMYFC/status/1274384690393288708
2020-06-20 16:52:41,iggystain,"I love you so much, don't mind the haters, there just mad there not as talented as you are pic.twitter.com/nyjRMPeq2P",https://twitter.com/iggystain/status/1274384689382424577
2020-06-20 16:52:41,ljnracer,"thank youuu!!",https://twitter.com/ljnracer/status/1274384688035950593
2020-06-20 16:52:41,luvzwoo,"you did so well jacobbbbb",https://twitter.com/luvzwoo/status/1274384687427923968
2020-06-20 16:52:40,akasha111182,"How am I all of these at once?pic.twitter.com/a0DdQZ5DUh",https://twitter.com/akasha111182/status/1274384686765215745
2020-06-20 16:52:40,redligion,"Tysm lilly",https://twitter.com/redligion/status/1274384686337294341
2020-06-20 16:52:40,Amchizzy,"I am blaming whoever introduced me to this club. It has been regrets for few years now. Top 4 use to make me believe there's hope but everything is gone!!!",https://twitter.com/Amchizzy/status/1274384686031257601
2020-06-20 16:52:40,mik_652,"God did not promise days without pain, Laughter without sorrow; sun without rain. But He did promise strength 4 the day, Comfort 4 the tears; And light 4 our way #JUI_APC_4BalochistanRights #JTI_APC4Students_Rights",https://twitter.com/mik_652/status/1274384683296600065
2020-06-20 16:52:40,daisydaviesx,"Sending love & hugs to you hope you’re okay xx",https://twitter.com/daisydaviesx/status/1274384683141173249
2020-06-20 16:52:40,doyoungphile,"THANKYOU DAY6 @day6official #DAY6 #데이식스 #DAY6WORLDTOUR #DAY6_GRAVITY #DAY6_MIDNIGHT_CONCERT",https://twitter.com/doyoungphile/status/1274384683103432705
2020-06-20 16:52:39,zzhenqtinq,"GDJEHLENE MINE FADED she rocks this omg!!!",https://twitter.com/zzhenqtinq/status/1274384682734571522
2020-06-20 16:52:39,yohanphile_,"23rd and 27th of June!!! Oui boys!! YOHAN CONTENT!!! YES https://twitter.com/idolradiokorea/status/1274284789307039746 …",https://twitter.com/yohanphile_/status/1274384682369478657
2020-06-20 16:52:39,kaiasnieves,"it has a cast of 8 people, and typically only alana is black. but those 20 people include understudies too.",https://twitter.com/kaiasnieves/status/1274384681035878402
2020-06-20 16:52:39,qyusunwoo,"thanks for today too jacob.",https://twitter.com/qyusunwoo/status/1274384679324409857
2020-06-20 16:52:39,Monika_Kapoor19,"Good Night dev",https://twitter.com/Monika_Kapoor19/status/1274384679068549120
2020-06-20 16:52:39,AstralEscapeArt,"Aw thank you so much!!",https://twitter.com/AstralEscapeArt/status/1274384679010029569
2020-06-20 16:52:38,zenithiq_,"THANK U VIII!!!",https://twitter.com/zenithiq_/status/1274384677092986880
2020-06-20 16:52:38,AnasApprentice3,"But he's responsible #ObeymeSatan #SatansRight #SatansCatMatterhttps://twitter.com/Kitsune_Odori/status/1274352060885086211 …",https://twitter.com/AnasApprentice3/status/1274384676258340864
2020-06-20 16:52:37,Hopetheyrehappy,"Supporting them is the Best decition i've ever made",https://twitter.com/Hopetheyrehappy/status/1274384673980977152
2020-06-20 16:52:37,nostalvgic,"BABYY I LOVE YOU you did great",https://twitter.com/nostalvgic/status/1274384671451877376
2020-06-20 16:52:37,heyshienaxxi,"i found it siszt. tyyy",https://twitter.com/heyshienaxxi/status/1274384671036465153
2020-06-20 16:52:37,selena_914,"I’m a girly girly but I’m fs a tomboy. Girls I know do not do the same shit I do.",https://twitter.com/selena_914/status/1274384670935920640
2020-06-20 16:52:36,aieynniey,"awww tenkiyu goodnight sweetdream too",https://twitter.com/aieynniey/status/1274384669333569537
2020-06-20 16:52:36,LeekWhibble,"Creative gifts are so special, no matter how smol >0< you have NO idea omgggg This is a good visual oh how it feels xDhttps://twitter.com/Kekeflipnote/status/1209199701146439680 …",https://twitter.com/LeekWhibble/status/1274384668968640513
2020-06-20 16:52:36,neonazula,"NOO U",https://twitter.com/neonazula/status/1274384667861348352
2020-06-20 16:52:35,gyurippu,"I guess that's all i can say to you. I don't wanna let you date another girl except me but i should not be selfish, right? So, i hope you choose the it girl of you, i hope she is the girl you're looking for. Happy choosing, JB oppa. pic.twitter.com/4dAPSA4VM3",https://twitter.com/gyurippu/status/1274384665982365696
2020-06-20 16:52:35,Maca494xx781228,"River",https://twitter.com/Maca494xx781228/status/1274384665722445833
2020-06-20 16:52:35,urhunnybunny97,"JACOB https://twitter.com/WE_THE_BOYZ/status/1274384529730359296 …",https://twitter.com/urhunnybunny97/status/1274384665458032641
2020-06-20 16:52:35,Kellyrei007,"Happy week Zey!",https://twitter.com/Kellyrei007/status/1274384664967278592
2020-06-20 16:52:35,Momma_Cora_,"You've got a point. lol",https://twitter.com/Momma_Cora_/status/1274384664933826560
2020-06-20 16:52:35,azukisohma,"It's the group i will support Hihi Jets pic.twitter.com/llzHYPRYyy",https://twitter.com/azukisohma/status/1274384662765244418
2020-06-20 16:52:35,silveryoon_,"AH THANK YOU",https://twitter.com/silveryoon_/status/1274384662643781633
2020-06-20 16:52:34,lucinthskywdia,"I’ll be awake in 5-6hrs wait for me darling",https://twitter.com/lucinthskywdia/status/1274384661087543299
2020-06-20 16:52:33,echosvn,"HAPPY BIRTHDAY pic.twitter.com/Fd5BgLXc23",https://twitter.com/echosvn/status/1274384657786732549
2020-06-20 16:52:33,etheerealm,"FANDOM MARAVILHOSOOOOO AAAAAAAA GIVE US SHE RA MOVIE",https://twitter.com/etheerealm/status/1274384657337942018
2020-06-20 16:52:32,LifeofTaymarie,"1st born lmao This is not yo kid",https://twitter.com/LifeofTaymarie/status/1274384653424578568
2020-06-20 16:52:32,Peyayaaaaaaa,"My luvvvv https://twitter.com/intosunhak/status/1274374084265037825 …",https://twitter.com/Peyayaaaaaaa/status/1274384651243544576
2020-06-20 16:52:31,jordaaanholly,"Thank you so much",https://twitter.com/jordaaanholly/status/1274384649159086082
2020-06-20 16:52:31,lovelyimhobi,"Let me know",https://twitter.com/lovelyimhobi/status/1274384649054289920
2020-06-20 16:52:31,BoysLoveFanwoot,"Can I just die for a whole day? So tiring..",https://twitter.com/BoysLoveFanwoot/status/1274384648672440321
2020-06-20 16:52:31,AceMusings,"Do. The. Right. Thing. https://twitter.com/ticoromao/status/1274318582768267264 …",https://twitter.com/AceMusings/status/1274384648353783809
2020-06-20 16:52:31,EleeceFace,"That is so amazing!! I had a friend that when I would drive would tell me a directions to turn based on the rings I wear on my hands. People like that are seriously the best",https://twitter.com/EleeceFace/status/1274384647514927106
2020-06-20 16:52:30,MewGulfLuv44,"Happy birthdayy to youuu ysa",https://twitter.com/MewGulfLuv44/status/1274384644587220992
2020-06-20 16:52:30,kristinagrpnt,"Ily 22 thank youu",https://twitter.com/kristinagrpnt/status/1274384644029517824
2020-06-20 16:52:30,kabewkie,"Winner has been drawn! Congrats @tinybunie !! Dm me with what you would like for your illustration Thank you to everyone else who joined! pic.twitter.com/qMKT4avSN0",https://twitter.com/kabewkie/status/1274384642230169600
2020-06-20 16:52:30,mobilemel,"Your Saturday loving vibes https://www.melsloveland.com/post/why-a-next-100-days-of-love-a-guide-to-building-a-loving-movement-of-the-heart …",https://twitter.com/mobilemel/status/1274384641856638976
2020-06-20 16:52:29,TopCatchTv,"Damnit sorry Windipity",https://twitter.com/TopCatchTv/status/1274384640648736768
2020-06-20 16:52:29,Cakebackup1,"#Adoptmetrades trading a ride post teen turtle a cymbal 1 monkey and 8 small gifts for a normal owl or any other kind of owl!",https://twitter.com/Cakebackup1/status/1274384639143051265
2020-06-20 16:52:29,msecretparadise,"Stolen from oomf What do you think about me? : clown, chaotic, funny, never shuts up. : soft, friendly, cute, sweet, baby, 1O/1O would protect. (lol) : crush, love talking to, hold my hand please. : intimidating, always on tl, scared to dm.",https://twitter.com/msecretparadise/status/1274384638950211585
2020-06-20 16:52:29,libbyvalley5,"Masks are making people sick! Lies, lies & more lies. Everyday. Wake up folks!",https://twitter.com/libbyvalley5/status/1274384638014717952
2020-06-20 16:52:29,_amanduuus,"I hope you enjoyed!!! Now it’s time to take some rest!",https://twitter.com/_amanduuus/status/1274384637620621313
2020-06-20 16:52:29,nizelix,"I LOVE YOUUUU",https://twitter.com/nizelix/status/1274384637351956480
2020-06-20 16:52:28,snoopssnoop,"um...for free https://twitter.com/tooruoikawa_/status/1274031689933570048 …",https://twitter.com/snoopssnoop/status/1274384636643287045
2020-06-20 16:52:28,_ebohvic,"Anytime I check LiveScores and @FCBayernEN scores more then 2goals, I know @lewy_official is on the score sheet",https://twitter.com/_ebohvic/status/1274384636240695297
2020-06-20 16:52:28,kamaritana_,"bitch i ride everything except that ho that turn in the air",https://twitter.com/kamaritana_/status/1274384635775025154
2020-06-20 16:52:28,Shuursha,"lets be honest abt ur oomfs 1) yes 2) yes 3) no 4) no( 5) no 6) no 7) yes 8) some 9) no 10) ~ 11) absolutely all 12) yes, she sunshine reply for questions!",https://twitter.com/Shuursha/status/1274384635305299971
2020-06-20 16:52:28,awitchimon,"yay thaaanks puraaaaa",https://twitter.com/awitchimon/status/1274384634650869766
2020-06-20 16:52:28,AwkwardSilcnce,"Baby",https://twitter.com/AwkwardSilcnce/status/1274384633061400578
2020-06-20 16:52:27,nearfutureplus,"i yelled at my mom yesterday the guilt fucked my whole day up didnt apologize eitherpic.twitter.com/931Az6SInd",https://twitter.com/nearfutureplus/status/1274384632247652352
2020-06-20 16:52:27,mik_652,"Life is Test, Islam is best, Namaz is must, Aakhrut is for rest, World is only dust, If Quran is in chest, Nothing need next, Obey ALLAH first. Success will b next. #JUI_APC_4BalochistanRights #JTI_APC4Students_Rights",https://twitter.com/mik_652/status/1274384632079880192
2020-06-20 16:52:27,danaxdanger,"I LOVE YOUUU",https://twitter.com/danaxdanger/status/1274384631069057029
2020-06-20 16:52:27,missgenoard,"*GASP* WHICH XENOBLADE (the only one I've played is XCDE and I'm currently still playing it! But EXCITE!!!!)",https://twitter.com/missgenoard/status/1274384629366091778
2020-06-20 16:52:27,MarieErvin6,"You have many",https://twitter.com/MarieErvin6/status/1274384629089394698
2020-06-20 16:52:27,tokkinika,"I'm glad you're happy with the result! Thank you once again!",https://twitter.com/tokkinika/status/1274384628749684736
2020-06-20 16:52:26,Match30349174,"Come and see Heidi's LIVE in #BIGOLIVE: Backyard Chillin https://slink.bigovideo.tv/ro5rwu pic.twitter.com/uRMng3f3VG",https://twitter.com/Match30349174/status/1274384624291131396
2020-06-20 16:52:25,SoftSatori,"babbyyyyyyyyyyy https://twitter.com/kxrokentrash/status/1274383881890934784 …",https://twitter.com/SoftSatori/status/1274384623880097793
2020-06-20 16:52:25,lynnmc1971,"Yep! Was fun tho",https://twitter.com/lynnmc1971/status/1274384623229906944
2020-06-20 16:52:25,hyunjinniekr,"jacoooob you were so amazinggg",https://twitter.com/hyunjinniekr/status/1274384623162789889
2020-06-20 16:52:25,Tammy_93314,"We Do Not See Things As They Are, We See Things As We Are. pic.twitter.com/DpZ3lpQzvh",https://twitter.com/Tammy_93314/status/1274384622965723138
2020-06-20 16:52:25,ancnmsgs,"FLASH WARNING !! Happy birthday, Marble Hornets! 1/6pic.twitter.com/UJoK16sCY0",https://twitter.com/ancnmsgs/status/1274384620168065026
2020-06-20 16:52:23,Shyra011,"OMG you reached itt Congrats",https://twitter.com/Shyra011/status/1274384612702031872
2020-06-20 16:52:23,LegatoTia,"Happy Saturday ParaPeeps Wish U All AwesomeWeekendhttps://twitter.com/septsoutheastp1/status/1274295837493997568 …",https://twitter.com/LegatoTia/status/1274384611695566850
2020-06-20 16:52:22,SaHiL_Hussain07,"Yesh",https://twitter.com/SaHiL_Hussain07/status/1274384609753608192
2020-06-20 16:52:22,_pandacynical,"Congrats",https://twitter.com/_pandacynical/status/1274384608625332226
2020-06-20 16:52:21,OhVicIveFallen,"Mutuals only!! Drop an emoji and I will write something about you",https://twitter.com/OhVicIveFallen/status/1274384606050103296
2020-06-20 16:52:21,BlobPsycho100,"Hope u all have a good day",https://twitter.com/BlobPsycho100/status/1274384605580271621
2020-06-20 16:52:21,saranghaeul,"thank youuu",https://twitter.com/saranghaeul/status/1274384604611264512
2020-06-20 16:52:20,washi_no_ouja,"PINK HAIRED ONE IS MY FAVORITE AAAAAAAAAA his name is koharu and he’s a former delinquent who now works as a kindergarten teacher and he’s just so cute also he’s the most boomer out of these boomers at 32",https://twitter.com/washi_no_ouja/status/1274384600387727367
2020-06-20 16:52:20,_deobi_,"Jakey Bakey",https://twitter.com/_deobi_/status/1274384599754379267
2020-06-20 16:52:19,JoeHengst,"~•A Love Symbol•~ for my best friend shurmgod_ I love and miss you Jeff Lee R.I.P. August 6, 1991 - March 1st, 2019 (sketch for a future project with his family) #2020 #painting #acrylicpainting #art #artist… https://www.instagram.com/p/CBqg4MIHUKz/?igshid=1ob0wxanz4nws …",https://twitter.com/JoeHengst/status/1274384597321609216
2020-06-20 16:52:19,yulegendkwan,"We all know he's racist",https://twitter.com/yulegendkwan/status/1274384595526529025
2020-06-20 16:52:18,diamondCriselle,"Love of the mother to her child",https://twitter.com/diamondCriselle/status/1274384594633019392
2020-06-20 16:52:18,jimindipitys,"MY BABYYYYYYY GUAPISIMA https://twitter.com/versekoo/status/1274379144474787842 …",https://twitter.com/jimindipitys/status/1274384592540229632
2020-06-20 16:52:18,daninctzenexol,"It had to be said bokuto supremacy",https://twitter.com/daninctzenexol/status/1274384591881670659
2020-06-20 16:52:17,kMilly_7,"that’s my middle name",https://twitter.com/kMilly_7/status/1274384588337557504
2020-06-20 16:52:16,glasses_DB,"Thank you so much!! I am sorry that I am not good at English and cannot thank you properly. Your comment really made me happy! I hope you have a nice day.",https://twitter.com/glasses_DB/status/1274384583757164544
2020-06-20 16:52:16,softinvelvet_,"THIS PIC SEND ME-https://twitter.com/kdrama_menfess/status/1274301015274123265 …",https://twitter.com/softinvelvet_/status/1274384582343708672
2020-06-20 16:52:15,PiProtogen,"I can just imagine you running through a supermarket holding an alligator",https://twitter.com/PiProtogen/status/1274384581223800833
2020-06-20 16:52:15,NikkiLotte_,"I'm still a Crash Bandicoot artist but, I want to do DBD and movie art too",https://twitter.com/NikkiLotte_/status/1274384578447388674
2020-06-20 16:52:14,Lauren_50709,"You Don't Always Need A Plan. Something You Just Need To Breathe, Trust, Let Go And See What Happens.pic.twitter.com/VDe2qc3MCW",https://twitter.com/Lauren_50709/status/1274384577918885890
2020-06-20 16:52:14,sandaragonxxxi,"Nahh!! Authornim inhale exhale,close your eyes lets think again you are only confuse, dont to mind them you have heart a big big heart",https://twitter.com/sandaragonxxxi/status/1274384574475206657
2020-06-20 16:52:13,kookiexeuphoria,"I see you on my tl often and tweets are great I hope we can get to know each other",https://twitter.com/kookiexeuphoria/status/1274384573196128256
2020-06-20 16:52:13,AmandaL42,"Absolutely delicious!",https://twitter.com/AmandaL42/status/1274384572168486917
2020-06-20 16:52:13,BYEKORRA,"THANK YOU",https://twitter.com/BYEKORRA/status/1274384570041790467
2020-06-20 16:52:12,wfaael3mda7,"yarab nfsy a4of s7abi b2a",https://twitter.com/wfaael3mda7/status/1274384568481701888
2020-06-20 16:52:12,CaratHannie1004,"Does anyone know ""it's love by Mose""??? Jeonghan sang it before and it is a really nice song, it was one of my fav songs He also sang it when he was a trainee When Im doing a karaoke night by myself (karaoke in my phone) I always sing this pic.twitter.com/oZ3nauBt1w",https://twitter.com/CaratHannie1004/status/1274384567772696577
2020-06-20 16:52:12,kittylotl,"We love you Ruby",https://twitter.com/kittylotl/status/1274384566359396353
2020-06-20 16:52:12,MehmoodPapa,"I love your kind behavior with people",https://twitter.com/MehmoodPapa/status/1274384565923131392
2020-06-20 16:52:12,AdeleLauraG,"I'm really excited too!",https://twitter.com/AdeleLauraG/status/1274384565667233792
2020-06-20 16:52:11,bytxr_,"aHaHAPPY FUCKINGG BBAPPPYYY",https://twitter.com/bytxr_/status/1274384565121896448
2020-06-20 16:52:11,juyeonsmist,"ok goodnight oomfs",https://twitter.com/juyeonsmist/status/1274384564002058242
2020-06-20 16:52:11,S3__Asa,"If your name is Abena or Ekua, just know I'm dating you.. I love you baby",https://twitter.com/S3__Asa/status/1274384563058487306
2020-06-20 16:52:11,fluffypiuw,"cangtip bangett",https://twitter.com/fluffypiuw/status/1274384562974388224
2020-06-20 16:52:11,sassycassyL,"and righty tweet.. all as as bad as each other",https://twitter.com/sassycassyL/status/1274384562592911360
2020-06-20 16:52:10,narshaapd,"the veemark part was so cute omg i cry",https://twitter.com/narshaapd/status/1274384559979683841
2020-06-20 16:52:10,Olaboyeayoola1,"Yes ooo... EGETWHY",https://twitter.com/Olaboyeayoola1/status/1274384559300325379
2020-06-20 16:52:10,s0ftyjiminie,"Have a sweet dreams",https://twitter.com/s0ftyjiminie/status/1274384558855577600
2020-06-20 16:52:10,ARCTYCHAZE,"I’ll be back before you know it, soft one.",https://twitter.com/ARCTYCHAZE/status/1274384557266145282
2020-06-20 16:52:09,fiftyminus2,"Cheers my dears x",https://twitter.com/fiftyminus2/status/1274384556888666112
2020-06-20 16:52:09,AnonymousUserba,"nicki minaj eras be like: /\ /\ /\ /\ | | | | | | | |",https://twitter.com/AnonymousUserba/status/1274384556221751297
2020-06-20 16:52:09,miyalice_,"Awww thank you",https://twitter.com/miyalice_/status/1274384554539864067
2020-06-20 16:52:09,Rinku120003,"Will I Marry u Ps ; mera proposal different hai so",https://twitter.com/Rinku120003/status/1274384554090852352
2020-06-20 16:52:09,korimariee3,"Call me cake",https://twitter.com/korimariee3/status/1274384554086797312
2020-06-20 16:52:09,Lynnxleftboob,"I totally get if i could turn back time vibes from uuuu",https://twitter.com/Lynnxleftboob/status/1274384553260527616
2020-06-20 16:52:08,aeronauticitrus,"Good morning!",https://twitter.com/aeronauticitrus/status/1274384551532429314
2020-06-20 16:52:08,wanoban,"JENNIE BEST GIRL",https://twitter.com/wanoban/status/1274384551251492865
2020-06-20 16:52:07,happypyodong,"Happy birthday",https://twitter.com/happypyodong/status/1274384546897649664
2020-06-20 16:52:07,__sheashea_,"Aaaand we’re back to people not being allowed to be upset over things. https://twitter.com/thebobbyhall/status/1274083747017736194 …",https://twitter.com/__sheashea_/status/1274384546763423744
2020-06-20 16:52:07,joker_kitten,"Good morning to you as well!! I hope you have a great day!!",https://twitter.com/joker_kitten/status/1274384546520338434
2020-06-20 16:52:07,Mira_Yasuki,"like the lrnz fans i will make a bot so i can vote for dedue as most handsome, guaranteeing him first place. i will have it no other way",https://twitter.com/Mira_Yasuki/status/1274384546180378626
2020-06-20 16:52:07,lydia23513302,"poop",https://twitter.com/lydia23513302/status/1274384545530273792
