date,username,to,replies,retweets,favorites,text,geo,mentions,hashtags,id,permalink
2020-06-20 15:15:13,DikshaBhati15,"Boycott these bastard bloody shitty people maar Diya best star ko in logo ne how much he suffered during this time pic.twitter.com/2mrwelhyWz",https://twitter.com/DikshaBhati15/status/1274360160811495430
2020-06-20 15:15:13,iadorehzlnl,"Hi guys. Can i take your time for a sec pls. i still really really dont understand why fans need to show negative opinions about the other groups/singers. im gonna be honest with you guys, I became a toxic fan before but then I realise that i dont have to be like that(thread)",https://twitter.com/iadorehzlnl/status/1274360160417243142
2020-06-20 15:15:12,Brodrick375,"Don't remind us son. Those were dark times",https://twitter.com/Brodrick375/status/1274360156063662080
2020-06-20 15:15:12,rwerejinah,"YES WE DO",https://twitter.com/rwerejinah/status/1274360155912540161
2020-06-20 15:15:12,iSlxthyy,"Would take another yeah of comp on that game",https://twitter.com/iSlxthyy/status/1274360155103285249
2020-06-20 15:15:11,HornyLanez,"the front office so bad tho",https://twitter.com/HornyLanez/status/1274360152490151937
2020-06-20 15:15:11,beometernally,"idk, just happen",https://twitter.com/beometernally/status/1274360151563255808
2020-06-20 15:15:10,tyraaznl,"my phone smells like you.",https://twitter.com/tyraaznl/status/1274360148690112513
2020-06-20 15:15:10,yay_tunes,"Oh please",https://twitter.com/yay_tunes/status/1274360147431784448
2020-06-20 15:15:09,Musa_Sam25,"Your brother had his fate sealed when he started supporting that banter club",https://twitter.com/Musa_Sam25/status/1274360145053650946
2020-06-20 15:15:09,ughsjjk,"its a sad story ig",https://twitter.com/ughsjjk/status/1274360144504250368
2020-06-20 15:15:09,Bloody_Nyx,"hm maybe @sapphowascorpio and me are lewd women and witches but idk https://twitter.com/nrherzog/status/1274163158698070016 …",https://twitter.com/Bloody_Nyx/status/1274360143833071616
2020-06-20 15:15:08,K_Geey,"Broskie its risky",https://twitter.com/K_Geey/status/1274360138984574976
2020-06-20 15:15:08,dakotasjo,"im the biggest fan luv can i have an autograph",https://twitter.com/dakotasjo/status/1274360138187575298
2020-06-20 15:15:07,scarlet_gamerss,"If only they made knack 3",https://twitter.com/scarlet_gamerss/status/1274360136581210117
2020-06-20 15:15:07,bloodsweatnhobi,"also i only had one (1) friend who wanted to try it with me so it would never have worked",https://twitter.com/bloodsweatnhobi/status/1274360136539275267
2020-06-20 15:15:07,D3M0NSAN,"Yeah just ppl being rude on the internet",https://twitter.com/D3M0NSAN/status/1274360136266584064
2020-06-20 15:15:07,Fake_Goose,"Same man. 2020 has truly been cruel",https://twitter.com/Fake_Goose/status/1274360135931047937
2020-06-20 15:15:07,TheMagicSkye,"no but i got both of you",https://twitter.com/TheMagicSkye/status/1274360135926910977
2020-06-20 15:15:07,PROMTHETJ,"ok i’ll go and study sg student things will talk w y’all ltr <3",https://twitter.com/PROMTHETJ/status/1274360134618066946
2020-06-20 15:15:06,ATLfanstruggles,"we aren't perfect https://twitter.com/kurstys_ok_art/status/1274360001629487104 …",https://twitter.com/ATLfanstruggles/status/1274360133318053888
2020-06-20 15:15:06,c3porice,"Aww shucks.",https://twitter.com/c3porice/status/1274360131367710720
2020-06-20 15:15:06,being_dhfm,"Na Account ki Kanisam oka 20 Likes & Retweet kuda Ravadam ledu Can I get 50 RTS #AdvanceHBDMaheshBabu #SarkaruVaariPaata @Urstrulymahesh",https://twitter.com/being_dhfm/status/1274360129865932801
2020-06-20 15:15:05,jaydee_casi,"I can feel your depression out of your frustration",https://twitter.com/jaydee_casi/status/1274360127903023107
2020-06-20 15:15:05,scftkuroox,"I realise that too",https://twitter.com/scftkuroox/status/1274360127588413440
2020-06-20 15:15:05,Dee_Old_Toast,"Acha chlen ap kh rahi hwn to hm inki bt man lete hen bhabi..",https://twitter.com/Dee_Old_Toast/status/1274360126447681536
2020-06-20 15:15:05,firslordzuko,"can we talk about jin real quick she is so cute and no one ever talks about her pic.twitter.com/8uTCK42gzB",https://twitter.com/firslordzuko/status/1274360126200217600
2020-06-20 15:15:05,Candyyyyyyyy_12,"Main inki class laga ti hun wait",https://twitter.com/Candyyyyyyyy_12/status/1274360125743038469
2020-06-20 15:15:05,nanu_celess,"We are already moots in my another account but we are not friends",https://twitter.com/nanu_celess/status/1274360125734690820
2020-06-20 15:15:04,MamitaStatus,"This is hitting home especially hard today https://twitter.com/blackdigitalhum/status/1274068215463915522 …",https://twitter.com/MamitaStatus/status/1274360123494928384
2020-06-20 15:15:04,DBalfas21,"Saka HAS to play that ball earlier",https://twitter.com/DBalfas21/status/1274360121330728963
2020-06-20 15:15:03,AintKaiyle,"HEY U PRETTY ASF WHACHU TALKING ABOUT?!?? YOU'RE THE MOST AMAZING PERSON ON EARTH! DON'T DOWN URSELF",https://twitter.com/AintKaiyle/status/1274360119464206336
2020-06-20 15:15:03,swooobin,"The best family in the world https://twitter.com/CRAVITY_twt/status/1274348827990822917 …",https://twitter.com/swooobin/status/1274360119304712193
2020-06-20 15:15:02,FairyTaeilie,"I’ve spammed about The 1975 a few times too but it always goes unnoticed...I think moonis should join forces otherwise we won’t ever be heard",https://twitter.com/FairyTaeilie/status/1274360113902555142
2020-06-20 15:15:01,NoSylviaPlath,"It’s been an almost horrid day.",https://twitter.com/NoSylviaPlath/status/1274360110450487296
2020-06-20 15:15:01,cxookiie,"annndd reply for the questions ofc ;)) tho i might reply late so sorry",https://twitter.com/cxookiie/status/1274360110295343104
2020-06-20 15:15:00,goldenyunhoo,"babe we talked abt this",https://twitter.com/goldenyunhoo/status/1274360108433076226
2020-06-20 15:15:00,KyenSuson,"Trueee @SB19Official",https://twitter.com/KyenSuson/status/1274360105903915008
2020-06-20 15:15:00,AmeSylph,"Well, when you tell me not to do something it's like an open invitation. And now I know why curiosity killed the cat. Good game, life",https://twitter.com/AmeSylph/status/1274360104918355968
2020-06-20 15:14:59,DREAMBTXTEEZUS,"soobin really broke off so many long term loves",https://twitter.com/DREAMBTXTEEZUS/status/1274360104184238083
2020-06-20 15:14:59,linoscent,"IM SAD AND ANGRY i needed to let it out",https://twitter.com/linoscent/status/1274360103685292032
2020-06-20 15:14:59,lilzukoxo,"Big Sean is good",https://twitter.com/lilzukoxo/status/1274360102980640768
2020-06-20 15:14:58,midzyesque,"In our school, I was known for being the person who hates kpop the most. It even got worse to the point where I judged their sexuality And now here I am, missed a lot of happenings as a kpop fan (especially TWICE'S). How I wish that I was an open minded person back then https://twitter.com/_softlyitzy/status/1274352405992206338 …",https://twitter.com/midzyesque/status/1274360098693902337
2020-06-20 15:14:58,yasminnhamsan,"which is next year of course",https://twitter.com/yasminnhamsan/status/1274360098526126080
2020-06-20 15:14:58,Vuyie,"And he doesn't bother anyone https://twitter.com/Quela__/status/1274359589786595334 …",https://twitter.com/Vuyie/status/1274360097993605121
2020-06-20 15:14:58,wiahhasna,"garing, boring",https://twitter.com/wiahhasna/status/1274360097582415875
2020-06-20 15:14:57,m7mdsholi,"Fucking miss this place https://twitter.com/fayebruffell/status/1273398878994382848 …",https://twitter.com/m7mdsholi/status/1274360095539896322
2020-06-20 15:14:57,namannsharmaa,"Thanks man, I am used to it most of my tweets are",https://twitter.com/namannsharmaa/status/1274360093782364165
2020-06-20 15:14:57,maycee_w98,"It's still so hard for me to fathom how someone who's supposed to love me could just stop all bc I'm happy. So much for ""family""",https://twitter.com/maycee_w98/status/1274360092410994689
2020-06-20 15:14:57,sassieest,"ceo of being an inspiration https://twitter.com/absolu1e/status/1274285005112565760 …",https://twitter.com/sassieest/status/1274360092276797440
2020-06-20 15:14:56,Destructical,"Aquablox (gives old day vibes) TanookiAlex (good just good) J_Bug (very good but bullied kylegfx )",https://twitter.com/Destructical/status/1274360091681198086
2020-06-20 15:14:56,zend0ll,"what dance should i learn to get skinny please someone interact with this post",https://twitter.com/zend0ll/status/1274360091165306881
2020-06-20 15:14:56,Sandraellla,"But body goals...",https://twitter.com/Sandraellla/status/1274360090770968576
2020-06-20 15:14:56,em21803,"Don’t mind me just coming to like again",https://twitter.com/em21803/status/1274360089462390786
2020-06-20 15:14:56,peachywooseokie,"I wish we can celebrate 300 days anniversary together, x1 #삼백일_엑스원을_플래시해 Still love you like it was day1 #300DAY_X1_FLASH",https://twitter.com/peachywooseokie/status/1274360089390903296
2020-06-20 15:14:56,daelynnhopkins,"i’m so bad at making friends that if someone simply likes on of my tweets i consider us besties",https://twitter.com/daelynnhopkins/status/1274360088350900224
2020-06-20 15:14:56,ummmuwaafii,"Nah , i'm not . Dont you remember me waktu mfls ? I potato je .You team jamal kan?",https://twitter.com/ummmuwaafii/status/1274360088304644096
2020-06-20 15:14:55,minawearsdiesel,"just smile and wave ma smile and wave",https://twitter.com/minawearsdiesel/status/1274360086933061632
2020-06-20 15:14:55,h1biscuit,"yes its me again n e ways i finally pierced my tragus! pic.twitter.com/E7giTjzV3X",https://twitter.com/h1biscuit/status/1274360086320705536
2020-06-20 15:14:55,xuciao,"its normal",https://twitter.com/xuciao/status/1274360086215847941
2020-06-20 15:14:55,klmpintrest,"They had it in black and white yesterday telling them that they would only be allowed one video visit per month for 30 mins. That’s 1 minute per day with their LOs. His mums not well so makes it’s so difficult for him to choose.",https://twitter.com/klmpintrest/status/1274360085167378434
2020-06-20 15:14:55,THECLASSICMANNY,"My baby.",https://twitter.com/THECLASSICMANNY/status/1274360084278190087
2020-06-20 15:14:55,sknbba,"I have been lucky to have some cute people around me https://twitter.com/sknbba/status/1273670255706083331 …pic.twitter.com/Wb0IF1Y1RC",https://twitter.com/sknbba/status/1274360084194373633
2020-06-20 15:14:54,Myetherealrosie,"Do u miss Wendy? I do miss her",https://twitter.com/Myetherealrosie/status/1274360080578703363
2020-06-20 15:14:54,milkovichwhore,"my diego fancam is like my favorite fancam i made its so good idc pic.twitter.com/DougQL9jOP",https://twitter.com/milkovichwhore/status/1274360080121675776
2020-06-20 15:14:53,THECHEFBOYRD,"My dad accidentally left my pizza out in the garage all night brb while I cry",https://twitter.com/THECHEFBOYRD/status/1274360075591864320
2020-06-20 15:14:53,aniimetitties,"let’s play the quiet game",https://twitter.com/aniimetitties/status/1274360075143065600
2020-06-20 15:14:52,juengmo,"{ struggle with my kkt layout } pic.twitter.com/Rv0w9efXz9",https://twitter.com/juengmo/status/1274360073695842305
2020-06-20 15:14:52,Bbygayss,"Petition to start a chwult struggle twt",https://twitter.com/Bbygayss/status/1274360073473667072
2020-06-20 15:14:52,abeliciousxo,"I know, don’t bully me now https://twitter.com/jamingarcia_/status/1274359949565612032 …",https://twitter.com/abeliciousxo/status/1274360073075208193
2020-06-20 15:14:52,forhuahua,"a flat one",https://twitter.com/forhuahua/status/1274360072429285383
2020-06-20 15:14:52,courtneysampson,"i was confused about ur reply for a good while bf i realised i said airport instead of airpods",https://twitter.com/courtneysampson/status/1274360071934410760
2020-06-20 15:14:52,a_bake15,"so you’re saying there’s no fixing this...",https://twitter.com/a_bake15/status/1274360071624024068
2020-06-20 15:14:52,talkingkoala,"Sounds like a delightful chap So we should expect these tyres to still be there when they're gone? Koala boys having a huge gruntfest right now. Someone is where they shouldn't be",https://twitter.com/talkingkoala/status/1274360071242145792
2020-06-20 15:14:51,jaiuloves,"#Vodafone #vodaidea #Vodafonedown speed in our area pic.twitter.com/vQwGuPPvxI",https://twitter.com/jaiuloves/status/1274360070780796928
2020-06-20 15:14:51,mightyujin,"i grabbed mine too! so we're really into food, i guess. now im craving for spicy tteokbokki",https://twitter.com/mightyujin/status/1274360069711253504
2020-06-20 15:14:51,kingbalu99,"Seriously.... Dhada audio wasted pic.twitter.com/q5tDvMdr16",https://twitter.com/kingbalu99/status/1274360069417664514
2020-06-20 15:14:51,Rougeisinpain,"not me god please",https://twitter.com/Rougeisinpain/status/1274360068603957248
2020-06-20 15:14:51,chumbuckeeet,"cheer me up please?",https://twitter.com/chumbuckeeet/status/1274360067194621952
2020-06-20 15:14:50,Louist_is_MySun,"IMAGINE having someone in your family that likes the boys CANNOT RELATE",https://twitter.com/Louist_is_MySun/status/1274360065097695236
2020-06-20 15:14:50,TOCHI3500,"https://curiouscat.qa/TOCHI3500 bored",https://twitter.com/TOCHI3500/status/1274360064988426240
2020-06-20 15:14:50,jmochilovely,"I am so sorry wallet https://twitter.com/__gaciria/status/1274359038726344704 …",https://twitter.com/jmochilovely/status/1274360063063457792
2020-06-20 15:14:50,_hyyhpt2_,"Is the guy with permed hairstyle his friend or bh staff? He was always with joon in museum. He's so lucky https://twitter.com/diojoonysus/status/1274358571489206272 …",https://twitter.com/_hyyhpt2_/status/1274360062652198918
2020-06-20 15:14:49,nayeonsoojin,"thinking about how i cry over twice and idle but i don't when i get my feelings hurt",https://twitter.com/nayeonsoojin/status/1274360058445361152
2020-06-20 15:14:49,Nico_NiiYazawa,"I’ma use this 3 hr chance to get a better sleep schedule",https://twitter.com/Nico_NiiYazawa/status/1274360058264948738
2020-06-20 15:14:48,lewizsz,"Burping into face mask",https://twitter.com/lewizsz/status/1274360058168647682
2020-06-20 15:14:47,angelbeom_,"kelsss",https://twitter.com/angelbeom_/status/1274360052304904193
2020-06-20 15:14:46,bighyuck,"damn way to flex",https://twitter.com/bighyuck/status/1274360048458895361
2020-06-20 15:14:46,shazbaztabz,"Oh that’s just disgusting. One of my favourite bbc presenters. The world is full of sickos stay safe.",https://twitter.com/shazbaztabz/status/1274360047691317249
2020-06-20 15:14:46,PrettyDarlingx,"Good morning because I didn’t see this last night",https://twitter.com/PrettyDarlingx/status/1274360047452205057
2020-06-20 15:14:46,flyybossliciaa,"shantelle",https://twitter.com/flyybossliciaa/status/1274360047057985536
2020-06-20 15:14:46,snowwhite4head,"come back king unless u logging off to make more bops https://twitter.com/lilbaby4pf/status/1274359284663496710 …",https://twitter.com/snowwhite4head/status/1274360046776958977
2020-06-20 15:14:45,MCityyyyy,"b...b...but he spell my name yyyyytiCM which is my backup instead of MCityyyyy so he make me sad",https://twitter.com/MCityyyyy/status/1274360045057212417
2020-06-20 15:14:45,XxDellamorte,"Things have been so hard lately and I have been so selfish because I am so invested in my own problems.",https://twitter.com/XxDellamorte/status/1274360043954212866
2020-06-20 15:14:45,tantenyadekpeci,"Why do all my 3 biases love little kids so much?",https://twitter.com/tantenyadekpeci/status/1274360043878547456
2020-06-20 15:14:45,yeosangisasnack,"oh noi’m sorry",https://twitter.com/yeosangisasnack/status/1274360041857069057
2020-06-20 15:14:44,cozPacker,"I’ll take your American history scrubbing... and raise with the massive denial that is... British history as taught in schools! ... It is an embarrassment, how we gloss over hundreds and hundreds of years of persecution and slaughter. ... Sigh",https://twitter.com/cozPacker/status/1274360041416654854
2020-06-20 15:14:44,uwuronie,"Everyday we get clowned or we are in war",https://twitter.com/uwuronie/status/1274360038950350850
2020-06-20 15:14:44,Alyssa365__,"Wish I had that person I could hit up in this time of need",https://twitter.com/Alyssa365__/status/1274360037616627713
2020-06-20 15:14:43,kdramatresh,"i have to wait until tomorrow for the subs to update and i cant stop scrolling for spoiler i see pbis and br spoiler everywhere",https://twitter.com/kdramatresh/status/1274360035447980032
2020-06-20 15:14:43,eroslxvi,"same",https://twitter.com/eroslxvi/status/1274360035196338179
2020-06-20 15:14:42,itsmelsbaby,"Disgraceful man. I acctually worry for some boys . What goes through their heads .",https://twitter.com/itsmelsbaby/status/1274360030796689408
2020-06-20 15:14:41,Ciccioline3,"You can say that again",https://twitter.com/Ciccioline3/status/1274360028032532482
2020-06-20 15:14:41,lisasmochii,"They're still here?",https://twitter.com/lisasmochii/status/1274360027504013313
2020-06-20 15:14:41,kimitodeai,"Maybe one day if we can drink americano we'll be able to understand his language....but not today",https://twitter.com/kimitodeai/status/1274360027319427072
2020-06-20 15:14:41,cmaroh2,"AND THE WINNER IS FROM KOREA OFHSJDJSIDJ OFC",https://twitter.com/cmaroh2/status/1274360026119852033
2020-06-20 15:14:40,Wa_211n,"My sweet",https://twitter.com/Wa_211n/status/1274360024018665474
2020-06-20 15:14:40,gowildvmin,"i want bangtan q&a bet heenim will answer their question with absurd thing or about poop/girlfriend lol",https://twitter.com/gowildvmin/status/1274360022831558656
2020-06-20 15:14:40,xfplmaestrox,"That Leno injury has ruined me",https://twitter.com/xfplmaestrox/status/1274360021707624448
2020-06-20 15:14:40,lNNERM00NCHILD,"he's so smol I almost couldn't see him",https://twitter.com/lNNERM00NCHILD/status/1274360020684201984
2020-06-20 15:14:39,NiminNimra,"why you always sad ?",https://twitter.com/NiminNimra/status/1274360019090366465
2020-06-20 15:14:39,tokyojana,"ughhhhh you have to! omg i forgot you're a cancer i wish i could go to the mall to look for a gift but i'm not tryna get rona",https://twitter.com/tokyojana/status/1274360017207074818
2020-06-20 15:14:38,MINSZ0NE,"Idk now too",https://twitter.com/MINSZ0NE/status/1274360016229695488
2020-06-20 15:14:38,95sangel,"im done holding back i am now a gyuhanwon biased pic.twitter.com/1eHvJRU6E5",https://twitter.com/95sangel/status/1274360015969595392
2020-06-20 15:14:37,kur8s,"its okay. same happened to me but when i watched it, it still made v fuckin sad",https://twitter.com/kur8s/status/1274360010517016578
2020-06-20 15:14:37,QKarpQ,"used to watch it daily here when i was like 7 or something i went to an arsenal game as well",https://twitter.com/QKarpQ/status/1274360009032335361
2020-06-20 15:14:37,thejsollano,"i no longer like the idea that i'm the only one with a pass hay i don't like doing grocery but i gots no choice i gotta do it #quaranthings",https://twitter.com/thejsollano/status/1274360008721874944
2020-06-20 15:14:37,elliemyo,"gamer moment",https://twitter.com/elliemyo/status/1274360008688484352
2020-06-20 15:14:37,softbbymint,"i,,,did not know this. but also when started using ao3, i didn’t how i need to bookmark an need to actually Select bookmark so,,,i lost everything i want to bookmark also i’m still not sure i’m using ao3 correctly (for posting stuffs). yes, i am dumb",https://twitter.com/softbbymint/status/1274360008671727616
2020-06-20 15:14:37,skemford,"One day I'll learn how to color i promise",https://twitter.com/skemford/status/1274360008311013377
2020-06-20 15:14:37,eitafilm,"and the fact the solar eclipse will happen today is a ring solar eclipse. the universe is proposing, hinata please say yes",https://twitter.com/eitafilm/status/1274360008017186817
2020-06-20 15:14:36,nocturnal_1995,"There's no such thing as an ending. Just a new beginning.",https://twitter.com/nocturnal_1995/status/1274360007853658112
2020-06-20 15:14:36,ManchoLucia,"omg literally my mom",https://twitter.com/ManchoLucia/status/1274360005689397250
2020-06-20 15:14:36,purseoks,"still wont believe me? then why is her transition in opening a dm box is so different?? anyone?? pic.twitter.com/2qX5EKZSHS",https://twitter.com/purseoks/status/1274360005454491652
2020-06-20 15:14:36,oyasumiruby,"Noooo I'm so sorry to hear that",https://twitter.com/oyasumiruby/status/1274360004880056322
2020-06-20 15:14:34,flexhao,"it went boring as usual hbu bubbaaa",https://twitter.com/flexhao/status/1274359999171444736
2020-06-20 15:14:34,seunghunsome,"#. i want to install kkt again but i have no storage but i want to talk with some of y'all trough kkt tho",https://twitter.com/seunghunsome/status/1274359997984456705
2020-06-20 15:14:34,Schmidtyy8,"I just want to take away your pain",https://twitter.com/Schmidtyy8/status/1274359997011496961
2020-06-20 15:14:33,S8nsSecretDaddy,"But I'm already dead, Fronkeh https://twitter.com/LMLyricbot/status/1274321308864692224 …",https://twitter.com/S8nsSecretDaddy/status/1274359993651933186
2020-06-20 15:14:32,HENTAIEZ,"i didn’t even mean to flex",https://twitter.com/HENTAIEZ/status/1274359990350905344
2020-06-20 15:14:32,exonationpicksg,"I guess you could say Jongin was the missing piece to this puzzle https://twitter.com/weareoneKAISOO/status/1273985817095135233 …",https://twitter.com/exonationpicksg/status/1274359990094987265
2020-06-20 15:14:32,Lastkingjoe__,"If you dead me & your friend don’t don’t hate",https://twitter.com/Lastkingjoe__/status/1274359989780578305
2020-06-20 15:14:32,hillofxion,"This is my 7th time on wemoonstruggle hunny",https://twitter.com/hillofxion/status/1274359988924764162
2020-06-20 15:14:32,MariaMison,"Someone sent me a voice recording of their version of i eat mantras for breakfast and IM LIVING FOR IT pic.twitter.com/ivsLUnVgO9",https://twitter.com/MariaMison/status/1274359987867799556
2020-06-20 15:14:32,shamitha_2310,"Okay",https://twitter.com/shamitha_2310/status/1274359987288997891
2020-06-20 15:14:32,SnOwbLiNd659,"Dated a Vietnamese girl when I was younger. Her parents told her to dump me (white) or else. Can’t undo brainwashing",https://twitter.com/SnOwbLiNd659/status/1274359987079311360
2020-06-20 15:14:31,emiko22139243,"exactly sea deserved better",https://twitter.com/emiko22139243/status/1274359982843219970
2020-06-20 15:14:30,zhencaiyan,"Since F ville is really exist.",https://twitter.com/zhencaiyan/status/1274359982046056448
2020-06-20 15:14:30,navjhinjr,"Everyone is watching yaar beb what is this",https://twitter.com/navjhinjr/status/1274359978938130433
2020-06-20 15:14:29,PelleyTuff_1,"Everybody so gangster til some shit really go down then mfs wanna say damn i fucked my life up scared asl of dat time duhhhh shoulda thought about that ahead of time",https://twitter.com/PelleyTuff_1/status/1274359977923272704
2020-06-20 15:14:29,cresaintdo,"Di handmaiden...",https://twitter.com/cresaintdo/status/1274359976681631744
2020-06-20 15:14:29,catsreverywhere,"YALL FLOODED MY NOTIFICATIONS AND MY PHONE CRASHED. IT COULDN'T HOLD SO MUCH CREAM CHEESE",https://twitter.com/catsreverywhere/status/1274359975813447681
2020-06-20 15:14:29,squishyjikyu,"ITS CUZ OF MY PFP I KNEW IT pic.twitter.com/W2MyVyuhhr https://twitter.com/squishyjikyu/status/1274358717350244354 …",https://twitter.com/squishyjikyu/status/1274359975272308740
2020-06-20 15:14:28,lovehope_twt,"ARMYs are just too focused on the word 'Privacy' and I think there's also some K-ARMYs saying to take it down so I'm became bit confused about it..tho I shared the photos as well but taken it down as I don't want to add in the chaos anymore..now it became a big misunderstanding",https://twitter.com/lovehope_twt/status/1274359973271592960
2020-06-20 15:14:27,remonalisaaa,"i can't breathe after i touch them",https://twitter.com/remonalisaaa/status/1274359968771174400
2020-06-20 15:14:27,poppyxlance,"my outfit for my birthday came in today and i’m FUMING they look horrible i want to wear my pyjamas i think",https://twitter.com/poppyxlance/status/1274359968469311489
2020-06-20 15:14:26,daviddonahue11_,"I go back to it every now and then but it just doesn’t hit the same anymore",https://twitter.com/daviddonahue11_/status/1274359963637481472
2020-06-20 15:14:26,uwgetsu,"MY BABY DESERVE IN THE TOP 20 TOO",https://twitter.com/uwgetsu/status/1274359963637256193
2020-06-20 15:14:26,hwngsparkle,"You're always on my tl and i mainly just like your tweets cause ngl you're intimidating https://twitter.com/fierywoo/status/1274355173813399553 …",https://twitter.com/hwngsparkle/status/1274359963503263745
2020-06-20 15:14:26,Keep_itG09,"Watch over me Abuelo Julio it’s my turn now to live out your name the name you gave me... until I see you again OG",https://twitter.com/Keep_itG09/status/1274359962848894977
2020-06-20 15:14:25,heddja,"yeah, it’s tough",https://twitter.com/heddja/status/1274359960802033664
2020-06-20 15:14:25,samanthachloee_,"this is just me u know",https://twitter.com/samanthachloee_/status/1274359960155983872
2020-06-20 15:14:25,alylibreaaa,"Guidance, Lord. Please.",https://twitter.com/alylibreaaa/status/1274359959694618624
2020-06-20 15:14:25,ireneality,"You made me laughed really hard that night when I had my heartbreak, thank you and I'm sorry.",https://twitter.com/ireneality/status/1274359959099068419
2020-06-20 15:14:25,y0urneedygirl,"i can do at least 1 hour of edging & at least 10 orgasms within that hour, so like i said before, good luck",https://twitter.com/y0urneedygirl/status/1274359958927216640
2020-06-20 15:14:24,jscalesonbass,"...dang. i can see it https://twitter.com/kashanacauley/status/1273998795483705345 …",https://twitter.com/jscalesonbass/status/1274359957417320454
