date,username,to,replies,retweets,favorites,text,geo,mentions,hashtags,id,permalink
2020-06-20 19:11:02,4lifeBipolar,"Mental illness is as bad as racisms. We are discriminated and labeled as “crazy” or “must be your sick head”. Our lives are secretive cause nobody wants to hear-nor deal “, with a mentally-ill-wrongly-made-human. Why nobody does anything like racism? Cheap talk...F. Y. hipocracy",https://twitter.com/4lifeBipolar/status/1274419508153913344
2020-06-20 19:11:02,rauldalpezzo,"Freak by Doja Cat is a freaking bop and I don’t understand why it is unreleased!",https://twitter.com/rauldalpezzo/status/1274419504341307392
2020-06-20 19:11:00,STFCdan,"Palace making Bournemouth look Sunday league",https://twitter.com/STFCdan/status/1274419499496878082
2020-06-20 19:10:57,blonde,"i have this thing where if someone has a headache i can look at their hands & fingers and pull out the headache for them by pressing on certain areas, every time they just look at me like wtf are you doing and suddenly the headache is gone and one of my favorite talents",https://twitter.com/blonde/status/1274419485022121985
2020-06-20 19:10:56,RuffRyder__,"Waitttt whaaaa",https://twitter.com/RuffRyder__/status/1274419482124005377
2020-06-20 19:10:54,Sleepin60575364,"Call your meth dealer immediately.... pic.twitter.com/HsDqXF2Km9",https://twitter.com/Sleepin60575364/status/1274419473597050881
2020-06-20 19:10:54,motiberns,"Waitings pa din",https://twitter.com/motiberns/status/1274419471495557120
2020-06-20 19:10:47,YunnoCasanova,"Lil baby goin on a killing spree https://twitter.com/lilbabyraps/status/1274209378732630016 …",https://twitter.com/YunnoCasanova/status/1274419444245291010
2020-06-20 19:10:44,Emily18Daniels,"Y’all. Advance staff handles the candidate’s water glass, microphone, podium, snacks, literally everything that could be touched https://twitter.com/joshnbcnews/status/1274401799286513672 …",https://twitter.com/Emily18Daniels/status/1274419429657522180
2020-06-20 19:10:42,HannahWDraws,"fully endorse CB I Hate Perfume The mind. The nose. 2nd Cumming: DOPE. Wet Pavement: . COMBINED TOGETHER: my mind has been officially boggled pic.twitter.com/fBlipe6Fmt",https://twitter.com/HannahWDraws/status/1274419421193179136
2020-06-20 19:10:41,Chryos9,"@CPFC all kinds of LETHAL",https://twitter.com/Chryos9/status/1274419419150761984
2020-06-20 19:10:36,dxrkifys,"Download Voicemod now for FREE! The best weapon for players and content creators -> - The best real-time Voice Changer - Amazing Soundboard - Collection of over 70 original voices - Voice Maker Troll like a PRO! http://bit.ly/2PO8Qj0",https://twitter.com/dxrkifys/status/1274419397306863617
2020-06-20 19:10:36,milay_di,"<——— approach with caution.",https://twitter.com/milay_di/status/1274419395146678273
2020-06-20 19:10:32,jaewinggum,"he was flirting too much so i kissed him for real",https://twitter.com/jaewinggum/status/1274419379787173904
2020-06-20 19:10:31,_2ChE,"WOW THATS IMPRESSIVE! WHATS YOUR FAVORITE MEAL TO COOK? I’M TRYING TO EVALUATE SKILL SET.",https://twitter.com/_2ChE/status/1274419375072702464
2020-06-20 19:10:29,Vitial_,"Dopamine overload",https://twitter.com/Vitial_/status/1274419367200141312
2020-06-20 19:10:27,katheszz,"Super stonks",https://twitter.com/katheszz/status/1274419361034485762
2020-06-20 19:10:21,Hannah_Arra,"Who were the 1.1m donuts that followed her!?",https://twitter.com/Hannah_Arra/status/1274419332341272583
2020-06-20 19:10:15,MarkdFreelance,"Congrats Hero! Getting to that 10k soon. Pleasure to have you on this platform",https://twitter.com/MarkdFreelance/status/1274419309624860672
2020-06-20 19:10:11,DrizzyKOE,"I need a @DoeBoyOfficial x @MAXOKREAM collab",https://twitter.com/DrizzyKOE/status/1274419290821795841
2020-06-20 19:10:05,Shru3291,"Some of you all are so sweet! I have been breaking down every single day! I got so many lovely DMS and msgs today. I was acting dramatic maybe.. but the fact that you all asked if I was doing okay.. just made my day better! We don't even talk much but that you could sense!",https://twitter.com/Shru3291/status/1274419267639709696
2020-06-20 19:10:01,DeividLake,"Noooooooooooo. Bday (Day 2) & Dia del Padre #moet #champagne #lol #fridge #happyfathersday #traveler #beauty #chill #drinks #socialPower #love #friends #ocean #beach #naturelover… https://www.instagram.com/p/CBqwovjg0ji/?igshid=765gybfe6wog …",https://twitter.com/DeividLake/status/1274419249273098240
2020-06-20 19:10:00,FresnoStateFB,"A @jcropper_5 touchdown pass. An @evan_williams32 interception. A @c_silva52 game-winning field goal. So many things happened in this game #GoDogs | #PrideOfTheValleypic.twitter.com/Ja2NWc0HF8",https://twitter.com/FresnoStateFB/status/1274419244990713857
2020-06-20 19:09:59,fedxricco,"well",https://twitter.com/fedxricco/status/1274419242910265344
2020-06-20 19:09:51,Mikyla_Howard,"Right, cute!",https://twitter.com/Mikyla_Howard/status/1274419208466714625
2020-06-20 19:09:49,palmtreesdolan,"WAIT UR TELLING ME THAT THAT WAS GRAYSON?? I DIDNT EVEN NOTICE I'm trippin pic.twitter.com/eJqq7HgBjr",https://twitter.com/palmtreesdolan/status/1274419200476381185
2020-06-20 19:09:47,selbts1,"wait king i wasn't ready",https://twitter.com/selbts1/status/1274419192402448386
2020-06-20 19:09:45,ColeDizzy_,"Another day... another transformation pic.twitter.com/0GQ26qSoiP – at Designer Studios",https://twitter.com/ColeDizzy_/status/1274419182000656386
2020-06-20 19:09:43,linomotchi,"do u know if we should log in or not? A lot of stays on my tl are saying different stuff and now im like",https://twitter.com/linomotchi/status/1274419173058326530
2020-06-20 19:09:34,Yuryu,"This is amazing. You can build a studio anywhere with the green background and Blender... / VFX Breakdown - Dynamo Dream Teaser https://youtu.be/FFJ_THGj72U via @YouTube",https://twitter.com/Yuryu/status/1274419137662447621
2020-06-20 19:09:31,TStriatus,"But it's the peaceful summer of love!!!",https://twitter.com/TStriatus/status/1274419125087899653
2020-06-20 19:09:24,theakorede,"You know it",https://twitter.com/theakorede/status/1274419096545898502
2020-06-20 19:09:23,Sarah_alshamlan,"Just whyyyy?",https://twitter.com/Sarah_alshamlan/status/1274419089964924928
2020-06-20 19:09:21,M_i_k_e_20,"I think my mum could fix 2020 tbh she can fix anything you mothers are amazing",https://twitter.com/M_i_k_e_20/status/1274419083920805888
2020-06-20 19:09:18,atbrady,"Never knew this!",https://twitter.com/atbrady/status/1274419069027069957
2020-06-20 19:09:14,reinireinireini,"Have you ever feel like... you don’t know how you’re feeling?",https://twitter.com/reinireinireini/status/1274419051972849664
2020-06-20 19:09:11,OLUCHI11,"8 on Netflix ... scary...weird! Hope I will finish watching",https://twitter.com/OLUCHI11/status/1274419041487032321
2020-06-20 19:09:10,inniesugar,"omg I’m so sorry forgive me stay",https://twitter.com/inniesugar/status/1274419036961378304
2020-06-20 19:09:09,whiteststevie,"@Vixella please do a Random Genetics video but with DOGS and CATS please",https://twitter.com/whiteststevie/status/1274419031781642241
2020-06-20 19:09:09,Wall_Spin,"Daaaaamn. Can't even compare",https://twitter.com/Wall_Spin/status/1274419030749822978
2020-06-20 19:09:01,nadiaaa27,"it’s a patron day",https://twitter.com/nadiaaa27/status/1274418997367312385
2020-06-20 19:08:58,GeorgeGammon,"This is going to be INCREDIBLE!! https://twitter.com/realvision/status/1274326287264423940 …",https://twitter.com/GeorgeGammon/status/1274418985900085254
2020-06-20 19:08:57,_blinkonchesdl,"ANYONE DESERVES A GRAMMY",https://twitter.com/_blinkonchesdl/status/1274418980841762822
2020-06-20 19:08:47,Mikyla_Howard,"So what’s the name?",https://twitter.com/Mikyla_Howard/status/1274418941654335489
2020-06-20 19:08:47,GaryBetsy,"And there it is, folks https://twitter.com/cchexcsechotmai/status/1274407068695494664 …",https://twitter.com/GaryBetsy/status/1274418938621747200
2020-06-20 19:08:41,_blinkonchesdl,"ANYONE DESERVES A GRAMMY",https://twitter.com/_blinkonchesdl/status/1274418914760568834
2020-06-20 19:08:37,BrooksideBird,"Was out till like 6 last night",https://twitter.com/BrooksideBird/status/1274418897131896835
2020-06-20 19:08:34,jaredhidden,"love it!",https://twitter.com/jaredhidden/status/1274418886239121408
2020-06-20 19:08:31,Hey_JessieX3,"no fokin way!!",https://twitter.com/Hey_JessieX3/status/1274418873853411335
2020-06-20 19:08:31,omgitsglamour,"Man, being a streamer is expensive lol...I just purchased a pack of 5 twitch emotes for $40.... without the sale it would’ve been $98! What in the hell?",https://twitter.com/omgitsglamour/status/1274418873350135809
2020-06-20 19:08:28,_blinkonchesdl,"ANYONE DESERVES A GRAMMY",https://twitter.com/_blinkonchesdl/status/1274418860389806087
2020-06-20 19:08:26,Classie_akie,"The numbers in WC... geez! https://twitter.com/nicd_sa/status/1274401833851781127 …",https://twitter.com/Classie_akie/status/1274418853385252864
2020-06-20 19:08:23,WellHeyNikki,"gotta find this. anejo is my fave https://twitter.com/__dondada_/status/1274073001919684610 …",https://twitter.com/WellHeyNikki/status/1274418837476294657
2020-06-20 19:08:22,HilaryLouvar,"So far I counted 3 oxygen tanks and 1 person wearing a mask. (Not the people with the oxygen tanks)",https://twitter.com/HilaryLouvar/status/1274418836863934464
2020-06-20 19:08:22,slimness__,"Very https://twitter.com/_kodakredd/status/1274169613446795270 …",https://twitter.com/slimness__/status/1274418834280243200
2020-06-20 19:08:14,dizneyboig4,"G-Day blunt turn up pic.twitter.com/23yMBo5qtp",https://twitter.com/dizneyboig4/status/1274418800440606727
2020-06-20 19:08:06,ChaloNextTime_,"Head is banging",https://twitter.com/ChaloNextTime_/status/1274418769838800896
2020-06-20 19:08:06,badgirlraineyj,"Father’s Day is coming up so here’s a special treat to all my daddies that aren’t getting the proper love they deserve (Probably my biggest squirt ever recorded!) https://onlyfans.com/raineyjames pic.twitter.com/W9iz6f6MEz",https://twitter.com/badgirlraineyj/status/1274418768144265218
2020-06-20 19:08:06,BloxVPresident,"Download Voicemod now for FREE! The best weapon for players and content creators -> - The best real-time Voice Changer - Amazing Soundboard - Collection of over 70 original voices - Voice Maker Troll like a PRO! http://bit.ly/2PO8Qj0",https://twitter.com/BloxVPresident/status/1274418767066542080
2020-06-20 19:07:59,tempe_bulat,"((PRET))",https://twitter.com/tempe_bulat/status/1274418736615718912
2020-06-20 19:07:58,Mikyla_Howard,"Clover?",https://twitter.com/Mikyla_Howard/status/1274418733709242368
2020-06-20 19:07:53,jempanada3,"To be fair, I thought the same thing. And once I caught a tuna in animal crossing I'm like",https://twitter.com/jempanada3/status/1274418715476594689
2020-06-20 19:07:51,hamzabhandari88,"The cheek of this Las Palmas player just now pic.twitter.com/EiqP6GzzJi",https://twitter.com/hamzabhandari88/status/1274418705435365376
2020-06-20 19:07:49,labeveryday,"Bruh https://twitter.com/forsci_q/status/1274343155454935040 …",https://twitter.com/labeveryday/status/1274418697306886151
2020-06-20 19:07:45,grantedethann,"Identical twins become identical again. Gray was right.. I’m fkn mind blown @EthanDolan @GraysonDolanhttps://youtu.be/2rN-zFTPKIQ",https://twitter.com/grantedethann/status/1274418678063382529
2020-06-20 19:07:29,xoshamieh,"Complex is owned by VERIZON? https://twitter.com/uuoah/status/1274092171931443200 …",https://twitter.com/xoshamieh/status/1274418611172659201
2020-06-20 19:07:29,jackmarsh71,"How tf can some of you tweet n complain about something yet go and do the same thing themselves",https://twitter.com/jackmarsh71/status/1274418610757386241
2020-06-20 19:07:25,thenekromancer_,"USHIJIMA AS VENON, TENDOU AS CARNAGE AM I DREAMING???",https://twitter.com/thenekromancer_/status/1274418596882649088
2020-06-20 19:07:21,Reaperl2l2,"o highlight do @brunaoftn ta fora do normal slccc!",https://twitter.com/Reaperl2l2/status/1274418578670919681
2020-06-20 19:07:17,TitusCT24,"Naa, very probably not Macs",https://twitter.com/TitusCT24/status/1274418562346520577
2020-06-20 19:07:13,GarethBarham2,"Fortnite turns them into axewheilding maniacs. And free?? You wait, the dreaded VBucks will be your daily argument...",https://twitter.com/GarethBarham2/status/1274418546672644098
2020-06-20 19:06:55,MichaelSeanz,"no, if people weren't vandals we could've avoided those actions. You enable them by pointing the finger at someone else. It's not the fault of people who didn't get them get removed that people went out and did something dangerous. It's the people who went and did it's fault.",https://twitter.com/MichaelSeanz/status/1274418470038507521
2020-06-20 19:06:48,krrishd,"that’s how i feel too but it still confuses me bc, i think tearing down symbolism at the heart of a society (en masse) does historically foreshadow serious escalation, but i wonder if neoliberalism has immunized against that",https://twitter.com/krrishd/status/1274418438744793097
2020-06-20 19:06:44,Drachensturm711,"https://youtu.be/Q4My8VzkZLI last time I'm spamming this today, honest. Louie Bellson, 1955",https://twitter.com/Drachensturm711/status/1274418425776017408
2020-06-20 19:06:38,tsupergirlworld,"Q: Fav food that you can't live without ? A: Well many but let's say it depends on my mood or the day today it was Burger King menu like so good ~~~~~~~~~~~~~~~~~~~~~~~~~~~~~~~~~~ Quote Edit by me… https://www.instagram.com/p/CBqwPt1KUC8/?igshid=dr0i2bxx1nos …",https://twitter.com/tsupergirlworld/status/1274418398953381888
2020-06-20 19:06:34,milay_di,"Y’all want Beyonce to do All and Nothing at the same time while raising her three kids,raising your kids and fighting Black oppression.",https://twitter.com/milay_di/status/1274418384025849856
2020-06-20 19:06:34,PankeeRoy,"..co what??",https://twitter.com/PankeeRoy/status/1274418381685436416
2020-06-20 19:06:30,SquirtingFarrah,"I guess the country has decided Covid is a party and we should all join in. Did everyone forget about it killing people? Especially our wisest and most vulnerable elders! WHAT IN THE FUCK IS WRONG WITH AMERICA?! #COVIDー19 #Coronapalooza #Americahttps://twitter.com/TheRickWilson/status/1274400133770346497 …",https://twitter.com/SquirtingFarrah/status/1274418363754635265
2020-06-20 19:06:27,JoseEsc13,"God damn nasty af",https://twitter.com/JoseEsc13/status/1274418354074185728
2020-06-20 19:06:26,Zibeomdentist,"WHAT? BUT ... How is that possible??",https://twitter.com/Zibeomdentist/status/1274418348076523521
2020-06-20 19:06:22,Abay_Yar_ARIBAY,"Aray",https://twitter.com/Abay_Yar_ARIBAY/status/1274418330561060864
2020-06-20 19:06:19,TheyLove_Chuck,"The first track of City Girls new shit took me off top.",https://twitter.com/TheyLove_Chuck/status/1274418318980481024
2020-06-20 19:06:07,Bluefiger3,"Download Voicemod now for FREE! The best weapon for players and content creators -> - The best real-time Voice Changer - Amazing Soundboard - Collection of over 70 original voices - Voice Maker Troll like a PRO! http://bit.ly/2PO8Qj0 #Voicechanger",https://twitter.com/Bluefiger3/status/1274418267336081411
2020-06-20 19:06:05,Skpiiii1,"Download Voicemod now for FREE! The best weapon for players and content creators -> - The best real-time Voice Changer - Amazing Soundboard - Collection of over 70 original voices - Voice Maker Troll like a PRO! http://bit.ly/2PO8Qj0 #Voicechanger",https://twitter.com/Skpiiii1/status/1274418261652840453
2020-06-20 19:06:00,rvkiII,"ME WHEN U DONT FOLLOWBACK",https://twitter.com/rvkiII/status/1274418239791984641
2020-06-20 19:06:00,McClellanKenny2,"There’s no way you’re 5’2",https://twitter.com/McClellanKenny2/status/1274418238949142529
2020-06-20 19:05:59,RTushay,"I’m just noticing that right now",https://twitter.com/RTushay/status/1274418233819439105
2020-06-20 19:05:48,PankeeRoy,"Better pass",https://twitter.com/PankeeRoy/status/1274418190815301634
2020-06-20 19:05:42,percyxswift,"mans pulverized his pre-algebra teacher and they’re worried abt a judo flip",https://twitter.com/percyxswift/status/1274418163543715840
2020-06-20 19:05:40,AxSilva13,"She liked my photo... ahhhhhhhhhhhhhh!!!",https://twitter.com/AxSilva13/status/1274418157290246144
2020-06-20 19:05:40,GeorgeDezz,"Not full makeup just contour",https://twitter.com/GeorgeDezz/status/1274418155885072387
2020-06-20 19:05:39,punishdoII,"new oomf is so pretty i",https://twitter.com/punishdoII/status/1274418152181346304
2020-06-20 19:05:32,haydn_YT,"Me to",https://twitter.com/haydn_YT/status/1274418120598474755
2020-06-20 19:05:29,brigepocasangre,"wow, mind blown",https://twitter.com/brigepocasangre/status/1274418109126934528
2020-06-20 19:05:21,PheebzXO,"lifeline has ALWAYS gone crazy but this!!",https://twitter.com/PheebzXO/status/1274418077782863872
2020-06-20 19:05:01,M_i_k_e_20,"Are they pretty ones jac",https://twitter.com/M_i_k_e_20/status/1274417992130945024
2020-06-20 19:04:56,TeegieJade,"Wait, but I’ve just got so many questions",https://twitter.com/TeegieJade/status/1274417970480066563
2020-06-20 19:04:54,Purple_ShirtGuy,"DAMN Michelle, starting wildfires!? Haha but yeah",https://twitter.com/Purple_ShirtGuy/status/1274417963785785344
2020-06-20 19:04:44,KJs_FN,"Yo check this out I made it in the video https://twitter.com/aggroballers/status/1274413006626095104 …",https://twitter.com/KJs_FN/status/1274417920110665729
2020-06-20 19:04:43,CraeBoog,"I could gaze at the Majesty and Craftmanship of This Timepiece All Day!...",https://twitter.com/CraeBoog/status/1274417917594079241
2020-06-20 19:04:42,auntypelz,"This chicken suya burger from woodhouse mad mad mad",https://twitter.com/auntypelz/status/1274417911055241217
2020-06-20 19:04:38,moistraji,"The Adlibs https://twitter.com/iilerixo_4RN/status/1274372841165684737 …",https://twitter.com/moistraji/status/1274417894189871105
2020-06-20 19:04:33,ramba65348510,"Download Voicemod now for FREE! The best weapon for players and content creators -> - The best real-time Voice Changer - Amazing Soundboard - Collection of over 70 original voices - Voice Maker Troll like a PRO! http://bit.ly/2PO8Qj0 #Voicechanger",https://twitter.com/ramba65348510/status/1274417872819781634
2020-06-20 19:04:27,unvacanal,"You won’t believe this! Sunglasses Punk Style Vintage Women Brand Designer Elegant Unique Woman... selling at $12.78 by Ms Consumer https://shortlink.store/7EvnydA-fp Selling out fast so be quick! pic.twitter.com/Z0YTarJeCr",https://twitter.com/unvacanal/status/1274417848430014464
2020-06-20 19:04:23,muss3lini,"these hackers quick wit it",https://twitter.com/muss3lini/status/1274417833586409472
2020-06-20 19:04:21,M_i_k_e_20,"It tells your story it's part of you your an amazing person first so that's all that matters everything else is a Bonus. Well lifting is pretty important to",https://twitter.com/M_i_k_e_20/status/1274417823213694976
2020-06-20 19:04:17,theonlykentb,"I hope they didn’t touch anything https://twitter.com/tulsaworld/status/1274414746264129536 …",https://twitter.com/theonlykentb/status/1274417807912890369
2020-06-20 19:04:16,xBigbotx,"woah https://twitter.com/Todd_McFarlane/status/1274416135752962048 …",https://twitter.com/xBigbotx/status/1274417802888138752
2020-06-20 19:04:15,spun_zy,"Download Voicemod now for FREE! The best weapon for players and content creators -> - The best real-time Voice Changer - Amazing Soundboard - Collection of over 70 original voices - Voice Maker Troll like a PRO! http://bit.ly/2PO8Qj0 #Voicechanger",https://twitter.com/spun_zy/status/1274417799734218754
2020-06-20 19:04:13,_Symmo,"On a free as well",https://twitter.com/_Symmo/status/1274417791798575106
2020-06-20 19:04:11,ReaLifeJackWest,"You ever create something so beautiful and think to yourself... “WHAT THE FUCK!”",https://twitter.com/ReaLifeJackWest/status/1274417784039116801
2020-06-20 19:04:09,PARTYWITHTY,"yo i’m baffled LOL",https://twitter.com/PARTYWITHTY/status/1274417772148244482
2020-06-20 19:04:04,PriCeleSs_PeN,"The shaderoom has too much power, it’s crazy",https://twitter.com/PriCeleSs_PeN/status/1274417753521348609
2020-06-20 19:03:59,fear_0f_allah,"Wow No comment",https://twitter.com/fear_0f_allah/status/1274417730549145602
2020-06-20 19:03:59,Tsquared,"It’s otw, this article is actually from the future",https://twitter.com/Tsquared/status/1274417730213593094
2020-06-20 19:03:56,NordicNinja,"Started working at an aquarium and was told the sharks get out of the way of the tuna during feeding time because no one wants to be hit by a fridge moving at 40 miles an hour when *you have no bones and they do* I went",https://twitter.com/NordicNinja/status/1274417719912173569
2020-06-20 19:03:48,TitusCT24,"In Germany this happens on a regular basis. The street my summer house is in was renamed from Max-Nonne-Straße (he had Nazi relations) to Ursula-de-Bohr-Straße (she... obviously had not.) I find that a good thing.",https://twitter.com/TitusCT24/status/1274417684227280898
2020-06-20 19:03:47,milay_di,"When someone starts a tweet with “no offense “ they are about to say something hella Offensive!!https://twitter.com/abolitionista/status/1274307244667088897 …",https://twitter.com/milay_di/status/1274417682826366978
2020-06-20 19:03:42,amaayaahh,"i am baffled what shows interest you?",https://twitter.com/amaayaahh/status/1274417659505979393
2020-06-20 19:03:38,MoNificent11,"It sure is. Get ready for the ride baby",https://twitter.com/MoNificent11/status/1274417643005652995
2020-06-20 19:03:33,Ramirez48467274,"“We” didn’t elect him, his followers did unfortunately https://twitter.com/bryanbehar/status/1274199230698029056 …",https://twitter.com/Ramirez48467274/status/1274417621543206912
2020-06-20 19:03:31,amazing_premier,"You won’t believe this! The Craving Hooded Blanket selling at $43.00 by Amazing Premier https://shortlink.store/jUZ0tt4Lh Selling out fast so be quick! pic.twitter.com/HoVzEFMiYi",https://twitter.com/amazing_premier/status/1274417616166236160
2020-06-20 19:03:31,myLUXstyles,"You won’t believe this! High Quality Sport Handbag selling at $54.95 by my LUX style https://shortlink.store/IG6Fj7LP9 Selling out fast so be quick! pic.twitter.com/JKnmZnC2hY",https://twitter.com/myLUXstyles/status/1274417614098440200
2020-06-20 19:03:29,MelissaHDuran,"For real. I was saying the same thing. This president Is moron. I mean, it's not like we didn't know he was a moron.. but holy shit!",https://twitter.com/MelissaHDuran/status/1274417605546315776
2020-06-20 19:03:20,theboysebi,"Burna Boy really murdered that Jerusalema remix",https://twitter.com/theboysebi/status/1274417569236221953
2020-06-20 19:03:18,Acorn1972,"I thought governors had to sign off any plans for wider reopening? So has HT not done what was on the plan or did govs not sign off on plans? Either way, I still agree- guidance is/ was not statutory.",https://twitter.com/Acorn1972/status/1274417559803236352
2020-06-20 19:03:18,CLyzZ2,"Download Voicemod now for FREE! The best weapon for players and content creators -> - The best real-time Voice Changer - Amazing Soundboard - Collection of over 70 original voices - Voice Maker Troll like a PRO! http://bit.ly/2PO8Qj0 #Voicechanger",https://twitter.com/CLyzZ2/status/1274417558846943238
2020-06-20 19:03:12,SKCrawfordNi,"Once was more than enuf of this hilarious example of how to ruin yourselves forever online. The fact it doesn't seem a parody & they obviously watched this back and were deliriously satisfied they would bitch the world up is",https://twitter.com/SKCrawfordNi/status/1274417535958614016
2020-06-20 19:03:10,LoLa_Rosee,"I just want a 6 month lease until I move to the A",https://twitter.com/LoLa_Rosee/status/1274417528211738625
2020-06-20 19:03:09,Vid_whoShe,"The sheer accuracy of that header I'm just-",https://twitter.com/Vid_whoShe/status/1274417520955387904
2020-06-20 19:03:09,omar_malikk,"Allay !",https://twitter.com/omar_malikk/status/1274417520234000384
2020-06-20 19:03:00,Channeyt93,"Fire !! https://twitter.com/honestyxloyalty/status/1274415892051513346 …",https://twitter.com/Channeyt93/status/1274417486570704896
2020-06-20 19:02:53,jaydengio,"Wowzers. Just wow. Soprano geng.",https://twitter.com/jaydengio/status/1274417455537029121
2020-06-20 19:02:52,Beleafer73,"holy shit! Thank you so much for this!",https://twitter.com/Beleafer73/status/1274417449564205057
2020-06-20 19:02:50,bajan_barb,"Ew that was a thing!?!?! What’s going on in Europe",https://twitter.com/bajan_barb/status/1274417444501819398
2020-06-20 19:02:45,LR_Farmiculture,"You won’t believe this! Nier Automata Yorha Costume Set selling at $73.10 USD by LARA Distributor https://shortlink.store/2tsfT8vmW Selling out fast so be quick! pic.twitter.com/oQF6HkrpPf",https://twitter.com/LR_Farmiculture/status/1274417423588917253
2020-06-20 19:02:44,LARA_Referrals,"You won’t believe this! New year Creative Chinese Lantern Lamp Decor Hanging selling at $6.68 USD by LARA Distributor https://shortlink.store/0GynEmI8v Selling out fast so be quick! pic.twitter.com/9wuMhUGkKC",https://twitter.com/LARA_Referrals/status/1274417419247923210
2020-06-20 19:02:44,nicky__moshi,"all i wanna do is go fishing in the middle of nowhere. need a break from all of the insanity",https://twitter.com/nicky__moshi/status/1274417417423392774
2020-06-20 19:02:37,_EBANKS_,"“I probably got more Mike Amiri jeans then Mike Amiri” that’s not ode??",https://twitter.com/_EBANKS_/status/1274417389334077442
2020-06-20 19:02:37,M_i_k_e_20,"Oh well kinda need it to live so it's ok",https://twitter.com/M_i_k_e_20/status/1274417388931280896
2020-06-20 19:02:34,JulianZiermann,"WHAT A SET @afrojack at @MDLBeast",https://twitter.com/JulianZiermann/status/1274417374469459968
2020-06-20 19:02:29,87History,"Sannies?!",https://twitter.com/87History/status/1274417353456062466
