date,username,to,replies,retweets,favorites,text,geo,mentions,hashtags,id,permalink
2020-06-20 15:20:20,Cuttiejun,"I was studying, I'm late",https://twitter.com/Cuttiejun/status/1274361447456399360
2020-06-20 15:20:20,binniebabiee,"I just saw a dead raccoon on the side of the road... dont let soobin find out but rest in peace sweetie",https://twitter.com/binniebabiee/status/1274361446873419777
2020-06-20 15:20:20,its_desty,"How you think I feel",https://twitter.com/its_desty/status/1274361446835593216
2020-06-20 15:20:19,indiavalentinaa,"you intimidate me a bit for no reason because you seem really cool and i wish i had the courage to dm you",https://twitter.com/indiavalentinaa/status/1274361445707403265
2020-06-20 15:20:19,Ann81173038,"Aching for a fight... people are in such pain and such rage they’ve actually gone insane",https://twitter.com/Ann81173038/status/1274361445057040384
2020-06-20 15:20:19,osomatsustan,"// JAHAHA DUMMY U FORGOT THE ‘//‘ STOP SPEAKIN LIES BC AND YOUR ETHE SWEET ONE alsO YWWW",https://twitter.com/osomatsustan/status/1274361442968485888
2020-06-20 15:20:19,BlasiniNatalia,"“I’m not going” bitch I’m still here",https://twitter.com/BlasiniNatalia/status/1274361442930692096
2020-06-20 15:20:18,id0nteven,"i wanted to do that daily mix thing but my daily mixes make my taste look even more basic teengirl pop than it is, so i will not be doing that. dearest apologies i know people were probably very excited",https://twitter.com/id0nteven/status/1274361440971997184
2020-06-20 15:20:17,x_SweetTee_x,"sad to say growing up i was always teased by my own race",https://twitter.com/x_SweetTee_x/status/1274361438061166592
2020-06-20 15:20:17,Kate_Maryon1,"When you spend a bunch of money but the before is better http://rltor.cm/cf5n4 pic.twitter.com/Zo9dP1UUaq",https://twitter.com/Kate_Maryon1/status/1274361436484100096
2020-06-20 15:20:17,qiiankuun,"I'm waiting for you to notice me pic.twitter.com/Q5XZ32GbbD",https://twitter.com/qiiankuun/status/1274361435276132359
2020-06-20 15:20:17,tyongfairyy,"IT DO BE LIKE THAT pic.twitter.com/o66UanbWSj",https://twitter.com/tyongfairyy/status/1274361434563137537
2020-06-20 15:20:17,jinneclipse,"omg i just preordered the bts galaxy buds i’m going to go on a spending hiatus for a month now",https://twitter.com/jinneclipse/status/1274361434487451648
2020-06-20 15:20:16,lixiestarlight,"I love watching the gods menu performances and wont get bored of streaming but i am so tired of not seeing the views go up or freezing constantly, it feels like youtube, and now never is out against us and idk why",https://twitter.com/lixiestarlight/status/1274361432365322240
2020-06-20 15:20:16,sooniesky,"lee seokmin, the person who owns my heart pic.twitter.com/hqpsPlnbte",https://twitter.com/sooniesky/status/1274361430255398913
2020-06-20 15:20:15,suckjinoof,"istgall those cringy ass quotes and battery badhane wale forwards",https://twitter.com/suckjinoof/status/1274361429622009863
2020-06-20 15:20:15,huyvicerylle,"same huhu i miss",https://twitter.com/huyvicerylle/status/1274361429219397632
2020-06-20 15:20:15,haydenmartxn,"I also want to speak for you all but I did terrible things din... not a day passed by that I don't find myself horrible.",https://twitter.com/haydenmartxn/status/1274361429039038464
2020-06-20 15:20:15,tokibby_s8n,"they dont deserve hifumi",https://twitter.com/tokibby_s8n/status/1274361428250472449
2020-06-20 15:20:15,daniiuchiiha,"i wanna hug a cat",https://twitter.com/daniiuchiiha/status/1274361427785134082
2020-06-20 15:20:15,flowerbkoo,"you’re",https://twitter.com/flowerbkoo/status/1274361425725718528
2020-06-20 15:20:14,bakulime,"indeed",https://twitter.com/bakulime/status/1274361422655479808
2020-06-20 15:20:13,wintaerry,"M sorry hun",https://twitter.com/wintaerry/status/1274361421128781824
2020-06-20 15:20:13,vogueyjh,"u implied am crazy when am not anyway jeonghan wonwoo monster redacted and i MISS U fr we were supposed to see e/o again this year its so sad also am gonna say this i loveee how passionate u r in dancing and writing hwhwh i wish u all the best oomfie mwah https://twitter.com/ENNAC0RE/status/1274354853733527557 …",https://twitter.com/vogueyjh/status/1274361420713299968
2020-06-20 15:20:13,fenty_tho,"hope she has the same energy for R9 https://twitter.com/legendarihhhh/status/1274318935668604929 …",https://twitter.com/fenty_tho/status/1274361420591910912
2020-06-20 15:20:13,9o9o6e6e,"its ok pocket boy ily still",https://twitter.com/9o9o6e6e/status/1274361418406522884
2020-06-20 15:20:13,petalsminhee,"mentor mentee session gonna start on 22/6 ??? help i duwan",https://twitter.com/petalsminhee/status/1274361417798303746
2020-06-20 15:20:13,btspaveddawae,"thank you! You should too",https://twitter.com/btspaveddawae/status/1274361417559203840
2020-06-20 15:20:12,milky_minutiae,"They sound so good and the meaning behind the song",https://twitter.com/milky_minutiae/status/1274361415122345984
2020-06-20 15:20:12,i_rahsinha,"2020 Do hazar bitch",https://twitter.com/i_rahsinha/status/1274361413977272320
2020-06-20 15:20:11,bbubuhiimsanha,"MUTUALS ONLY!! drop an emoji and I will write something about you ( 3rd time. Everytime I post something like this, it always flops)",https://twitter.com/bbubuhiimsanha/status/1274361411422941184
2020-06-20 15:20:11,universeGO_,"sold",https://twitter.com/universeGO_/status/1274361411292917760
2020-06-20 15:20:11,jelly_pack,"Left Twitter is turning me into an unironic ""cutting out negative energies "" himbo because jesus christ some of youse are just way too aggro 24/7",https://twitter.com/jelly_pack/status/1274361410466861062
2020-06-20 15:20:11,skylq_,"social dysphoria’s a lil bitch, i rlly wish more people talked about it",https://twitter.com/skylq_/status/1274361410101940225
2020-06-20 15:20:11,_Zeotrope_,"Simeon being taken first is a mood",https://twitter.com/_Zeotrope_/status/1274361409451720705
2020-06-20 15:20:10,sameoldlulu,"anon did you get the video i dedicated? ;)",https://twitter.com/sameoldlulu/status/1274361407753109504
2020-06-20 15:20:10,gowonlovebott,"i’m so sad i had a dream where i bought a gowon polaroid for only $5 then i woke up",https://twitter.com/gowonlovebott/status/1274361407295885317
2020-06-20 15:20:10,nakaligo,"a dissapointment hun",https://twitter.com/nakaligo/status/1274361407136399360
2020-06-20 15:20:10,_deexxo,"no no no city girls slander will NOT be accepted",https://twitter.com/_deexxo/status/1274361406394109953
2020-06-20 15:20:09,MamaMoBright,"U don't want?",https://twitter.com/MamaMoBright/status/1274361401721499653
2020-06-20 15:20:08,cmrockwell1990,"They always ask why are men but never how are men",https://twitter.com/cmrockwell1990/status/1274361399670722567
2020-06-20 15:20:08,LayyalAhmed,"I’m addicted to coke",https://twitter.com/LayyalAhmed/status/1274361396642418690
2020-06-20 15:20:08,edilylena,"omg thanks legend",https://twitter.com/edilylena/status/1274361396507996160
2020-06-20 15:20:07,hopeside_97,"peak devastation : reached",https://twitter.com/hopeside_97/status/1274361395874877449
2020-06-20 15:20:07,wakeupstarboy,"Me n you both",https://twitter.com/wakeupstarboy/status/1274361395371544576
2020-06-20 15:20:07,elyminahrempitz,"so twt won’t let me use this picture as a header this me and my minah rempitz pic.twitter.com/QPVf78T5Yv",https://twitter.com/elyminahrempitz/status/1274361394427658240
2020-06-20 15:20:07,kristinakimmmm,"so danielle cohn told diego to go back to his country but is now making spanish music... call me a hater but i dont understand ppl... kmskmskms",https://twitter.com/kristinakimmmm/status/1274361393622515712
2020-06-20 15:20:07,miIasqueen,"i’m so so sorry bby for the things you watched",https://twitter.com/miIasqueen/status/1274361393437986818
2020-06-20 15:20:07,theduckavenger,"SAME. That and Hotel Hell and Hell’s Kitchen.",https://twitter.com/theduckavenger/status/1274361392036843521
2020-06-20 15:20:06,kyanite_acnh,"A bummer for sure I wanna play in fall but I don’t wanna tt to do it",https://twitter.com/kyanite_acnh/status/1274361390090776577
2020-06-20 15:20:06,aixhahx,"being an arsenal fan can be hard at times",https://twitter.com/aixhahx/status/1274361389814071297
2020-06-20 15:20:05,Venerium,"Baby",https://twitter.com/Venerium/status/1274361385783365632
2020-06-20 15:20:05,Cuttiejun,"I'm late sorry",https://twitter.com/Cuttiejun/status/1274361385728827394
2020-06-20 15:20:05,d4zaism,"y’all reo haters my mans deserves better",https://twitter.com/d4zaism/status/1274361385602998272
2020-06-20 15:20:05,lovinloey,"popcornbaek will be dearly missed",https://twitter.com/lovinloey/status/1274361384273211398
2020-06-20 15:20:05,marathi_indian,"See this got only 50 odd likes...you are not identified by your work..but your abuse on Congress... Sad to see an IIT grad shown aukaat by followers think about it",https://twitter.com/marathi_indian/status/1274361384256466948
2020-06-20 15:20:05,Rafif_Disciplex,"Perfectionpic.twitter.com/ECDUhnFg4p",https://twitter.com/Rafif_Disciplex/status/1274361384101384192
2020-06-20 15:20:04,royaleparkjimin,"Honestly, ‘let go’ is my fave and it hurts me when y’all forgot about it",https://twitter.com/royaleparkjimin/status/1274361382931034112
2020-06-20 15:20:04,freddyomar101,"why is this becoming an everyday thing and for what the color of our skinshit hurts man for those of you that don’t know this feeling consider yourself blessed beyond measure https://twitter.com/itspete213/status/1274202971299934209 …",https://twitter.com/freddyomar101/status/1274361382633377792
2020-06-20 15:20:04,daddy_mooo,"cons of summer is the hot fucking sun burning you but you’re too insecure to take that long sleeve layer off",https://twitter.com/daddy_mooo/status/1274361382390071297
2020-06-20 15:20:04,dearjinniie,"Everyone becomes an expert just with the goal of unleashing hatred. im so sorry bb this damn place turns to shitvery oftn",https://twitter.com/dearjinniie/status/1274361381647724549
2020-06-20 15:20:03,lvlygguk,"Someone interact with me,, i feel like im muted by all my followers IF NOT THEN YOU CAN CC ME anytime",https://twitter.com/lvlygguk/status/1274361377147301888
2020-06-20 15:20:03,brisnies,"yo pray for my dog she’s been THROUGH it this past month. )’: she broke her leg, is having kidney failure, and now she’s at the vet bc something else is wrong and we don’t know pic.twitter.com/wl9m1H2cBN",https://twitter.com/brisnies/status/1274361376321015808
2020-06-20 15:20:03,Angelus619,"I wish all of these creeps didn't exist",https://twitter.com/Angelus619/status/1274361376241303553
2020-06-20 15:20:03,dZSkizzy,"dw everyone knows what you're refering to",https://twitter.com/dZSkizzy/status/1274361376090316801
2020-06-20 15:20:03,payIinson,"WAIT I FORGOT HIM",https://twitter.com/payIinson/status/1274361375385509891
2020-06-20 15:20:02,yasjhan_,"im coloring it https://twitter.com/yasjhan_/status/1274340936068128769 …",https://twitter.com/yasjhan_/status/1274361371979771904
2020-06-20 15:20:02,obviouslyatin,"you are not alone pic.twitter.com/lw7RC7b5Pp",https://twitter.com/obviouslyatin/status/1274361371774181376
2020-06-20 15:20:01,loonaticbxtch,"It really is",https://twitter.com/loonaticbxtch/status/1274361371015217153
2020-06-20 15:20:01,sweblueman,"Just seeing a statue is reason enough for these imbecils to tear it down. Who it depicts or what it represents is not important. So sad. #planetoftheapes",https://twitter.com/sweblueman/status/1274361368968298498
2020-06-20 15:20:00,JessicaMarie196,"Should be seeing one of my favourite bands in Milton Keynes today..",https://twitter.com/JessicaMarie196/status/1274361363377373185
2020-06-20 15:19:58,heejingum,"oh shit fr? it didn't came up on my notifs gomenasai",https://twitter.com/heejingum/status/1274361356641112069
2020-06-20 15:19:58,ateezcity2,"is my bio clapped",https://twitter.com/ateezcity2/status/1274361354539995141
2020-06-20 15:19:57,lilisananus,"running in general",https://twitter.com/lilisananus/status/1274361352929316865
2020-06-20 15:19:56,Sadab1252,"I know",https://twitter.com/Sadab1252/status/1274361348034453504
2020-06-20 15:19:56,notsyakila,"red pepper is sooo good but too bad i can’t handle the spiciness im a weak ass bitch https://twitter.com/kyochonmalaysia/status/1273813628454490112 …",https://twitter.com/notsyakila/status/1274361347329765376
2020-06-20 15:19:55,petiteeny,"you're my favorite but fr thats a thing my mind can t,,, who is my fav",https://twitter.com/petiteeny/status/1274361344997781510
2020-06-20 15:19:55,dahIialee,"i love her but something great just hits different",https://twitter.com/dahIialee/status/1274361344742100992
2020-06-20 15:19:55,_muzaimah,"Thinking the same thing too https://twitter.com/goingtomcd/status/1274244799416025088 …",https://twitter.com/_muzaimah/status/1274361344012107776
2020-06-20 15:19:55,daysforme,"Jae's adlibs in TOOL is always be my favorite #DAY6_MIDNIGHT_CONCERT",https://twitter.com/daysforme/status/1274361343559168001
2020-06-20 15:19:55,fuckitsanton,"Cmon man issa 9",https://twitter.com/fuckitsanton/status/1274361343290814465
2020-06-20 15:19:55,Big_daddymara,"I may be for the streets but I’m always on your block",https://twitter.com/Big_daddymara/status/1274361341856317440
2020-06-20 15:19:54,bellydancelover,"That’s wonderful news that he doesn’t seem to have any emotional scars from it! WHEW! I’ve heard of some cairns really being beaten up so badly I’m so happy he’s okay. He’s such a special little soul",https://twitter.com/bellydancelover/status/1274361340984000514
2020-06-20 15:19:54,scrawnyspencer,"what y’all hating sea of monsters for shes good",https://twitter.com/scrawnyspencer/status/1274361340879155200
2020-06-20 15:19:54,davidlarkin12,"This is the game which cost us qualification for 78 World Cup ...only a 2-1 win , failed to qualify on goal difference",https://twitter.com/davidlarkin12/status/1274361339599781889
2020-06-20 15:19:54,dongpyorkribs,"guess it’s not elov anymore https://twitter.com/cravity_twt/status/1274348827990822917 …",https://twitter.com/dongpyorkribs/status/1274361338580459521
2020-06-20 15:19:54,taesmarbles,"I'll put my name in my dn for you tho gf",https://twitter.com/taesmarbles/status/1274361338412687360
2020-06-20 15:19:54,manggoyklt,"300 days since debut~ happy 300 days my love @x1official101 @x1memberspic.twitter.com/bDONyrsl5O",https://twitter.com/manggoyklt/status/1274361338211340288
2020-06-20 15:19:53,purplejjaeni,"no.. he probably next or the last one maybe they let him be the last since he was supposed to join the charity online concert right... but pity him it's so late now",https://twitter.com/purplejjaeni/status/1274361336265244673
2020-06-20 15:19:53,kyuntoxicated,"Mine doesnt have the live thingy but anyways thanks!! pic.twitter.com/663QJYxjDs",https://twitter.com/kyuntoxicated/status/1274361334902034432
2020-06-20 15:19:52,Ed13831002,"Not all but it has a consistent theme",https://twitter.com/Ed13831002/status/1274361331110612997
2020-06-20 15:19:52,enzo_artista,"spending an hour looking for cool songs to chop up and i found one and gza already fucking got to it",https://twitter.com/enzo_artista/status/1274361330477105152
2020-06-20 15:19:52,afieffirdaus,"Everyone will graduate. Doesnt count as achievement",https://twitter.com/afieffirdaus/status/1274361330154090496
2020-06-20 15:19:51,sunnewfied,"all i want for them now is a complete rest and vacation https://twitter.com/juyeonbubs/status/1274358880970014720 …",https://twitter.com/sunnewfied/status/1274361327373307904
2020-06-20 15:19:51,inumvkis,"I KNOW RIGHTTT haesoo is the most beautiful man i have ever set eyes on . taekyung is such boyfriend material too like PLEASE ............",https://twitter.com/inumvkis/status/1274361326962262016
2020-06-20 15:19:51,surtlethell_,"hrmrhrmm why do people only focus on the bad parts of the gacha life community??!?!?",https://twitter.com/surtlethell_/status/1274361325548736512
2020-06-20 15:19:50,yourmystell16,"hays @SB19Official",https://twitter.com/yourmystell16/status/1274361324370161666
2020-06-20 15:19:50,ggukstaki,"me! i need a sugar daddy",https://twitter.com/ggukstaki/status/1274361321052688392
2020-06-20 15:19:50,yooniesnose,"i really did it",https://twitter.com/yooniesnose/status/1274361320968785929
2020-06-20 15:19:49,vmcubs,"ah shit here we go again",https://twitter.com/vmcubs/status/1274361319932620801
2020-06-20 15:19:49,tanivya_sinha,"Yes...Mental health is always taken as a joke when our brain is most complex and these conditions are not anything but a by-product of evolution. Understanding your body should be very important https://twitter.com/amanmehi/status/1274360596138360832 …",https://twitter.com/tanivya_sinha/status/1274361318821081090
2020-06-20 15:19:49,abcdelizabeth84,"PTSD needs to be treated seriously because it doesnt come to play Hope he gets the help he needs. Hope he accepts the help.",https://twitter.com/abcdelizabeth84/status/1274361316875145217
2020-06-20 15:19:48,cyjgyeom,"@Target please sell some got7 albums in stores i want to be broke",https://twitter.com/cyjgyeom/status/1274361314996092928
2020-06-20 15:19:48,shapsjsha,"Is #DAY6_MIDNIGHT_CONCERT really trending No. 1 in Singapore?? I guess SG My Days really miss 191005 because yes, me too",https://twitter.com/shapsjsha/status/1274361314098348032
2020-06-20 15:19:48,_pratheep10_,"I need that energy back",https://twitter.com/_pratheep10_/status/1274361312668119041
2020-06-20 15:19:48,StayBiebsTweet,"never say never by justin bieber and jaden smith will forever remain a boppic.twitter.com/cBOugKsuWX",https://twitter.com/StayBiebsTweet/status/1274361312340926472
2020-06-20 15:19:47,molocrush,"we are",https://twitter.com/molocrush/status/1274361311787270146
2020-06-20 15:19:47,owoholic,"i have not one bit to do with this stop accusing me",https://twitter.com/owoholic/status/1274361310004707328
2020-06-20 15:19:47,sreenu_goli,"E speed tho record ala pedtham ankuntunnaru #AdvanceHBDMaheshBabu #SarkaruVaariPaata @Urstrulymahesh",https://twitter.com/sreenu_goli/status/1274361308456992768
2020-06-20 15:19:46,morrthemerri_er,"Don't we all",https://twitter.com/morrthemerri_er/status/1274361304870985730
2020-06-20 15:19:45,IbrahimKanu19,"I really hope Holding can get back to that form he was in before the injury",https://twitter.com/IbrahimKanu19/status/1274361302836744193
2020-06-20 15:19:45,Youngnyangs,"Maybe if the USA had different laws regarding guns or weapons in general you wouldn't need police officers in school https://twitter.com/aishaseoul/status/1274106827467194368 …",https://twitter.com/Youngnyangs/status/1274361302450868225
2020-06-20 15:19:45,yinyamm,"seriouss",https://twitter.com/yinyamm/status/1274361302186553347
2020-06-20 15:19:45,fad_kulis88cute,"If you are not in the good mood please stop texting me. U hurt me even more.",https://twitter.com/fad_kulis88cute/status/1274361300794007553
2020-06-20 15:19:45,dxvej,"hi, im sorry",https://twitter.com/dxvej/status/1274361299737051136
2020-06-20 15:19:44,moccamocciis,"it's 11am and i've managed to -draft all the rough animation for my test -set up booth for the online con today -draft 2 more commissions and sketches for zine -wrote 3 more pages 4 szll fic and with all of tht done i will now proceed to die for 4 hrs before i hav 2 get up",https://twitter.com/moccamocciis/status/1274361299586224128
2020-06-20 15:19:43,skAdo0sh_,"yall simping for the government #Anonymouspic.twitter.com/vqD5CraOUn",https://twitter.com/skAdo0sh_/status/1274361294632570880
2020-06-20 15:19:43,GGUKLY_,"KAKSKKS I CANT WAIT TO WATCH DAY6 TONIGHT #DAY6_MIDNIGHT_CONCERT",https://twitter.com/GGUKLY_/status/1274361294288646144
2020-06-20 15:19:43,xCutePineapple,"Graphic design is my passion",https://twitter.com/xCutePineapple/status/1274361292791349251
2020-06-20 15:19:42,fxcklevii,"damn https://twitter.com/fuksxav/status/1274356313171132418 …",https://twitter.com/fxcklevii/status/1274361290375520258
2020-06-20 15:19:42,ntshatisya,"okay https://twitter.com/_itsmesuraya/status/1273982200124329984 …",https://twitter.com/ntshatisya/status/1274361288517316609
2020-06-20 15:19:41,fearlesskwan,"i need those, BDO lang pinapakita sakin, it’s making me look even more brOke-",https://twitter.com/fearlesskwan/status/1274361285824528384
2020-06-20 15:19:40,Kween4eva21,"it's just me talking to myself about bts and stuff",https://twitter.com/Kween4eva21/status/1274361281634582535
2020-06-20 15:19:40,modipadi2bake,"Watching Where Do We Go From Here with Oprah Winfrey pic.twitter.com/1fRfPzVKJz",https://twitter.com/modipadi2bake/status/1274361279520673800
2020-06-20 15:19:39,sonreirluv_,"GAGO",https://twitter.com/sonreirluv_/status/1274361278740361216
2020-06-20 15:19:39,shannaiee,"Loving me is a TOXIC for them, Loving me is their HELL, Loving me is their FAILURE.",https://twitter.com/shannaiee/status/1274361276563509253
2020-06-20 15:19:39,annikanttakeit,"where’s cashmere vanilla",https://twitter.com/annikanttakeit/status/1274361275192147973
2020-06-20 15:19:37,softbbyloki,"Bruh SAYS WHO",https://twitter.com/softbbyloki/status/1274361269139714048
2020-06-20 15:19:37,Bernie_Mackk,"I’ll never give him for what he did to ”Foreigner”",https://twitter.com/Bernie_Mackk/status/1274361266358845441
2020-06-20 15:19:36,minecraftsimpp,"I’m so sorry to any artist i follow,,,I see amazing art and comment AWOOGA or a bunch of or even bark ,,, I’m stupid and can’t use words",https://twitter.com/minecraftsimpp/status/1274361262705647622
2020-06-20 15:19:35,pixienamuu,"IM CRYING BYE I LOVE U SO MUCCCCCCHHHHH HUHU https://twitter.com/pjmsoutro_/status/1274360624034615298 …",https://twitter.com/pixienamuu/status/1274361259102818304
2020-06-20 15:19:35,mmingyvs,"like those yp hair sia",https://twitter.com/mmingyvs/status/1274361258611863559
2020-06-20 15:19:35,ravneet_22,"Same asf",https://twitter.com/ravneet_22/status/1274361258314280968
2020-06-20 15:19:35,riyokki,"i would honestly prefer interactive mutuals/followers than numbers but i also don't respond regularly so maybe that's another thing",https://twitter.com/riyokki/status/1274361258263760897
2020-06-20 15:19:34,namtiddies_jin,"Omg I thought that said over I got so scared I was like what did he do he’s the cuties he wouldn’t do anything bad I’m just dumb",https://twitter.com/namtiddies_jin/status/1274361257106255873
2020-06-20 15:19:34,frootzyu,"Well our agency was great tho i understand you but please move on for a better future wkwk",https://twitter.com/frootzyu/status/1274361255818457089
2020-06-20 15:19:34,AktuStudents,"Please help @AktuStudents . Paper is not as important than our life please help. @AKTU_Lucknow",https://twitter.com/AktuStudents/status/1274361255042494464
2020-06-20 15:19:33,woocultz,"i rest my case https://twitter.com/woocultz/status/1251140446421581825 …",https://twitter.com/woocultz/status/1274361253029281793
2020-06-20 15:19:33,TheTichur,"Chainsaw envy! Bought a chainsaw and it’s never worked, waiting in the makers opening to get it fixed. Bloke over the back cutting down a rainforest and making a racket, a wish it was me",https://twitter.com/TheTichur/status/1274361249426481154
2020-06-20 15:19:32,Angelique0801,"Same struggle",https://twitter.com/Angelique0801/status/1274361249048989696
2020-06-20 15:19:32,__asare,"owah say sorry",https://twitter.com/__asare/status/1274361247853686785
2020-06-20 15:19:32,beometernally,"i'm a woman and it happens to me too",https://twitter.com/beometernally/status/1274361247530733570
2020-06-20 15:19:32,katxbabes,"Awh I'm sorry bb you don't deserve to get bullied",https://twitter.com/katxbabes/status/1274361246398197763
2020-06-20 15:19:31,Marielandii,"heart’s been broken so many times pic.twitter.com/0PZv6PAQLf",https://twitter.com/Marielandii/status/1274361244934266880
2020-06-20 15:19:31,HomareBath,"It is so flat, it became fat",https://twitter.com/HomareBath/status/1274361243453788162
2020-06-20 15:19:31,savvylittleminx,"Sadly, I think it's like that for all of them. Depending on who you read? Even Diavolo and perhaps Barbar. ...and that just makes me sad..",https://twitter.com/savvylittleminx/status/1274361242023538688
2020-06-20 15:19:31,stealingswords,"//unsure how much sleep I got. Will be getting more. Hopefully. Cya And then it's another few hours working on the ref Yeehaw",https://twitter.com/stealingswords/status/1274361241797120000
2020-06-20 15:19:31,itsjuliawhut,"JA, i miss being vip",https://twitter.com/itsjuliawhut/status/1274361241574748162
2020-06-20 15:19:31,RuzannaAiko,"U knw back then... I would always sing this... When i see... Kepala org bekilat sambil pegang my head and then run away ya Allah child me why-",https://twitter.com/RuzannaAiko/status/1274361241209692161
2020-06-20 15:19:31,y0urlocalGH0ST,"I never watched/read",https://twitter.com/y0urlocalGH0ST/status/1274361241071284226
2020-06-20 15:19:30,nanosworId,"Another time",https://twitter.com/nanosworId/status/1274361240865865731
2020-06-20 15:19:28,DukerinoTV,"This video is somehow more menacing without the music",https://twitter.com/DukerinoTV/status/1274361231273492481
2020-06-20 15:19:28,mtgmtz,"I thought the leaked photos were about something else, thanks for explaining it inadvertently hahaha; I will stop looking for the photos and have my surprise of the colors",https://twitter.com/mtgmtz/status/1274361229683781632
2020-06-20 15:19:27,FLIRTFORY0U,"LO JAMET",https://twitter.com/FLIRTFORY0U/status/1274361227536297985
2020-06-20 15:19:27,taeglaze,"@jungkook we miss you bro pic.twitter.com/2Pmx1wcD3Q",https://twitter.com/taeglaze/status/1274361226496110594
2020-06-20 15:19:27,CarlosE66304181,"Finna grind it harder then ever for my bros love everyone who is reading this and stay safe never know when your time is up",https://twitter.com/CarlosE66304181/status/1274361224780791808
