date,username,to,replies,retweets,favorites,text,geo,mentions,hashtags,id,permalink
2020-06-20 16:49:35,taeyeonss_syj,"i really really really love miss jung sooyeon",https://twitter.com/taeyeonss_syj/status/1274383907341795328
2020-06-20 16:49:34,VishmaF,"I think y'all should stop in my opinionpic.twitter.com/dIGsdkNDgm",https://twitter.com/VishmaF/status/1274383905198571521
2020-06-20 16:49:34,Ayeeeo_Cedes,"I want tacos today",https://twitter.com/Ayeeeo_Cedes/status/1274383905190182913
2020-06-20 16:49:34,paulaab_bot,"I caught in hit and me , Do you love is true.",https://twitter.com/paulaab_bot/status/1274383904997326849
2020-06-20 16:49:34,shabblack,"Just checked & this is on my phonehttps://twitter.com/Debbi_sb/status/1274269832146415616 …",https://twitter.com/shabblack/status/1274383904334643201
2020-06-20 16:49:34,Mdlovemj4ever,"https://youtu.be/RLjDIP6z8kQ This was the final episode of season #1 I will miss that show",https://twitter.com/Mdlovemj4ever/status/1274383902954700800
2020-06-20 16:49:33,Jason_TheChamp,"We're playing Dead by Daylight! #Pridehttp://www.twitch.tv/jason_thechamp?sr=a …",https://twitter.com/Jason_TheChamp/status/1274383901817860096
2020-06-20 16:49:33,DUSKNR,"dan barkle always going to be my biggest inspiration",https://twitter.com/DUSKNR/status/1274383901360893960
2020-06-20 16:49:32,jmsmangahas,"DUDE. YOU'RE GOOD AT POWERPOINT N TRADITIONAL, WHAT MORE SA PHOTOSHOP????? YOU'LL GET THERE SWEAR. I LOVE YOU, TWINNIE!!!!! SERVE US SOME GOD TIER ART",https://twitter.com/jmsmangahas/status/1274383896646266886
2020-06-20 16:49:32,nickisnpdx,"have fun gifting! i know u will!",https://twitter.com/nickisnpdx/status/1274383896403116033
2020-06-20 16:49:32,my2centsay,"#RepubliCONS wanted this stooge at the helm....look at the damage they have done! Given millions of tax dollars to farmers, banks and corporations while taking healthcare and food from poor people. Shame on the GOP! Vote them all out! #BlueTsunami2020",https://twitter.com/my2centsay/status/1274383894633119744
2020-06-20 16:49:31,MariamS89471203,"And all she wanted was a peaceful life https://www.instagram.com/p/CBqgj9tHuYm8HNeN4HurhW0k5a5xQ0r_eHpWxE0/?igshid=o9g7ida6lyaw …",https://twitter.com/MariamS89471203/status/1274383894272520192
2020-06-20 16:49:31,Pontyboy99,"Donations can still be made here - https://www.justgiving.com/fundraising/Beatrice-Pebble-Hunt … Thank You SO MUCH to everyone who has donated to date. Beatrice has so far raised just over £1200 for our Wonderful, Wonderful NHS!",https://twitter.com/Pontyboy99/status/1274383893995585538
2020-06-20 16:49:31,fluffyhoshiiii,"so cute",https://twitter.com/fluffyhoshiiii/status/1274383893987307521
2020-06-20 16:49:30,Valonka,"Each of us has bad days. You're helping me ... Without knowing it. Just look at that smile or watch your favorite series with you. Thank you. @canyaman1989 #CanYaman #CanYamanFansDaypic.twitter.com/omshC1D87q",https://twitter.com/Valonka/status/1274383887548977154
2020-06-20 16:49:30,osamumiyaaa,"EXTREMELY LATE BUT GOOD NIGHT MOOTS!",https://twitter.com/osamumiyaaa/status/1274383886995222528
2020-06-20 16:49:30,jeanieblushh,"Love you!!!!!!",https://twitter.com/jeanieblushh/status/1274383886613610499
2020-06-20 16:49:30,tobeeo_,"PARTNERS AGAIN THANK YOU SHERAAAA",https://twitter.com/tobeeo_/status/1274383886173130752
2020-06-20 16:49:29,Ochayuu,"Thank you!",https://twitter.com/Ochayuu/status/1274383885162463233
2020-06-20 16:49:29,tinratio,"a #killingeve donation commission I got to do for a dear friendproceeds from this comm went to the National Black Justice Coalition, a civil rights organization dedicated to empowering black lesbian, gay, bisexual, and transgender people. Donate here! https://www.mightycause.com/organization/nbjc …pic.twitter.com/iZMVJIMtJK",https://twitter.com/tinratio/status/1274383884776615936
2020-06-20 16:49:29,Mooncrestacnh,"all they did was be nosy and act like they are actual police when they were just security guards like know your sad place. acting like u telling the principal i used the bathroom for more then 10 minutes is gonna haunt me in my sleep. @hoshiacnhhttps://twitter.com/tpwkineroda/status/1273988360286146561 …",https://twitter.com/Mooncrestacnh/status/1274383884579491840
2020-06-20 16:49:29,classicolawale8,"Sir kindly bless me",https://twitter.com/classicolawale8/status/1274383884419989504
2020-06-20 16:49:29,blksapphiresun,"Nothing but the best for my black pic.twitter.com/UTY7OBHOBt",https://twitter.com/blksapphiresun/status/1274383883862188039
2020-06-20 16:49:29,BeingIndian0077,"@Hayatkhaan786 thankyou sister",https://twitter.com/BeingIndian0077/status/1274383882842828802
2020-06-20 16:49:28,koryzzle_,"Naruto rookie 12 appreciation tweet pic.twitter.com/nLJbphLMxB",https://twitter.com/koryzzle_/status/1274383880217260032
2020-06-20 16:49:28,blastchan,"FER NOSJHJS IM NOT UR BIAS PLS UN SAY THAT ALSO THANKIUU SM",https://twitter.com/blastchan/status/1274383877948076032
2020-06-20 16:49:27,ThomasJWhite2,"JT,He Backed Himself Into A Corner When He Didn’t Say “I’LL PICK”The Most QualifiedorWhen U Don’t Do That U Get 2 Proven,But That’s,The Donald & WILL RE-ELECT 2 MAKE”GREAT AGAIN N 2020”https://twitter.com/thejtlewis/status/1274113445957427200 …",https://twitter.com/ThomasJWhite2/status/1274383877247647746
2020-06-20 16:49:27,bettafish,"I’m game for reinterpreting characters but this wasn’t an alteration for the medium, this was an outright new character with Cass’ name. And the implication that she counts as Cass just b/c she’s an Asian girl is pretty ick in its own right.",https://twitter.com/bettafish/status/1274383877088436225
2020-06-20 16:49:27,kephas_joe,"Follow me to gain more followers",https://twitter.com/kephas_joe/status/1274383876627091456
2020-06-20 16:49:27,Amchizzy,"They'll be disgraced this season until they relegate",https://twitter.com/Amchizzy/status/1274383875708465154
2020-06-20 16:49:27,sherrijuune,"We will together",https://twitter.com/sherrijuune/status/1274383873732775937
2020-06-20 16:49:26,wannabeMy_chris,"Marine. Dance. Practice. Won. But. Watch. It. Be. A. Fish. Or. An. Octopus. I hate it here, iT MIGHT NOT BE MARINE SUITS",https://twitter.com/wannabeMy_chris/status/1274383873233891328
2020-06-20 16:49:26,jbbam2,"Get 100% FB @jbbam2 @raghubir666 @Arunmore5541 @AremwakiIsaiah @DipsonGiri1 @sumigrng20 @basirmiya10 @harkdhami4 @saroj46097587 @uraj_x @Lalan57847459 @ramuydv82 @MitraAgyat @hemsagar0918 @jyotika1sharma @TopNeupane @ranajyu @omp_sapkota @sanimaiya1 @JafrinaNasrin @drs1k RT&",https://twitter.com/jbbam2/status/1274383872147353601
2020-06-20 16:49:26,afiqirfanafr,"5 days more!!",https://twitter.com/afiqirfanafr/status/1274383870901673984
2020-06-20 16:49:25,mirakyun,"a QUAD salchow nonetheless apparently lol",https://twitter.com/mirakyun/status/1274383866506199045
2020-06-20 16:49:25,sophieuphoria,"I’m so sorry this happened to you, nobody should have children if their sexuality is going to be a deal breaker. You don’t deserve this at all. My DMs are open if you need anything",https://twitter.com/sophieuphoria/status/1274383865482805249
2020-06-20 16:49:23,mn_croissant,"Cutest bee I’ve ever known",https://twitter.com/mn_croissant/status/1274383860520726528
2020-06-20 16:49:23,princejkookie,"goodnight !!",https://twitter.com/princejkookie/status/1274383858599772160
2020-06-20 16:49:23,abeni_francesca,"1- Telling the creator / author of a series that he doesn’t know how to do his job, accuse him of sexism because there are no women in his team (fun fact: at Miraculous work several women. the show is not only based on script writing)",https://twitter.com/abeni_francesca/status/1274383856901271553
2020-06-20 16:49:23,allyzuki,"Awwwww cute",https://twitter.com/allyzuki/status/1274383856750202880
2020-06-20 16:49:22,divineseulgi,"HAPPY BIRTHDAY",https://twitter.com/divineseulgi/status/1274383854900514816
2020-06-20 16:49:22,pillowtask,"Put this on your profile and see how many people wants to, - be your closest friend/fams - be your sa - i have a crush on you - fuck with you",https://twitter.com/pillowtask/status/1274383854774566912
2020-06-20 16:49:21,healsunshine,"GEMEEEESS BANGEEET !!!!",https://twitter.com/healsunshine/status/1274383850295050241
2020-06-20 16:49:21,ThinkingWayBack,"...tag me in your post or DM me about it!! I don't want to make it seem like I only have and participate in my own: I'd love to take part in ANY of yours provided I'm able to! Hope this all made sense! Have a fantastic day, friends!! Love you so much!",https://twitter.com/ThinkingWayBack/status/1274383849045229570
2020-06-20 16:49:19,Melanie_rundell,"Cheers to the freakin’ weekend bit of Ella to get in the weekend spirit #EllaFitzgerald #Weekend #BlueSkies #jazzmusicpic.twitter.com/auv7l7jidp",https://twitter.com/Melanie_rundell/status/1274383843760508929
2020-06-20 16:49:19,PiProtogen,"I think everyone does",https://twitter.com/PiProtogen/status/1274383842715942912
2020-06-20 16:49:19,NMintLeaf,"Oof ;-; Well, I hope you find a ride toy monkey or ride neon monkey",https://twitter.com/NMintLeaf/status/1274383842649018370
2020-06-20 16:49:19,snoopssnoop,"hell... is hot https://twitter.com/chuuy4s/status/1274335005410381824 …",https://twitter.com/snoopssnoop/status/1274383841944272898
2020-06-20 16:49:19,alecneversad,"they had a security guard bc they had problems with break-ins and tagging.. bc the cops can’t do their job. then the cops come, see a minority security guard worker hired by the shop.. and shoot him dead by accident... #AndresGuardado #DefundThePolicehttps://twitter.com/vergiltheg/status/1273887077180952578 …",https://twitter.com/alecneversad/status/1274383841352798209
2020-06-20 16:49:18,marisbellamy1,"Awwwwwwwww, pretty Somora taking a snooze and so snuggly too!",https://twitter.com/marisbellamy1/status/1274383838999764993
2020-06-20 16:49:18,overagaine4,"#freezayn So baby hold on, to my heart Need you to keep me from falling apart I'll always hold on,because you make me strong",https://twitter.com/overagaine4/status/1274383836793704448
2020-06-20 16:49:18,_daejane,"Happy Father's Day",https://twitter.com/_daejane/status/1274383835904409601
2020-06-20 16:49:17,IWannaBeAMem3,"chile-",https://twitter.com/IWannaBeAMem3/status/1274383834361061378
2020-06-20 16:49:17,CrookedSea_,"These Matte Feminist Earrings will be up on Friday! Turn on the shop countdown on our insta story to be reminded for the launch, only these 4 pairs will be up (as mentioned in our story there will be smaller versions available too!) pic.twitter.com/fFkQl47jec",https://twitter.com/CrookedSea_/status/1274383832771420160
2020-06-20 16:49:17,amberromance90,"Wooooow! Amazing",https://twitter.com/amberromance90/status/1274383831899013125
2020-06-20 16:49:16,RichardArt13,"Congratulations Dude You deserve all, your art style it's the best",https://twitter.com/RichardArt13/status/1274383831391485953
2020-06-20 16:49:16,AxiomCatwalk,"The World is Watching! #QAnonhttps://twitter.com/PhaethonSR/status/1274380961396948993 …",https://twitter.com/AxiomCatwalk/status/1274383830099488768
2020-06-20 16:49:16,pianistyoongs,"Nice to meet you doneuwu",https://twitter.com/pianistyoongs/status/1274383829105598467
2020-06-20 16:49:16,LavenderLives,"Art of War Sun Tzu. @POTUS No ruler should put troops into the field merely to gratify his own spleen; no general should fight a battle simply out of pique. If it is to your advantage, make a forward move; if not, stay where you are.",https://twitter.com/LavenderLives/status/1274383828174372867
2020-06-20 16:49:16,blueivyownsbey,"the way Ms.Hidalgo is THAT bitch https://twitter.com/linahidalgotx/status/1274087699683725319 …",https://twitter.com/blueivyownsbey/status/1274383827935416327
2020-06-20 16:49:15,1010arts,"Ahhh it must be fun to have someone in the family who's into cooking and baking!",https://twitter.com/1010arts/status/1274383826626555904
2020-06-20 16:49:15,vickisigh,"i love both",https://twitter.com/vickisigh/status/1274383824521015296
2020-06-20 16:49:15,raiannasymone,"Lol right like baby wrong place wrong time and kids don’t whisper lmao",https://twitter.com/raiannasymone/status/1274383823405568012
2020-06-20 16:49:14,CarmillaaaaaX,"Uchiha Sauceke Give me nukecode #naruto #nukecodes #saucepic.twitter.com/Eo1GHg7ksG",https://twitter.com/CarmillaaaaaX/status/1274383822876901376
2020-06-20 16:49:14,solthequeer,"the talent what a classic",https://twitter.com/solthequeer/status/1274383822801506304
2020-06-20 16:49:14,Kaalynn__,"25th wya",https://twitter.com/Kaalynn__/status/1274383821589434375
2020-06-20 16:49:14,miniebeom,"hello we're not close but i just wanted to tell you that you're a beautiful hooman who's loved and always shall be protected at any cause. ILY",https://twitter.com/miniebeom/status/1274383821228486656
2020-06-20 16:49:13,ddaengxcypher,"kinda sorta in love with my red velvet photocards pic.twitter.com/VwGL5xSvN9",https://twitter.com/ddaengxcypher/status/1274383818624032769
2020-06-20 16:49:13,_CLOUD00,"Happy birthday Ryeowook, I love you forever! You will be my forever bias #HappyRyeowookDay #LittlePrince_Ryeowook_HappyBirthdaypic.twitter.com/1S8BbLHfFb",https://twitter.com/_CLOUD00/status/1274383816975478789
2020-06-20 16:49:13,yoonsinsfire,"which one am i? y'all better reply something nice - soft stan, sunshine, nice, friendly ""babie"" - loud asf, lowkey funny, “are u ok?"" - intimidating, popular, always on tl ""no words"" - crush, i wanna hug and kith you, wanna date ""want kissies?""",https://twitter.com/yoonsinsfire/status/1274383816786800640
2020-06-20 16:49:12,jungwoosIut,"I have no idea I just saw someone on twt use it and saved it for myself SKDJSJDJDJD",https://twitter.com/jungwoosIut/status/1274383814438068224
2020-06-20 16:49:12,MakeupByJxb,"Waiting on the @JeffreeStar restock AND the day I finally join the JSC fam officially pic.twitter.com/iRbqODIApT",https://twitter.com/MakeupByJxb/status/1274383812449853441
2020-06-20 16:49:11,KeilaniWilliam2,"Did y’all know Monsta x invited R&Bpic.twitter.com/oz4PL8ycDh",https://twitter.com/KeilaniWilliam2/status/1274383809958612994
2020-06-20 16:49:11,Trixczia,"I LOVE YOU BB SUPEEEER",https://twitter.com/Trixczia/status/1274383809190875137
2020-06-20 16:49:11,softieWRYYYYYY,"#Affinitweet Emoji Mood , , , , , , , , , ... via https://affinitweet.com/emoji-mood pic.twitter.com/XezaQl5ZOV",https://twitter.com/softieWRYYYYYY/status/1274383808851132417
2020-06-20 16:49:11,reylosinspace,"Als this is absolutely not a jab at AU writers, I am here for any and all AU fic situationspic.twitter.com/JITc73wk2T",https://twitter.com/reylosinspace/status/1274383807022379010
2020-06-20 16:49:10,miazkilan,"youuuu toooo bb",https://twitter.com/miazkilan/status/1274383805390794753
2020-06-20 16:49:09,Kuaka8,"Oh! My Stans are going to rejoice over this!https://twitter.com/atheurer1/status/1274383661408845824 …",https://twitter.com/Kuaka8/status/1274383801532190723
2020-06-20 16:49:09,FadhilN,"Eyy, it's birthday for both of those two lovely guys! @vanyaviranda @apiidan",https://twitter.com/FadhilN/status/1274383801049702400
2020-06-20 16:49:07,hxllyxbee,"Very good, much love",https://twitter.com/hxllyxbee/status/1274383792493428743
2020-06-20 16:49:06,Young5Ever_,"I think I lost my motivation fell off again when my computer stopped working for the second time after my warranty ppl fixed it the first time",https://twitter.com/Young5Ever_/status/1274383788550893568
2020-06-20 16:49:06,juiclia,"yes, I will. https://twitter.com/qinsuol/status/1274368025508982790 …",https://twitter.com/juiclia/status/1274383787497975809
2020-06-20 16:49:06,cvaerx,"MORE https://twitter.com/ItzJustJay32/status/1274383681252216834 …",https://twitter.com/cvaerx/status/1274383785908371456
2020-06-20 16:49:06,ItzzXteen,"Face pretty but Soul prettierpic.twitter.com/JOlPDyAugM",https://twitter.com/ItzzXteen/status/1274383785782652929
2020-06-20 16:49:05,renhakuyuu,"Just let me know any time",https://twitter.com/renhakuyuu/status/1274383784654315521
2020-06-20 16:49:05,ladiosaathena,"I’m just not for the gay bashing at all. Take that childish ass shit somewhere else and grow up on your way there.",https://twitter.com/ladiosaathena/status/1274383783484166144
2020-06-20 16:49:04,abcdebayn,"kuroooo's header https://twitter.com/fairykenma/status/1274298680493748224 …",https://twitter.com/abcdebayn/status/1274383780946440192
2020-06-20 16:49:04,connielopez62,"Omg Congratulations mija! So happy for you and your family! Grandpa and I can’t wait to meet your baby girl!",https://twitter.com/connielopez62/status/1274383780849922048
2020-06-20 16:49:04,kcnjikishimoto,"thxx",https://twitter.com/kcnjikishimoto/status/1274383780502024192
2020-06-20 16:49:04,taekookielicio3,"Awww thank you",https://twitter.com/taekookielicio3/status/1274383779222740995
2020-06-20 16:49:04,pahayahayjj,"Happy fathers day to all fathers out there and to all the moms nga nag paka daddy sa ila babies",https://twitter.com/pahayahayjj/status/1274383777330913283
2020-06-20 16:49:04,Khlaris_i_o,"What?",https://twitter.com/Khlaris_i_o/status/1274383777238863874
2020-06-20 16:49:03,mulletdowoon,"thank youuuuu pooo",https://twitter.com/mulletdowoon/status/1274383774768193538
2020-06-20 16:49:03,Tbezzy_16th,"I’m not letting NOBODY manipulate me into thinking I didn’t do right by them. I’m a good person & can’t NOBODY take that from me",https://twitter.com/Tbezzy_16th/status/1274383774214750209
2020-06-20 16:49:03,LegendarySuccub,"Cute",https://twitter.com/LegendarySuccub/status/1274383774197874688
2020-06-20 16:49:03,strawberrikoo,"love you more i hope you feel better soon:(",https://twitter.com/strawberrikoo/status/1274383774189596678
2020-06-20 16:49:03,mallettvalerie,"It is Sheila I feel like I grieved for my mum when she was first diagnosed, the most heartbreaking was when I use to go in she would ask me where Kieran was and my dad who we had lost 13 yrs previous she had forgotten bless her heart xxxx",https://twitter.com/mallettvalerie/status/1274383773581402113
2020-06-20 16:49:02,shabblack,"Its on my phone",https://twitter.com/shabblack/status/1274383768925753346
2020-06-20 16:49:01,elliekuespert,"omg please do mine in some sort of accent",https://twitter.com/elliekuespert/status/1274383768502099969
2020-06-20 16:49:01,AngelsNamed,"I believe!",https://twitter.com/AngelsNamed/status/1274383768208453639
2020-06-20 16:49:01,LIMEDAYOUNG,"bubuuu, i think it's too late to talk a lot hshshs, sleep well arinie!",https://twitter.com/LIMEDAYOUNG/status/1274383765251358720
2020-06-20 16:49:00,nico_0621,"It’s actually an au i thought of a few months back!!! i love kimiuso",https://twitter.com/nico_0621/status/1274383764370493440
2020-06-20 16:49:00,annienocontext,"NOTE: THIS IS A JOKE ACCOUNT MADE FOR FUN, I DO NOT PROMOTE ATTACKING/BULLYING PLEASE DON'T SEND HATE TO ANYONE IN SCREENSHOTS! TY!",https://twitter.com/annienocontext/status/1274383763619958787
2020-06-20 16:49:00,iEllxii,"No sorry im making a neon! I didn't have to comment but I wanted to see who is kind or not!",https://twitter.com/iEllxii/status/1274383763326337026
2020-06-20 16:49:00,ArtioWyvern,"Thank you",https://twitter.com/ArtioWyvern/status/1274383762240024577
2020-06-20 16:48:59,oWinterWren,"Hey it's me Wren ٢◎▼◎ゝ new twitter to connect with rp friends and...for future streaming...? hmmm",https://twitter.com/oWinterWren/status/1274383759840813056
2020-06-20 16:48:59,bucinloona,"gowon's voice https://twitter.com/hyesjisoo/status/1274379675272347648 …",https://twitter.com/bucinloona/status/1274383758217539585
2020-06-20 16:48:59,yv3sjaguar,"me whenever the camera zooms to yves",https://twitter.com/yv3sjaguar/status/1274383757793882112
2020-06-20 16:48:58,TwittyWittyBits,"This infectious hysteria is starting to concern me. This will not be a fight between white & non-white... this will be a colour-blind fight between the power of truth (protected by moderates) VS the lies of the far-left (and evil-doing of their uncritical media-inflamed morons)https://twitter.com/BasedPoland/status/1274343885720948736 …",https://twitter.com/TwittyWittyBits/status/1274383755436797954
2020-06-20 16:48:58,BQPublic1,"I love @KessenaO ! He always brings the Love, Humor & LoGic! #WWG1WGAhttps://twitter.com/KessenaO/status/1274382198758612995 …",https://twitter.com/BQPublic1/status/1274383755365548032
2020-06-20 16:48:58,Wingmanpays,"Stupidity Plus I’m missing four wheels and I’m knackered lol I’ve fallen asleep in a west end theatre with her before and I still walk with a limp And I have things to sort out in my head as well today so a rain check is a good idea xx",https://twitter.com/Wingmanpays/status/1274383754849640449
2020-06-20 16:48:58,IlanaNight13,"Sending you love and support I'm here if you need anything!",https://twitter.com/IlanaNight13/status/1274383754291638273
2020-06-20 16:48:58,ASHISL4ND,"PRETTIESThttps://twitter.com/OfficialMonstaX/status/1274350176400887808 …",https://twitter.com/ASHISL4ND/status/1274383753943691271
2020-06-20 16:48:58,KathmanduAlty,"Beautiful weather today to enjoy our barbecued Tandoori dishes. • • View menu on our website to place your takeaway order for Home Delivery or Collection (10% Discount). pic.twitter.com/5dKKlBdAuN",https://twitter.com/KathmanduAlty/status/1274383753901674502
2020-06-20 16:48:58,IITheBecksterII,"Omg you're on Twitter!",https://twitter.com/IITheBecksterII/status/1274383752970539010
2020-06-20 16:48:58,cakey39,"Not enjoying black mage particularly so far but love my glam for it #ffxivpic.twitter.com/YSJ3WOwkXr",https://twitter.com/cakey39/status/1274383752303652864
2020-06-20 16:48:57,ceedubyahcee,"I do book reviews for the @Geekerati podcast! We’re on all the big streaming services",https://twitter.com/ceedubyahcee/status/1274383750198030336
2020-06-20 16:48:57,Amchizzy,"Thanks love but keep the cuddle away till Monday. I need to heal well without transferring aggression",https://twitter.com/Amchizzy/status/1274383747908079620
2020-06-20 16:48:56,HUMBLUEXO,"LOVE U",https://twitter.com/HUMBLUEXO/status/1274383744783101952
2020-06-20 16:48:55,jojifarmer,"take ur time hun!! i hope u feel better soon pic.twitter.com/vy7u5cXUR9",https://twitter.com/jojifarmer/status/1274383741473832960
2020-06-20 16:48:55,GetRightGirrl,"Exactly. It’s been harrowing, the lack of leadership at a state level, while our county judge begs for permission to try to mitigate this disaster. This should be a no-brainer. Instead, it’s rampant Trumpism in the governor’s mansion. & I was a Republican & voted for this idiot!",https://twitter.com/GetRightGirrl/status/1274383740073062403
2020-06-20 16:48:54,PousumiGhosh,"R u trying to justify nepotism? R u trying to hide how she abused @itsSSR? Do u want us to forget all that she said to him on a National Television? Kuch toh sharam karo... Kam se kam ab toh Nepotism ko support maat karo plz. #SushantSinghRajput #CBIInvestigationForSushanthttps://twitter.com/filmfare/status/1274361968359550979 …",https://twitter.com/PousumiGhosh/status/1274383738101657600
2020-06-20 16:48:54,LuciernagaMovie,"• A bit of the TRAILER of #LaLuciernagaMovie • #TheFireflyMovie • Watch it at letsmowies (Link Above ) https://www.instagram.com/p/CBqgJkoJUQJ/?igshid=hadhu06kvoks …",https://twitter.com/LuciernagaMovie/status/1274383736260497410
2020-06-20 16:48:53,WorldMusic1234,"*FREE* Hard Dance Tracks - Produced and Remixed by Darbo #darbo #freedownload #music #harddance #hardhouse via @darbomusic",https://twitter.com/WorldMusic1234/status/1274383734490435586
2020-06-20 16:48:53,Ahmad43206177,"Oh Allah What a beauty",https://twitter.com/Ahmad43206177/status/1274383732938543113
2020-06-20 16:48:53,_chorros,"oh how i miss #DAY6pic.twitter.com/BR80kzUzZY",https://twitter.com/_chorros/status/1274383730904199168
2020-06-20 16:48:52,kesiena_lilian,"U deserve queen https://twitter.com/AifyTheresa/status/1274380711018008576 …",https://twitter.com/kesiena_lilian/status/1274383728798846976
2020-06-20 16:48:52,miazkilan,"u tooooo bb",https://twitter.com/miazkilan/status/1274383727209009152
2020-06-20 16:48:51,theoryofwonho,"KIHYUN STANS COME GET YOUR MAN THIS IS UNACCEPTABLEpic.twitter.com/K0iYGWY0PN",https://twitter.com/theoryofwonho/status/1274383725749510146
2020-06-20 16:48:51,Tehreem39158890,"No one ....literally no one Me to myself after every 15 mins : ""Yaar WB ne kaha tha k bht ziada ehtiaat krni hy baar baar sanitizer ka istemal kryn"" So me har 15 mint k bad washroom my jaa k 20 sec k liye hand wash kr k aati hn or phr sanitizer b use krti hn @WaseemBadami",https://twitter.com/Tehreem39158890/status/1274383723945963520
2020-06-20 16:48:51,sophietexas_,"i’m too chumby :/",https://twitter.com/sophietexas_/status/1274383723895586821
2020-06-20 16:48:51,Angels_Piano,"Yup! I actually did! I even took their songs to school for “listening comprehension” and we did fill in the blanks with their songs, took some Sgt Peppers songs",https://twitter.com/Angels_Piano/status/1274383722658308097
2020-06-20 16:48:50,Lorena_37649,"We Do Not See Things As They Are, We See Things As We Are. pic.twitter.com/VaqvU07zEU",https://twitter.com/Lorena_37649/status/1274383721731362816
2020-06-20 16:48:50,temsmilkies,"he's so adorable! would definitely give him a big hug",https://twitter.com/temsmilkies/status/1274383720644919296
2020-06-20 16:48:50,doyeonescent,"See you in the morning! pic.twitter.com/KbUrvNMBLG",https://twitter.com/doyeonescent/status/1274383720431009794
2020-06-20 16:48:50,CELESG1RI,"like if you agree",https://twitter.com/CELESG1RI/status/1274383718854078467
2020-06-20 16:48:49,kriselii,"new writing prompt idea: click this link and write a fic based on what commonly used but randomly generated Ao3 tag inspires you https://archiveofourown.org/tags?show=random …",https://twitter.com/kriselii/status/1274383718249984001
