date,username,to,replies,retweets,favorites,text,geo,mentions,hashtags,id,permalink
2020-06-20 16:23:38,fullyofu,"Am just learning Korean",https://twitter.com/fullyofu/status/1274377378068746242
2020-06-20 16:23:33,FeeSabeelAllah1,"Can we just take this time to appreciate @maimoonax becuz she one of the few ppl on this app that has gheerah for her religion&speaks up when ppl mock the deen. The ppl that hate her are stupid rats becuz they wanna be her. Same ppl that hate her kiss a$$to shias...just sayin",https://twitter.com/FeeSabeelAllah1/status/1274377357969764353
2020-06-20 16:23:31,christcuzco,"im about to start deleting chats on snapchat to those who take 3 weeks to respond and say no one hits them upyou aint a celebrity",https://twitter.com/christcuzco/status/1274377349367201793
2020-06-20 16:23:26,mashukoushi,"bcs I love making myself floooooop mutuals only !! drop an emoji so I can write abt you!",https://twitter.com/mashukoushi/status/1274377328471060481
2020-06-20 16:23:17,jenwelries,"thanks sweetie",https://twitter.com/jenwelries/status/1274377290793672704
2020-06-20 16:23:15,lysolwastaken,"THANK YOU CHDJDD",https://twitter.com/lysolwastaken/status/1274377281549418498
2020-06-20 16:23:14,Thomas17842328,"I would love to know the name of boobs but not that time of the month ""period"" nope",https://twitter.com/Thomas17842328/status/1274377280001802241
2020-06-20 16:23:14,echofhades,"no and cmbyn was horrible representation of gay relationships because the relationship was more sexual than vulnerable and emotional but that's just my opinion so",https://twitter.com/echofhades/status/1274377277011300353
2020-06-20 16:23:11,VAROOS3N,"And mine last a week,",https://twitter.com/VAROOS3N/status/1274377263778279426
2020-06-20 16:23:09,just_sierras,"Pretty depressed",https://twitter.com/just_sierras/status/1274377256056446977
2020-06-20 16:23:06,_darneyy,"Her house I’m be there before 5 me and kho I plan on leaving around 12 prolly 1 it’s only a 2hr drive",https://twitter.com/_darneyy/status/1274377244664827911
2020-06-20 16:23:06,sleeppingirl,"abis rest mey",https://twitter.com/sleeppingirl/status/1274377244392091648
2020-06-20 16:22:56,ddaenggknj,"lmao (sad) birthday self pic.twitter.com/Gkj76NBPhT",https://twitter.com/ddaenggknj/status/1274377203749285889
2020-06-20 16:22:56,sinseibad,"Before and Afters from an old patio set my Grandma gave us. Looking P R E T T Y neat. pic.twitter.com/74snRnZgIU",https://twitter.com/sinseibad/status/1274377200561766402
2020-06-20 16:22:53,nanaleaf1,"mark leeee",https://twitter.com/nanaleaf1/status/1274377191183323136
2020-06-20 16:22:51,lexnxr,"don’t text me like im a backup plan i’ll really make ya ass look stupid",https://twitter.com/lexnxr/status/1274377181267976194
2020-06-20 16:22:51,lysolwastaken,"EXCUSE ME",https://twitter.com/lysolwastaken/status/1274377180873519104
2020-06-20 16:22:46,Breanna11447838,"If you call you boo, bro or dude, yk that relationship solid",https://twitter.com/Breanna11447838/status/1274377161139503105
2020-06-20 16:22:40,lickvcid,"ik it’s real when i got him into all this astrology stuff",https://twitter.com/lickvcid/status/1274377135218659328
2020-06-20 16:22:39,ellessworldd,"Pool day",https://twitter.com/ellessworldd/status/1274377130537779201
2020-06-20 16:22:38,GirlWinker,"Lmaoo thxx",https://twitter.com/GirlWinker/status/1274377127832551426
2020-06-20 16:22:36,LizeTheBeezNeez,"Idk maybe it’s just me... but I find it weird.",https://twitter.com/LizeTheBeezNeez/status/1274377119909494784
2020-06-20 16:22:35,hanjisungieo,"I'm sure I'm one of them. right? https://twitter.com/LEIIKNOW/status/1274376598976901120 …",https://twitter.com/hanjisungieo/status/1274377115337539586
2020-06-20 16:22:32,NayrusL0ve,"Get a tattoo of a roach instead",https://twitter.com/NayrusL0ve/status/1274377103522140161
2020-06-20 16:22:32,AVlELLE,"hmm i find that hard to believe but idk why",https://twitter.com/AVlELLE/status/1274377102318428160
2020-06-20 16:22:28,ilimoonlightili,"i'm fighting terry crews",https://twitter.com/ilimoonlightili/status/1274377084048158727
2020-06-20 16:22:23,MsSparkle_,"You know what it is whenever I visit",https://twitter.com/MsSparkle_/status/1274377064041381888
2020-06-20 16:22:23,overlyfancy_,"goodnight im thinking about them right now pic.twitter.com/6qLLtanRqb",https://twitter.com/overlyfancy_/status/1274377062887723008
2020-06-20 16:22:19,rvchsy1,"I dont befriend weird btcs......which is why I don’t have friendseverybody a little weird to me",https://twitter.com/rvchsy1/status/1274377046014263298
2020-06-20 16:22:14,loverrakk,"I love him so much omg help. pic.twitter.com/ISRDTxUPDS",https://twitter.com/loverrakk/status/1274377026330193920
2020-06-20 16:22:14,scftbaejin,"- @hhyk_hyaz Hellooooo!!! Huhuhu how was jjaeni's stage just now? HAHAHHAAH:""))) I love talking to youu sumpaaj seronok. I hope we can meet in the future . I love youu mwaaahhh",https://twitter.com/scftbaejin/status/1274377024702832640
2020-06-20 16:22:00,ohnoitsrosa,"Please make sure you watch all the way to the end for a special surprise friend https://youtu.be/GmMbhlEt0pY",https://twitter.com/ohnoitsrosa/status/1274376965508775936
2020-06-20 16:21:59,kyoongzone3,"baekhyunee forgot his own schedule pic.twitter.com/e2ciz3dW7S",https://twitter.com/kyoongzone3/status/1274376963742822403
2020-06-20 16:21:51,lysolwastaken,"I WANT FUNNY NUMBER",https://twitter.com/lysolwastaken/status/1274376931622838273
2020-06-20 16:21:50,cynthiasgr8,"I sent Jessica a pic of my outfit and she goes “wait, you look good at that angle is that how you send your nudes cochina”",https://twitter.com/cynthiasgr8/status/1274376924127727618
2020-06-20 16:21:42,420_truths,"Ive never been this fucked in my life before. Anyone wanna help me do some illegal activity",https://twitter.com/420_truths/status/1274376890841735168
2020-06-20 16:21:40,bellanixole,"my dumbass used to drink them when my anxiety levels were high",https://twitter.com/bellanixole/status/1274376882939736065
2020-06-20 16:21:36,Rosechiox,"2018 was better",https://twitter.com/Rosechiox/status/1274376865940221954
2020-06-20 16:21:33,LizeTheBeezNeez,"She didn’t find nun wrong that he was texting a fan page ? I would automatically think they would be minors since I haven’t seen no adults that like society.",https://twitter.com/LizeTheBeezNeez/status/1274376852736540674
2020-06-20 16:21:31,marmaucumla,"basta siz..,,, flipping the script only gives u a temporary sympathy for the truth will always prevail, not now but soon. karma is a bitch raba gyud. malay mo, ur slowly tasting it rn without much realizations",https://twitter.com/marmaucumla/status/1274376846004514817
2020-06-20 16:21:29,parkjeYeol,"happi berthday beb!!!",https://twitter.com/parkjeYeol/status/1274376836806369281
2020-06-20 16:21:28,_darneyy,"I’m bouta head there !! Come to our girls night",https://twitter.com/_darneyy/status/1274376834663223299
2020-06-20 16:21:28,lysolwastaken,"WH SPARE 1??",https://twitter.com/lysolwastaken/status/1274376833224433664
2020-06-20 16:21:24,CRINGE_OF_GOD,"They just want a little smooch.",https://twitter.com/CRINGE_OF_GOD/status/1274376818137522178
2020-06-20 16:21:18,luhbabyyrosaly,"imagine hating on payno . he’s so unproblematic leave him alone",https://twitter.com/luhbabyyrosaly/status/1274376793345216513
2020-06-20 16:21:18,molala_la,"yes u too sweetie",https://twitter.com/molala_la/status/1274376790463508482
2020-06-20 16:21:08,sup_im_sammy,"stop pretending to give a shit about optics, we can see your likes and rts",https://twitter.com/sup_im_sammy/status/1274376749766176773
2020-06-20 16:21:08,scftbaejin,"Love you toooo",https://twitter.com/scftbaejin/status/1274376749460013058
2020-06-20 16:21:06,lightsauriant,"Imagine having gun control in your country, can relate",https://twitter.com/lightsauriant/status/1274376739423244288
2020-06-20 16:21:05,r0ckych1ck,"guess who’s cuttin their hair like casey from atypical tmrw",https://twitter.com/r0ckych1ck/status/1274376737837559808
2020-06-20 16:21:04,hanaaforkituan,"Okay goodnight guys for real, im logging out pic.twitter.com/dtDGEyHnAN",https://twitter.com/hanaaforkituan/status/1274376731479076897
2020-06-20 16:20:58,tiarajameson,"Merc for the dub.",https://twitter.com/tiarajameson/status/1274376707093360641
2020-06-20 16:20:57,lysolwastaken,"for my layout pls pick",https://twitter.com/lysolwastaken/status/1274376704882954241
2020-06-20 16:20:48,vntegie,"of course good ending",https://twitter.com/vntegie/status/1274376664328351744
2020-06-20 16:20:41,cucumbba,"when you don’t have a middle name https://twitter.com/miaaxaaim/status/1273667175765721088 …",https://twitter.com/cucumbba/status/1274376634381074432
2020-06-20 16:20:40,bearyboo_j9,"Good night to Joong and Nine and congrats.... woooopsieeee pic.twitter.com/4NEOBScuwF",https://twitter.com/bearyboo_j9/status/1274376631499382784
2020-06-20 16:20:37,bianoitws,"heterobait",https://twitter.com/bianoitws/status/1274376620879556609
2020-06-20 16:20:30,skzvirgos,"think it’s the right time to bring this back #DAY6 #데이식스 #DAY6WORLDTOUR #DAY6_GRAVITY #DAY6_MIDNIGHT_CONCERTpic.twitter.com/9ZJPb6S7U2",https://twitter.com/skzvirgos/status/1274376590760177664
2020-06-20 16:20:26,zsevu,"Omg gm y'all with luo binghe's sky pillar",https://twitter.com/zsevu/status/1274376575287525384
2020-06-20 16:20:23,oratilemothibe,"please make for me",https://twitter.com/oratilemothibe/status/1274376562125742081
2020-06-20 16:20:23,Lao_Cody,"Your words won’t affect me",https://twitter.com/Lao_Cody/status/1274376561513254914
2020-06-20 16:20:22,mahnewr_,"ur slowly becoming lactose intolerant mera asar",https://twitter.com/mahnewr_/status/1274376557373591553
2020-06-20 16:20:13,K00BERRIE,"ahh okie it's just your pronouns aren't in your profile anywhere",https://twitter.com/K00BERRIE/status/1274376518614028292
2020-06-20 16:20:08,littyleaah,"Today will be a good day",https://twitter.com/littyleaah/status/1274376497629929475
2020-06-20 16:20:07,abbygillon,"Really bored so, guess (1 or more of..) my villagers? 1. 2. 3. 4. 5. 6. 7. 8. 9. 10.",https://twitter.com/abbygillon/status/1274376494085783553
2020-06-20 16:19:59,ongepeach,"Next June, 23rd",https://twitter.com/ongepeach/status/1274376458983452673
2020-06-20 16:19:59,kllrqsn,"IM OK ITS JUST.,,,SOUSHIN",https://twitter.com/kllrqsn/status/1274376458148986880
2020-06-20 16:19:56,tapeddoll,"what's my talent you ask? drawing circles free hand",https://twitter.com/tapeddoll/status/1274376446669193218
2020-06-20 16:19:52,BelieveinFro,"Neanderthal gene exposed",https://twitter.com/BelieveinFro/status/1274376430814625794
2020-06-20 16:19:50,lysolwastaken,"i havent slept yet hehe",https://twitter.com/lysolwastaken/status/1274376420932718592
2020-06-20 16:19:47,darysjae,"party in city where the heat is on all night on the beach till the break of dawn welcome to miami",https://twitter.com/darysjae/status/1274376410631675904
2020-06-20 16:19:45,manob4n,"Miss youuu",https://twitter.com/manob4n/status/1274376401538265089
2020-06-20 16:19:44,Y0UNGTAEKS,"I also often see you in my tl but your @and content??? chef's kiss https://twitter.com/ilyjangjun/status/1274370278072565762 …",https://twitter.com/Y0UNGTAEKS/status/1274376398568816642
2020-06-20 16:19:41,magata_xo,"Arsenal fan and happiness in the same sentence???",https://twitter.com/magata_xo/status/1274376383792283649
2020-06-20 16:19:38,KwakwaraNetty,"Other side of d wall",https://twitter.com/KwakwaraNetty/status/1274376372044079104
2020-06-20 16:19:37,txtcentergyu,"anyone under the likes are being unfollowed https://twitter.com/MOA_muse/status/1274361714272800770 …",https://twitter.com/txtcentergyu/status/1274376367904223233
2020-06-20 16:19:32,_okayt_,"Tmb posso ficar?",https://twitter.com/_okayt_/status/1274376345695457280
2020-06-20 16:19:31,MercyAlmasi,"twin",https://twitter.com/MercyAlmasi/status/1274376343443181569
2020-06-20 16:19:27,senorita_amor,"Honestly tho, it’s lowkey your fault cause we certain songs came on you could’ve followed the ee-yip https://twitter.com/theleakspeaks/status/1274376038152318976 …",https://twitter.com/senorita_amor/status/1274376327802630147
2020-06-20 16:19:23,beomgyeuphoria,"my pfp gives it away so don’t look at that but here",https://twitter.com/beomgyeuphoria/status/1274376309163143174
2020-06-20 16:19:18,bitterflop,"thank you delll",https://twitter.com/bitterflop/status/1274376289269374976
2020-06-20 16:19:15,yaaawwwiii,"HELLOO we barely interact so i hope that we interact more at sana maging close tayo ilyy stay safe",https://twitter.com/yaaawwwiii/status/1274376275247763457
2020-06-20 16:19:14,sup_im_sammy,"the people who are really mad about that US Grant statue don't seem to be all that mad about the police murdering people its weird",https://twitter.com/sup_im_sammy/status/1274376272278364161
2020-06-20 16:19:13,heiyoshii,"pls keep on tweeting on wwct because i crying hahah jokes aside, i like ur tweets they are golds",https://twitter.com/heiyoshii/status/1274376267115061248
2020-06-20 16:19:13,ifeIIforittwice,"most of them aren’t wearing masks and don’t care to because “the virus only kills old people” but all lives matter though https://twitter.com/ianbremmer/status/1274342211631669249 …",https://twitter.com/ifeIIforittwice/status/1274376265198260226
2020-06-20 16:19:10,fatlilbx,"yup they’re called coregasms another reason work them abs",https://twitter.com/fatlilbx/status/1274376256549781504
2020-06-20 16:19:10,shanty_sukhraj,"Me : A B C D E F G H I J K She : What is this ? Me : A for Attractive, B for Beautiful, Cute, Dashing, Elegant, Funny, Gorgeous and Hot She : What about I J K ? Me : I am just kidding",https://twitter.com/shanty_sukhraj/status/1274376254657949696
2020-06-20 16:19:02,bangtanlomfl,"im not crying https://twitter.com/jkyoongs/status/1274323311548231689 …",https://twitter.com/bangtanlomfl/status/1274376220118003712
2020-06-20 16:19:00,cxle_xht,"I'm sorry gais but it's time for me to live twt again",https://twitter.com/cxle_xht/status/1274376213868376064
2020-06-20 16:18:55,GotMilkMellow,"Factsss",https://twitter.com/GotMilkMellow/status/1274376191638745089
2020-06-20 16:18:52,urfaveleo8297,"I’m rewearing yesterday’s fit when my hair is done",https://twitter.com/urfaveleo8297/status/1274376178518970370
2020-06-20 16:18:44,ramosraquelc,"miss u too beh",https://twitter.com/ramosraquelc/status/1274376147124383747
2020-06-20 16:18:43,peachylys,"can someone tell me why a GROWN ASS MAN was being SO mean to me at the window today like listen Gilbert, I’ll go clock out and throw hands rn if you wanna act so tough",https://twitter.com/peachylys/status/1274376142896549890
2020-06-20 16:18:38,soontoyoung,"A way to help reviving the loss of income of their business due to covid. It's like hitting two birds with one stone https://twitter.com/emarieyyehoshi/status/1274157966501900288?s=19 …",https://twitter.com/soontoyoung/status/1274376120322805760
2020-06-20 16:18:38,XuxiNaSushi,"ayo I can not do absolutely nothing",https://twitter.com/XuxiNaSushi/status/1274376120234905600
2020-06-20 16:18:36,Pushaan__,"Gg pernah oleng DOUN IS MY LOP",https://twitter.com/Pushaan__/status/1274376111388950532
2020-06-20 16:18:31,haechansaur,"if i talk to you in chinese korean or tagalog, would you understand? no right? bc you only know one language which is the UNIVERSAL language",https://twitter.com/haechansaur/status/1274376089217818624
2020-06-20 16:18:28,myrandaminaj,"maybe it’s a girl crush but maybe you’re queer",https://twitter.com/myrandaminaj/status/1274376077293617153
2020-06-20 16:18:23,avocadobarnes,"watch me make more fancams with indo songs",https://twitter.com/avocadobarnes/status/1274376057068466177
2020-06-20 16:18:16,girlthats_kd,"Sit On this wooood Like you just walked inside a gymnasium",https://twitter.com/girlthats_kd/status/1274376030002860032
2020-06-20 16:18:16,keulisa019,"MUTUALS ONLY!! drop an emoji and I will write something about you (lol watch this flop or wtv)",https://twitter.com/keulisa019/status/1274376028861820928
2020-06-20 16:18:16,hasnaloey,"Goodnight sayang Sweetdreams:))",https://twitter.com/hasnaloey/status/1274376026739499011
2020-06-20 16:18:09,Ciamphoo,"Happy happy birthdayyy!!",https://twitter.com/Ciamphoo/status/1274375998541197312
2020-06-20 16:18:02,grayjhs,"Maybe it's telling the truth",https://twitter.com/grayjhs/status/1274375967847469056
2020-06-20 16:17:58,jamesfisher_19,"It’s pretty lit tho",https://twitter.com/jamesfisher_19/status/1274375952152190978
2020-06-20 16:17:57,wallowsmallows,"i need mutuals like/rt if u stan • 1d ot5 / solo • dayglow • wallows • troye sivan • boy pablo • clairo • peach tree rascals • conan gray • 13rw",https://twitter.com/wallowsmallows/status/1274375947727237121
2020-06-20 16:17:56,SOOJUNGxBB,"kiss.",https://twitter.com/SOOJUNGxBB/status/1274375944468197376
2020-06-20 16:17:48,lysolwastaken,"YUHHH CAYLIE IS AWAKE TIME TO CELEBRATE",https://twitter.com/lysolwastaken/status/1274375911270264832
2020-06-20 16:17:47,summer2019stan,"ur too pwetty for that love",https://twitter.com/summer2019stan/status/1274375905775886346
2020-06-20 16:17:46,honeytyong,"my pleasure",https://twitter.com/honeytyong/status/1274375904131612672
2020-06-20 16:17:23,soontoyoung,"PISO PER VIEW SCHEME! Please click the tweet below for more infohttps://twitter.com/bestboyhoshi/status/1274295213213675522?s=19 …",https://twitter.com/soontoyoung/status/1274375805129224193
2020-06-20 16:17:20,lvlymarks,"Party in city where the heat is on all night on the beach till the break of dawn Welcome to miami",https://twitter.com/lvlymarks/status/1274375794702331904
2020-06-20 16:17:19,adia_cousin,"oop back to sleep I goooo this headache is not the wave !!!!",https://twitter.com/adia_cousin/status/1274375787693703169
2020-06-20 16:17:18,tasteofdarvey,"we're all hoping for something but ya know how they work lol so idk but I'm sad too",https://twitter.com/tasteofdarvey/status/1274375783193235462
2020-06-20 16:17:14,taegyusoulmates,"keep up the good job bubs",https://twitter.com/taegyusoulmates/status/1274375767535652865
2020-06-20 16:17:12,buckysvinyl,"i had my birthday party last night and it was a success and everyone had fun but my eyes burn and my head kinda hurts",https://twitter.com/buckysvinyl/status/1274375758203387907
2020-06-20 16:17:10,junoomf,"anything that comes we take it",https://twitter.com/junoomf/status/1274375750674608133
2020-06-20 16:17:02,jooniepeg,"anyway in a side not cant wait for this new svt album",https://twitter.com/jooniepeg/status/1274375718521106432
2020-06-20 16:16:58,jaefrrrey,"Yeah, it's better to shut yout mouth",https://twitter.com/jaefrrrey/status/1274375701752188928
2020-06-20 16:16:56,staykids_twt,"yeah, he told me he asked someone before me, but he regretted it, so thats why i’m with him now i’m so sorry for your loss bby",https://twitter.com/staykids_twt/status/1274375693149798402
2020-06-20 16:16:54,MoeNatMai2001,"Ahee handsome P'Vee #ENOFLOVEep11pic.twitter.com/yOmSbmzPws",https://twitter.com/MoeNatMai2001/status/1274375684278808576
2020-06-20 16:16:49,timyrasylvia,"I ONLY GOT TWITTER LAST YEAR I KNOW ITS EMBARRASSING SHHHHHH",https://twitter.com/timyrasylvia/status/1274375662883803139
2020-06-20 16:16:40,jaehwandipity,"THANKS FOR TONIGHT @day6official @Jae_Day6 @Dw_day6_drummer @DAY6_BOBSUNGJIN #DAY6 #데이식스 #DAY6WORLDTOUR #DAY6_GRAVITY #DAY6_MIDNIGHT_CONCERTpic.twitter.com/kqVYK1xOB4",https://twitter.com/jaehwandipity/status/1274375626569314308
2020-06-20 16:16:37,swagpcyy,"thankuuu ifo!!!",https://twitter.com/swagpcyy/status/1274375611394318342
2020-06-20 16:16:22,titomoronta_BG,"I like it like that",https://twitter.com/titomoronta_BG/status/1274375548609888256
2020-06-20 16:16:16,kristcult,"me too ara^^ dont hesitate to interact with me sweety",https://twitter.com/kristcult/status/1274375524320567302
2020-06-20 16:16:13,lanwcellot,"Celine",https://twitter.com/lanwcellot/status/1274375513650257923
2020-06-20 16:16:03,freddiemcfly1,"Happy 51st anniversary to these two amazing people. My mom and dad are the greatest two people I know. Love you both more then words could ever say. pic.twitter.com/1c5qx6JTIw",https://twitter.com/freddiemcfly1/status/1274375468825767936
2020-06-20 16:15:59,magata_xo,"Hama, it's about timeeee",https://twitter.com/magata_xo/status/1274375451486674950
2020-06-20 16:15:58,fayechim,"BTW, UR SO GOOD AT EDITING https://twitter.com/sexcpied/status/1273954507223777280 …",https://twitter.com/fayechim/status/1274375447619330052
2020-06-20 16:15:54,divineauthors,"the tea is scalding today",https://twitter.com/divineauthors/status/1274375432427585540
2020-06-20 16:15:53,adia_cousin,"I had a dream that I went grocery shopping",https://twitter.com/adia_cousin/status/1274375428044660736
2020-06-20 16:15:50,OSH_RANGHAJA,"shet maling picture",https://twitter.com/OSH_RANGHAJA/status/1274375415604244481
2020-06-20 16:15:46,ohnoitsrosa,"Thomas watch my video",https://twitter.com/ohnoitsrosa/status/1274375396847505409
2020-06-20 16:15:35,floralip,"i keep seeing things and idk wether should i go for rukyah or therapy",https://twitter.com/floralip/status/1274375354140913666
2020-06-20 16:15:29,ilndjbeom,"cheaters",https://twitter.com/ilndjbeom/status/1274375327012327424
2020-06-20 16:15:29,_average__jo,"You aint lyin honey",https://twitter.com/_average__jo/status/1274375325720379393
2020-06-20 16:15:21,blueixiay,"happy birthday! please, stay healthy. ily",https://twitter.com/blueixiay/status/1274375293734547456
2020-06-20 16:15:12,weateezin,"How you like THAT",https://twitter.com/weateezin/status/1274375255331667969
2020-06-20 16:15:11,Peachyluv17,"nonton anime",https://twitter.com/Peachyluv17/status/1274375253943189506
2020-06-20 16:15:07,meronxabamecha,"schools belike racism: wearing a hoodie in class: and thats on dutch schools",https://twitter.com/meronxabamecha/status/1274375234901196800
2020-06-20 16:15:01,notc0lt,"softblocked oomf just bcos he thinks too highly on himself",https://twitter.com/notc0lt/status/1274375211140345857
2020-06-20 16:14:57,jooniepeg,"i know interlude/outro Wings such a banger bcs ADORA produced it",https://twitter.com/jooniepeg/status/1274375192626688000
2020-06-20 16:14:56,JessaWood1,"I don't know why, but all I want right now is sex. pic.twitter.com/uvNj3icZ6t",https://twitter.com/JessaWood1/status/1274375189279711232
2020-06-20 16:14:53,mikaelabye,"JOKE quits na",https://twitter.com/mikaelabye/status/1274375178072371201
2020-06-20 16:14:53,kpoplover727,"Really who needs a boyfriend when EXO keeps you busy and plan dinner dates with you",https://twitter.com/kpoplover727/status/1274375176914960392
2020-06-20 16:14:42,RelldoesTV,"Its always a movie when da gang step on the scene pic.twitter.com/CTiwFSRCHD",https://twitter.com/RelldoesTV/status/1274375131540971521
2020-06-20 16:14:42,spiderlydoctor,"sw GIVE US SHE RA MOVIE https://twitter.com/shecatradora/status/1274351997794254850 …",https://twitter.com/spiderlydoctor/status/1274375131389997059
2020-06-20 16:14:30,rogersversx,"or any other flag https://twitter.com/hundredacrwood/status/1273697422259052544 …",https://twitter.com/rogersversx/status/1274375082131980291
2020-06-20 16:14:27,Ragin_Cajun400,"Good vibes ~!~ https://youtu.be/ILtDs0MmRHE",https://twitter.com/Ragin_Cajun400/status/1274375068806721536
2020-06-20 16:14:27,HY3L1P,"Just been rejected by the loml",https://twitter.com/HY3L1P/status/1274375067091251200
2020-06-20 16:14:25,IrishMeryll_,"Happy Father's day papa",https://twitter.com/IrishMeryll_/status/1274375057922355201
2020-06-20 16:14:20,jaime631,"Have a nice Saturday Tuttle N. Texas and Friends.... pic.twitter.com/k7qsnPKV7O",https://twitter.com/jaime631/status/1274375040247758848
2020-06-20 16:14:20,lyssx_sxlinxs,"Yes he was crying right on the neighbors roof as I got home and I was on the phone with Marco and just told him “I hope we find Bunga soon” he looked so scared on that roof lol",https://twitter.com/lyssx_sxlinxs/status/1274375036988686338
2020-06-20 16:14:19,tonetskieeeee,"Stay strong",https://twitter.com/tonetskieeeee/status/1274375035529109506
2020-06-20 16:14:18,subincheeks,"ALICE YOU ARE MY OG REALLY words can’t express much but you and i know that’s enough really",https://twitter.com/subincheeks/status/1274375029627580416
2020-06-20 16:14:14,MadalynVelasqu2,"Call me your babe any day. pic.twitter.com/lVDJlvZdLP",https://twitter.com/MadalynVelasqu2/status/1274375011562852353
2020-06-20 16:14:13,SasiKir54703134,"Hope it Works...! #FabiFlu #Glenmark #Covid19 #coronaviruspic.twitter.com/oZklRJvtEc",https://twitter.com/SasiKir54703134/status/1274375007968169984
2020-06-20 16:14:11,xuxisenpai,"[ 12 ] — ADORABLE LAYOUT — a lumi?? we’re besties now — a soft stan aw — i can tell u love xuxi a lot — lets interact more okayy i hope u have a gr8 day",https://twitter.com/xuxisenpai/status/1274375002100428800
2020-06-20 16:14:10,scifernandx,"ficar fitt",https://twitter.com/scifernandx/status/1274374995985211394
2020-06-20 16:14:09,playgirlang,"LMAO atp i think i could psychoanalyze someone if they asked bc",https://twitter.com/playgirlang/status/1274374990834610177
2020-06-20 16:14:08,im_para_dise,"ladies first",https://twitter.com/im_para_dise/status/1274374987487428613
2020-06-20 16:14:05,bigchocochan,"OMG I remember listening to this song EVERYDAY in the class (my classmates play it) and know nothing about 2PM is my biggest regrets https://twitter.com/su_woo715/status/1274273656672141315 …",https://twitter.com/bigchocochan/status/1274374976745771008
2020-06-20 16:13:58,Bryauna124,"I’m in love https://twitter.com/gotbangtanwhore/status/1274332068059795458 …",https://twitter.com/Bryauna124/status/1274374946345672706
2020-06-20 16:13:57,soontoyoung,"DONATIONS FOR CHAMSIMS OR STREAM PASSES (A THREAD)",https://twitter.com/soontoyoung/status/1274374943346581505
