date,username,to,replies,retweets,favorites,text,geo,mentions,hashtags,id,permalink
2020-06-20 18:23:37,WHISKYLOVEXO,"They also came to escape totalitarian regimes, opression of free expression, and lawlessness just to name a few more.... genius.",https://twitter.com/WHISKYLOVEXO/status/1274407574251753473
2020-06-20 18:23:37,santilotr,"Download Voicemod now for FREE! The best weapon for players and content creators -> - The best real-time Voice Changer - Amazing Soundboard - Collection of over 70 original voices - Voice Maker Troll like a PRO! http://bit.ly/2PO8Qj0 #Voicechanger",https://twitter.com/santilotr/status/1274407573832323073
2020-06-20 18:23:36,AnKanis04,"ULTRA MIND BLOWN https://twitter.com/Mrdodobird/status/1237194284903723014 …",https://twitter.com/AnKanis04/status/1274407569017225217
2020-06-20 18:23:33,BashanKhongshei,"Damn that's really sick",https://twitter.com/BashanKhongshei/status/1274407556706758657
2020-06-20 18:23:32,jtrus3,"Wait, you weren't pursuing academic excellence to learn parenting skills? *Gasp* can there be more to you, as a person, than having babies?!?! If my eyes roll back any farther into my head, they're not coming back.",https://twitter.com/jtrus3/status/1274407554156834816
2020-06-20 18:23:30,_PURPLEHEARTT,"mind blown",https://twitter.com/_PURPLEHEARTT/status/1274407542660136963
2020-06-20 18:23:25,milay_di,"So y’all gave them money as competition and not cos you love them? https://twitter.com/jayjaysarps/status/1274384999849091074 …",https://twitter.com/milay_di/status/1274407524905684992
2020-06-20 18:23:15,Smackedbacon1,"Download Voicemod now for FREE! The best weapon for players and content creators -> - The best real-time Voice Changer - Amazing Soundboard - Collection of over 70 original voices - Voice Maker Troll like a PRO! http://bit.ly/2PO8Qj0 #Voicechanger",https://twitter.com/Smackedbacon1/status/1274407480148340737
2020-06-20 18:23:07,ProLifPatriot,"What the H",https://twitter.com/ProLifPatriot/status/1274407447004839936
2020-06-20 18:23:06,nayoxo,"Omg this looks like a fan account edit, it's that good",https://twitter.com/nayoxo/status/1274407443192328194
2020-06-20 18:23:02,JordonBTC,"About to cancel my gym membership and not one person inside is wearing a mask... no masks in a gym??!?",https://twitter.com/JordonBTC/status/1274407426045939714
2020-06-20 18:22:59,Kyra_Nicole18,"You don't say?! #NYChttps://twitter.com/RealJamesWoods/status/1274345488225931264 …",https://twitter.com/Kyra_Nicole18/status/1274407414343839750
2020-06-20 18:22:54,CarolMcBelle,"doing an online chemotherapy recertification course and it’s super boring",https://twitter.com/CarolMcBelle/status/1274407391413637126
2020-06-20 18:22:54,esdrasgrimaldo,"That spear, and the Canadian destroyer both got me https://twitter.com/l0rdadrean/status/1274156669401018373 …",https://twitter.com/esdrasgrimaldo/status/1274407390973050880
2020-06-20 18:22:50,cakefthes,"but how could u not include heartbreak girl https://twitter.com/cth5sos/status/1274209784636624897 …",https://twitter.com/cakefthes/status/1274407376171352064
2020-06-20 18:22:47,NolimitCrazyJoe,"Im A chill person So keep the drama away before you die round here",https://twitter.com/NolimitCrazyJoe/status/1274407361902530561
2020-06-20 18:22:44,DonThaPhantom,"And the start of the haha I’ll be quiet lol",https://twitter.com/DonThaPhantom/status/1274407349671702528
2020-06-20 18:22:37,Gosay20th,"Ty from AFTV is 50 years old. FIFTY !",https://twitter.com/Gosay20th/status/1274407320475373568
2020-06-20 18:22:34,krusbaer,"Some great nuggets in today's video . You often talk about Core Content, that's a part of the mentorship, right?",https://twitter.com/krusbaer/status/1274407310488715264
2020-06-20 18:22:25,VowWorld_,"Your insane !",https://twitter.com/VowWorld_/status/1274407272727314434
2020-06-20 18:22:20,ariealshyneice,"mind blowing",https://twitter.com/ariealshyneice/status/1274407251009249281
2020-06-20 18:22:18,SherriW40093332,"But, she sounds so lovely, especially with those choice of words. https://twitter.com/KarluskaP/status/1274173581212213249 …",https://twitter.com/SherriW40093332/status/1274407243673411584
2020-06-20 18:22:11,linstable_,"Uyghurs are forced to work in your production chains in China. When are you gonna end your business with the companies which using forced labor with Uighurs ? @adidas already did it ! It's on the way for @LACOSTE too ! And you @Nike ? #UyghurLivesMatter #UyghurGenocide",https://twitter.com/linstable_/status/1274407213025710081
2020-06-20 18:22:09,AuntiDode,"Seriously stressing!",https://twitter.com/AuntiDode/status/1274407202225303553
2020-06-20 18:21:59,SquirtingFarrah,"That's right. He just wants his supporters to be happy, not alive apparently... https://twitter.com/TrumpDeathClock/status/1274020848417083394 …pic.twitter.com/ixEGryQPJF",https://twitter.com/SquirtingFarrah/status/1274407163201327105
2020-06-20 18:21:59,hamdaaarshad,"oops",https://twitter.com/hamdaaarshad/status/1274407162308165634
2020-06-20 18:21:58,JeremyF91638831,"Download Voicemod now for FREE! The best weapon for players and content creators -> - The best real-time Voice Changer - Amazing Soundboard - Collection of over 70 original voices - Voice Maker Troll like a PRO! http://bit.ly/2PO8Qj0 #Voicechanger",https://twitter.com/JeremyF91638831/status/1274407156394098688
2020-06-20 18:21:56,Carson_jessie23,"my guy @bo_millikanhttps://twitter.com/bc_athletics_/status/1274404386689757184 …",https://twitter.com/Carson_jessie23/status/1274407151100928002
2020-06-20 18:21:56,TomCaulfield01,"Can you imagine how the world would react",https://twitter.com/TomCaulfield01/status/1274407149452447744
2020-06-20 18:21:51,BRRSC,"Caught, then deleted it. PLEASE make Strathclyde University accountable for employing a Sectarian Bigot (as an HR Manager ) PHONE: 0141-552-4400 Mon-Fri 9am-5pm EMAIL: equalopportunities@strath.ac.uk WRITE: University of Strathclyde, 16 Richmond Street, Glasgow, G1 1XQ pic.twitter.com/NpovoF13b9",https://twitter.com/BRRSC/status/1274407129374502920
2020-06-20 18:21:46,MARIp0saaa,"Im gonna go insane my aunt that thinks that the virus is a hoax and vaccines cause autism",https://twitter.com/MARIp0saaa/status/1274407107886972932
2020-06-20 18:21:38,aniskahmad,"Whaaaaaaaaat my mind pic.twitter.com/WcNBpkpvXd",https://twitter.com/aniskahmad/status/1274407072705191938
2020-06-20 18:21:36,Jeffery75710425,"Some of us are broke",https://twitter.com/Jeffery75710425/status/1274407063804956677
2020-06-20 18:21:34,StilvollxXx,"Is stormy weather in your place?",https://twitter.com/StilvollxXx/status/1274407056489971713
2020-06-20 18:21:30,ilmshawn,"Is it just me or is anyone glad this spring is finally over? ⠀ ⠀ It's the first day of summer! ⠀ ⠀ Flip flops, shorts, suntanning, playing in the sand, working in the garden, sipping on some cold Matcha or… https://www.instagram.com/p/CBqrFjIFllI/?igshid=1ucgwp67wyg20 …",https://twitter.com/ilmshawn/status/1274407041088528384
2020-06-20 18:21:29,JoeMiller101,"Real life ?! pic.twitter.com/qhJIWTtgKl",https://twitter.com/JoeMiller101/status/1274407037510787080
2020-06-20 18:21:24,PAMewang,"so many thoughts",https://twitter.com/PAMewang/status/1274407015402606597
2020-06-20 18:21:21,milay_di,"This is actually a very good deal https://twitter.com/thesolape/status/1272179843275395073 …",https://twitter.com/milay_di/status/1274407004824633344
2020-06-20 18:21:12,balldawgs,"Still don’t understand how @PAPPYGAWD made this shot @kg_werkpic.twitter.com/teEeol6voA",https://twitter.com/balldawgs/status/1274406963242123265
2020-06-20 18:21:11,Aras90817253,"Download Voicemod now for FREE! The best weapon for players and content creators -> - The best real-time Voice Changer - Amazing Soundboard - Collection of over 70 original voices - Voice Maker Troll like a PRO! http://bit.ly/2PO8Qj0 #Voicechanger",https://twitter.com/Aras90817253/status/1274406961069486080
2020-06-20 18:21:06,MaseratiLisa,"That's a lot of people. I know the difference but sometimes my phone's auto correct changes it.",https://twitter.com/MaseratiLisa/status/1274406941922598912
2020-06-20 18:21:06,babasale,"Bruh https://twitter.com/nbcsportssoccer/status/1274406174855659520 …",https://twitter.com/babasale/status/1274406941138264064
2020-06-20 18:20:53,funsizeditalian,"Wearing contacts and makeup today",https://twitter.com/funsizeditalian/status/1274406886805327872
2020-06-20 18:20:50,scorpihooe,"My queen said “I charge my crystals in a full moon” and I said #BLACKPARADE",https://twitter.com/scorpihooe/status/1274406873605734400
2020-06-20 18:20:47,Allen_TheAlpha,"Thad Moffitt from last to 8th in 2 laps #ARCA | #GeneralTire200",https://twitter.com/Allen_TheAlpha/status/1274406861178011648
2020-06-20 18:20:46,mrr_honeyppang,"The hottest rappers #SAMBAKJA #MONSTAXonKCON2020 #MONSTAX @OfficialMonstaXpic.twitter.com/G8fumeJrq9",https://twitter.com/mrr_honeyppang/status/1274406857986072576
2020-06-20 18:20:42,Footy_Tipster,"What a goal from Pedro Neto! Literally a perfect volley! pic.twitter.com/bzd0nSlfIN",https://twitter.com/Footy_Tipster/status/1274406839376019457
2020-06-20 18:20:41,milay_di,"Yes na. I think it’s the final week",https://twitter.com/milay_di/status/1274406834758189057
2020-06-20 18:20:40,YouwannabeDowns,"Aw not the electric wave brush stopppp.. what sorcery I can’t lie tho I’d def cop lol https://twitter.com/kgfaithh/status/1274086542726754304 …",https://twitter.com/YouwannabeDowns/status/1274406832954650626
2020-06-20 18:20:39,_vmyre,"why jt cut tf up on friendly like that",https://twitter.com/_vmyre/status/1274406825752920064
2020-06-20 18:20:38,Alhassan_haidar,"Pedro Neto Goal of the season contender!",https://twitter.com/Alhassan_haidar/status/1274406824108855303
2020-06-20 18:20:38,matthew_oline,"Bless to see 20 just thankful god game me another healthy year to live",https://twitter.com/matthew_oline/status/1274406823907545089
2020-06-20 18:20:35,JonnieTickle,"Daft prick shouldn’t have been out if she’s showing symptoms",https://twitter.com/JonnieTickle/status/1274406808841596933
2020-06-20 18:20:34,Lessiaaaa____,"I can def tell a difference",https://twitter.com/Lessiaaaa____/status/1274406807348404226
2020-06-20 18:20:30,waynesheffield,"Come on people https://twitter.com/angelinawtsp/status/1274366305534201857 …",https://twitter.com/waynesheffield/status/1274406789505744896
2020-06-20 18:20:26,arcticgarrix,"Omg that’s so good you better NOT delete this",https://twitter.com/arcticgarrix/status/1274406774158827521
2020-06-20 18:20:21,LMHllx,"thank god this quarantine is about to be over",https://twitter.com/LMHllx/status/1274406750104563712
2020-06-20 18:20:19,lmAmirr,"And d!cksucking is a hobby for you?",https://twitter.com/lmAmirr/status/1274406742311534594
2020-06-20 18:20:19,IftakharJasmine,"Just watched inception. Safe to say I have a headache now",https://twitter.com/IftakharJasmine/status/1274406741632000002
2020-06-20 18:20:04,RocStarLife_,"Been like how do you fake that something gotta be off in ya head",https://twitter.com/RocStarLife_/status/1274406679778594816
2020-06-20 18:20:02,donutocean,"I will revisit this thread when I have a crop and a lil more confidence",https://twitter.com/donutocean/status/1274406671461298177
2020-06-20 18:19:52,Lazarbeam1fan,"Cong the fuck grats man holy shit bro",https://twitter.com/Lazarbeam1fan/status/1274406631535783939
2020-06-20 18:19:46,shonnyg4,"Get a wig that’s braids",https://twitter.com/shonnyg4/status/1274406603035414530
2020-06-20 18:19:40,AndyMascola,"When I was around eight, I was like, “Wait, so the same band that made ‘Wooly Bully’ also made ‘Little Red Riding Hood’ AND ‘Ring Dang Do’?” pic.twitter.com/77B2CWdOOI",https://twitter.com/AndyMascola/status/1274406579354435584
2020-06-20 18:19:38,HUIWOONGIE,"love the contents i got today - kino's vlive and hwanwoong TIMES 3 T H R E E !!",https://twitter.com/HUIWOONGIE/status/1274406571691216896
2020-06-20 18:19:37,rrj2909,"Really?!?!? https://twitter.com/thedailyshow/status/1274394319110180866 …",https://twitter.com/rrj2909/status/1274406567769767943
2020-06-20 18:19:36,xoxonalu,"this is amazing",https://twitter.com/xoxonalu/status/1274406561339891714
2020-06-20 18:19:26,lordvendettaxrp,"NEED TO WATCH THIS FROM @ThinkingCrypto1 https://youtu.be/rgchERioohE",https://twitter.com/lordvendettaxrp/status/1274406522462887940
2020-06-20 18:19:25,who_la_GRiM,"The end is near apparently, but what an amazing photo!!! https://twitter.com/MDoggMattCross/status/1273697575166717957 …",https://twitter.com/who_la_GRiM/status/1274406514740981761
2020-06-20 18:19:24,myouiminaluvr,"celeste your mind!!!!!",https://twitter.com/myouiminaluvr/status/1274406510534115328
2020-06-20 18:19:23,Finvesting101,"Whoa!!",https://twitter.com/Finvesting101/status/1274406509502398470
2020-06-20 18:19:20,dlcsk30,"It is getting a little confusing being on both I have to admit",https://twitter.com/dlcsk30/status/1274406494008639488
2020-06-20 18:19:18,Fernanda_1217,"I’ve met quite a few females that are allergic to peanuts, but will eat them anyway just to test their limit???? “I’ll stop when my mouth gets swollen or when I can’t feel my tongue/throat” .... So y’all don’t care about dying???? pic.twitter.com/CViIJALIoL",https://twitter.com/Fernanda_1217/status/1274406488581312512
2020-06-20 18:19:16,__jvlen,"i believe in GOD not in karma",https://twitter.com/__jvlen/status/1274406480398233600
2020-06-20 18:19:14,lv_again,"seo yeji's so good in it too im",https://twitter.com/lv_again/status/1274406469773950984
2020-06-20 18:19:01,ThinkingWayBack,"T H I S https://twitter.com/tsstruggletwt/status/1274405370342014977 …",https://twitter.com/ThinkingWayBack/status/1274406414379868162
2020-06-20 18:18:50,BlackB4Onyx,"Damn https://twitter.com/millysvantage/status/1274011509643833344 …",https://twitter.com/BlackB4Onyx/status/1274406370150768640
2020-06-20 18:18:46,EcoCart_io,"Each year over 5 TRILLION plastic bags are used. Less than 1% of all plastic bags are recycled, most are just thrown out after a single use and take hundreds of years to degrade. Each ton of bags saves the energy equivalent of 11 barrels of oil pic.twitter.com/WJSP33PmAa",https://twitter.com/EcoCart_io/status/1274406352257835008
2020-06-20 18:18:46,milay_di,"Lmfaoooohttps://twitter.com/thegreatestogwl/status/1274256706076319749 …",https://twitter.com/milay_di/status/1274406350831976451
2020-06-20 18:18:39,CreamiiBB,"the way I’m bi",https://twitter.com/CreamiiBB/status/1274406323069677569
2020-06-20 18:18:36,ImaginaryCard,"What a hit by Neto! I almost choked on my food #WHUWOL",https://twitter.com/ImaginaryCard/status/1274406311573282817
2020-06-20 18:18:32,MarcRosenfeldd,"Woke up with 3.4k new streams & 2.5k new listeners on Spotify FROM YESTERDAY Dreams are becoming reality Thank you God",https://twitter.com/MarcRosenfeldd/status/1274406296050036737
2020-06-20 18:18:21,allexsassy,"special early in the morning when you’re trying to sleep for too long but their noises waking you up! https://twitter.com/almighteeee_/status/1273752813181468672 …",https://twitter.com/allexsassy/status/1274406247186329600
2020-06-20 18:18:16,YVASBP,"Probably none. The realization that they really ain’t “it” hurts their ego pic.twitter.com/fWuRwkxAWO",https://twitter.com/YVASBP/status/1274406228194664448
2020-06-20 18:18:16,SoccerCooligans,"Neto! Holy smokes. Felt that strike through the damn tv. #WHUWOLpic.twitter.com/ZdTjMsgAdv",https://twitter.com/SoccerCooligans/status/1274406226470883334
2020-06-20 18:18:10,BlueRay_90,"Was mate! You see the one before in the Leicester game by chilwell?",https://twitter.com/BlueRay_90/status/1274406202001293312
2020-06-20 18:18:04,ashleyhughes94,"@AdamaTrd37 is unstoppable I would hate to be a left back against him such explosive power and pace!",https://twitter.com/ashleyhughes94/status/1274406176139116546
2020-06-20 18:18:02,susanloli,"totally didn’t realize today is the first day of summer. pic.twitter.com/HmwXbGf0sg",https://twitter.com/susanloli/status/1274406169432461314
2020-06-20 18:17:56,noritaatje,"i hate it when i am and the person i text is",https://twitter.com/noritaatje/status/1274406145164222464
2020-06-20 18:17:55,StilvollxXx,"Boom",https://twitter.com/StilvollxXx/status/1274406140869251074
2020-06-20 18:17:54,lov3yourself88,"Holy shit! 1-10 how mind blowing is it?",https://twitter.com/lov3yourself88/status/1274406135269748736
2020-06-20 18:17:50,lmfsaa132,"Download Voicemod now for FREE! The best weapon for players and content creators -> - The best real-time Voice Changer - Amazing Soundboard - Collection of over 70 original voices - Voice Maker Troll like a PRO! http://bit.ly/2PO8Qj0 #Voicechanger",https://twitter.com/lmfsaa132/status/1274406119574831107
2020-06-20 18:17:50,dxn92_,"Neto... What a Goal! #WHUWOL",https://twitter.com/dxn92_/status/1274406119423737856
2020-06-20 18:17:48,Charlie___Davis,"He Was PUZZLED Can Anyone Explain How?!? pic.twitter.com/5nyPa09yUX",https://twitter.com/Charlie___Davis/status/1274406107893633025
2020-06-20 18:17:47,M_i_k_e_20,"Haha comment all you like on mine it's ok",https://twitter.com/M_i_k_e_20/status/1274406104160559105
2020-06-20 18:17:47,hoodbougie_,"I found out one of my jersey niggas got a baby otw !!! hold on y’all... I can’t fuckin breathe",https://twitter.com/hoodbougie_/status/1274406103367983107
2020-06-20 18:17:43,FplRabbi,"Doc assist! If this clean sheet holds I’m looking at 97 pts with 10 more players to go . Mad. #FPL #FPLCommunity",https://twitter.com/FplRabbi/status/1274406090051125252
2020-06-20 18:17:40,BFC_lol,"I'm so impatient with how long it takes women to get ready",https://twitter.com/BFC_lol/status/1274406076922966016
2020-06-20 18:17:39,Mark201920,"Get over it ffs everyone moaning they want kent but everyone also moaning when he rapes them in fut champs",https://twitter.com/Mark201920/status/1274406071470379020
2020-06-20 18:17:36,nappyamazon,"I just found out about this restaurant that ONLY serves lasagna not too far from me",https://twitter.com/nappyamazon/status/1274406060825116673
2020-06-20 18:17:35,HanauGirl,"Agreed. First in the pouring rain and then elbow deep in sneezing and coughing. Looks like MAGA may just take themselves out, unfortunately, us along with them",https://twitter.com/HanauGirl/status/1274406054332379137
2020-06-20 18:17:34,Brianna_Alexiaa,"Very https://twitter.com/mbkogslim/status/1274405754649411584 …",https://twitter.com/Brianna_Alexiaa/status/1274406052419842048
2020-06-20 18:17:33,ZAYGUIM,"Rihanna??? I Love Rihanna! SHE'S HERE??!!",https://twitter.com/ZAYGUIM/status/1274406045914476544
2020-06-20 18:17:32,noniesmakeup,"My anxiety BUT I GOT IT!! Notice the time....I was ON site 10 minutes before. Literally I watched it go from sold out to add to cart... And hour of watching a circle go round and round. I have a headache I hope you see how much I love you @JeffreeStar and @shanedawsonpic.twitter.com/ROhX45R2jy",https://twitter.com/noniesmakeup/status/1274406044450598912
2020-06-20 18:17:29,milay_di,"Why does another person’s success pain those ones?",https://twitter.com/milay_di/status/1274406031691583489
2020-06-20 18:17:15,PNEPolice,"Can’t for the life of me think why Fisher wouldn’t start......Browne’s not a full-back",https://twitter.com/PNEPolice/status/1274405972849700864
2020-06-20 18:17:09,ShvdLuv,"I could really do nude modeling the way I can angle my body.",https://twitter.com/ShvdLuv/status/1274405947092480000
2020-06-20 18:17:05,Rakesh___Kumar,"#beinginhuman @BeingSalmanKhan ...u rip buddy....why most ppl call him bhai? .... treat him like any ordinary with a rouge history......Any parents hv option to raise his kid like sushant or salman , to whom thy will pickup?",https://twitter.com/Rakesh___Kumar/status/1274405930671603713
2020-06-20 18:17:05,ninjasgrxxve,"i thought he was bleach his hair again, but turns out he coloring his hairhttps://twitter.com/ninjasgrxxve/status/1274381324883619840 …",https://twitter.com/ninjasgrxxve/status/1274405929119698945
2020-06-20 18:17:03,naomisavv,"They adding COVID 19 trackers on our phones now",https://twitter.com/naomisavv/status/1274405920517181440
2020-06-20 18:17:01,RyanHarland94,"17 goals for a 9th placed, abysmal Arsenal is ridiculous. Aubameyang needs to leave Arsenal like. Imagine if he was at city or liverpool Massively underrated and the seasons not even over yet as well",https://twitter.com/RyanHarland94/status/1274405911898009606
2020-06-20 18:16:52,2Anuar10,"Crack",https://twitter.com/2Anuar10/status/1274405875919147009
2020-06-20 18:16:51,mwenye_G,"Tweet for Wolves. Neto",https://twitter.com/mwenye_G/status/1274405871070711811
2020-06-20 18:16:46,AQMajali,"ufff wolves going crazy",https://twitter.com/AQMajali/status/1274405849621028865
2020-06-20 18:16:38,uvifze,"Download Voicemod now for FREE! The best weapon for players and content creators -> - The best real-time Voice Changer - Amazing Soundboard - Collection of over 70 original voices - Voice Maker Troll like a PRO! http://bit.ly/2PO8Qj0 #Voicechanger",https://twitter.com/uvifze/status/1274405815122870273
2020-06-20 18:16:35,oddeyeciercle,"title track: psycho, peek a boo, zimzalabim b-side: in & out, sunny side up, kingdom come, attaboy, red dress, you better know",https://twitter.com/oddeyeciercle/status/1274405804502847488
2020-06-20 18:16:32,Wodan522,"What a run by Traore though",https://twitter.com/Wodan522/status/1274405791693508610
2020-06-20 18:16:29,kimmitoki,"It's been 6-7yearz since I got this bby u beeen with be thru thickandthin bbyluvu *this picture was taken 5years ago* pic.twitter.com/dSsoxM7VVV",https://twitter.com/kimmitoki/status/1274405777097191424
2020-06-20 18:16:28,ChenSeVc,"EXOL PLEASE CHECK THIS OUT https://twitter.com/_sayuriin/status/1271983447410479106 …",https://twitter.com/ChenSeVc/status/1274405772517089280
2020-06-20 18:16:25,laxcoachlocker,"Meet the Gait Torque Purchase this brand new stick at http://laxcoachlocker.com pic.twitter.com/lWYwMd3g3s",https://twitter.com/laxcoachlocker/status/1274405763423879169
2020-06-20 18:16:25,ivykraay,"it’s tru doe..... https://twitter.com/natefridson/status/1274125474994819073 …",https://twitter.com/ivykraay/status/1274405762849218562
2020-06-20 18:16:23,mbkogslim,"That’s wild",https://twitter.com/mbkogslim/status/1274405754649411584
2020-06-20 18:16:22,blessmehaechu,"clara will eat me",https://twitter.com/blessmehaechu/status/1274405748043329538
2020-06-20 18:16:21,saithakor,"If they’re called apartments, why are they stuck together",https://twitter.com/saithakor/status/1274405746013282306
2020-06-20 18:16:19,SusanneGrandahl,"And that’s not correct. I’m a nurse. In Denmark. Worked at the acute Covid ward when the Covid peaked. Of course masks work. And of course a mask protects you. Jezzz So many stupid ignorant people pic.twitter.com/crDkLbxciK",https://twitter.com/SusanneGrandahl/status/1274405737633140737
2020-06-20 18:16:17,cerdeeq7,"What an unbelievable strike from Pedro Neto #WHUWOL",https://twitter.com/cerdeeq7/status/1274405729802256390
2020-06-20 18:16:09,CrazyCatEyesJMR,"Go grab your CCE merchandise quickly!!! pic.twitter.com/xfXdkxHFnT",https://twitter.com/CrazyCatEyesJMR/status/1274405693337059328
2020-06-20 18:16:07,byalysonshelton,"I’m not sure we’ll reopen in the fall. They’re saying 2021.",https://twitter.com/byalysonshelton/status/1274405684667277312
2020-06-20 18:15:57,Jebobuddyscuddy,"Apparently not.",https://twitter.com/Jebobuddyscuddy/status/1274405642170773504
2020-06-20 18:15:55,VantaesMoonchld,"It's past mid night and why tf are y'all going thirsty Thursday on a damn Sunday????? pic.twitter.com/nlAqGvGwX6",https://twitter.com/VantaesMoonchld/status/1274405636235603969
2020-06-20 18:15:55,bbgdrea,"Another Kings Canyon!!!! https://twitter.com/playapex/status/1274403407516913664 …",https://twitter.com/bbgdrea/status/1274405634620809217
2020-06-20 18:15:52,bomboclaatthfc,"Adama made that look so easy fam",https://twitter.com/bomboclaatthfc/status/1274405622683807745
2020-06-20 18:15:51,RitsukoBlue,"@WorktoGame @Mrhappy1227 @TheSeshEmpire @AngryJulie @SlyTheFox Damn! He didn't even want to take it back or even ebay the game! https://twitter.com/xboxvaldeli/status/1274227808353554433 …",https://twitter.com/RitsukoBlue/status/1274405617659187201
2020-06-20 18:15:45,Jumpzan23,"I have no idea wtf is goin on",https://twitter.com/Jumpzan23/status/1274405594745561088
2020-06-20 18:15:44,eveaston,"What I like to see from Neto",https://twitter.com/eveaston/status/1274405590748495873
2020-06-20 18:15:44,DBlock_Turk,"You bitchez iz WiErDo’S",https://twitter.com/DBlock_Turk/status/1274405590731808768
2020-06-20 18:15:44,_ShesInfamous,"Cause fuck!!!!!",https://twitter.com/_ShesInfamous/status/1274405588160491520
2020-06-20 18:15:39,TheyCallMeLionz,"Omg thats why they killed Aunt Jemima! #Killary",https://twitter.com/TheyCallMeLionz/status/1274405567415582721
2020-06-20 18:15:38,cliffdaBigredog,"How is this being allowed. https://twitter.com/ariberman/status/1274098195648446469 …",https://twitter.com/cliffdaBigredog/status/1274405565981171713
2020-06-20 18:15:38,Yoss3r,"Kalief Browder, Netflix.",https://twitter.com/Yoss3r/status/1274405564597112833
2020-06-20 18:15:37,DavePaoletti,"Whoa That’s a helluva photo.",https://twitter.com/DavePaoletti/status/1274405561321222144
2020-06-20 18:15:35,Ranplimo,"Hello, I herb ... I ordered your application 17 days ago, the request was not updated, and SMSA says it has not been received, when will it be updated? Application No. 412840338!",https://twitter.com/Ranplimo/status/1274405550416113665
2020-06-20 18:15:30,BlueWave_20n20,"My head is about to explode over this https://twitter.com/mspoint1106/status/1274404406004535296 …",https://twitter.com/BlueWave_20n20/status/1274405528916111363
