date,username,to,replies,retweets,favorites,text,geo,mentions,hashtags,id,permalink
2020-06-20 17:13:00,anisa_roisita,"HAPPY BIRTHDAYYYYY",https://twitter.com/anisa_roisita/status/1274389801685282817
2020-06-20 17:12:54,Anurag_anu_,"And u",https://twitter.com/Anurag_anu_/status/1274389776175529984
2020-06-20 17:12:53,asavakit4,"GO TO BED AND SLEEP FOR A WEEK Q! YOU HAVE EARNED IT!!",https://twitter.com/asavakit4/status/1274389774212780032
2020-06-20 17:12:48,DiyahDonDada,"When I die I wanna be buried in a cowboys casket so they can let me down one more time",https://twitter.com/DiyahDonDada/status/1274389752184295426
2020-06-20 17:12:46,giggle_don,"Him lucky",https://twitter.com/giggle_don/status/1274389741409050625
2020-06-20 17:12:44,Anurag_anu_,"Sana live thi insta pe",https://twitter.com/Anurag_anu_/status/1274389734404448256
2020-06-20 17:12:32,MNMadzhiye,"Thelma Jones ~ I'd Rather Leave While I'm In Love",https://twitter.com/MNMadzhiye/status/1274389685570285575
2020-06-20 17:12:31,BharathMaharshi,"No screenshots No more Teams as I already told previously",https://twitter.com/BharathMaharshi/status/1274389680029499393
2020-06-20 17:12:31,lafol57,"Bringing the good news!https://twitter.com/TheTrueChannel/status/1274388982256861186 …",https://twitter.com/lafol57/status/1274389679920623616
2020-06-20 17:12:21,Sweethe53108620,"Donee",https://twitter.com/Sweethe53108620/status/1274389636505382919
2020-06-20 17:12:18,maryjaane72,"Happy Happy Birthday Beautiful",https://twitter.com/maryjaane72/status/1274389625646182405
2020-06-20 17:12:16,TiAijah_,"I don’t want him tho lmao",https://twitter.com/TiAijah_/status/1274389618037850114
2020-06-20 17:12:15,Choosetolove1,"Atomic size",https://twitter.com/Choosetolove1/status/1274389611398168577
2020-06-20 17:12:09,almahalawysamy,"Good evening my friend, iraaa pic.twitter.com/aPB3kY03Ao",https://twitter.com/almahalawysamy/status/1274389587377389575
2020-06-20 17:12:04,TiAijah_,"Chris and his gf is toooo cute and the fact that she’s okay with us being friends",https://twitter.com/TiAijah_/status/1274389567513268225
2020-06-20 17:12:03,UrstrulyRamDHFM,"1 Word About Our SUPERSTAR Rply With Tag @urstrulymahesh #SarkaruVaariPaata #AdvanceHBDMaheshBabu",https://twitter.com/UrstrulyRamDHFM/status/1274389561431318529
2020-06-20 17:12:02,chakimong,"Hii handsome",https://twitter.com/chakimong/status/1274389560290500611
2020-06-20 17:12:00,PatriceLCooper,"Ur welcome!",https://twitter.com/PatriceLCooper/status/1274389550400303105
2020-06-20 17:11:52,enilegnax,"Happy birthdayyyyy",https://twitter.com/enilegnax/status/1274389515486941184
2020-06-20 17:11:51,NASH_ZAMANO,"Let’s keep this going please Attorney general ( @kyoag) WE DEMAND justice for Breonna Taylor. I’m tagging 5 friends who I know will do the same. @HonestyMaKayla @VoQalAceDawg @quesyyyy @Jakaylaashley @Oracle_MkEhttps://twitter.com/poncedeleon_a/status/1274294312050794497 …",https://twitter.com/NASH_ZAMANO/status/1274389513406754816
2020-06-20 17:11:48,osythobela,".Habashwee Yabona I would love to see this kind of Tweet every hour from every African child. Congratulations..you have been lockedup .God is great.....",https://twitter.com/osythobela/status/1274389501436137474
2020-06-20 17:11:43,Sandruhh_Duhh,"Chicago Up!!!! Im sick",https://twitter.com/Sandruhh_Duhh/status/1274389478694694913
2020-06-20 17:11:41,babybearviIIe,"THANK UUUU I LOVE U SO MUCH",https://twitter.com/babybearviIIe/status/1274389468867440640
2020-06-20 17:11:34,_snxdr,"Happy Father's Day!!!",https://twitter.com/_snxdr/status/1274389442359255041
2020-06-20 17:11:21,TiAijah_,"I stay getting spoiled",https://twitter.com/TiAijah_/status/1274389384981291011
2020-06-20 17:11:18,MassDHFM,"1 Word About Our SUPERSTAR Rply With Tag @urstrulymahesh #SarkaruVaariPaata #AdvanceHBDMaheshBabu",https://twitter.com/MassDHFM/status/1274389373862268929
2020-06-20 17:11:17,LILIES_STREAMS,"[UPDATE] VIEWS: 12, 430, 294 LIKES: 1.3M Stream more Lilies, 15M next https://youtu.be/i8hicLO6gwY #LISA #LALISA #HowYouLikeThatLisa #StreamHYLT_Lisa #BLACKPINK @ygofficialblinkpic.twitter.com/kaIjWIKzZH",https://twitter.com/LILIES_STREAMS/status/1274389369890074624
2020-06-20 17:11:09,YashmiYami,"How do you make me smile",https://twitter.com/YashmiYami/status/1274389336432078848
2020-06-20 17:11:09,TiAijah_,"I love being single and friends with my homies",https://twitter.com/TiAijah_/status/1274389335689830400
2020-06-20 17:11:05,definitelykiki,"Arrrrgh Andeng",https://twitter.com/definitelykiki/status/1274389319495516161
2020-06-20 17:11:03,lafol57,"Giving up the Northern Pacific Coast is insane",https://twitter.com/lafol57/status/1274389312797319169
2020-06-20 17:10:56,GreenDay_korea,"No thank u for ur concerning :)",https://twitter.com/GreenDay_korea/status/1274389283294425088
2020-06-20 17:10:54,varafsh,"Thank you. Yes im agree. With every video or pictures she uploaded there are lots of good vibes including which is valuable to her fans",https://twitter.com/varafsh/status/1274389274834530304
2020-06-20 17:10:53,babybearviIIe,"I LOVE UUU",https://twitter.com/babybearviIIe/status/1274389269377945602
2020-06-20 17:10:52,chuuzui,"MAEE THAT'S SO BEAUTIFUL",https://twitter.com/chuuzui/status/1274389266383110146
2020-06-20 17:10:51,mikey_luv,"I LOVE YOU KIM JAE HWAN",https://twitter.com/mikey_luv/status/1274389261626695680
2020-06-20 17:10:48,taelomon,"hi princess daddy https://twitter.com/princessdaddyve/status/1274387696576847874 …",https://twitter.com/taelomon/status/1274389247261380609
2020-06-20 17:10:44,TubaMazharR,"May Allah accept this deed",https://twitter.com/TubaMazharR/status/1274389233407533056
2020-06-20 17:10:41,CheerDianne,"another answered prayer",https://twitter.com/CheerDianne/status/1274389221193572353
2020-06-20 17:10:40,Hafeez_khar,"Good Work it's Really Hard Target but achived... Barve Dophin Firce. We have Proud on you.",https://twitter.com/Hafeez_khar/status/1274389213455224833
2020-06-20 17:10:38,i_m_Tufail,"The opening of new wine shops will be an open attack on our religion and faith it's high time to start protesting against it otherwise our whole generation will be ruined and we will perish forever #nowineshopsinkashmir let's make it trendingpic.twitter.com/wDnaSxiQRQ",https://twitter.com/i_m_Tufail/status/1274389208539336706
2020-06-20 17:10:38,FrontpageLEXY,"I had such a disturbing dream abt Erick I miss him so much",https://twitter.com/FrontpageLEXY/status/1274389207159627776
2020-06-20 17:10:30,TiAijah_,"Go kart racing or the beach",https://twitter.com/TiAijah_/status/1274389174808989698
2020-06-20 17:10:27,_OhHeyRi,"Same ppl i told you bout before",https://twitter.com/_OhHeyRi/status/1274389161848512513
2020-06-20 17:10:23,tsunderekjn,"JENNIE BEST GIRL pic.twitter.com/GDX62eGnRV",https://twitter.com/tsunderekjn/status/1274389144278458370
2020-06-20 17:10:17,tee_sibo,"On it",https://twitter.com/tee_sibo/status/1274389120543055872
2020-06-20 17:10:17,Ayorkor_Mensah,"I am, i hope you are too?",https://twitter.com/Ayorkor_Mensah/status/1274389119213461504
2020-06-20 17:10:14,PaulaGalindoRo1,"I Need this. pic.twitter.com/yF3ZYIBM5S",https://twitter.com/PaulaGalindoRo1/status/1274389107565879298
2020-06-20 17:10:14,Anurag_anu_,"I m fine as always",https://twitter.com/Anurag_anu_/status/1274389105409843200
2020-06-20 17:10:14,Georgia_loveCY,"Your hashtag is wrong!!!!!!!The right #CanYamanFansDay #CanYamanFanDay",https://twitter.com/Georgia_loveCY/status/1274389104420159488
2020-06-20 17:10:13,TubaMazharR,"Great",https://twitter.com/TubaMazharR/status/1274389101073104897
2020-06-20 17:10:11,theyenvyk_,"I love the fact that I’m very observant, I sit back and pay attention to everything!",https://twitter.com/theyenvyk_/status/1274389092420259841
2020-06-20 17:09:54,kourtne_yy,"using social media as a weapon in a relationship not cute. at all",https://twitter.com/kourtne_yy/status/1274389020412383233
2020-06-20 17:09:45,OfDragonsWings,"||. Give me a cute username for my new account imma make Gonna make my favorite Youtuber Niki",https://twitter.com/OfDragonsWings/status/1274388982865018886
2020-06-20 17:09:41,ZaynUlAbdin14,"So nice of you. Lots of prayers for you stay same , blessed and happy",https://twitter.com/ZaynUlAbdin14/status/1274388965576060928
2020-06-20 17:09:38,tee_sibo,"Please follow @AdolfKalawila he follows back @lastHonestWoman @TheGoodKeed @MaSibanda01 @mugorejeen @MicLarry2 @_RonnyTM let's get him to 5Khttps://twitter.com/AdolfKalawila/status/1274384886468677634 …",https://twitter.com/tee_sibo/status/1274388953219596289
2020-06-20 17:09:32,t_bab918,"glad to know my grandson being educated",https://twitter.com/t_bab918/status/1274388931052789763
2020-06-20 17:09:25,marcellalika,"stay safe everyone",https://twitter.com/marcellalika/status/1274388902237753345
2020-06-20 17:09:23,kociakowska,"LOUIS TOMLINSON IS BEAUTIFUL",https://twitter.com/kociakowska/status/1274388891274010626
2020-06-20 17:09:22,urmichaelangelo,"Happy Father's Day",https://twitter.com/urmichaelangelo/status/1274388888849547268
2020-06-20 17:09:17,sesemayeza,"Jamaican Black Castor oil is the hun she thinks she is",https://twitter.com/sesemayeza/status/1274388865764282370
2020-06-20 17:09:13,broujaehyun,"BUY I LOP U",https://twitter.com/broujaehyun/status/1274388849100091398
2020-06-20 17:09:11,HeidiWa67936915,"How are you today ? I made some nudey photos, they are on my website follow me pic.twitter.com/aOEYzRZKzh",https://twitter.com/HeidiWa67936915/status/1274388839721775109
2020-06-20 17:08:53,CHUCK_1967,"THERE WAS SOMETHING VERY EVIL GOING ON IN TIJUANA AND I HAD TO GET AWAY FROM IT. IT WAS VERY SERIOUS AND I WAS WARNED ABOUT IT.",https://twitter.com/CHUCK_1967/status/1274388764924809217
2020-06-20 17:08:38,Elabell77483345,"Beautifully saidshe is a power of positive energies always #DemetÖzdemir",https://twitter.com/Elabell77483345/status/1274388703234805762
2020-06-20 17:08:21,eribaekyoong,"Her secret di webtoon",https://twitter.com/eribaekyoong/status/1274388633991049217
2020-06-20 17:08:20,mickeymami_,"idk, make it make sense.",https://twitter.com/mickeymami_/status/1274388627087392769
2020-06-20 17:08:12,stephilici0us,"THIS!! There’s even diagrams made for those who don’t like to read https://twitter.com/vxganeli/status/1274079265873592321 …",https://twitter.com/stephilici0us/status/1274388592425603074
2020-06-20 17:08:09,mickeymami_,"niggas are just weird as fuck.",https://twitter.com/mickeymami_/status/1274388582095114241
2020-06-20 17:08:03,AsangPongen1,"Yes 101℅ true",https://twitter.com/AsangPongen1/status/1274388557751189504
2020-06-20 17:07:48,AtinukeArowolo,"It's only when I post about Sickle Cell that I get plenty engagements on this bird app Thank you all for the show of love and support yesterday",https://twitter.com/AtinukeArowolo/status/1274388493133848576
2020-06-20 17:07:43,alwaysyouLara,"My cute lil angel, congrats for your little family, I'm so happy for you! I love you so much Sophie, I literally can't put it into words rn Enjoy your dance party love https://twitter.com/hessophielt/status/1274386785678823427 …",https://twitter.com/alwaysyouLara/status/1274388473269624832
2020-06-20 17:07:43,lawalayomipo,"Ifunanya baby.",https://twitter.com/lawalayomipo/status/1274388472543969280
2020-06-20 17:07:43,Nitesh_kumar_1,"If one reads bhagvad gita with sincerely and with all seriousness. Then by the grace of the lord the reaction of his past misdeeds will not act on him. #HareKrishna pic.twitter.com/afygo7cfF5",https://twitter.com/Nitesh_kumar_1/status/1274388471457542144
2020-06-20 17:07:39,IvoryWi52404147,"sexy nudes giveaway guys? Follow & RT I'll contact 1 of you in DMs with some pic.twitter.com/GOnUvb4cPN",https://twitter.com/IvoryWi52404147/status/1274388456286945281
2020-06-20 17:07:37,RainBowNatty93,"One thing about Tola people they funny bad inno",https://twitter.com/RainBowNatty93/status/1274388447369793536
2020-06-20 17:07:35,TiAijah_,"It’s going to be a good Saturday",https://twitter.com/TiAijah_/status/1274388437123108865
2020-06-20 17:07:33,liptinzs,"GA MAO!!! ;",https://twitter.com/liptinzs/status/1274388430210732033
2020-06-20 17:07:30,Sklavenliebe,"For you pic.twitter.com/5OtZldUrfP",https://twitter.com/Sklavenliebe/status/1274388418374459397
2020-06-20 17:07:28,RV212studiosLtd,"Awww thx sm ma bro",https://twitter.com/RV212studiosLtd/status/1274388409071677441
2020-06-20 17:07:22,GiannaDemarcoXO,"Seems so...and what was really different.. once they got her to the police car..they put her in the front seat",https://twitter.com/GiannaDemarcoXO/status/1274388383817662464
2020-06-20 17:07:15,Letcheeee,"Lol i will consider it as a pleasure",https://twitter.com/Letcheeee/status/1274388356764332034
2020-06-20 17:07:06,a_manluv,"according to your bio, you're an 18-year-old Christian from the Philippines. why are you defending a system that does not exist in your community and that does not seem to affect you? the caste system is disgusting. your family shouldn't affect your social status.",https://twitter.com/a_manluv/status/1274388317514035200
2020-06-20 17:06:58,FabienneHolste2,"Thank you.. you have a great weekend too.. stay safe..",https://twitter.com/FabienneHolste2/status/1274388285805256705
2020-06-20 17:06:53,Letcheeee,"If that’s what what you want?",https://twitter.com/Letcheeee/status/1274388264187641856
2020-06-20 17:06:50,MyNameIsAjee_,"I’ve smoked weed since I was 15 and I’m still trying to figure out what weed y’all smoking that y’all lips be so black",https://twitter.com/MyNameIsAjee_/status/1274388250036260867
2020-06-20 17:06:48,theoloriherself,"I'm serious nau",https://twitter.com/theoloriherself/status/1274388241299509248
2020-06-20 17:06:42,_MilCob,"My love https://twitter.com/WE_THE_BOYZ/status/1274384529730359296 …",https://twitter.com/_MilCob/status/1274388217899425792
2020-06-20 17:06:31,OtaviaDenise,"I Want Me A Real ManNot Nobody Wasting My Time I Can’t Get Back",https://twitter.com/OtaviaDenise/status/1274388169887297536
2020-06-20 17:06:28,RainBowNatty93,"Lol nooo steak",https://twitter.com/RainBowNatty93/status/1274388157195268096
2020-06-20 17:06:25,NiaLibra99,"You too",https://twitter.com/NiaLibra99/status/1274388144268378112
2020-06-20 17:06:24,whitewingdove70,"That's so awesome!",https://twitter.com/whitewingdove70/status/1274388140397035521
2020-06-20 17:06:22,beanstayskeamn,"Thank you so much again for coming out we really really appreciate the support Met some really beautiful souls last night and kicked @The Monocle https://www.instagram.com/p/CBqifQtFbMe/?igshid=1vxlj8w54cuph …",https://twitter.com/beanstayskeamn/status/1274388134453825537
2020-06-20 17:06:10,lawalayomipo,"My bro. Thanks.",https://twitter.com/lawalayomipo/status/1274388081450377216
2020-06-20 17:06:06,Sandyk5251,"I know Colton is giving his sister, Arianna, fits at times.... But it's so cute when they're playing together...",https://twitter.com/Sandyk5251/status/1274388067239915522
2020-06-20 17:05:58,BharathMaharshi,"Biggest Cleansweep till 50 members Share screenshots or else no teams for sure Teams will be send to inbox for those who send screenshots #Dream11 @Dream11 @iam_Wolverine1 @teams_dream @templeboysadda @RounakSarraf @d11fantasyworld @noumans473 @D11Alex005 https://twitter.com/BharathMaharshi/status/1274355337374490624 …pic.twitter.com/QUpUqIomBM",https://twitter.com/BharathMaharshi/status/1274388031223427073
2020-06-20 17:05:56,heyitsmesamy,"Sana was on verge of crying while speaking about Sushant",https://twitter.com/heyitsmesamy/status/1274388023631724545
2020-06-20 17:05:55,awaisabbas05,"20 to 25 last",https://twitter.com/awaisabbas05/status/1274388017994780672
2020-06-20 17:05:54,AsangPongen1,"Today",https://twitter.com/AsangPongen1/status/1274388015561863168
2020-06-20 17:05:49,theyloveneesh_,"I need a good book to read , I need to finish reading my TD jakes book lol",https://twitter.com/theyloveneesh_/status/1274387994456272897
2020-06-20 17:05:47,yerinnn_,"Lets bee friend gaes",https://twitter.com/yerinnn_/status/1274387987179036672
2020-06-20 17:05:44,RainBowNatty93,"I mess up my Jeep with food ... wow",https://twitter.com/RainBowNatty93/status/1274387971718995969
2020-06-20 17:05:40,Kajalchhetri12,"@thisistalos @BTS_twt thank you for these beautiful lyrics .. and no doubt #JK has a great taste in music pic.twitter.com/AAfCjZo8tf",https://twitter.com/Kajalchhetri12/status/1274387956053110784
2020-06-20 17:05:39,theoloriherself,"You want to drag me cos of Arsenal?? Me wey dey catch cruise...Arsenal kor",https://twitter.com/theoloriherself/status/1274387953230454784
2020-06-20 17:05:38,regina_bae_,"Wonder how arsenal fans feel rn, uno alright ?",https://twitter.com/regina_bae_/status/1274387947673079808
2020-06-20 17:05:36,lovelymariissa1,"I miss going to ojos locos",https://twitter.com/lovelymariissa1/status/1274387940563578881
2020-06-20 17:05:32,sempiternaljeon,"HAPPY BDAYY KIKILLLLLLL wish you all the best and gbu bebi hani switiii happy wedding nyotieee @AKILLEERRpic.twitter.com/BteAg5ILLB",https://twitter.com/sempiternaljeon/status/1274387921265557505
2020-06-20 17:05:18,Siinrajiaal,"We all know that probability is low, but you keep doubting. Go set an example and leave the optimists alone.",https://twitter.com/Siinrajiaal/status/1274387862297784320
2020-06-20 17:05:17,Jxmin23_,"These police are pathetic",https://twitter.com/Jxmin23_/status/1274387858070147072
2020-06-20 17:05:14,RideAppOfficial,"Tag someone Just share into your story And drop a comment """" . Follow us for more @RideAppOfficial #gooddesign #designlife #designlove #designdaily #designinspiration #designoftheday #designforall #designinspo #designwork #designsolutions #designerlife #quotespic.twitter.com/MHjbCR8D3o",https://twitter.com/RideAppOfficial/status/1274387846657445895
2020-06-20 17:05:03,GlynnnMnts,"Thankful.",https://twitter.com/GlynnnMnts/status/1274387802856148995
2020-06-20 17:05:00,Anurag_anu_,"To konse pics dekhe tune",https://twitter.com/Anurag_anu_/status/1274387787291086848
2020-06-20 17:04:48,theyloveneesh_,"I need a desk . I be laying in the bed tryna do homework so lazy",https://twitter.com/theyloveneesh_/status/1274387736598843392
2020-06-20 17:04:47,geminihamzzi,"13 first friend i ever made on carat stan twt literally the sweetest and best wholesome person ever!!! Someone you can always count on Deserves the world and super nice a literal angel ily one of my fave moots pic.twitter.com/ivSG9okoBI",https://twitter.com/geminihamzzi/status/1274387735025868801
2020-06-20 17:04:46,MD23472941,"goodnight pic.twitter.com/rUyAEQWejA",https://twitter.com/MD23472941/status/1274387728499478528
2020-06-20 17:04:29,koalatampan,"Happy birthday",https://twitter.com/koalatampan/status/1274387660467888128
2020-06-20 17:04:29,petaIskz,"i see ur struggling a lot in that first sentence there stfuuuuu i l*ve you too and oh The Unexpected Reunion",https://twitter.com/petaIskz/status/1274387660350590979
2020-06-20 17:04:28,RuthMcelwee3,"It 6oclock in the evening over here is northern Ireland but good morning to you and hope you have a great day",https://twitter.com/RuthMcelwee3/status/1274387656517050368
2020-06-20 17:04:27,TrueSavageInMe,"It's all caught on camera my friend. Watch the video.https://www.msnbc.com/weekends-with-alex-witt/watch/police-arrest-protester-outside-trump-rally-arena-in-tulsa-85505093751?cid=sm_npd_ms_tw_ma …",https://twitter.com/TrueSavageInMe/status/1274387651538419713
2020-06-20 17:04:18,AllysonDumayag,"You make it easier when life gets hard...",https://twitter.com/AllysonDumayag/status/1274387611935600640
2020-06-20 17:04:17,saltion01,"Follow everyone who likes and retweet this tweet., Follow me @saltion01 Follow back",https://twitter.com/saltion01/status/1274387610459426819
2020-06-20 17:04:14,GiannaDemarcoXO,"Classic Trumpturd",https://twitter.com/GiannaDemarcoXO/status/1274387595225677825
2020-06-20 17:04:13,niques_skylah,"Sigh this urge to pop off is be so real!",https://twitter.com/niques_skylah/status/1274387592709132290
2020-06-20 17:04:07,heyitsmesamy,"Yea my heart is crying",https://twitter.com/heyitsmesamy/status/1274387564837826560
2020-06-20 17:04:00,AdSheikh18,"LOVE is LOVE and love is not FOR Sale anywhere else in the world It is gift from ALLAH https://twitter.com/Fatii01_/status/1274310402587983874 …",https://twitter.com/AdSheikh18/status/1274387538451496962
2020-06-20 17:03:57,Cynthia76931543,"So true and very sad that this (violent protesting) has become acceptable behavior. You reap what you sow. #WeveGotACountryToSave #LawAndOrder #WinRed & #LeadRight #Trump2020NowMoreThanEver",https://twitter.com/Cynthia76931543/status/1274387525700743168
2020-06-20 17:03:57,tee_sibo,"It hurts",https://twitter.com/tee_sibo/status/1274387525109456897
2020-06-20 17:03:46,GiannaDemarcoXO,"OMG..lol..it was ok to cheat on her before he became President...okrrrrrrr Rosie",https://twitter.com/GiannaDemarcoXO/status/1274387477814546434
2020-06-20 17:03:43,KarenAngela7,"Extreme Crocodile Dundee voice: Now THAT was a nap!",https://twitter.com/KarenAngela7/status/1274387465848176640
2020-06-20 17:03:42,tthirteenalwys_,"BABIES",https://twitter.com/tthirteenalwys_/status/1274387463440486400
2020-06-20 17:03:42,anakniboyet,"happy birthday @Trish_Nicoleeee big girl na amung bby eshat",https://twitter.com/anakniboyet/status/1274387460126961664
2020-06-20 17:03:40,MerraBabyyyy__,"That’s someone who they should’ve put a knee on his neck bitch ass",https://twitter.com/MerraBabyyyy__/status/1274387451528851458
2020-06-20 17:03:37,theesierralana,"Girl its a black AMERICAN holidayhttps://twitter.com/MsJazzybelle/status/1274132794348896257 …",https://twitter.com/theesierralana/status/1274387442469089280
2020-06-20 17:03:35,peachbbuu,"love ur self y'. don't feel insecure u are pretty. good night have a nice dream y'all",https://twitter.com/peachbbuu/status/1274387433635774465
2020-06-20 17:03:29,Wanguichioma,"Next time i swear to put a smile on Pic. #instagramposts pic.twitter.com/Lc167d21kv",https://twitter.com/Wanguichioma/status/1274387408805642245
2020-06-20 17:03:29,Niphemmy_O,"No his daughter",https://twitter.com/Niphemmy_O/status/1274387406381289473
2020-06-20 17:03:24,heyitsmesamy,"The minute I missed her she came online my bebu I love you so much plzzz plzzz be happie dont stress much about haters my darling bubba we are here to shower our endless love to you you deserve everything good in this world @ishehnaaz_gill bebe plz be happie #ShehnaazGillpic.twitter.com/jkt748d0Mk",https://twitter.com/heyitsmesamy/status/1274387385145384960
2020-06-20 17:03:20,CHUCK_1967,"ALL OF THE DEMONS SLOWED ME DOWN, BUT THEY COULDN'T STOP ME.",https://twitter.com/CHUCK_1967/status/1274387370230591488
2020-06-20 17:03:17,bbeyyaang,"Happy Father's Day pa ILY pa pic.twitter.com/M9k69YH7YK",https://twitter.com/bbeyyaang/status/1274387357488369665
2020-06-20 17:03:17,Ayuyusuf9,"LAY ZHANG, hurry back, go back to EXO, we will miss you with the other members, if you don't return now, hopefully if all the members have returned from their respective duties, we must promise to return to us too, I EXO-L miss you yixing #lay_is_exo #EXOisNINE #cutayuna pic.twitter.com/HkOhuUobW3",https://twitter.com/Ayuyusuf9/status/1274387356972281859
2020-06-20 17:03:13,rudrendrakr,"@GeorgekurianINC thank you so much sir..I am honored!",https://twitter.com/rudrendrakr/status/1274387339721097224
2020-06-20 17:03:00,goldenpeach_30,"Happy bday~~~~",https://twitter.com/goldenpeach_30/status/1274387283722956801
2020-06-20 17:02:55,Anurag_anu_,"Kiske pics",https://twitter.com/Anurag_anu_/status/1274387263250522117
2020-06-20 17:02:54,talaathefangirl,"NOIR - LUCIFER NOIR - AIRPLANE MODE NOIR - DOOM DOOM NOIR - GANGSTA TOO - MAGNOLIA TOO - TAKE IT SLOW TOO - EVERYTHING'S GONNA BE ALRIGHT TOO - RISING SUN PERFORMANCE (ROAD TO KINGDOM)!",https://twitter.com/talaathefangirl/status/1274387259572158464
2020-06-20 17:02:50,TrueSavageInMe,"RIGHT!https://www.msnbc.com/weekends-with-alex-witt/watch/police-arrest-protester-outside-trump-rally-arena-in-tulsa-85505093751?cid=sm_npd_ms_tw_ma …",https://twitter.com/TrueSavageInMe/status/1274387244875419648
2020-06-20 17:02:48,127reguIate,"1901 we just became mutuals & started talking recently but i'm glad we did!! you're a lovely person to talk to and i wanna thank you for introducing me to more people i hope we can be closer friends in the future uwu",https://twitter.com/127reguIate/status/1274387233466806272
2020-06-20 17:02:47,Siinrajiaal,"Nothing.",https://twitter.com/Siinrajiaal/status/1274387230576963584
2020-06-20 17:02:43,AtinukeArowolo,"My OG thank uuu",https://twitter.com/AtinukeArowolo/status/1274387213812412417
2020-06-20 17:02:24,adorey_styles,"Done pic.twitter.com/5tFdQpABNC",https://twitter.com/adorey_styles/status/1274387135194423296
2020-06-20 17:02:23,Sail_by_wind,"@ShadesOfTaylena we know eachother since lolwa gang we share and Bcos of similarities u r my twin i have to say u r beautiful just the way u r and i am so happy we r friends please come on twitter more often i miss u",https://twitter.com/Sail_by_wind/status/1274387130001657856
2020-06-20 17:02:18,Georgia_loveCY,"I've never dealt with an actor in the past but with you I don't know what happened....It's an inexplicable phenomenon that faces anyone who loves you...and as time goes on we want to support you more and more....We will always be here for you @canyaman1989 #CanYamanFansDaypic.twitter.com/OrwonKB7QB",https://twitter.com/Georgia_loveCY/status/1274387111081324544
2020-06-20 17:02:15,ghirschvw,"You have a great day too",https://twitter.com/ghirschvw/status/1274387098792013826
2020-06-20 17:02:13,SofthenicShadow,"Heres better quality.pic.twitter.com/jVoxv2R3QO",https://twitter.com/SofthenicShadow/status/1274387088062976001
2020-06-20 17:02:07,niallsrevivalx,"liam payne as emojis; a cute thread pic.twitter.com/YjS7pBMVL2",https://twitter.com/niallsrevivalx/status/1274387063475970048
