date,username,to,replies,retweets,favorites,text,geo,mentions,hashtags,id,permalink
2020-06-20 16:15:19,kumalazaw,"THANK U @day6official I LOVE U TO THE SUN AND BACK #DAY6 #DAY6_MIDNIGHT_CONCERT #DAY6MIDNIGHTCONCERT #DAY6_GRAVITY #DAY6WORLDTOUR #day6",https://twitter.com/kumalazaw/status/1274375286474149889
2020-06-20 16:15:16,kthinqsss,"THANKFUL FOR THE EXPERIENCE I LOVE DAY6 SO MUCH",https://twitter.com/kthinqsss/status/1274375271936700416
2020-06-20 16:15:14,GaneshK69299817,"Get well soon",https://twitter.com/GaneshK69299817/status/1274375262843441153
2020-06-20 16:15:11,Blackfl83145012,"Loveyoumore baby panda I will wait for you take care always all the way from Philippines",https://twitter.com/Blackfl83145012/status/1274375253376942081
2020-06-20 16:15:08,OUbowers,"Morning Mattie! You are such a good helper. Have a blessed day.",https://twitter.com/OUbowers/status/1274375241301721089
2020-06-20 16:14:56,Your_Princes__1,"Luv u too",https://twitter.com/Your_Princes__1/status/1274375189502078976
2020-06-20 16:14:51,CatraSapatenis,"Obrigaduh Guys GIVE US SHE RA MOVIEpic.twitter.com/X6xZSCXyXQ",https://twitter.com/CatraSapatenis/status/1274375168769564678
2020-06-20 16:14:47,ang_uLovit,"My casita is almost done",https://twitter.com/ang_uLovit/status/1274375150591344642
2020-06-20 16:14:45,mystitweeting,"Yess please... Thank you for your time and energy...",https://twitter.com/mystitweeting/status/1274375143679299587
2020-06-20 16:14:36,skeilnicole_,"Always welcome my forever bebe always here for you",https://twitter.com/skeilnicole_/status/1274375105905221634
2020-06-20 16:14:35,shrektiny,"aww, love you too, darling! but, love yourself first, okay?",https://twitter.com/shrektiny/status/1274375102046416898
2020-06-20 16:14:33,lasia_breell,"Ok fucking weirdo https://twitter.com/praiselken/status/1273961585418162181 …",https://twitter.com/lasia_breell/status/1274375093955842050
2020-06-20 16:14:31,BunnyAnnaCult2,"Ram charan king of box office",https://twitter.com/BunnyAnnaCult2/status/1274375084115767298
2020-06-20 16:14:29,princessgabbbyy,"Omg groot https://twitter.com/lilnasx/status/1274366649244643330 …",https://twitter.com/princessgabbbyy/status/1274375077568688131
2020-06-20 16:14:29,TalkZquad,"Me to me: Can I have a tweet that receives more than 50 likes? Also me to me: Never in a million years :(",https://twitter.com/TalkZquad/status/1274375076515770368
2020-06-20 16:14:28,Lolilolipop___,"Happy birthday melati",https://twitter.com/Lolilolipop___/status/1274375069662240768
2020-06-20 16:14:26,LeithTy,"Exit left with MY baby and all the gifts double duceeeee",https://twitter.com/LeithTy/status/1274375062074920960
2020-06-20 16:14:22,InnocentCMann,"Done",https://twitter.com/InnocentCMann/status/1274375045968654342
2020-06-20 16:14:19,LILIES_STREAMS,"Lilies please stream here too VLive https://www.vlive.tv/video/198327 #HowYouLikeThatLisa #StreamHYLT_Lisa #LISA #LALISA LISA LALISA @ygofficialblink",https://twitter.com/LILIES_STREAMS/status/1274375035956781057
2020-06-20 16:14:13,ackeryeager,"gm the loml hv a great day!",https://twitter.com/ackeryeager/status/1274375009679454208
2020-06-20 16:14:12,Day6Mylove_,"Let us all say : THANKYOU DAY6 @day6official #DAY6_MIDNIGHT_CONCERT",https://twitter.com/Day6Mylove_/status/1274375006202417152
2020-06-20 16:14:01,Thabiso_Queen,"Hahahaha she was adjusting a beautiful moment anytime",https://twitter.com/Thabiso_Queen/status/1274374957598900224
2020-06-20 16:13:58,SofthenicShadow,"Do you take rh items?",https://twitter.com/SofthenicShadow/status/1274374945863118848
2020-06-20 16:13:55,DoneByBre,"This ho and these curls !",https://twitter.com/DoneByBre/status/1274374934035300352
2020-06-20 16:13:55,koreipsulu,"Anyways pic.twitter.com/988tZgPzlp",https://twitter.com/koreipsulu/status/1274374932495884294
2020-06-20 16:13:43,eunnxeo,"➯ #⃟그미니 wjsn_uzzu_'s Twitter update with Eunseo ⋆ ⸢200620⸥ ✎ᝰ┆ Uzzu in Neverland WJSN Eunseo in Neverland Unnie's gift was brought pic.twitter.com/7XwoTGTXXb",https://twitter.com/eunnxeo/status/1274374883254792192
2020-06-20 16:13:43,FenianBranch1,"Thank you so much Ragnell! xxx",https://twitter.com/FenianBranch1/status/1274374881468178436
2020-06-20 16:13:40,DoneByBre,"I wish I can wear a frontal I want some long ass hair colored red",https://twitter.com/DoneByBre/status/1274374869011103745
2020-06-20 16:13:29,petarsaur,"Agreed, but then 90's Star Wars proceeded to illiterate on itself and provided context, as well as relative meaning between its characters and world. I feel Doctor Who fumbles with its lore every now and then, but ultimately just abandons it.",https://twitter.com/petarsaur/status/1274374824941416448
2020-06-20 16:13:22,NrShzlnEzzty,"hatechu but iloveyou",https://twitter.com/NrShzlnEzzty/status/1274374793836417025
2020-06-20 16:13:17,radhitazkdlin,"The best thing i have #DAY6_MIDNIGHT_CONCERTpic.twitter.com/si14U0WOwF",https://twitter.com/radhitazkdlin/status/1274374775436173313
2020-06-20 16:13:15,leonjwiniee,"it's okay, thank you for your hard work",https://twitter.com/leonjwiniee/status/1274374766040760321
2020-06-20 16:13:10,imthatbabee_,"In the O for the weekend",https://twitter.com/imthatbabee_/status/1274374746428395521
2020-06-20 16:13:10,DayraAcosta12,"Ouch https://twitter.com/sidehoseok/status/1273849784974090241 …",https://twitter.com/DayraAcosta12/status/1274374745031467011
2020-06-20 16:13:08,Mo2pee99,"And the late UTATA Mandela married out. Since y'all use his name on many things why don't you use that against him? You can't judge anyone because of what their leaders failed to do.",https://twitter.com/Mo2pee99/status/1274374736169046016
2020-06-20 16:13:04,arrarara01,"Ok u were beautiful = still a queen, but but Jae u r more beautify @Jae_Day6 #DAY6 #데이식스 #DAY6WORLDTOUR #DAY6_GRAVITY #DAY6_MIDNIGHT_CONCERTpic.twitter.com/EApvfANsAy",https://twitter.com/arrarara01/status/1274374718351499264
2020-06-20 16:13:01,_LoveDesto,"That’s it",https://twitter.com/_LoveDesto/status/1274374706884415491
2020-06-20 16:12:59,SooEyeeCatching,"Yesterday was a really good day",https://twitter.com/SooEyeeCatching/status/1274374700341309446
2020-06-20 16:12:59,Thabiso_Queen,"So embarrassing",https://twitter.com/Thabiso_Queen/status/1274374699129221122
2020-06-20 16:12:52,asimprii,"hatt",https://twitter.com/asimprii/status/1274374670029070336
2020-06-20 16:12:52,TalkZquad,"Yeaahh me too",https://twitter.com/TalkZquad/status/1274374669504638979
2020-06-20 16:12:50,theoloriherself,"Who guys?? I no dey o..",https://twitter.com/theoloriherself/status/1274374662672322567
2020-06-20 16:12:48,han_sea_,"changbin the prettiest changbin talented changbin handsome changbin beautiful changbin charming changbin the brightest changbin the funniest changbin lovely changbin attractive changbin gorgeous changbin stunning changbin good-looking changbin best boy changbin god’s menu",https://twitter.com/han_sea_/status/1274374653843308545
2020-06-20 16:12:29,imurgirls,"Araa stay strong",https://twitter.com/imurgirls/status/1274374571299225610
2020-06-20 16:12:26,TalkZquad,"Y r u ppl acting like Zepeto?",https://twitter.com/TalkZquad/status/1274374561996238849
2020-06-20 16:12:25,DesuKanami,"His Face is super cute The history is beautiful pic.twitter.com/LdmRC7xwXW",https://twitter.com/DesuKanami/status/1274374557240082432
2020-06-20 16:12:24,yusstiaR,"perfect ending (*´˘`*)ー",https://twitter.com/yusstiaR/status/1274374553657958403
2020-06-20 16:12:23,LeithTy,"Y’all ever feel like the shit you going thru, nobody can fix ? Sometimes we just gotta go thru the motions",https://twitter.com/LeithTy/status/1274374546934714368
2020-06-20 16:12:13,x0x0_jennie,"love u",https://twitter.com/x0x0_jennie/status/1274374504589004800
2020-06-20 16:12:08,edsiyoon,"bright and bubbly oppa #윤시윤 #ユンシユン #尹施允 #yoonsiyoon #yoonshiyoon #yoondonggu #moa_ent #multitalentedsiyoon #wittysiyoonie #mrniceguy #lovablesiyoon #handsomeoppa #adorableoppa #hottieoppa #MahalKitaSiyoonie Rooting For You Always pic.twitter.com/GrABOZpLal",https://twitter.com/edsiyoon/status/1274374482455478275
2020-06-20 16:12:03,dayjaexxx,"BAKIT YONG ""BABY I KNOW IT'S ALREADY OVER"" NI JAE DAMANG DAMA KO?!",https://twitter.com/dayjaexxx/status/1274374465065897984
2020-06-20 16:11:56,Piyawan64079243,"Kiss Mark #ENOFLOVEep11pic.twitter.com/AC1kk0bpeb",https://twitter.com/Piyawan64079243/status/1274374436230057984
2020-06-20 16:11:53,TalkZquad,"I would n 18",https://twitter.com/TalkZquad/status/1274374422317563904
2020-06-20 16:11:49,gretagxrbo,"Thank youuuu",https://twitter.com/gretagxrbo/status/1274374402914652161
2020-06-20 16:11:40,stilllwithkoo,"thank you SO SO much my angel, i love you with my whole heart i'm so glad you like it hehe",https://twitter.com/stilllwithkoo/status/1274374369154748416
2020-06-20 16:11:40,Celestial_Jamie,"Hinode Sunrise Attack ☉",https://twitter.com/Celestial_Jamie/status/1274374365237264387
2020-06-20 16:11:29,Amu907,"My sweeties.. #SevenYearsOfShivangiJoshipic.twitter.com/5mkhvuGDSR",https://twitter.com/Amu907/status/1274374321570365440
2020-06-20 16:11:22,LeratoLesinga,"But seriously thou we must do away with this patriarchal systems",https://twitter.com/LeratoLesinga/status/1274374291082170375
2020-06-20 16:11:19,mss_mabrookah,"Sometimes saying how you feel is powerful enough to change how you feel",https://twitter.com/mss_mabrookah/status/1274374281057767425
2020-06-20 16:11:11,parkAkire,"I CANT STOP CRYING. CONGRATULATIONS WILL ALWAYS BE A FAV THAT smiles on their eyes when mydays singing I LOVE YOU @day6official #DAY6_MIDNIGHT_CONCERT",https://twitter.com/parkAkire/status/1274374247415070720
2020-06-20 16:11:10,LILIES_STREAMS,"[UPDATE] VIEWS: 12, 244, 009 LIKES: 1.3M Keep streaming Fam, lets hit 15M views https://youtu.be/i8hicLO6gwY #LISA #LALISA #HowYouLikeThatLisa #StreamHYLT_Lisa #BLACKPINK @ygofficialblinkpic.twitter.com/seHjOCDyu9",https://twitter.com/LILIES_STREAMS/status/1274374243262689281
2020-06-20 16:11:08,StonerGirlClaro,"The TL not playin attention... I got about one relationship left in me . Possibly a fbuddy situationship . . Anything after that ima make the streets home .",https://twitter.com/StonerGirlClaro/status/1274374232823091200
2020-06-20 16:11:08,EOmorojunior,"Nataka dame wa Arsenal. I can imagine that loyalty.",https://twitter.com/EOmorojunior/status/1274374231573348352
2020-06-20 16:11:06,AbegailRada5,"awitize pic.twitter.com/9f8IlJ5XoV",https://twitter.com/AbegailRada5/status/1274374225088770049
2020-06-20 16:11:06,vodoberry_,"miss macy",https://twitter.com/vodoberry_/status/1274374222819717122
2020-06-20 16:11:05,DentistMohame18,"Yeas",https://twitter.com/DentistMohame18/status/1274374219963514882
2020-06-20 16:10:59,TheyEnvyLa,"i feel like eating cheesecake factory today, so imma prolly go",https://twitter.com/TheyEnvyLa/status/1274374196559298560
2020-06-20 16:10:57,mattarochia,"God Speed",https://twitter.com/mattarochia/status/1274374185779855360
2020-06-20 16:10:49,madhood13,"@SecretStylingMH was on the road today.. I'm absolutely elated I finally got to surprise my sister Charlene & do her hair today & she was beyond excitedHUGE thank you to Linda for writing letters to get approval &… https://www.instagram.com/p/CBqcIdCgNXA/?igshid=3l8y0yiz3npr …",https://twitter.com/madhood13/status/1274374154922442752
2020-06-20 16:10:41,Donnam33dwr,"love it",https://twitter.com/Donnam33dwr/status/1274374121049260032
2020-06-20 16:10:40,Blackfl83145012,"Handsome",https://twitter.com/Blackfl83145012/status/1274374116141760512
2020-06-20 16:10:36,mammon_inc,"I want a mommy to facefuck me to the point where i don't know if the wet spots on the floor are tears, drool or pre...",https://twitter.com/mammon_inc/status/1274374097531797505
2020-06-20 16:10:35,Tdg_xoo,"Ask someone “why tf are you staring at me?” and watch their facial expression change",https://twitter.com/Tdg_xoo/status/1274374095753240583
2020-06-20 16:10:30,TalkZquad,"Thank you so much, Aitijhya",https://twitter.com/TalkZquad/status/1274374073280151552
2020-06-20 16:10:25,oikawachuu,"HAPPY BIRTHDAY TO THE BIGGEST BABY AND OUR PRECIOUS LIL HIMAN TANGERINE HINATA https://twitter.com/oikawachuu/status/1274373879075569668/photo/1pic.twitter.com/tkzJjC4HPx pic.twitter.com/PrbbNWYp6x",https://twitter.com/oikawachuu/status/1274374054045265926
2020-06-20 16:10:22,theoloriherself,"Arsenal is so predictable! Mad cash out...LMAO!",https://twitter.com/theoloriherself/status/1274374039230963713
2020-06-20 16:10:13,Ozzgal1,"Yes shes a fine one to talk about racisim claims to be caucasian but changes colour when the cause suits her.. next she will be an advocate for animal rights!",https://twitter.com/Ozzgal1/status/1274374002849480704
2020-06-20 16:10:12,_OhHeyRi,"That’s cus ppl don’t know how to speak up when they have a problemhttps://twitter.com/destinysharnea/status/1274195332944068609 …",https://twitter.com/_OhHeyRi/status/1274373998080647168
2020-06-20 16:10:09,TalkZquad,"Y r ppl comparing them?!",https://twitter.com/TalkZquad/status/1274373985627586565
2020-06-20 16:10:07,SofthenicShadow,"I also might be getting a NGR Giraffe. Can i get anything with it?",https://twitter.com/SofthenicShadow/status/1274373978656665601
2020-06-20 16:10:07,DDAECHWlTA,"THEA BABY HAPPY BIRTHDAYYY YOU'VE COME SO FAR AND I'M SO PROUD OF YOU, I HOPE YOU CAN HAVE SOME FUN AND BE HAPPY ON YOUR DAY, YOU DESERVE IT @kookvhearteu",https://twitter.com/DDAECHWlTA/status/1274373976706347013
2020-06-20 16:10:00,NdabezithaRobin,"Nex, nothing, dololo I was playing soccer on the side tho ngama after school",https://twitter.com/NdabezithaRobin/status/1274373948717838336
2020-06-20 16:09:49,arrarara01,"Thank u so much",https://twitter.com/arrarara01/status/1274373901024288768
2020-06-20 16:09:46,Chiksilogmoto,"Gonna change my icon?",https://twitter.com/Chiksilogmoto/status/1274373888558809089
2020-06-20 16:09:46,elviiiiia_,"* and getting a corn with Elvia",https://twitter.com/elviiiiia_/status/1274373888550584321
2020-06-20 16:09:44,thelzy_28,"Feedback like this AawwwwI love them always....... Dont forget to place your order for a neatly packaged customized wall clock. #surpriseghana #specialdaygift #ghanagiftshop #giftshopghana #giftforall… https://www.instagram.com/p/CBqcAZhpMXo/?igshid=17x714zhn1824 …",https://twitter.com/thelzy_28/status/1274373880849801217
2020-06-20 16:09:35,Thabiso_Queen,"Yhoo it's just sad now",https://twitter.com/Thabiso_Queen/status/1274373843717623808
2020-06-20 16:09:34,DiyahDonDada,"CONGRATULATIONS BROTHER!!!!!! WELL DESERVED",https://twitter.com/DiyahDonDada/status/1274373840014061569
2020-06-20 16:09:28,trabuoichum,"#ENOFLOVEep11 I love every Nuea's lines he is so UWUpic.twitter.com/cZeTfeINGL",https://twitter.com/trabuoichum/status/1274373815364009984
2020-06-20 16:09:28,camela415,"Ohhhhhhhhhhh boooooooyyyyyyyy!!!!!! This is gonna be fun!!!!!",https://twitter.com/camela415/status/1274373814445473792
2020-06-20 16:09:26,theoloriherself,"Down date ni",https://twitter.com/theoloriherself/status/1274373804333174787
2020-06-20 16:09:21,LisaLouX1,"Stuff like this pickles my brain.... like, HOW?!https://twitter.com/halofairylights/status/1273854102825385984 …",https://twitter.com/LisaLouX1/status/1274373782002700292
2020-06-20 16:09:18,bcult_m,"In front of Dhfms... Anything will B possible.... Bhayaa #AdvanceHBDMaheshBabuhttps://twitter.com/_UrstrulyHNE/status/1274371744719986689 …",https://twitter.com/bcult_m/status/1274373771902586880
2020-06-20 16:09:18,CarloEmmanuel8,"Next stageee na",https://twitter.com/CarloEmmanuel8/status/1274373769809637376
2020-06-20 16:09:16,Sheebah933,"It's time for the best Dj to disturb your night till midnight @djalibreezy on @XfmUG #xfmxplosion we go so pic.twitter.com/1N0SEBh1gg",https://twitter.com/Sheebah933/status/1274373762381643776
2020-06-20 16:09:13,kinkypinky21,"Essex xx you",https://twitter.com/kinkypinky21/status/1274373749551357954
2020-06-20 16:09:13,kamaboku_420,"HAPPY BIRTHDAY",https://twitter.com/kamaboku_420/status/1274373748599160833
2020-06-20 16:09:09,TalkZquad,"THEY ALL R MY FAV",https://twitter.com/TalkZquad/status/1274373732211933186
2020-06-20 16:09:08,Corinthiaan,"if you don’t have your phone in dark mode, you’re a maniac.",https://twitter.com/Corinthiaan/status/1274373728575594497
2020-06-20 16:09:04,Anurag_anu_,"Neend ka dushman hu me",https://twitter.com/Anurag_anu_/status/1274373712079278083
2020-06-20 16:08:59,softmonmonie,"it's okay bub, we're here for you okay? I hope you get better soon and you don't deserve this :( we love you! please cheer up",https://twitter.com/softmonmonie/status/1274373692038934528
2020-06-20 16:08:59,Nayada27478782,"Thank youuuuuGod bless youu pic.twitter.com/5gj09Xdu7v",https://twitter.com/Nayada27478782/status/1274373689912557568
2020-06-20 16:08:57,Seviltek5,"good song",https://twitter.com/Seviltek5/status/1274373683709124609
2020-06-20 16:08:54,lojo4270,"Amen",https://twitter.com/lojo4270/status/1274373670027382785
2020-06-20 16:08:53,AsangPongen1,"Haters gonna hate because they know I'm doing great. Keep doubting me. ~Sidharth Shukla ~ #SidharthShukla @sidharth_shukla",https://twitter.com/AsangPongen1/status/1274373666092888065
2020-06-20 16:08:43,DjenabouMk,"I cried so much after seeing the videos of what happened to him. This one hit me hard, I’m happy they all got charged.https://twitter.com/chrisnola03/status/1274226123510087681 …",https://twitter.com/DjenabouMk/status/1274373624728879105
2020-06-20 16:08:39,zykeriaa__,"Santana being in the Jobs video was literally the icing on the cake",https://twitter.com/zykeriaa__/status/1274373608517885955
2020-06-20 16:08:35,Kim_dKd,"You made it ?",https://twitter.com/Kim_dKd/status/1274373590280998915
2020-06-20 16:08:29,LeratoLesinga,"Good 4 you sis",https://twitter.com/LeratoLesinga/status/1274373564695707653
2020-06-20 16:08:29,NdabezithaRobin,"What do you call thispic.twitter.com/3QsgJpex3i",https://twitter.com/NdabezithaRobin/status/1274373563986915330
2020-06-20 16:08:26,CHUCK_1967,"WHITE LIVES DON'T MATTER ANYMORE, BUT DROPPING A BAGGIE FULL OF METH AND GETTING DROPPED TO THE GROUND WILL GET YOU NATIONAL ATTENTION, A FOLDED FLAG THAT FLEW ON CAPITOL HILL THE SAME DAY YOU DIED HIGH ON DRUGS WHILE IN POLICE CUSTODY. THAT'S HOW MUCH HIS LIFE MATTERED TO HIM.pic.twitter.com/nrZB0rSNhu",https://twitter.com/CHUCK_1967/status/1274373552561627136
2020-06-20 16:08:25,Donnam33dwr,"Beautiful, Congratulations too them both",https://twitter.com/Donnam33dwr/status/1274373549973790721
2020-06-20 16:08:21,theoloriherself,"As I was saying....https://twitter.com/theoloriherself/status/1274333845098201088 …",https://twitter.com/theoloriherself/status/1274373530763890692
2020-06-20 16:08:15,annalejano,"One of my many fave BTS https://twitter.com/itzyejin_/status/1273778211894071296 …",https://twitter.com/annalejano/status/1274373505304444929
2020-06-20 16:08:07,trabuoichum,"#ENOFLOVEep11 Prom really does well in the cofession scene his voice his tone is so soft and caring ;------; Prom bestest boy softest boy",https://twitter.com/trabuoichum/status/1274373473305899012
2020-06-20 16:08:05,keyasea,"My tattoo done healing",https://twitter.com/keyasea/status/1274373467207581696
2020-06-20 16:08:02,jb_22nd,"Ohhh I don’t like that",https://twitter.com/jb_22nd/status/1274373454016532480
2020-06-20 16:08:02,CatraSapatenis,"As Duas GIVE US SHE RA MOVIE",https://twitter.com/CatraSapatenis/status/1274373453496356872
2020-06-20 16:07:59,LisaLouX1,"I’m embarrased for them #Handbags",https://twitter.com/LisaLouX1/status/1274373441685262341
2020-06-20 16:07:57,DMBMamas,"DMBFamily! Please wish this beautiful couple a most enchanting, blessed wedding day!Congratulations @bendo7732 and @christyelix!! We're ALL w/ you in Spirit!!! #DMB #TwoStep https://youtu.be/VllfUmKzNg8 https://twitter.com/bendo7732/status/1274319391929368583 …",https://twitter.com/DMBMamas/status/1274373431669198853
2020-06-20 16:07:33,LALAVA1,"Let's Show the World how it's Done",https://twitter.com/LALAVA1/status/1274373330473287681
2020-06-20 16:07:31,helinto_offl,"5 Secrets to know your partner well in lockdown - Special tips for bride/groom to be Hello Bride/ Groom Are you stressed? Lock down and pandemic situation already postponed your wedding plans? It's… https://www.instagram.com/p/CBqbwDXDC3n/?igshid=1ln3qv9i1sqrg …",https://twitter.com/helinto_offl/status/1274373322277601280
2020-06-20 16:07:21,ULTRAROSAANGEL,"-comes on twitter to get my feelings hurt so i dont e*t-",https://twitter.com/ULTRAROSAANGEL/status/1274373282700148739
2020-06-20 16:07:19,SofthenicShadow,"All my items, NFR Crow, NR Ginger cat, 2 legendaries, my whole am inventory basically, and my group for new Halloween? I can add diamonds.pic.twitter.com/3FeW7VU02u",https://twitter.com/SofthenicShadow/status/1274373273829031937
2020-06-20 16:07:15,nunesnaayara,"Se for pecado, help",https://twitter.com/nunesnaayara/status/1274373254958977024
2020-06-20 16:07:13,LisaLouX1,"Arsenal?",https://twitter.com/LisaLouX1/status/1274373245530189825
2020-06-20 16:07:11,LanaParrish10,"i'm slutty bad grl do you want to have some fun? help me get 37 comments pic.twitter.com/IynWPUQ2C1",https://twitter.com/LanaParrish10/status/1274373239020666887
2020-06-20 16:07:02,brightsforwin,"Love her always. Btw jan has a good voice too. she currently made the antagonist role for who are you thai remake https://twitter.com/Jackhangu/status/1274372692972433410 …",https://twitter.com/brightsforwin/status/1274373201816981505
2020-06-20 16:06:51,cai_moniece,"People really be looking at me funny when I bring a full course meal for my lunch break like yes my momma cook and yes I ain’t missing no meals PERIOD",https://twitter.com/cai_moniece/status/1274373154480291844
2020-06-20 16:06:49,AmethystxBTS,"Okay..",https://twitter.com/AmethystxBTS/status/1274373148511809537
2020-06-20 16:06:48,lovely1DMJ,"YES, you deserve everything beautiful on the planet, God made me meet you, he knows what you and I truly deserve",https://twitter.com/lovely1DMJ/status/1274373143637954563
2020-06-20 16:06:48,dianaybar05,"Thank you Christine",https://twitter.com/dianaybar05/status/1274373140471336967
2020-06-20 16:06:35,Maria_Ricielle,"It will behttps://twitter.com/SmiIe/status/1269677440965771266 …",https://twitter.com/Maria_Ricielle/status/1274373088247836674
2020-06-20 16:06:30,i_m_Tufail,"Mind; Let's suicide and end This pain. Heart; Chor na yaar, Maa Bohot royegi. Akhir Maa jo hain Luv u mom",https://twitter.com/i_m_Tufail/status/1274373066022252544
2020-06-20 16:06:19,yeah_osom,"If ever I knew how to dance, ""you can call me danceu machine menjisan""https://twitter.com/luvchrispy/status/1274095113656991751 …",https://twitter.com/yeah_osom/status/1274373021478744064
2020-06-20 16:06:16,deobyy,"THEY PERFORMED SALTY!!! IT'S A YES FOR DEOBIS https://twitter.com/TBZ_SUNW00/status/1274366882192060416 …",https://twitter.com/deobyy/status/1274373006714966017
2020-06-20 16:06:15,tyunningrain,"take care of yourself too",https://twitter.com/tyunningrain/status/1274373002914721794
2020-06-20 16:06:12,hasminuhh,"aah shit im in an angsty mood rn",https://twitter.com/hasminuhh/status/1274372992013725696
2020-06-20 16:05:54,AmethystxBTS,"If you want to share anything we are here :) Dms are always open for you",https://twitter.com/AmethystxBTS/status/1274372914624823304
2020-06-20 16:05:52,Chiksilogmoto,"Hello dearpic.twitter.com/b7onjH51ow",https://twitter.com/Chiksilogmoto/status/1274372906433175553
2020-06-20 16:05:50,lylykalay,"I miss youuuu...",https://twitter.com/lylykalay/status/1274372900418551808
2020-06-20 16:05:48,PrettyUGLY_,"Dionne",https://twitter.com/PrettyUGLY_/status/1274372892084576256
2020-06-20 16:05:43,Goonerlover69,"I can't believe it",https://twitter.com/Goonerlover69/status/1274372869208903680
2020-06-20 16:05:31,arreumdaun,"Thank you",https://twitter.com/arreumdaun/status/1274372820781264902
2020-06-20 16:05:16,Chiksilogmoto,"Himissyouuu twitter",https://twitter.com/Chiksilogmoto/status/1274372758546206722
2020-06-20 16:05:10,FenianBranch1,"Wow!! This is amazing!! Happy Summer Solstice & Litha Blessings to you, Spell Fire & family! May you all have a magickal day & enjoy your beautiful bonfire ritual tonight! Blessed Be xxx",https://twitter.com/FenianBranch1/status/1274372733112127488
2020-06-20 16:05:09,StonerGirlClaro,"Can you cook ? Will forever be hella funny to me . .",https://twitter.com/StonerGirlClaro/status/1274372727193743361
2020-06-20 16:05:05,tee_sibo,"Good one",https://twitter.com/tee_sibo/status/1274372709108133891
2020-06-20 16:05:01,mansaerrr_,"ONE OF MY FAV FIC IS UPDATING https://twitter.com/yilinges/status/1274371695386771456 …",https://twitter.com/mansaerrr_/status/1274372692506898434
2020-06-20 16:04:58,IamRumG,"So you're proud updating the score ...U people should just go and partner with NCDC",https://twitter.com/IamRumG/status/1274372680683266049
2020-06-20 16:04:55,Aahadpirzada,"Wowwwww MA sha Allah stay shine https://twitter.com/OfficialLailaIk/status/1274367691437072384 …",https://twitter.com/Aahadpirzada/status/1274372669857767425
2020-06-20 16:04:51,DjenabouMk,"They’re on my Instagram @simplybelleessentials",https://twitter.com/DjenabouMk/status/1274372649939095558
2020-06-20 16:04:50,LelenaPeacock,"Thanks!",https://twitter.com/LelenaPeacock/status/1274372645329481729
2020-06-20 16:04:46,Amu907,"Sexiest couple in ITV... #SevenYearsOfShivangiJoshipic.twitter.com/4UoPiP49dQ",https://twitter.com/Amu907/status/1274372630921883648
2020-06-20 16:04:44,Abiodun_20,"Ass senal",https://twitter.com/Abiodun_20/status/1274372623808499723
2020-06-20 16:04:40,helinsarca,"liam",https://twitter.com/helinsarca/status/1274372605697495043
2020-06-20 16:04:37,baejeaans,"get well soon~",https://twitter.com/baejeaans/status/1274372592019763200
