date,username,to,replies,retweets,favorites,text,geo,mentions,hashtags,id,permalink
2020-06-20 15:45:00,Wonglevina,"Highway to Heaven Skrrt pull up in the coupe Beep beep. Girl I got your loving on repeat. And I bet u never had it like this, real good loving, light up your wrist",https://twitter.com/Wonglevina/status/1274367656200507392
2020-06-20 15:44:59,parkAkire,"I knoww!! Thats hot!! #DAY6_MIDNIGHT_CONCERThttps://twitter.com/jjaehyungie/status/1274358543953477633 …",https://twitter.com/parkAkire/status/1274367651482042372
2020-06-20 15:44:53,prdsdefs_lady,"nooo omg I'm confused between left and right. the left part",https://twitter.com/prdsdefs_lady/status/1274367628279083009
2020-06-20 15:44:53,Lala11_7,"She's used to being in a class by herself #KHiveForBidenhttps://twitter.com/Sigmundine2/status/1274367357700448262 …",https://twitter.com/Lala11_7/status/1274367628040196096
2020-06-20 15:44:49,Brito_minaj,"Love you",https://twitter.com/Brito_minaj/status/1274367609572675585
2020-06-20 15:44:47,Goonerlover69,"Just give the gulls a bag a chips to sneak other goal in",https://twitter.com/Goonerlover69/status/1274367600215166977
2020-06-20 15:44:46,Karlaaaj_,"I fell out the bed last night how... good question foo cause ion even know.",https://twitter.com/Karlaaaj_/status/1274367596247293952
2020-06-20 15:44:42,jjhbestboy,"MUTUALS ONLY! drop an emoji and I will write something about you",https://twitter.com/jjhbestboy/status/1274367578916282370
2020-06-20 15:44:41,yohanophoria,"chan myluuuuv pic.twitter.com/VTomswF9b7",https://twitter.com/yohanophoria/status/1274367576483618817
2020-06-20 15:44:39,ijuweriah,"Indeed.https://twitter.com/iamhamzaabbasi/status/1274322968999591937 …",https://twitter.com/ijuweriah/status/1274367567595880448
2020-06-20 15:44:38,Iopessauro,"LOVE UOU",https://twitter.com/Iopessauro/status/1274367563233976321
2020-06-20 15:44:26,BhamiDelacruz,"Yey I'm so excited",https://twitter.com/BhamiDelacruz/status/1274367514026233857
2020-06-20 15:44:23,DiyahDonDada,"Yall must aint been to Lil raleigh before cause this aint nun new they always turnt lmaoohttps://twitter.com/BANDS919/status/1274177679626047490 …",https://twitter.com/DiyahDonDada/status/1274367502538203141
2020-06-20 15:44:21,poetgranny,"The most expensive product you can buy the leftist nihilism. Wake up + Love Life https://overpopulationisamyth.com",https://twitter.com/poetgranny/status/1274367491830091785
2020-06-20 15:43:54,ThePinkyMajesty,"Follow meeeeeeeeee pic.twitter.com/wBxBhyPfJY",https://twitter.com/ThePinkyMajesty/status/1274367380500754433
2020-06-20 15:43:52,yasmeen_mayana,"Our banner is now up you can easily locate us at Kaduna Capital plaza first floor ff04 pls help us retweet to reach more audiencepic.twitter.com/BrgMRAKTrA",https://twitter.com/yasmeen_mayana/status/1274367373072633858
2020-06-20 15:43:47,SofthenicShadow,"I cant spam anymore aaaaaa",https://twitter.com/SofthenicShadow/status/1274367348213002240
2020-06-20 15:43:45,realdefnik96,"maybe just growling will wake you up!pic.twitter.com/5TMVt74bMx",https://twitter.com/realdefnik96/status/1274367343108317192
2020-06-20 15:43:43,michele_oneL83,"Thank you pic.twitter.com/fRTmi9p4Y6",https://twitter.com/michele_oneL83/status/1274367334438834178
2020-06-20 15:43:43,lishaa_love_,"This is beyond me",https://twitter.com/lishaa_love_/status/1274367331335102470
2020-06-20 15:43:39,realdefnik96,"sounding irritated ngl kinda hot thopic.twitter.com/S3GP2354vN",https://twitter.com/realdefnik96/status/1274367317326000128
2020-06-20 15:43:39,luluuuumd,"wtf was that. thank god for yinwar at the end.",https://twitter.com/luluuuumd/status/1274367314691895296
2020-06-20 15:43:33,realdefnik96,"how about in english?pic.twitter.com/Wfh4dBUHra",https://twitter.com/realdefnik96/status/1274367291451293696
2020-06-20 15:43:30,prdsdefs_lady,"i can't stan new groups because feeling ko andami ko pang need matutunan and malaman about my got7 and my itzy",https://twitter.com/prdsdefs_lady/status/1274367277224189952
2020-06-20 15:43:29,aishaslutz,"Yeah I am",https://twitter.com/aishaslutz/status/1274367274472767489
2020-06-20 15:43:27,SofthenicShadow,"Wbowhowj0iwowo0",https://twitter.com/SofthenicShadow/status/1274367265689960449
2020-06-20 15:43:25,TalkZquad,"Yeahhh wuaaahhh",https://twitter.com/TalkZquad/status/1274367257192198144
2020-06-20 15:43:24,realdefnik96,"don’t worry,, I have more :}pic.twitter.com/Z1QNE31naY",https://twitter.com/realdefnik96/status/1274367252469436417
2020-06-20 15:43:23,mariicadd,"so i decided to post here pic.twitter.com/K2MSqmbJk4",https://twitter.com/mariicadd/status/1274367249768316929
2020-06-20 15:43:21,BelovedShip,"""My heart is yours since the first time I saw you."" pic.twitter.com/utKtWNC2JD",https://twitter.com/BelovedShip/status/1274367239010037760
2020-06-20 15:43:20,sincerely_shade,"Don’t come around if you ain’t turnt",https://twitter.com/sincerely_shade/status/1274367237630148610
2020-06-20 15:43:17,donghyunieeeee,"Okayyyyy, after days of killing us with their visuals..now, they're killing us with their vocals...",https://twitter.com/donghyunieeeee/status/1274367222442422274
2020-06-20 15:43:14,kathyQuemba,"Same feeling https://twitter.com/richardcadrouce/status/1274360024345841665 …",https://twitter.com/kathyQuemba/status/1274367210924933120
2020-06-20 15:43:01,Saphira_Eragon_,"Yes sir you're one of a kind pic.twitter.com/2ZfKlOYAbU",https://twitter.com/Saphira_Eragon_/status/1274367156759564289
2020-06-20 15:42:59,eunsangforlife,"A live broadcast is now showing on V. HE'S VIBIN' CHAN IN DA HOUSEhttps://www.vlive.tv/video/198633",https://twitter.com/eunsangforlife/status/1274367150073864198
2020-06-20 15:42:55,Abiodun_20,"Please don't leave me",https://twitter.com/Abiodun_20/status/1274367131677872128
2020-06-20 15:42:48,DhriteshBhagat,"Ahem! Ahem! Let's make babies! . Go sketch your own character. And yeah! Stay tuned. Parallels episode 4 going to be a big one! . . #howtodraw #art #drawing #sketch #artist #draw… https://www.instagram.com/p/CBqY7D3AT2j/?igshid=uzr8mfwryg1g …",https://twitter.com/DhriteshBhagat/status/1274367101508169729
2020-06-20 15:42:41,ELFEriStarLight,"This is the only time I get to be a CEO so I'm claiming it Love you Tamaaa!!! So much! Happy Birthday again~",https://twitter.com/ELFEriStarLight/status/1274367073079050247
2020-06-20 15:42:38,TalkZquad,"Fank u again",https://twitter.com/TalkZquad/status/1274367062698160129
2020-06-20 15:42:28,PRlDEJENO,"♡ ㅤDue to my health condition, I’ll take a rest until it gets better. So please don't bub or unfollow me. Thank you, have a great day moots Pitt.",https://twitter.com/PRlDEJENO/status/1274367016753696768
2020-06-20 15:42:26,_ramenoodle,"sweet dreams, my loves. pic.twitter.com/gRqlD9BYgq",https://twitter.com/_ramenoodle/status/1274367008549662720
2020-06-20 15:42:25,Kabali_0309,"My FAV CAMERA https://twitter.com/RajiniFC/status/1174690104742465542 …",https://twitter.com/Kabali_0309/status/1274367006037307392
2020-06-20 15:42:19,prdsdefs_lady,"what is the title of the show on the right side??",https://twitter.com/prdsdefs_lady/status/1274366982175899651
2020-06-20 15:42:17,felicitygarciaA,"i'll entrust thy heart to ""The One"" who owns it",https://twitter.com/felicitygarciaA/status/1274366972726145024
2020-06-20 15:42:10,__xnia,"I’m not accepting nothing less then what I’m putting out",https://twitter.com/__xnia/status/1274366942959337477
2020-06-20 15:42:07,jaci_serigala_,"Baby wants to see his senpai.",https://twitter.com/jaci_serigala_/status/1274366929000706054
2020-06-20 15:42:06,Educated517,"My Mom just don't know how much I appreciate her she definitely is that constant voice pushing me",https://twitter.com/Educated517/status/1274366924634361858
2020-06-20 15:41:58,TalkZquad,"Y r they doin like that?!",https://twitter.com/TalkZquad/status/1274366892023541761
2020-06-20 15:41:54,Slimm_kj,"Lil baby has really been a mood",https://twitter.com/Slimm_kj/status/1274366876542472192
2020-06-20 15:41:51,jhesselayyy,"I'm so obsessed. Shocks.",https://twitter.com/jhesselayyy/status/1274366865083514880
2020-06-20 15:41:51,tbztwit,"Goodnight",https://twitter.com/tbztwit/status/1274366861895819265
2020-06-20 15:41:48,__cboss,"I can’t wait to get off work and change my clothes it’s hot as fuck",https://twitter.com/__cboss/status/1274366852718788610
2020-06-20 15:41:48,98sliner,"Focus on their hand #ENOFLOVEep11pic.twitter.com/BMiUsIbhXU",https://twitter.com/98sliner/status/1274366849078054912
2020-06-20 15:41:44,satsumasiwomen,"(*´˘`*)Thanks",https://twitter.com/satsumasiwomen/status/1274366835073224705
2020-06-20 15:41:38,moonjinniekore,"Hi can you send me the ss of jin apologising to ARMYS that he never bull!ed anyone",https://twitter.com/moonjinniekore/status/1274366810003918849
2020-06-20 15:41:35,niteshsinha04,"Really! Wow, what a beautiful acting. Aise hi acting movie me v kia kro ab Don't say #RIPSushant , He is still alive in the heart of 137 crore indian.",https://twitter.com/niteshsinha04/status/1274366794350788608
2020-06-20 15:41:28,lovely1DMJ,"Of course I believe you, I love you very much, and I will always even if we stop talking, you are peace to my soul and inspire me to be who I am, I truly love you",https://twitter.com/lovely1DMJ/status/1274366767717134336
2020-06-20 15:41:27,queenlee_kaths,"I love you, Day6!!! Promise! Watching even just snippets from your concert makes my heart full. What more if i get the chance to watch you live in concert! #DAY6_MIDNIGHT_CONCERT #DAY6 #DAY6_GRAVITY",https://twitter.com/queenlee_kaths/status/1274366764319563776
2020-06-20 15:41:22,Amu907,"She is such a cutie n nautankibaaz... #SevenYearsOfShivangiJoshipic.twitter.com/TEo8MtgV07",https://twitter.com/Amu907/status/1274366742970556418
2020-06-20 15:41:19,DiyahDonDada,"You not supposed to idolizing nobody but the most high, not beyonce, nobody.https://twitter.com/akirangei/status/1274025259705008134 …",https://twitter.com/DiyahDonDada/status/1274366730706567168
2020-06-20 15:41:19,TalkZquad,"I already do lol",https://twitter.com/TalkZquad/status/1274366730681282565
2020-06-20 15:41:16,JennJennBooo,"Negative that’s Ashley’s job!",https://twitter.com/JennJennBooo/status/1274366716651462657
2020-06-20 15:41:16,knnovationxx,"Fan arts are the best Thanks for creating this precious gems @mataharichanggu and @ToichiKoichi , you guys are the beeeest pic.twitter.com/nhsCeYJ1kM",https://twitter.com/knnovationxx/status/1274366716101844992
2020-06-20 15:41:06,Wonglevina,"Baby Don't Like it My baby don't like it when u come around",https://twitter.com/Wonglevina/status/1274366675391934465
2020-06-20 15:40:59,HerbieJuliet,"Sing en dance",https://twitter.com/HerbieJuliet/status/1274366646988214273
2020-06-20 15:40:53,wonderclarin,"THANK YOU JM CONGRATS DIIN",https://twitter.com/wonderclarin/status/1274366620446720006
2020-06-20 15:40:49,RuthMcelwee3,"Omg you stay safe",https://twitter.com/RuthMcelwee3/status/1274366605036847108
2020-06-20 15:40:49,Goonerlover69,"I had to think then its Saturday",https://twitter.com/Goonerlover69/status/1274366603174477824
2020-06-20 15:40:45,CunadoMichael,"How sweet",https://twitter.com/CunadoMichael/status/1274366588280397830
2020-06-20 15:40:38,milkyeiy,"MUTUALS ONLY!! drop an emoji and I will write something about you",https://twitter.com/milkyeiy/status/1274366558689587200
2020-06-20 15:40:37,Mandie_simza,"Does she?? never seen her lol am sure she looks good on them not those worn by trash can",https://twitter.com/Mandie_simza/status/1274366551966318595
2020-06-20 15:40:32,HerbieJuliet,"Ur so ill. So will that change who she is or how she was created??....if at all u decided not to have some sense, then just be human",https://twitter.com/HerbieJuliet/status/1274366531707777028
2020-06-20 15:40:14,siriwitini,"Nad be happy always your smile is the best view Kalau capek istirahat jangan sampe stress jangan sakit jangan over thinking 520 from dinda",https://twitter.com/siriwitini/status/1274366456256327680
2020-06-20 15:40:08,Wannable_twts,"-wb bagi meme ongeeee dong guisss",https://twitter.com/Wannable_twts/status/1274366432172584960
2020-06-20 15:40:06,JoannaAriola21,"Happy motmot!!",https://twitter.com/JoannaAriola21/status/1274366423251341313
2020-06-20 15:40:05,edzelgarfin,"Bitch yow",https://twitter.com/edzelgarfin/status/1274366420088913921
2020-06-20 15:40:00,TalkZquad,"DID Y'ALL LOSE YOUR FUCKING MEMORY?!?! #FREEZAYN #harrystylesislovedpartypic.twitter.com/PuWKK2IcLS",https://twitter.com/TalkZquad/status/1274366396760088577
2020-06-20 15:39:56,scorchtrlcls,"First impression : sebel banget ngegas suruh ngurangin nyawa lal Your nickname in my head : pilek Closeness rating [1-10] : 8! Do i like you : yes! You are my : pilek qu Ever had a crush on you : nooo Should you post this too : yes",https://twitter.com/scorchtrlcls/status/1274366381878767616
2020-06-20 15:39:53,SofthenicShadow,"Hello. Are you up? ^^",https://twitter.com/SofthenicShadow/status/1274366370063568896
2020-06-20 15:39:51,BunnyAnnaCult2,"Batch batch ante ga mb kuda tweet spellimg mistake he",https://twitter.com/BunnyAnnaCult2/status/1274366361204961280
2020-06-20 15:39:48,Goonerlover69,"Wait we may have a weapon coming on",https://twitter.com/Goonerlover69/status/1274366348014039041
2020-06-20 15:39:36,lilstunaaa,"I love my CF’s they play right along with me",https://twitter.com/lilstunaaa/status/1274366298731040772
2020-06-20 15:39:36,agapanthusssss,"me after reading Here U Are chapter 127:",https://twitter.com/agapanthusssss/status/1274366296814006272
2020-06-20 15:39:34,Abiodun_20,"Ass senal",https://twitter.com/Abiodun_20/status/1274366287314071553
2020-06-20 15:39:34,_Nimilo,"You good man!",https://twitter.com/_Nimilo/status/1274366286894632966
2020-06-20 15:39:25,petarsaur,"Delightful",https://twitter.com/petarsaur/status/1274366249724608514
2020-06-20 15:39:14,xlittlegurlx,"0 tweet! See tomorrow new era!",https://twitter.com/xlittlegurlx/status/1274366203666903040
2020-06-20 15:39:05,Goonerlover69,"Oh we all get like that!",https://twitter.com/Goonerlover69/status/1274366166954278912
2020-06-20 15:39:03,Hyeongjunaaa,"I will always be here for you, waiting! As long as I can keep you, I will keep you always #삼백일_엑스원을_플래시해 #300DAY_X1_FLASH @x1official101pic.twitter.com/YEAHWkR1Mv",https://twitter.com/Hyeongjunaaa/status/1274366159819685896
2020-06-20 15:39:01,Jesstice_League,"Hehehe you're SO welcome, Raven :') : ) Yes I do, and I love it too, especially because it reminds me of you and the beehive ~ it's like the official unofficial gif for all of us bees !!",https://twitter.com/Jesstice_League/status/1274366149648691203
2020-06-20 15:38:55,Ozzgal1,"This is bs riding on Floyd's death where were they before..??",https://twitter.com/Ozzgal1/status/1274366126244405250
2020-06-20 15:38:38,theoloriherself,"Laff o...you go meet me for front.",https://twitter.com/theoloriherself/status/1274366052059709447
2020-06-20 15:38:37,maiya_fudge,"Me either! I’ve always said our political views and opinions can differ but I draw the line at racism, ignorance, and just basic humanity then I can’t do it",https://twitter.com/maiya_fudge/status/1274366051329900546
2020-06-20 15:38:28,lovely1DMJ,"You are also my everything, honey",https://twitter.com/lovely1DMJ/status/1274366012754989064
2020-06-20 15:38:18,theoloriherself,"My sister...it is a very toxic relationship",https://twitter.com/theoloriherself/status/1274365970593824769
2020-06-20 15:38:18,JSampleVA,"*Their* beauty made fade, but yours... never.",https://twitter.com/JSampleVA/status/1274365969310367745
2020-06-20 15:38:18,arrarara01,"Wow so proud of him @Jae_Day6 https://twitter.com/thedivestudios/status/1274359564234682368 …",https://twitter.com/arrarara01/status/1274365968739786752
2020-06-20 15:38:11,Sadi80061592,"Stunningggg....",https://twitter.com/Sadi80061592/status/1274365940449280000
2020-06-20 15:38:03,realdefnik96,"hi who wants to be shouted at by choi san for waking up late :))pic.twitter.com/ceNSNIpohq",https://twitter.com/realdefnik96/status/1274365908635406337
2020-06-20 15:38:02,ApekshaS411,"I wonder Nepo_kids kahi depression me naa chale jaae",https://twitter.com/ApekshaS411/status/1274365905040883712
2020-06-20 15:38:02,MountVilleTown,"To : @SlNRYUJIN Fr : @_SKZHYNJN heyo, thanks for being a good friend and making everyone's day brighter. you're the best. ㅡ #MICpic.twitter.com/8lmQ5RijAt",https://twitter.com/MountVilleTown/status/1274365902587215874
2020-06-20 15:37:48,donttellmebaby,"ONLY KINGS @WE_THE_BOYZ #THEBOYZ #더보이즈 @Creker_THEBOYZpic.twitter.com/Dm4MXMZcRP",https://twitter.com/donttellmebaby/status/1274365844802461698
2020-06-20 15:37:43,stellaryeji,"i know a disclaimer is supposed to be written in the beginning but i'm sorry hshshs i thought i sent a tweet for this earlier. - first one shot yEET - please quote, don't reply - i don't own itzy in all aspect - purely fictional - criticism is different from hating thank you",https://twitter.com/stellaryeji/status/1274365824057266176
2020-06-20 15:37:30,Ozzgal1,"Go Trump Go..",https://twitter.com/Ozzgal1/status/1274365770030624771
2020-06-20 15:37:11,wonderclarin,"THANK YOU G! THIS IS TOO MUCH",https://twitter.com/wonderclarin/status/1274365690590318592
2020-06-20 15:37:08,_xHisChocolate,"Hair done now it’s time to shop for Father’s Day.",https://twitter.com/_xHisChocolate/status/1274365674949947393
2020-06-20 15:37:07,lostshruu,"more power to you Stay strong",https://twitter.com/lostshruu/status/1274365673607581697
2020-06-20 15:37:07,Joan63397837,"Te lief",https://twitter.com/Joan63397837/status/1274365671405686784
2020-06-20 15:37:03,Amu907,"My Gorgeous girl.. #SevenYearsOfShivangiJoshipic.twitter.com/s7EYvnfDYl",https://twitter.com/Amu907/status/1274365656389967873
2020-06-20 15:37:01,Bonsky0205,"Cryingggg so hard !! your love so pure. We always support you guys!! Lets walk together #AlwaysWithBright #GlobalLiveFMxBrightWin @bbrightvc @winmetawin",https://twitter.com/Bonsky0205/status/1274365648366235648
2020-06-20 15:37:00,Dzonnakela,"I'm a bangles girlpic.twitter.com/bJ5o5Mf0wS",https://twitter.com/Dzonnakela/status/1274365641965948936
2020-06-20 15:36:58,_xoxoAmarican,"Who lmaoooo",https://twitter.com/_xoxoAmarican/status/1274365634596474880
2020-06-20 15:36:56,AsangPongen1,"Yes @sidharth_shukla please read this",https://twitter.com/AsangPongen1/status/1274365627247943680
2020-06-20 15:36:51,Ozzgal1,"Wayne thank you..coming from you this says it all.",https://twitter.com/Ozzgal1/status/1274365604514930689
2020-06-20 15:36:37,baejeaans,"semangaaat!!! everything will be okayy",https://twitter.com/baejeaans/status/1274365546230738944
2020-06-20 15:36:37,Yahairaag_,"Finished off my last quarter at UCI really strong! I got straight A’s and a spot on the Dean’s Honor List. I DID THAT",https://twitter.com/Yahairaag_/status/1274365545010171905
2020-06-20 15:36:34,Goonerlover69,"Fuuuuuccckkkk fuck fuck",https://twitter.com/Goonerlover69/status/1274365533987713024
2020-06-20 15:36:34,DeclutrdLS,"Thank u..",https://twitter.com/DeclutrdLS/status/1274365533534617605
2020-06-20 15:36:33,MelodyWyles,"This TRUTH!https://twitter.com/CaslerNoel/status/1274360929992544256 …",https://twitter.com/MelodyWyles/status/1274365530468540416
2020-06-20 15:36:28,jynncrr,"Astro is the group of visuals",https://twitter.com/jynncrr/status/1274365506737197056
2020-06-20 15:36:27,Jemimah111,"Yawa and Venice @ynoooohpic.twitter.com/p5c5yZRWAn",https://twitter.com/Jemimah111/status/1274365503427862528
2020-06-20 15:36:27,Quinnhicky1,"MUTUALS ONLY drop an emoji and I'll say something about you @SB19Official",https://twitter.com/Quinnhicky1/status/1274365502698041344
2020-06-20 15:36:26,esqupsi,"I hope the one ""who claim they are a mother and nursing while streaming "" is telling the truth and not making story bcs don't use seventeen names or streaming and voting for u to get attention BUT If you're telling the truth you're an AWESOME MAMA",https://twitter.com/esqupsi/status/1274365501448151041
2020-06-20 15:36:26,taylorschanel13,"state of grace, holy ground y treacherous",https://twitter.com/taylorschanel13/status/1274365498554306561
2020-06-20 15:36:20,scorchtrlcls,"First impression : asik di ajak dm an Your nickname in my head : moiii Closeness rating [1-10] : 8! Do i like you : yes! You are my : besti dm aku Ever had a crush on you : nooo Should you post this too : yes",https://twitter.com/scorchtrlcls/status/1274365477012135936
2020-06-20 15:36:16,Dude_in_love,"Can I Get 1000 followers to promote below tags Jai babu follow back #AdvanceHBDMaheshBabu #SarkaruVaariPaata #MaheshBabu @urstrulyMaheshpic.twitter.com/V5AsVxwGNw",https://twitter.com/Dude_in_love/status/1274365457407983619
2020-06-20 15:36:14,BunnyAnnaCult2,"Antha fasta ha",https://twitter.com/BunnyAnnaCult2/status/1274365447983337472
2020-06-20 15:36:10,Bluemingzzz,"Aaaa gemes",https://twitter.com/Bluemingzzz/status/1274365432812564482
2020-06-20 15:36:09,enszeo,"#𝐃𝐀𝐈𝐒𝐄𝐎 Uzzu in Neverland WJSN Eunseo in Neverland Unnie's gift was brought pic.twitter.com/TnIwIV7Ema",https://twitter.com/enszeo/status/1274365430295957504
2020-06-20 15:36:09,O_lateju_,"Go and meet @fivestargene",https://twitter.com/O_lateju_/status/1274365429344022528
2020-06-20 15:36:02,___pammy,"Okay... The lyrics #DAY6_MIDNIGHT_CONCERT #DAY6",https://twitter.com/___pammy/status/1274365400688427010
2020-06-20 15:36:02,kwcngbae,"congratulations on the birth of these two children! i hope they can grow to be good children and become obedient children, may the world love them too-! pastttt, sorry i stole the metawin gift :"""" pic.twitter.com/QdfSc9oJWP",https://twitter.com/kwcngbae/status/1274365399438483457
2020-06-20 15:35:57,sumando10,"Happy birthdaypic.twitter.com/MOA6jx9Flg",https://twitter.com/sumando10/status/1274365377636634627
2020-06-20 15:35:56,swolaf1224,"light",https://twitter.com/swolaf1224/status/1274365374201397249
2020-06-20 15:35:50,tangoinnight_,"omg im here sibdiebdjd",https://twitter.com/tangoinnight_/status/1274365349732003840
2020-06-20 15:35:45,__oursisterhood,"We are really excited to link up with the women of our world for our 4th Annual Day of Prayer We would love to hear from all of our sisters who linked up mentally, spiritually to experience an high vibration of… https://www.instagram.com/p/CBoP1TfgJ0i/?igshid=fg6w4p6gkjki …",https://twitter.com/__oursisterhood/status/1274365330274553857
2020-06-20 15:35:45,violetemaple,"no al, this is to sweet :( i'm crying wuff uu anyway",https://twitter.com/violetemaple/status/1274365327611031554
2020-06-20 15:35:41,Goonerlover69,"Giddy up @Arsenal",https://twitter.com/Goonerlover69/status/1274365310926274560
2020-06-20 15:35:33,DeclutrdLS,"nice photos..",https://twitter.com/DeclutrdLS/status/1274365277560422402
2020-06-20 15:35:30,Trabaeee,"Y’all got me dying stop calling that girl a boy",https://twitter.com/Trabaeee/status/1274365266495971328
2020-06-20 15:35:22,MountVilleTown,"To : @songkang_bee Fr : @roses_arre_rosi my ice cream is coming faster than your candy ㅡ #MICpic.twitter.com/amneVtCdWP",https://twitter.com/MountVilleTown/status/1274365232719093760
2020-06-20 15:35:11,justShAY_it,"Girl yessss .. bouta put my wig in a rubber band rq https://twitter.com/babydollxdes/status/1274364886949249024 …",https://twitter.com/justShAY_it/status/1274365186326114305
2020-06-20 15:35:11,ultramilkaja,"Trueee",https://twitter.com/ultramilkaja/status/1274365185562513410
2020-06-20 15:35:09,Wannable_twts,"-wb jihoon pake masker ke pasarpic.twitter.com/3HQqYwqQbx",https://twitter.com/Wannable_twts/status/1274365178520301568
2020-06-20 15:35:04,OmTheReality,"Othiri othiri prarthanagal venam. I m still not out of the woods.",https://twitter.com/OmTheReality/status/1274365156747644929
2020-06-20 15:35:03,Amu907,"Best Actress in ITV.. #SevenYearsOfShivangiJoshipic.twitter.com/7GMx7DXRpP",https://twitter.com/Amu907/status/1274365153731960833
2020-06-20 15:35:02,Lala11_7,"Daffy Duck will ETERNALLY be... ""MY NIGGA"" https://twitter.com/Decervelage/status/1274364742220558336 …",https://twitter.com/Lala11_7/status/1274365146887081984
2020-06-20 15:34:51,Dedededaine,"I'm sorry pero gamitin ko yung picture when I'm wearing my Doom Dada dress #PHIXOS24HRSRPPCHALLENGEpic.twitter.com/LsEwQlb3Ce",https://twitter.com/Dedededaine/status/1274365102414680065
2020-06-20 15:34:50,scorchtrlcls,"First impression : anak kicil adik aa tom Your nickname in my head : MAGUNDUL Closeness rating [1-10] : 8!! Do i like you : yes! You are my : magundul ku Ever had a crush on you : noo Should you post this too : yes",https://twitter.com/scorchtrlcls/status/1274365099289874432
2020-06-20 15:34:48,kmbrlyclmp_,"Ofc we are! Imy both a lot seeyouu soon",https://twitter.com/kmbrlyclmp_/status/1274365087357136896
2020-06-20 15:34:46,Jemimah111,"New Lens, New Camhttps://twitter.com/rondcz/status/1274298006590730245 …",https://twitter.com/Jemimah111/status/1274365079949963265
2020-06-20 15:34:45,Ozzgal1,"What amazes if BLM why didnt she do something when she was considered a member of the Royal family all she did is bitch, complain & talk about herself..",https://twitter.com/Ozzgal1/status/1274365076972146691
2020-06-20 15:34:38,maiya_fudge,"So ignorant.. I’ve been having to do that to a lot of people recently",https://twitter.com/maiya_fudge/status/1274365046190194695
2020-06-20 15:34:30,AmakaPLEdochie,"Witchcraft is wen you knw dat u won't marry her & still continue datin her for 8 years. My brother even if u make it to heaven u 'll not see God. #copied",https://twitter.com/AmakaPLEdochie/status/1274365014623817728
2020-06-20 15:34:11,TalkZquad,"Ppl are bad am going bye U r good ik but still-",https://twitter.com/TalkZquad/status/1274364933614911488
