date,username,to,replies,retweets,favorites,text,geo,mentions,hashtags,id,permalink
2020-06-24 02:08:11,apryor48,"Turn on Marie Kondo and",https://twitter.com/apryor48/status/1275611650746470400
2020-06-24 02:08:11,klberney,"Socially distanced sports - NYC style. #NewYorkerinNewYork #NYC #kayaking #HudsonRiver #KayakBasketballpic.twitter.com/PlWBQ4rwBQ",https://twitter.com/klberney/status/1275611647973998592
2020-06-24 02:08:11,road2lvl100,"Someone please just take Divapic.twitter.com/l1h3tUNKZG",https://twitter.com/road2lvl100/status/1275611647764201472
2020-06-24 02:08:10,HyperHypeH1,"you are my future presidenthttps://twitter.com/aoc/status/1275602308328501248 …",https://twitter.com/HyperHypeH1/status/1275611644698046464
2020-06-24 02:08:10,VashtiRathbone,"Breaking News Take advantage of your offer with Vogacloset WebSite only when you use my special vogacloset coupon Use code BFD Other Code : VCS18 BFD K5S JFS 3BA كود فوغا كلوسيت الجديد 2020 H&M : STS Sty pic.twitter.com/1K7QZwpOcD",https://twitter.com/VashtiRathbone/status/1275611644299816972
2020-06-24 02:08:10,piyak120494,"It's amazing and make me cry",https://twitter.com/piyak120494/status/1275611643766964224
2020-06-24 02:08:09,dadSTL,"Another awesome weekend camping! I think we got the hang of it! Even the kids are enjoying it! It was a chilly morning Saturday and our little doodles had to bundle up while I made breakfast on the campfire! … https://www.instagram.com/p/CBzO38tDZKB/?igshid=1nlztdst4ozz8 …",https://twitter.com/dadSTL/status/1275611638830444544
2020-06-24 02:08:09,itzbangtaan,"ITZY MIDZY FIGHTING! @ITZYofficial",https://twitter.com/itzbangtaan/status/1275611638541045760
2020-06-24 02:08:08,TenCentPistol9,"Need to do the same, my phone's available power dynamics are down to 21%",https://twitter.com/TenCentPistol9/status/1275611638222057473
2020-06-24 02:08:08,partofthe94line,"Spicy @KpopMom5 @chimmychanga97",https://twitter.com/partofthe94line/status/1275611636829753348
2020-06-24 02:08:08,_CryptoCurator,"Oh I know - I was there when we used to call him the #Bitcoin oracle ;)",https://twitter.com/_CryptoCurator/status/1275611635726585856
2020-06-24 02:08:07,steelcityhawk,"I fried some chicken and it was heat",https://twitter.com/steelcityhawk/status/1275611634048827394
2020-06-24 02:08:07,PremiumsPrem,"SOLO NETFLIX FOR SALE 1 MONTH SUBSCRIPTION SOLO - P150 NO WARRANTY LESS HOLD UNLI DOWNLOADS ULTRA HD 4-5 DEVICES MOP: GCASH/LOAD+ Tags: Netflix ph, Netflix for sale, cheap netflix, no warranty, Spotify ph, spotify for sale pic.twitter.com/TFdB6BDUha",https://twitter.com/PremiumsPrem/status/1275611633054711809
2020-06-24 02:08:07,rhett_savage,"$10.00 shipped BMWT or $7.50 PWE (at your own risk) @HobbyConnector @Hobby_Connectpic.twitter.com/JoWl8GESvg",https://twitter.com/rhett_savage/status/1275611631578308609
2020-06-24 02:08:07,otanigoat,"Oh shit damn",https://twitter.com/otanigoat/status/1275611630810755073
2020-06-24 02:08:06,LymanAWhitney,"May America Finally Bury The Confederate Flag!pic.twitter.com/zcWTS8stsQ",https://twitter.com/LymanAWhitney/status/1275611629137297409
2020-06-24 02:08:06,hollz_11,"Help baby:( #معصيتي_راحتيpic.twitter.com/H0yWJ59UVz",https://twitter.com/hollz_11/status/1275611627501559809
2020-06-24 02:08:06,Heartvoicesong1,"This is the tweet!!!! Whew.... https://twitter.com/jacknfortweeets/status/1275473971081699328 …",https://twitter.com/Heartvoicesong1/status/1275611626088157184
2020-06-24 02:08:05,Leo_dicaprio_A,"World wide trending For Countdown Trend Marana Mass !! #70DaysForEnigmaPSPKBDay #VakeelSaab || @PawanKalyan",https://twitter.com/Leo_dicaprio_A/status/1275611625622343680
2020-06-24 02:08:05,TREM_MAS_CARO57,"Noss",https://twitter.com/TREM_MAS_CARO57/status/1275611623533826049
2020-06-24 02:08:05,stock_tidbits,"$ATOS is working on two COVID-19 Programs and is pending FDA APPROVAL to begin Clinical Trials pic.twitter.com/nV5v9bWQdL",https://twitter.com/stock_tidbits/status/1275611623437168640
2020-06-24 02:08:04,Dave_2saucy,"Who u telling!!",https://twitter.com/Dave_2saucy/status/1275611620832694274
2020-06-24 02:08:04,Urstrulynithin9,"9M Maheshains on @Facebook Within Anna birthday make it 10M followers. 10M Maheshains on @Twitter nxt week Craze matters @urstrulyMahesh #SarkaruVaariPaatapic.twitter.com/CFHKO42PEp",https://twitter.com/Urstrulynithin9/status/1275611618768912386
2020-06-24 02:08:03,nenemadness1,"Cause you my fiancé duhhh",https://twitter.com/nenemadness1/status/1275611617384894466
2020-06-24 02:08:03,Kcp992sjcyjsyj1,"SURPRISE MASS VOTING Our surprise mass voting attack for Male Popularity Award on Cheodeol has started!! PROTECT AND INCREASE OUR SPOT!!! Fighting ARMY!! @BTS_twt #SOBAATTACK (http://welcome.myloveidol.com ) *Save SOME hearts & don't use all*pic.twitter.com/CwCPCRrsIO",https://twitter.com/Kcp992sjcyjsyj1/status/1275611616743059456
2020-06-24 02:08:03,TheMysticWood,"Breakfast of champions at 7pm, ibuprofen and a glass of kefir.",https://twitter.com/TheMysticWood/status/1275611615442792449
2020-06-24 02:08:03,PennyStocksMomo,"BBs StockHaven ― i_like_bb_stock: Ok http://dlvr.it/RZDzl2 via ⟶ http://cbet.wtf √",https://twitter.com/PennyStocksMomo/status/1275611613777674241
2020-06-24 02:08:02,PennyStocksMomo,"BBs StockHaven ― hinchback: $ORRCF Oroco Resource huge potential take a look https://youtu.be/b1-Zjol-62Y http://dlvr.it/RZDzks via ⟶ http://cbet.wtf √",https://twitter.com/PennyStocksMomo/status/1275611612771020800
2020-06-24 02:08:02,AlertTrade,"DDAmanda® Zardiw: Thanks!!! She's a real Peach......lol.... http://dlvr.it/RZDzkc ⟶ http://buff.ly/2LWgYNU √ Promo code: alt888",https://twitter.com/AlertTrade/status/1275611612062216193
2020-06-24 02:08:02,jermarbates40,"So These Cops Will Not Stop",https://twitter.com/jermarbates40/status/1275611611575836673
2020-06-24 02:08:02,cody6912b,"@VerisTheVee you gay",https://twitter.com/cody6912b/status/1275611610812420101
2020-06-24 02:08:01,Jack___Maxwel,"Me earlier #longboarding stay active people. pic.twitter.com/jWtClu809u",https://twitter.com/Jack___Maxwel/status/1275611608962736135
2020-06-24 02:08:01,VivianeCndida2,"Gizelly GABIMARTINS BY NIGHT",https://twitter.com/VivianeCndida2/status/1275611608384000001
2020-06-24 02:08:01,MikeyFresh1,"Tyshawn in the new THPS game #TheBXpic.twitter.com/5Yad5GQtzR",https://twitter.com/MikeyFresh1/status/1275611607150858240
2020-06-24 02:08:01,HolyJeepers2020,"The saying ""A problem shared is a problem halved"", can sometimes be quite the opposite. - ""A problem shared can be a problem multiplies, several times over""... Wisdom and discretion keeps the heart safe brother.",https://twitter.com/HolyJeepers2020/status/1275611606895013888
2020-06-24 02:08:01,SissybitchN,"Best thing to do then is to just tighten your grip on TW and weed them out... then burn them all",https://twitter.com/SissybitchN/status/1275611606546894852
2020-06-24 02:08:01,kingjackys,"truly “one of the hardest working artists in the game” @JacksonWang852 #TEAMWANG",https://twitter.com/kingjackys/status/1275611605187715074
2020-06-24 02:08:00,nondage,"I WILL its still wippy but I will try get it done tonight since its just smth small I will @u when I post it ...... Im Obsessed with them wttf",https://twitter.com/nondage/status/1275611604609105923
2020-06-24 02:08:00,El_Gemy22,"Why all this intransigence? Are you gonna to give us a job after graduation? Or will you leave us and say every human being is free in what he does! Retweeeeeet #Egypt_kills_graduates",https://twitter.com/El_Gemy22/status/1275611604353236992
2020-06-24 02:08:00,Fiorella_im,"No one is denying this. But to say Karen is a racist term in America is incorrect.",https://twitter.com/Fiorella_im/status/1275611603921014785
2020-06-24 02:08:00,hannah_m_long,"I was 16, working as a cashier. I had a stalker. I told my boss. She said I could go on break when he was in the store so I didn’t have to serve him, but my breaks were still only 15 min, and the stalker would wait for me. It went on for weeks. I was terrified every day. I quit.https://twitter.com/poetmaybe3/status/1275077537257779207 …",https://twitter.com/hannah_m_long/status/1275611603224997889
2020-06-24 02:07:59,joBeeGeorgeous,"So we've decided to suck up to China, and view Pakistan as our mortal enemy. Smart. Money wise.https://twitter.com/DeccanHerald/status/1275607991685795840 …",https://twitter.com/joBeeGeorgeous/status/1275611599399645184
2020-06-24 02:07:58,lukeran9,"Exactly besides why isn’t there allowed to be two FOTG and main dancer? they dumb also the stupid yxh writing articles abt the fights when they know they started it in the first place",https://twitter.com/lukeran9/status/1275611595637493761
2020-06-24 02:07:58,Mo_B_Dick,"It’s Ice Cream or whatever goofy Android names. You had this update 4 years ago…welcome to Apple",https://twitter.com/Mo_B_Dick/status/1275611594165190662
2020-06-24 02:07:58,FanciAdaj,"Motivation wise yea but once u remember the routine it’s a waste cause u can motivate yourself tohttps://twitter.com/imbadaxx/status/1275586943678545920 …",https://twitter.com/FanciAdaj/status/1275611593527746561
2020-06-24 02:07:58,RTWT48uno,"Up!!! Like and rt to vote @mnl48official #MNL48https://twitter.com/rtwt48kks8/status/1275017818447073280 …",https://twitter.com/RTWT48uno/status/1275611593485824005
2020-06-24 02:07:57,_Melanin_Queenn,"My hotel room booked for my birthday",https://twitter.com/_Melanin_Queenn/status/1275611591950708741
2020-06-24 02:07:57,LiliSparx,"I'm glad it reached you never doubt that you are important and valuable.",https://twitter.com/LiliSparx/status/1275611591602552832
2020-06-24 02:07:57,tredlacy,"Being black means we all had to overcome obstacles. I’m not fighting white people and black people. Y’all kiss my ass.",https://twitter.com/tredlacy/status/1275611588670763009
2020-06-24 02:07:56,Tkaik13,"For me it's probably DNA (second half). His part on ""Kites"" by N.E.R.D. is also",https://twitter.com/Tkaik13/status/1275611587517317121
2020-06-24 02:07:56,b1gMACdaddy,"We live! Come through and show some love. DUB CITY @FireSticksGT @NupeSkywalker @SkitZy95https://m.twitch.tv/bigmacdaddy78/profile …",https://twitter.com/b1gMACdaddy/status/1275611587466969089
2020-06-24 02:07:56,j_nerdy_,"there are too many to count, but of course i gotta mention my ride or die @NovaturientOne. i have spent every birthday for the past three years with her in three different states i say this literally: i truly dont know where i'd be without her. twitter friendships https://twitter.com/marisakanter/status/1275516339713703938 …",https://twitter.com/j_nerdy_/status/1275611587378806786
2020-06-24 02:07:56,LawCannon,"Y’all asked for it: PHILLY CHEESESTEAK tutorial https://youtu.be/gqf9MWcOwkU #Support #BlackChefs RT RT RTpic.twitter.com/ByH9KVJ0XS",https://twitter.com/LawCannon/status/1275611586984632326
2020-06-24 02:07:56,best_todoroki,"""cus I wanted to!""",https://twitter.com/best_todoroki/status/1275611586502197250
2020-06-24 02:07:56,ItzFireFurious,"Twitter been lonely since I split from Flora",https://twitter.com/ItzFireFurious/status/1275611585462050817
2020-06-24 02:07:56,piupoty,"BTS PAVED THE WAY Every agency in South Korean agree abt this @BTS_twtpic.twitter.com/gh6CZsGJgQ",https://twitter.com/piupoty/status/1275611584186839040
2020-06-24 02:07:55,outrosvn,"don't break the chain ♡ lockscreen home screen last song u listened to? 35th photo in ur gallery 7 moots @jiminluvxx @mystaelliferous @sugacology @sexcpied @kaixmyg @kimvktae_ @taetaemouh https://twitter.com/PurpleAnu1/status/1275609909967519746 …pic.twitter.com/7r5TcXmczv",https://twitter.com/outrosvn/status/1275611582030995457
2020-06-24 02:07:55,Ahmmed20892163,"Back on the green grass, return to life pic.twitter.com/A918js8Qhs",https://twitter.com/Ahmmed20892163/status/1275611581443985409
2020-06-24 02:07:55,willowisp_fire,"The line between ""cut them out of your life because wrong think"" and ""report for wrong think"" is razor thin.",https://twitter.com/willowisp_fire/status/1275611581146173440
2020-06-24 02:07:55,nyc_jay24,"Whappy*",https://twitter.com/nyc_jay24/status/1275611580160528384
2020-06-24 02:07:55,SoundOfWings333,"oh. good. my sun/venus and moon and mars are here and my stellium so that's... *stares* *blinks* *sighs* ...very accurate.https://twitter.com/DCnumerology/status/1275595539002908672 …",https://twitter.com/SoundOfWings333/status/1275611579984121857
2020-06-24 02:07:54,Awakein20,"Gave me the chills Push.",https://twitter.com/Awakein20/status/1275611578973540352
2020-06-24 02:07:54,Moscatosleezy,"Lady Gaga",https://twitter.com/Moscatosleezy/status/1275611578658967552
2020-06-24 02:07:54,TheJoanneV,"@jillyiianne @lark_ramirez insensitive post ba? Sorrry!",https://twitter.com/TheJoanneV/status/1275611576767135749
2020-06-24 02:07:53,GooFyGotClout,"Glooks fam",https://twitter.com/GooFyGotClout/status/1275611575236407298
2020-06-24 02:07:53,kaicheerful,"Let's go pic.twitter.com/1DP2IDlHYb",https://twitter.com/kaicheerful/status/1275611572262408192
2020-06-24 02:07:52,TweetNameN,"What the hell happened in the 20s besides the Woman's Suffrage movement leading to the women getting the right to vote, Prohibition, & Flappers anyway? Oh the Industrial revolution ...so child labor yay",https://twitter.com/TweetNameN/status/1275611571054620672
2020-06-24 02:07:52,Sharveenaexooo,"EXO-Ls who use Choeaedol app, lets be friends. I will send hearts",https://twitter.com/Sharveenaexooo/status/1275611570945404928
2020-06-24 02:07:52,RTWT48uno,"Up!!! Like and rt to vote @mnl48official #MNL48https://twitter.com/rtwt48forty5/status/1274983052330930177 …",https://twitter.com/RTWT48uno/status/1275611568085045250
2020-06-24 02:07:51,smartystrides,"It saddens me to anticipate this call falling on Tin Ears. Just going by the 'form'... #BetterCulturalVandals #auspol https://www.smh.com.au/national/indigenous-australians-want-equal-partnership-in-closing-the-gap-20200623-p5558q.html … via @smh",https://twitter.com/smartystrides/status/1275611564108701696
2020-06-24 02:07:51,staytrue_MT,"finna be dropping some heat soon",https://twitter.com/staytrue_MT/status/1275611564104732675
2020-06-24 02:07:51,Diogo74065101,"Brabo",https://twitter.com/Diogo74065101/status/1275611563462983680
2020-06-24 02:07:50,lovESlidn,"lmao spot on. https://twitter.com/xanypantie/status/1275216319844139009 …",https://twitter.com/lovESlidn/status/1275611561894146049
2020-06-24 02:07:50,House_Goddess,"What a way to start the day pic.twitter.com/kT7uPx7FXM",https://twitter.com/House_Goddess/status/1275611561869148161
2020-06-24 02:07:50,AllisonHerrera_,"Fire playlist only",https://twitter.com/AllisonHerrera_/status/1275611559226757120
2020-06-24 02:07:49,snoso1k,"I love the position that I’m in",https://twitter.com/snoso1k/status/1275611556752044032
2020-06-24 02:07:49,GooFyGotClout,"Thank you so much brodie !! Means a lot",https://twitter.com/GooFyGotClout/status/1275611556664016896
2020-06-24 02:07:49,IbraaD,"August Rush",https://twitter.com/IbraaD/status/1275611556273848320
2020-06-24 02:07:48,stef2dotoh,"Whaaat you missed my broadcast yesterday?! I passed! 100% certified.",https://twitter.com/stef2dotoh/status/1275611554621333504
2020-06-24 02:07:48,__yaheard,"My new dude though .... y’all bitches could neverrrrrrrrrr",https://twitter.com/__yaheard/status/1275611553757364224
2020-06-24 02:07:48,a7_ops,"Sasha and Storm have now met and they look good side by side...almost as fly as me and my Queen nakenyap look together...Lol #hisandhers https://www.instagram.com/p/CBzO1bZA-9z/?igshid=qv3roynj49at …",https://twitter.com/a7_ops/status/1275611552788463616
2020-06-24 02:07:48,glowingcanary,"The suspense.pic.twitter.com/Rmvef6BStM",https://twitter.com/glowingcanary/status/1275611552213688320
2020-06-24 02:07:48,OllyRTeregulova,"This is definitely what I look like when I write. I write like I'm ECSTATICALLY on FIRE. pic.twitter.com/Km260erGOk",https://twitter.com/OllyRTeregulova/status/1275611551152648193
2020-06-24 02:07:48,Caparaistan,"LIT As fiery as ever!!! @layzhang #Lit_LayZhang #IamLIT https://youtu.be/j4qVhOaRBSY pic.twitter.com/f5TFbFIbsb",https://twitter.com/Caparaistan/status/1275611550724657153
2020-06-24 02:07:47,trizzyreborn,"ur looking",https://twitter.com/trizzyreborn/status/1275611546446557184
2020-06-24 02:07:46,UhHuhItsMIKE,"$StayLikeMIKE",https://twitter.com/UhHuhItsMIKE/status/1275611545968553985
2020-06-24 02:07:46,CheapPremiums2,"PROMO: GET 3 MONTHS SPOTIFY FOR ONLY P50 TODAY! SPOTIFY PREMIUM 3 Months - P60 | Renew - P70 8 Months - P150 | Renew - P170 12 Months - P250 | Renew - P270 FULL WARRANTY MOP: GCASH/LOAD : spotify for sale, spotify ph, spotify cheap price, pic.twitter.com/Xx5CfrV8Cu",https://twitter.com/CheapPremiums2/status/1275611544110247936
2020-06-24 02:07:45,badenser2,"Understood. Loud and clear",https://twitter.com/badenser2/status/1275611541933420544
2020-06-24 02:07:45,Lovejones223,"@MissyMSmith Dat Display pic tho",https://twitter.com/Lovejones223/status/1275611541216399362
2020-06-24 02:07:45,FireyAerys,"Did she tell you to refer to her as your aunt, Egg?",https://twitter.com/FireyAerys/status/1275611540499116032
2020-06-24 02:07:45,BeastModeSoc,"following you",https://twitter.com/BeastModeSoc/status/1275611538682867712
2020-06-24 02:07:45,RonMaaba,"Long time no seeee welcome back https://twitter.com/kawaimikay/status/1275599049966538752 …",https://twitter.com/RonMaaba/status/1275611538116587520
2020-06-24 02:07:44,renebeanbean,"What haha",https://twitter.com/renebeanbean/status/1275611536451502081
2020-06-24 02:07:44,Raghava_45,"Happy Birthday to The Greatest Footballer Of All Time #HappyBirthdayMessipic.twitter.com/1RrXKl8rjB",https://twitter.com/Raghava_45/status/1275611534249451520
2020-06-24 02:07:44,WhereisAsriel,"7.5/10 the tattoo emboss looks kinda weird but everything else is cool",https://twitter.com/WhereisAsriel/status/1275611534182486023
2020-06-24 02:07:43,MelW__,"*best",https://twitter.com/MelW__/status/1275611533293338624
2020-06-24 02:07:43,joaovt_7,"tesouratcha",https://twitter.com/joaovt_7/status/1275611533268127745
2020-06-24 02:07:43,JSU40_Reynolds,"This Lito !",https://twitter.com/JSU40_Reynolds/status/1275611532907491330
2020-06-24 02:07:43,nyc_jay24,"Lmao Wappy",https://twitter.com/nyc_jay24/status/1275611532756422658
2020-06-24 02:07:43,G__Henny,"Please, we need it for the second half of summer",https://twitter.com/G__Henny/status/1275611532311908359
2020-06-24 02:07:43,KenJiMiAmore,"SB19 Top7 On BBS50.. @SB19Official #SB19BBSocialTop7",https://twitter.com/KenJiMiAmore/status/1275611531699355648
2020-06-24 02:07:43,Winikin,"Happy to oblige. pic.twitter.com/2EBadXYi4j",https://twitter.com/Winikin/status/1275611531472855041
2020-06-24 02:07:42,smitherman25,"goated https://twitter.com/toosii2x/status/1275597639359148033 …",https://twitter.com/smitherman25/status/1275611529203908608
2020-06-24 02:07:42,mikey_k21,"That 70s Show is highly underrated",https://twitter.com/mikey_k21/status/1275611528427982854
2020-06-24 02:07:41,sadtalksnojutsu,"Finally! Been waiting for too long and I’m really looking forward to it especially after reading the novels https://twitter.com/crunchyroll/status/1275579641202442242 …",https://twitter.com/sadtalksnojutsu/status/1275611524040732672
2020-06-24 02:07:41,memohrm7,"Well now i know to say everyone but you",https://twitter.com/memohrm7/status/1275611523545739265
2020-06-24 02:07:41,Nursebubblegutz,"smokingpic.twitter.com/ZojJnMJD8C",https://twitter.com/Nursebubblegutz/status/1275611523046612992
2020-06-24 02:07:41,TiffRichElliott,"English",https://twitter.com/TiffRichElliott/status/1275611522182426624
2020-06-24 02:07:40,SSGSS_Brandon,"Godly, but not as godly as Giorno's Theme",https://twitter.com/SSGSS_Brandon/status/1275611521079525376
2020-06-24 02:07:40,liddytronic,"val somebody told me all the milkshakes start as vanilla then they just add powders to make the other flavors in the cup is it true??",https://twitter.com/liddytronic/status/1275611519573798917
2020-06-24 02:07:40,falsaafi,"You desi",https://twitter.com/falsaafi/status/1275611518285910016
2020-06-24 02:07:39,DemetriusDuart2,"to bad your a water type~ eh but that wouldnt stop me from pleasuring a milfy oshawott",https://twitter.com/DemetriusDuart2/status/1275611514867761152
2020-06-24 02:07:39,prakarock,"Wow, semaa.. Great work.. @KeerthyOfficial #Master @actorvijaypic.twitter.com/bE97FXmsaD",https://twitter.com/prakarock/status/1275611513588379648
2020-06-24 02:07:38,KbeKnot,"Know you always got yo self an das what’s more important",https://twitter.com/KbeKnot/status/1275611511747117056
2020-06-24 02:07:37,JayTechTVHD,"DM me",https://twitter.com/JayTechTVHD/status/1275611507628421130
2020-06-24 02:07:37,tobbyib8,"Juice wrld Roberry",https://twitter.com/tobbyib8/status/1275611507477434369
2020-06-24 02:07:37,HelanMBack,"If the Sovereign Lord who lives forever and created us all - can he not say that of each one of us? If Jesus came as the servant of the Lord then he would have followed the scripts of the OT which would mean that he was to preach the Word of the Lord NOT to take claim to be him",https://twitter.com/HelanMBack/status/1275611505610952704
2020-06-24 02:07:37,ninibear096,"This edit is so fucking hot Or its just Jennie Kim @ygofficialblinkhttps://twitter.com/AlRJENS/status/1275441752267042816 …",https://twitter.com/ninibear096/status/1275611504948023299
2020-06-24 02:07:36,Muntaha_says,"Mar jao bohat scope he",https://twitter.com/Muntaha_says/status/1275611504147120128
2020-06-24 02:07:36,_DrzzyDre,"Always working “PUFF AND PAINT” coming in Aug pic.twitter.com/9CWbjjqfFl",https://twitter.com/_DrzzyDre/status/1275611501441753091
2020-06-24 02:07:36,SongZequi,"IT WARMS ME MORE THAN THR SUN IN SUMMER, GOD!!!!!! #SHOWNU #MONSTAXpic.twitter.com/2BSiDcpC2I",https://twitter.com/SongZequi/status/1275611500691050497
2020-06-24 02:07:36,Mr_Inspire1,"@gumroad Please verify my account so I can get my payout...",https://twitter.com/Mr_Inspire1/status/1275611500208586753
2020-06-24 02:07:35,0ceanOfDreams,"Of course if it were to get out that they are trans, well that privilege would probably disappear or lessen. That's always my worry. I'm not a super masc person at all, but I do pass well. However I'm always worried that my ""secret"" will get out in a place where it shouldn't",https://twitter.com/0ceanOfDreams/status/1275611500019961857
2020-06-24 02:07:35,DaniKatta1,"Yessir I’m only 16 and my rapping bars are shits gonna be scary oh yeah hella flows, the hip hop scene ain’t ready,Slatt",https://twitter.com/DaniKatta1/status/1275611499860578306
2020-06-24 02:07:35,tyIer4711,"apple tree game crazy rn pic.twitter.com/YblBzJAmED",https://twitter.com/tyIer4711/status/1275611499734528000
2020-06-24 02:07:35,slotface666,"Calculate how dirty I am #transgirl #hotpicks #nudes #xxx #hot #sassy #dirty #dirtypics pic.twitter.com/OgSYHZ5YBA",https://twitter.com/slotface666/status/1275611499374010368
2020-06-24 02:07:35,TheHybridEnigma,"It was their time to shine!",https://twitter.com/TheHybridEnigma/status/1275611498585473025
2020-06-24 02:07:35,0ceanOfDreams,"Agreed. I do think that *some* trans men have certain level of partial male privilege, not as much as cis men, but some. Specifically the ones who pass very well as stereotypical masc men. ++https://twitter.com/seacastl/status/1275105720749273099 …",https://twitter.com/0ceanOfDreams/status/1275611498426048514
2020-06-24 02:07:35,HomeWorkZMusic,"Hot hot hot new collab coming soon from @rnbjayr & @clfvcknr. @Quezon City, Philippines https://www.instagram.com/p/CBzOzxFp15y/?igshid=j5ohewsipkkm …",https://twitter.com/HomeWorkZMusic/status/1275611498254131201
2020-06-24 02:07:35,MelW__,"Somebody said get it Karen lmaooooo I’m screaming bear",https://twitter.com/MelW__/status/1275611496920293376
2020-06-24 02:07:34,justinibikinii,"Same",https://twitter.com/justinibikinii/status/1275611495296954368
2020-06-24 02:07:34,TheMuscleTussle,"#twitter runners-hive, I need recommendations for an @Apple Watch running app. Currently using the @Nike Run Club app which crushes after every run >10k, which means I lose all the data. While I have your attention , recommendations for a running watch are welcome. @dlisforrest",https://twitter.com/TheMuscleTussle/status/1275611495204872192
2020-06-24 02:07:34,tazegoat,"only run from fed, touch my watch why u wann get dead pic.twitter.com/YMQuLc9V3Q",https://twitter.com/tazegoat/status/1275611494366031878
2020-06-24 02:07:34,JoaoS_Neto,"@1grimcs u are a monster bud, congrats !!!!",https://twitter.com/JoaoS_Neto/status/1275611492428189697
2020-06-24 02:07:33,beans_n_bops,"The Desert Of The 'Field",https://twitter.com/beans_n_bops/status/1275611490255548416
2020-06-24 02:07:33,ther3alpapo,"Dem ass is fire",https://twitter.com/ther3alpapo/status/1275611489286664193
2020-06-24 02:07:33,kogut_max,"These ain’t no accidents remember Eric garner, and you are not a good cop if you can’t check your partner @MONTANAof300",https://twitter.com/kogut_max/status/1275611489081098240
2020-06-24 02:07:32,BajiKeisuke,"fire nation army",https://twitter.com/BajiKeisuke/status/1275611486841237504
2020-06-24 02:07:32,AltKali,"Just because it's easy for you to watch doesn't mean it's easy to make buddy. Plus, making porn isn't something she should be demonised for so YES SHE SHOULD WALK AWAY CLEAN!!! It's just a fuckin job get with the program. Sincerely, A very proud sex worker",https://twitter.com/AltKali/status/1275611484219940867
2020-06-24 02:07:31,Nashley71934715,"OMG THIS IS... OMG",https://twitter.com/Nashley71934715/status/1275611483200724992
2020-06-24 02:07:31,vminkook_13,"KINGS @BTS_twt https://www.vogue.co.jp/magazine/2020-8 pic.twitter.com/Nh1fy0bKvl",https://twitter.com/vminkook_13/status/1275611483066347521
