date,username,to,replies,retweets,favorites,text,geo,mentions,hashtags,id,permalink
2020-06-24 02:12:25,exo_doramas,"When I read some tweet of my Asian Idols in English my expression maybe is like: And then like jsjsjjjsjsghs What ever... This photoshoot was amazing as everything bby Mew does #MewSuppasit #CosmoXMewSuppasithttps://twitter.com/MSuppasit/status/1275595238015332352 …",https://twitter.com/exo_doramas/status/1275612714690383873
2020-06-24 02:12:25,hyper10sive,"I know i havent had 2 uploads a week the past couple of weeks but once everything is set with the new pc the schedule will be back to normal",https://twitter.com/hyper10sive/status/1275612714686021633
2020-06-24 02:12:25,ravenskyedreams,"I want them all to be charged. I want justice for her. I want some peace that we didn’t stop for her, she mattered before, now and after, I wish that for her. We gotchu boo",https://twitter.com/ravenskyedreams/status/1275612714132484096
2020-06-24 02:12:25,quyennie,"대박! Best skz comeback ever!!!",https://twitter.com/quyennie/status/1275612714023428096
2020-06-24 02:12:24,orangeintheWH,"Not much. Just Aisha and her typing virtue-signaling.",https://twitter.com/orangeintheWH/status/1275612711293005824
2020-06-24 02:12:24,JenBTSVTJ,"Wooooooah. Beautiful JK looks so young with his hair like that",https://twitter.com/JenBTSVTJ/status/1275612710001086464
2020-06-24 02:12:22,yash_kurzekar,"Hardly",https://twitter.com/yash_kurzekar/status/1275612703185240065
2020-06-24 02:12:22,Suriya_FC1,"•29 Days To Go #Suriyabirthdaycountdown #SingamSuriya #SooraraiPottru | @Suriya_offlpic.twitter.com/iHGD0DTrz1",https://twitter.com/Suriya_FC1/status/1275612702010937344
2020-06-24 02:12:21,tenon81,"She is so hot girl @KayCarterxxx I see she is doing alot scenes with @DogfartProd I wish the next one is 4 BBC in DP action! , or do it with @AMERICAN_ANAL they are good,",https://twitter.com/tenon81/status/1275612698835902466
2020-06-24 02:12:21,halalxan,"this bitch tweeting anything",https://twitter.com/halalxan/status/1275612697468567552
2020-06-24 02:12:21,shelfedkath,"FEELIN GOOD AS HELL",https://twitter.com/shelfedkath/status/1275612697451732992
2020-06-24 02:12:21,Andrescht131,"London drugs photolab website. Youll have to upload your own photo so make sure you download a high resolution one",https://twitter.com/Andrescht131/status/1275612697321549825
2020-06-24 02:12:21,m6gioppa,"After finishing the last of us, I can see why people dislike it so much BUT I still loved the game and I’m at peace with the ending. Imma just say that Factions on this game would be",https://twitter.com/m6gioppa/status/1275612696558305283
2020-06-24 02:12:20,coldbam,"hello!!",https://twitter.com/coldbam/status/1275612695434272770
2020-06-24 02:12:20,bankrupt_hippo,"#uswnt hot take of the day #alexmorgan will be the all time leading goalscorer #nwsl #fyp #foryoupage * #uswnt #nwsl #womenssoccer #fyp #notforyou #alexmorgan #uswnt #alexmorganfan #tobinheath17… https://www.instagram.com/p/CBzPUGNDhAC/?igshid=1vvrsy1iaghg0 …",https://twitter.com/bankrupt_hippo/status/1275612694054305792
2020-06-24 02:12:20,notminyoongles,"Models are quaking pic.twitter.com/opw849GmvJ",https://twitter.com/notminyoongles/status/1275612693060149248
2020-06-24 02:12:20,bboyst4nc3,"Thats my guy thats my guy! SKURTT pic.twitter.com/GAqF4vAJwq",https://twitter.com/bboyst4nc3/status/1275612692473143296
2020-06-24 02:12:19,SoundOfWings333,"Yes, and they're unfortunately pretty convincing because people are gullible as fuck.https://twitter.com/MindTendencies2/status/1275603753538777088 …",https://twitter.com/SoundOfWings333/status/1275612689365008384
2020-06-24 02:12:19,Igonna_Adln22,"Self improvement is my biggest priority rn",https://twitter.com/Igonna_Adln22/status/1275612688953905152
2020-06-24 02:12:19,VivianeCndida2,"L GABIMARTINS BY NIGHT",https://twitter.com/VivianeCndida2/status/1275612688429834240
2020-06-24 02:12:18,joBeeGeorgeous,"""In a fit of rage, he drew a gun and shot his wife Lalita."" Where do ppl casually get guns from. (Some chap had once brandished a gun in the apartment complex I lived in earlier)https://twitter.com/DeccanHerald/status/1275611358445203457 …",https://twitter.com/joBeeGeorgeous/status/1275612685669785603
2020-06-24 02:12:18,DYORCryptoBot,"[BOT SCAN - 24/06 02h] Total scan bullish points: 3,263 pts Total scan bearish points: 2,183 pts $BTC dominance: 65.11% For more details, please visit https://dyor.net This bot is experimental. Not financal advise. Play safe and #DYOR",https://twitter.com/DYORCryptoBot/status/1275612685456093185
2020-06-24 02:12:18,beybikyung,"“A WHOLE CUTIE WITH THE BEST SIDE PROFILE“ @/KJW pic.twitter.com/EGGGnIOFJY",https://twitter.com/beybikyung/status/1275612684159815681
2020-06-24 02:12:18,Union_Keyblade,"Litterally no one said that",https://twitter.com/Union_Keyblade/status/1275612683300147202
2020-06-24 02:12:17,HanaHivee,"Building an NBA all time starting lineup that would go 82-0! Which team is better pic.twitter.com/rQN2LqI4Ll",https://twitter.com/HanaHivee/status/1275612681618292739
2020-06-24 02:12:17,MichaelLeppert,"Uh oh, “whomst” has been called.",https://twitter.com/MichaelLeppert/status/1275612679537917952
2020-06-24 02:12:17,FlzzySzn,"@rockaflockax @TheeOvoAngel Drake leak. https://soundcloud.com/yk4yk4/drake-need-me?ref=twitter …",https://twitter.com/FlzzySzn/status/1275612679202320384
2020-06-24 02:12:16,NakinhaPrior,"Priornation",https://twitter.com/NakinhaPrior/status/1275612678019600385
2020-06-24 02:12:16,thesinofgreeda,"That’s awesome bro! Congrats! Did he follow u after that reply?",https://twitter.com/thesinofgreeda/status/1275612677906337793
2020-06-24 02:12:16,Justpeacheyy,"That’s one big baby!!!",https://twitter.com/Justpeacheyy/status/1275612677704908802
2020-06-24 02:12:16,adambadmdfk,"Rate my outfit /10pic.twitter.com/6II9vaFUgz",https://twitter.com/adambadmdfk/status/1275612676333289473
2020-06-24 02:12:16,princessphire,"I hate that I had to wait to schedule my next Brazilian till I knew how much I was getting paid. And now she’s booked till August I win her peach& kitty give away",https://twitter.com/princessphire/status/1275612675389550593
2020-06-24 02:12:15,Aso0m1412,"Just wooow pic.twitter.com/WLkegtDWSN",https://twitter.com/Aso0m1412/status/1275612674295021569
2020-06-24 02:12:15,Prrety4,"Flops my ass. Nct 127, Nct dream, wayV world domination legends k-fans are always blind #nctworlddomination #NCT127 #NCTDREAM #WayV #WayZenNi #NCTZENSpic.twitter.com/wlFUxrIXoj",https://twitter.com/Prrety4/status/1275612670440415232
2020-06-24 02:12:14,HiYellowGuy,"Ramy shoe game is",https://twitter.com/HiYellowGuy/status/1275612667466653701
2020-06-24 02:12:13,ChegeRex,"YES MA’AM",https://twitter.com/ChegeRex/status/1275612664924983297
2020-06-24 02:12:13,glee_writes,"Burning",https://twitter.com/glee_writes/status/1275612664803340288
2020-06-24 02:12:13,gift__lucy,"the bass here is just https://open.spotify.com/track/1ZhhiI06eIjXZjXK6OXO8u?si=WouGv4BeRiaWwGeqqlZBrg …",https://twitter.com/gift__lucy/status/1275612664484335616
2020-06-24 02:12:12,lorelaixregina,"um okay bitch",https://twitter.com/lorelaixregina/status/1275612661628260353
2020-06-24 02:12:11,MrsFreshFeet,"Quality! YL HOODIE almost sold out! Shop NOYS! http://Www.noyscreatives.com pic.twitter.com/WBdJmKucLs",https://twitter.com/MrsFreshFeet/status/1275612657215733764
2020-06-24 02:12:11,imravindr,"331,000 TWEETS UP #70DaysForEnigmaPSPKBDay #VakeelSaab || @PawanKalyan",https://twitter.com/imravindr/status/1275612656100151303
2020-06-24 02:12:11,VivianeCndida2,"E GABIMARTINS BY NIGHT",https://twitter.com/VivianeCndida2/status/1275612654455971840
2020-06-24 02:12:10,CarlyCalifello,"Yes how dare I prefer Booker win. Or that I think it’s completely wrong to try to suppress voters by shutting the doors in their face. Or how rediculous it is that Booker had to go get a court injunction to ensure the ppl of KY can vote lol",https://twitter.com/CarlyCalifello/status/1275612653453533184
2020-06-24 02:12:10,RkKashy82885377,"#sunnyleone is your best actress. Sexy & hot dancing girl.. I'm big fan..",https://twitter.com/RkKashy82885377/status/1275612651213684737
2020-06-24 02:12:10,RPAMENT,"BLΛƆKPIИK 𝐇𝐎𝐖 𝐘𝐎𝐔 𝐋𝐈𝐊𝐄 𝐓𝐇𝐀𝐓 2020/06/26 𝗖𝗢𝗠𝗘𝗕𝗔𝗖𝗞 @RPBLACKPINK #BLACKPINKpic.twitter.com/cdOyndo3M2",https://twitter.com/RPAMENT/status/1275612650999775235
2020-06-24 02:12:09,SilviaKunaahe,"Melancia GABIMARTINS BY NIGHThttps://twitter.com/SossegaJonas/status/1275610741069041665 …",https://twitter.com/SilviaKunaahe/status/1275612648323899393
2020-06-24 02:12:09,610riginal,"“I won't diss the next brother to be paid, that's not my trade It's just the plan that is designed by the colored man” https://music.apple.com/us/album/wake-up-reprise-in-the-sunshine/1288207200?i=1288207314 …",https://twitter.com/610riginal/status/1275612647283740675
2020-06-24 02:12:09,cidinharejane,"Cidinha GABIMARTINS BY NIGHT",https://twitter.com/cidinharejane/status/1275612645304012807
2020-06-24 02:12:08,cryptoexp64212G,"$ICX All targets Hit! 15% Profit For more Free signals, Join http://t.me/phoenixICF $SOL $REQ $POLY $WRX $LINK $NEBL $STPT #cryptocurrency $BTC $ETH $CTXC $MFT $XRP $ENJ $GO $AST $NULS $AMB #bitcoin 11032pic.twitter.com/X0XNPHBZGR",https://twitter.com/cryptoexp64212G/status/1275612643567566848
2020-06-24 02:12:08,Stuntz__,"Let’s goo",https://twitter.com/Stuntz__/status/1275612642816610304
2020-06-24 02:12:08,ErinDoReMi,"where is he i just wanna talk",https://twitter.com/ErinDoReMi/status/1275612642401415168
2020-06-24 02:12:07,beans_n_bops,"why not tho",https://twitter.com/beans_n_bops/status/1275612640883224588
2020-06-24 02:12:07,cunnili91733776,"I think you meant “built like a Hottie”",https://twitter.com/cunnili91733776/status/1275612640325144576
2020-06-24 02:12:07,en_sf2d,"Because she is literally IT https://twitter.com/3richard3/status/1275497406948429825 …",https://twitter.com/en_sf2d/status/1275612637448097794
2020-06-24 02:12:07,nara_akinari,"I relate to WWX in the second pic on a personal level. Yep. That is me when meeting deadlines. HAHAHAHAHA Anyway, these are really heartwarming to see Amy. Thank you for bringing these to us. Very adorable",https://twitter.com/nara_akinari/status/1275612636927815680
2020-06-24 02:12:06,YoshiKiraSan,"hits especially different when you’re sad",https://twitter.com/YoshiKiraSan/status/1275612634486837248
2020-06-24 02:12:06,lenascorpio20,"@GreatOneWillie I'm Soo buying THIS New #SashaBanks Shirt It's Muy Fuego #Legit #LuchaBoss pic.twitter.com/FR9nrYJXF1",https://twitter.com/lenascorpio20/status/1275612633589301250
2020-06-24 02:12:06,GINGCLIT,"omg he's so hot i am foaming at the mouf.. pic.twitter.com/DLQMC7IU04",https://twitter.com/GINGCLIT/status/1275612632808960000
2020-06-24 02:12:04,CardGuyCody,"$60 SHIPPED FIRM TAKES BOTH!! TATUM IS ON #TheHobby @Hobby_Connectpic.twitter.com/3jejsAYYju",https://twitter.com/CardGuyCody/status/1275612626899341312
2020-06-24 02:12:03,ariana_queen_LM,"imagine nicki ft cupcakke with a yikes type beat",https://twitter.com/ariana_queen_LM/status/1275612622436667393
2020-06-24 02:12:03,Maryclaire1011,"I’ll be honest- if I put it in a drawer and I can’t see it anymore? It no longer exists.pic.twitter.com/wUfbKvJzFF",https://twitter.com/Maryclaire1011/status/1275612621979426821
2020-06-24 02:12:03,ZeroJour,"I got cold chills on that part. That gif is",https://twitter.com/ZeroJour/status/1275612621304102913
2020-06-24 02:12:02,Gyre_SA,"Why you no sleep Mr Marawa",https://twitter.com/Gyre_SA/status/1275612617021816832
2020-06-24 02:12:01,funnyfergi,"Preach pic.twitter.com/aGPStdkCXK",https://twitter.com/funnyfergi/status/1275612615578996741
2020-06-24 02:12:01,VivianeCndida2,"I GABIMARTINS BY NIGHT",https://twitter.com/VivianeCndida2/status/1275612614207385602
2020-06-24 02:12:01,Jedi_Saiyan_3,"Cutie https://twitter.com/thehoodlumxx/status/1275611851712131073 …",https://twitter.com/Jedi_Saiyan_3/status/1275612613930627073
2020-06-24 02:12:00,josifus77,"Come and see FIREPRINCESS's LIVE in #BIGOLIVE https://slink.bigovideo.tv/umWCee pic.twitter.com/axjJrt5uGr",https://twitter.com/josifus77/status/1275612610528935936
2020-06-24 02:12:00,obkabo,"2nd and 3rd frame https://twitter.com/ms_oh_tee/status/1275440447314210816 …",https://twitter.com/obkabo/status/1275612609891500032
2020-06-24 02:12:00,BuildBigMoney1,"Psychologists will tell you how important boundaries are. So I've heard.",https://twitter.com/BuildBigMoney1/status/1275612608112951296
2020-06-24 02:11:59,Sallu03705543,"Wow very beautiful pic avi sweet amazing I Love You AVI",https://twitter.com/Sallu03705543/status/1275612607248912384
2020-06-24 02:11:59,kxllerwhale,"get well soon, baejin",https://twitter.com/kxllerwhale/status/1275612604099031045
2020-06-24 02:11:58,hermoine22,"TXT 1 million sales in august https://twitter.com/TXTintl_twt/status/1275607534506610689 …",https://twitter.com/hermoine22/status/1275612601393668101
2020-06-24 02:11:58,_jessy_fit_,"My 30-Day Home Program is dope and it shows! #NewProfilePicpic.twitter.com/MOj4qeUnrX",https://twitter.com/_jessy_fit_/status/1275612600622108672
2020-06-24 02:11:58,yamurda11119542,"Coupon Sale Awesome from OUNASS Use coupon discount كود خصم أناس NN58 RN66 Deducted for each order Bath and Body : ESY Vogacloset : KIV American Eagle : B844 Namshi : NAM117 H&M : A723 AJMALL : FUN62 MOTHERCARE : OK38 pic.twitter.com/y0V53oYbry",https://twitter.com/yamurda11119542/status/1275612599732715520
2020-06-24 02:11:57,Chris_PoV,"Live Love Laugh would be tho",https://twitter.com/Chris_PoV/status/1275612596075245569
2020-06-24 02:11:57,tetchpine_bard,"“I am...in your overwhelming beauty my love.” He bows as he kisses her hand. “Perhaps you can show me the way”https://twitter.com/knight_tiefling/status/1275611630609616903 …",https://twitter.com/tetchpine_bard/status/1275612595324583939
2020-06-24 02:11:57,seanboi18,"Made A cartoon of my baw @AugustAlsina pic.twitter.com/WhuZbcCgmz",https://twitter.com/seanboi18/status/1275612594884280321
2020-06-24 02:11:56,ErikBanales,"To everyone wondering, this was all taken apart, spray painted, and put back together. None of that case stuff, hand made all for @trvisXX",https://twitter.com/ErikBanales/status/1275612592744968192
2020-06-24 02:11:56,ThePokeRaf,"Both have my respect. They’ve done their bit to assist Ash in key battles. Still early days for development too. Riolu is bound to be set up for an arc, correlating to Ash having the power to sense and master aura. It was inevitable to happen",https://twitter.com/ThePokeRaf/status/1275612592162119680
2020-06-24 02:11:55,HotpotatoK,"Only facts my dude https://twitter.com/paperdragun/status/1275464657315049473 …",https://twitter.com/HotpotatoK/status/1275612590392016896
2020-06-24 02:11:55,OMoze69,"4th one",https://twitter.com/OMoze69/status/1275612590358573062
2020-06-24 02:11:55,vipulbadoni,"Average will consume. Smart will produce.",https://twitter.com/vipulbadoni/status/1275612588689285120
2020-06-24 02:11:55,LawCannon,"Where’s all my people who like PHILLY CHEESESTEAK Would y’all eat this? I snapped on this one... pic.twitter.com/uT4LQunxEP",https://twitter.com/LawCannon/status/1275612587841990657
2020-06-24 02:11:54,GuzanskyStefany,"Tmj kkk",https://twitter.com/GuzanskyStefany/status/1275612586109743105
2020-06-24 02:11:54,CagedBirdsCafe,"Will and Grace",https://twitter.com/CagedBirdsCafe/status/1275612585572945920
2020-06-24 02:11:54,TiffRichElliott,"Cross between Vancouver, B.C., New York City, and the Oregon Coast.",https://twitter.com/TiffRichElliott/status/1275612583999893505
2020-06-24 02:11:54,noemed_03,"Ok I’m switching the song to MIA",https://twitter.com/noemed_03/status/1275612583131787265
2020-06-24 02:11:54,tukalatele,"top update pas gua lagi pules astaga",https://twitter.com/tukalatele/status/1275612582619910145
2020-06-24 02:11:54,Asclepius____,"Further proof if you really want to believe/see something, you will",https://twitter.com/Asclepius____/status/1275612582427136000
2020-06-24 02:11:53,1Dussy,"Steven Tyler. He called me Schweetheart.",https://twitter.com/1Dussy/status/1275612582091599876
2020-06-24 02:11:53,VivianeCndida2,"R GABIMARTINS BY NIGHT",https://twitter.com/VivianeCndida2/status/1275612582028722176
2020-06-24 02:11:53,Djnovad_,"But how is that privilege though especially when white people use the system more than black people do",https://twitter.com/Djnovad_/status/1275612580862713857
2020-06-24 02:11:53,CactusJvxk,"Watch one invade you house niw",https://twitter.com/CactusJvxk/status/1275612580292296704
2020-06-24 02:11:53,Rcovr_,"Body bag for shorty https://twitter.com/thoom1n/status/1275497265516470274 …",https://twitter.com/Rcovr_/status/1275612578576846848
2020-06-24 02:11:52,TrapezeClub,"Mark your calendars for August 29thYou are cordially invited to Trapeze’s SWINGCHELLA Neon Carnival! Get ready to swing the night away at the sexiest event of the year! We will have great music, food, drinks, body painters, and MORE! #trapezeclubpic.twitter.com/pV9Lrow5bh",https://twitter.com/TrapezeClub/status/1275612575288393732
2020-06-24 02:11:52,_nicholas_ryan,"I wish you’d choke me. How you JUST GONNA BE TRHAT FINE? lord I’m REALLY gonna have the hottest wife ever. ilysm",https://twitter.com/_nicholas_ryan/status/1275612573866561536
2020-06-24 02:11:51,TheShoujoPrince,"So wait why does everyone hate last of us 2 I haven’t been paying much attention",https://twitter.com/TheShoujoPrince/status/1275612573375889413
2020-06-24 02:11:51,BamFr_,"Niggas always say @BIRDMAN5STAR trash , y’all need listen to his classics 1998-1999",https://twitter.com/BamFr_/status/1275612573044523008
2020-06-24 02:11:51,_iamsplendor,"Follow me I follow back patheticallypic.twitter.com/fNNHM4vfGe",https://twitter.com/_iamsplendor/status/1275612572826419205
2020-06-24 02:11:51,JD65417316,"Dropping Knowledge! https://twitter.com/davelevine0com/status/1275463599704567811 …",https://twitter.com/JD65417316/status/1275612570666311682
2020-06-24 02:11:51,Javed_Jd22,"Happy 33rd birthday to the Greatest player Lionel Messi. Keep bringing the same magic for many more years. #Happybirthdaymessi ⁦⁩pic.twitter.com/CIWpMU2zIP",https://twitter.com/Javed_Jd22/status/1275612569978494979
2020-06-24 02:11:50,hunter32343637,"This you? https://twitter.com/sorinpro368/status/1275533264296521734 …pic.twitter.com/uwL2Uxoa3Z",https://twitter.com/hunter32343637/status/1275612569072435201
2020-06-24 02:11:50,n_aksum,"today has been a DAYhttps://twitter.com/kaytranada/status/1275581782809862144 …",https://twitter.com/n_aksum/status/1275612565805182977
2020-06-24 02:11:49,PaulKnowsAll2,"Dildos can Tweet! Who'da thunk it...",https://twitter.com/PaulKnowsAll2/status/1275612563472973824
2020-06-24 02:11:49,lilyaquesito,"I wanna go back to when I was up late looking up chupacabra videos on YouTube",https://twitter.com/lilyaquesito/status/1275612561933651968
2020-06-24 02:11:49,sunysie,"F for all people simp for alyssa",https://twitter.com/sunysie/status/1275612561841537035
2020-06-24 02:11:48,AltKali,"Be good to people!! https://twitter.com/babiegvk/status/1274923189303275521 …",https://twitter.com/AltKali/status/1275612559308193793
2020-06-24 02:11:47,ikari59,"lets gooo",https://twitter.com/ikari59/status/1275612556917260289
2020-06-24 02:11:47,Cruz11La,"Sheezzhhh https://twitter.com/thedrakelife/status/1275612197482348546 …",https://twitter.com/Cruz11La/status/1275612556812595200
2020-06-24 02:11:47,FunbullOh,"Mmmmmm YES",https://twitter.com/FunbullOh/status/1275612556384747523
2020-06-24 02:11:47,ThaPeoplesAgent,"@Tiphani_M watching the @Ericthomasbtc wealth conference and saw you from Rochester salute that’s big time",https://twitter.com/ThaPeoplesAgent/status/1275612556384747522
2020-06-24 02:11:47,KD4205,"Thanks bro",https://twitter.com/KD4205/status/1275612554069340162
2020-06-24 02:11:46,BayliffeSheryl,""" An opportunity that is not repeated Take advantage of your discount with Aliexpress علي اكسبريس only when you use my special coupon Use: EVE كود خصم على اكسبريس | Aliexpress discount coupon code EVE EVE EVE pic.twitter.com/sJRQkxYLTy",https://twitter.com/BayliffeSheryl/status/1275612552529981440
2020-06-24 02:11:46,brooklynyeah,"I love a powerful woman!!",https://twitter.com/brooklynyeah/status/1275612549514432515
2020-06-24 02:11:45,X_Tshezi,"I’m only seeing this now bro https://twitter.com/_truesole/status/1275458840893497344 …",https://twitter.com/X_Tshezi/status/1275612548612661249
2020-06-24 02:11:45,ChillymoJoe,"Lowkey got a mean lil headache",https://twitter.com/ChillymoJoe/status/1275612548524642304
2020-06-24 02:11:45,FanciAdaj,"just my opinion from observing but I could be wrong",https://twitter.com/FanciAdaj/status/1275612548344274946
2020-06-24 02:11:45,dollarstorerih,"She ain’t even apologize lol just said she was 17 which was a lie, she was almost 20. She also targeted me out of our entire group and slandered me on her page lol. Wonder why it was only me? Hmmm bet I can guess...https://twitter.com/mommaxdee/status/1275611932813217792 …",https://twitter.com/dollarstorerih/status/1275612547014516736
2020-06-24 02:11:45,lypham27,"Don't break the chain Lockscreen! Homescreen! Last song u listened to? 35th photo in ur gallery 5 moots: ... I dont make friends on twt https://twitter.com/jaehyunixm/status/1275542450887671813 …pic.twitter.com/EWWXdAcfrB",https://twitter.com/lypham27/status/1275612546951548929
2020-06-24 02:11:45,VivianeCndida2,"B GABIMARTINS BY NIGHT",https://twitter.com/VivianeCndida2/status/1275612545215279105
2020-06-24 02:11:44,itz_trauma,"Who else knows about this 1984 piece of art pic.twitter.com/ES6Wsvp2V6",https://twitter.com/itz_trauma/status/1275612542564552705
2020-06-24 02:11:44,ilovebuccigang,"One Piece, FMAB, Code Geass, Death Note.https://twitter.com/StrawhatDonny/status/1275564678568173568 …",https://twitter.com/ilovebuccigang/status/1275612540672737280
2020-06-24 02:11:43,RinTingz,"If you look like this be my best friendpic.twitter.com/L7tO2aPdfe",https://twitter.com/RinTingz/status/1275612540228288512
2020-06-24 02:11:43,FlamingHashira,"Yes! The strongest demon slayers are called Hashiras and there's 9 of us! However 5 of them are currently out on missions, so it's just Myself the Flame Pillar, Mitsuri the Love Pillar, Shinobu the Insect Pillar, and Giyuu the Water Pillar!",https://twitter.com/FlamingHashira/status/1275612538235875329
2020-06-24 02:11:43,_youASHy,"FRIEND I can actually agree with that cause this cancer man I have a HEADACHE lol but he’s still the best out of the other signs I’ve dealt with",https://twitter.com/_youASHy/status/1275612537195814917
2020-06-24 02:11:43,idntHATE_iTWEET,"@Gutterglitter3 we can shoot a movie",https://twitter.com/idntHATE_iTWEET/status/1275612536952545281
2020-06-24 02:11:43,_CryptoCurator,"@Travis_Kling gives the best advice :)https://crypto.u.today/bitcoin-btc-transfers-wealth-to-this-category-of-people-asset-manager-says …",https://twitter.com/_CryptoCurator/status/1275612536881197071
2020-06-24 02:11:43,jimmyskeets,"You did it your way Pipp! So you Absofuckinglutely did it right!",https://twitter.com/jimmyskeets/status/1275612536428212224
2020-06-24 02:11:43,InvestorsLive,"Tonight's edition of #KnowWhatYouOwn $SINT $KTOV $EVOK $IDEX (warned about 4 of 4 of them yesterday for those who pay attention) nailed a few offerings today an S-3 and perhaps the next one of the bunch that… https://www.instagram.com/p/CBzPR4Bj0q2/?igshid=xknlll3b2cvu …",https://twitter.com/InvestorsLive/status/1275612536197599232
2020-06-24 02:11:42,aaronray6,"How you gone treat this sh#t like you gone live again",https://twitter.com/aaronray6/status/1275612535450996736
2020-06-24 02:11:42,bluedream24,"& that don julioooo made me a fool for youuuu @Kehlani pic.twitter.com/UrzCqoC9yD",https://twitter.com/bluedream24/status/1275612532699365377
2020-06-24 02:11:42,MahleeJ1219,"I have found a new love in @LewisCapaldi. His lyrics are just . That is all.",https://twitter.com/MahleeJ1219/status/1275612532548526080
2020-06-24 02:11:41,BSaiTej41402655,"https://twitter.com/urstrulyMahesh/status/1266937240808157185?s=19 … Everyone Look At This Present Retweets 31K Record Kottam Vakeelsab Ni Beat Chesam Oka Post Vey bro #SarkaruVaariPaata",https://twitter.com/BSaiTej41402655/status/1275612531449462784
2020-06-24 02:11:41,Rezmag2,"Ws everyday",https://twitter.com/Rezmag2/status/1275612531113902080
2020-06-24 02:11:41,jgBigBoy1,"America You Need to Know: , A person who is very flat chested is very hard to be a 10. Our country is respected again, remember that.",https://twitter.com/jgBigBoy1/status/1275612529759223813
2020-06-24 02:11:41,pocholotz,"She's dancing all out as if there's no tomorrowhttps://twitter.com/FeatherJmeee/status/1275415299601416192 …",https://twitter.com/pocholotz/status/1275612529301938176
2020-06-24 02:11:41,jshgms,"Let us not be afraid to risk! Good morning! pic.twitter.com/jrY45lZW9M",https://twitter.com/jshgms/status/1275612528958074880
2020-06-24 02:11:40,Mori_Blu,"I’m feeling mighty attacked as well o.o",https://twitter.com/Mori_Blu/status/1275612527662116864
2020-06-24 02:11:40,marvinis200t,"High be nice",https://twitter.com/marvinis200t/status/1275612526118486018
2020-06-24 02:11:40,tanzaxo,"Same",https://twitter.com/tanzaxo/status/1275612525015564288
2020-06-24 02:11:39,SPARKUPCandles,"SparkUP your coffee table with this modern luxury designer stack ⁣ ⁣⁣ #candle #candles #handmade #love #homedecor #instagood #home #gift #fragrance #designerbooks #designer #candleaddict #soywax #decor… https://www.instagram.com/p/CBzPRl9HSXu/?igshid=1a8p92jn2ratz …",https://twitter.com/SPARKUPCandles/status/1275612521899208704
