date,username,to,replies,retweets,favorites,text,geo,mentions,hashtags,id,permalink
2020-06-24 02:17:08,JonathanADonner,"YOU GO GIRL!",https://twitter.com/JonathanADonner/status/1275613901376286720
2020-06-24 02:17:08,liddytronic,"wild stuff",https://twitter.com/liddytronic/status/1275613901019897861
2020-06-24 02:17:07,dollzly,"Orange flavorAvailable in 14-22inches 150% Density Non-Shedding 100% Brazilian hair SHOP NOW Fast Free Shipping to anywhere in the US @dollzly #orangehairdontcare #orangehair #dyedhair #colorfulhairdontcare… https://www.instagram.com/p/CBzO9clDlmA/?igshid=1i80daviz9cpl …",https://twitter.com/dollzly/status/1275613898234900480
2020-06-24 02:17:07,trickyrichx2,"The way of a superior man.",https://twitter.com/trickyrichx2/status/1275613897525846016
2020-06-24 02:17:07,Sopher95,"What’s Good If You Bored Scrolling trough the comments Check out my new single “you” out now on YouTube some Rnb rap trap #retweet #thankyou let me know what y’all think https://youtu.be/_UFdsHmZEsk",https://twitter.com/Sopher95/status/1275613896389222400
2020-06-24 02:17:06,PasswordSuck2,"You got obliterated, big fat L on that one. You thought you had a chance? Progressives are the future, deal with it, the time of the establishment and old guards has brought nothing but pain to this world!pic.twitter.com/PJvvWAnq1O",https://twitter.com/PasswordSuck2/status/1275613892606074880
2020-06-24 02:17:05,priscil19585731,"Filo GABIMARTINS BY NIGHT",https://twitter.com/priscil19585731/status/1275613890001412096
2020-06-24 02:17:04,maxiedexter,"I can't call my wife Delores any more because i may mispronounce it.",https://twitter.com/maxiedexter/status/1275613886188711937
2020-06-24 02:17:04,IndyMagic,"The FUTURE pic.twitter.com/hmRFIRAUBq",https://twitter.com/IndyMagic/status/1275613883504513024
2020-06-24 02:17:04,SEBONGERSLOVE,"WONWOO ON WEVERSE -JUNE 24,2020 11:14 (KST)- @pledis_17pic.twitter.com/HVBin8XMQA",https://twitter.com/SEBONGERSLOVE/status/1275613882623524865
2020-06-24 02:17:03,sunil_hebbar,"Welcome to Club FSD",https://twitter.com/sunil_hebbar/status/1275613882430689283
2020-06-24 02:17:03,noaxxv,"Aaah thanks sweetheart",https://twitter.com/noaxxv/status/1275613881495433223
2020-06-24 02:17:03,SvenMotion,"got some tmrw",https://twitter.com/SvenMotion/status/1275613879381495813
2020-06-24 02:17:02,_ricy1901,"Coupon Discount Awesome from ONASS Use coupon discount كود خصم أناس NT65 RN66 Deducted for each order Bath and Body : ESY Vogacloset : KIV American Eagle : B844 Namshi : NAM117 H&M : A723 AJMALL : FUN62 MOTHERCARE : OK38 pic.twitter.com/PhCEJ8HZgv",https://twitter.com/_ricy1901/status/1275613877326077952
2020-06-24 02:17:02,Lkdwx,"on the >>>",https://twitter.com/Lkdwx/status/1275613874620780544
2020-06-24 02:17:01,aegis_runestone,"Yeah. That's probably why they replaced mine because I couldn't even get past the first part of the calibration screen.",https://twitter.com/aegis_runestone/status/1275613873274359808
2020-06-24 02:17:01,RosAnimalis,"6. Pretty sure every moment having to deal with Alpha was very much a Negative in the Mood Indicator lmao. Tbh I don’t blame him they’re exhaughsting lmao",https://twitter.com/RosAnimalis/status/1275613871206735873
2020-06-24 02:17:01,dollarstorerih,"All of them are crazy lol they ALL are",https://twitter.com/dollarstorerih/status/1275613870048940034
2020-06-24 02:17:00,lisassloveee,"SAY IT LOUDER",https://twitter.com/lisassloveee/status/1275613866408448000
2020-06-24 02:16:59,nyhcmaven84,"that's my district! Trust, most people here neither knew nor gave a shit about the NBC anchor.",https://twitter.com/nyhcmaven84/status/1275613864709758976
2020-06-24 02:16:59,chiigri,"HELLLPPP!1!₱!₱89#0* BUT TRUE",https://twitter.com/chiigri/status/1275613863245787136
2020-06-24 02:16:59,rickynerd_,"stale hot cheetos",https://twitter.com/rickynerd_/status/1275613862964822016
2020-06-24 02:16:59,GL17CH_SE18,"Proper bad boy set",https://twitter.com/GL17CH_SE18/status/1275613862297993216
2020-06-24 02:16:58,662online,"This new @blakexbanks “Dance On My Grave” Video is hella directed by @IkilledKiki now on http://662online.com pic.twitter.com/ai1S9awVBg",https://twitter.com/662online/status/1275613860033150976
2020-06-24 02:16:58,marshymell0ww,"Uhhh?? This is not riri it’s @AllyiahsFace",https://twitter.com/marshymell0ww/status/1275613859349270528
2020-06-24 02:16:58,BangalorePKfans,"Worldwide Trending for a countdown trend Mass oora mass #VakeelSaab @PawanKalyan #70DaysForEnigmaPSPKBDaypic.twitter.com/YLfC7cazJ9",https://twitter.com/BangalorePKfans/status/1275613858225205248
2020-06-24 02:16:58,Girl131Fan,"She hugs back and smiled weakly.",https://twitter.com/Girl131Fan/status/1275613857763823616
2020-06-24 02:16:57,TalimanJeremy,"Copped last restock. They worth that $115 pic.twitter.com/1cmdL1vruC",https://twitter.com/TalimanJeremy/status/1275613855608008704
2020-06-24 02:16:57,itsarigrace,"It's not an opinion love, it's a fact",https://twitter.com/itsarigrace/status/1275613854941294592
2020-06-24 02:16:56,PneumaSP,"NAHHH that’s a goated response, you know ur worth",https://twitter.com/PneumaSP/status/1275613852558860289
2020-06-24 02:16:56,AfordavlePrem,"PROMO: IF YOU AVAIL NETFLIX YOU CAN GET 3 MONTHS SPOTIFY FOR ONLY P30 NETFLIX FOR SALE 1 Month (NO HOLD) SOLO - P270 SHARED - P100 Can Customize Email and Pass -GIFT CARD METHOD -NO HOLD/WIPED OUT Tags|netflix ph,netflix legit,netflix for sale,spotify for sale pic.twitter.com/Bjyeu69bCB",https://twitter.com/AfordavlePrem/status/1275613851199827969
2020-06-24 02:16:56,AlexNelson47,"Hold up, this is about to be so . https://twitter.com/jackharlow/status/1275549830429970437 …",https://twitter.com/AlexNelson47/status/1275613850763739136
2020-06-24 02:16:56,mkmousanz,"@AOC 4 years ago asking what was the best way for her to get involved https://twitter.com/jonnyboyca/status/1275613553911689222 …",https://twitter.com/mkmousanz/status/1275613850612588546
2020-06-24 02:16:56,Alexandriacecch,"You really did that https://twitter.com/antoniacrump/status/1275606978274816001 …",https://twitter.com/Alexandriacecch/status/1275613849035567104
2020-06-24 02:16:56,kandyjjang,"they’re killin’ those LOOKS pic.twitter.com/zDJJikaSWe",https://twitter.com/kandyjjang/status/1275613849001947136
2020-06-24 02:16:55,letstalkbb1,"The QUEEN of the #FlameGangg #FlameGangg stand up https://twitter.com/taylorverrico/status/1275423976668499969 …",https://twitter.com/letstalkbb1/status/1275613847857004544
2020-06-24 02:16:55,ournabiseul,"Oh it's coming alright https://www.koreaboo.com/news/red-velvet-seulgi-reveals-details-upcoming-unit-duo-irene/ …",https://twitter.com/ournabiseul/status/1275613846602829826
2020-06-24 02:16:55,velvetcakey,"Velvetcakey",https://twitter.com/velvetcakey/status/1275613846502125568
2020-06-24 02:16:55,littleherbsco,"24K gold + rose infused hair growth oil with sea moss its SO GOOD https://etsy.me/2zQYCMc",https://twitter.com/littleherbsco/status/1275613845957083141
2020-06-24 02:16:55,judebirch,"plus his incentive is - his OWN agenda! https://twitter.com/gtconway3d/status/1275602062089359360 …",https://twitter.com/judebirch/status/1275613845449592837
2020-06-24 02:16:54,spaceflannl,"Hey there, little guy Why are you so scared of voting rights?",https://twitter.com/spaceflannl/status/1275613843578904582
2020-06-24 02:16:54,ShadeofGray_1,"Yessir https://twitter.com/thetournament/status/1275602473688981507 …",https://twitter.com/ShadeofGray_1/status/1275613843528564736
2020-06-24 02:16:54,GAinILM,"Madison Cawthorn is a dude. The Republicans rejected the woman (Lynda Bennett) like they always do, here in NC. And he's just as bad, if not worse, than Meadows. https://wlos.com/news/local/madison-cawthorn-defeats-trumps-pick-in-north-carolina-gop-house-primary … https://www.madisoncawthorn.com/index.php/about-madison/ …",https://twitter.com/GAinILM/status/1275613841909481473
2020-06-24 02:16:53,Moneyslide34,"You are not a good cop if yu can’t check yo partner look at George Floyd it took 3 to pin em down n he wasn’t wrestling",https://twitter.com/Moneyslide34/status/1275613839963369473
2020-06-24 02:16:53,minashood,"damnnn this is CRAZY!!",https://twitter.com/minashood/status/1275613836968517632
2020-06-24 02:16:52,dmvsredbonerebl,"Thank you jess",https://twitter.com/dmvsredbonerebl/status/1275613834309443587
2020-06-24 02:16:52,reyablo,"my cousin timbo really one of the coldest artists i know pic.twitter.com/ZTul3FgMV4",https://twitter.com/reyablo/status/1275613833554427904
2020-06-24 02:16:51,JustDo_Wright,"Getting busy in this grand Coupe",https://twitter.com/JustDo_Wright/status/1275613831151190018
2020-06-24 02:16:51,PoliticalAnt,"No, that is blatant racism because @realDonaldTrump has been told that "" #KungFlu"" is racist but keeps saying it to please his white supremacist base.",https://twitter.com/PoliticalAnt/status/1275613829456629762
2020-06-24 02:16:50,DulcesinFlow,"OMG!!! I'm excited!!!!! I did it!!",https://twitter.com/DulcesinFlow/status/1275613826701045760
2020-06-24 02:16:50,45MUSTGO,"Ask my beard.....",https://twitter.com/45MUSTGO/status/1275613826570874880
2020-06-24 02:16:50,anfpat_,"Just finished rewatching the Rose Bowl between UGA and Oklahoma. Let’s just say it never gets old .",https://twitter.com/anfpat_/status/1275613825266565121
2020-06-24 02:16:49,1016HOOTASKOOTA,"Awesome day in the lab Fire Melodies Supervibes #1016lab #Lab1o16 #1016sounds #indy ##musician #producerculture #producerlife #artoftheday #artistic_share https://www.instagram.com/p/CBzMd61DbLq/?igshid=151k5rcywh7x3 …",https://twitter.com/1016HOOTASKOOTA/status/1275613822204760066
2020-06-24 02:16:49,tetchpine_bard,"“Falma. That’s a very pretty name. Do you need any food or drink at all? I brought a basket with me of stuff.” He wants to help her a lot",https://twitter.com/tetchpine_bard/status/1275613821307097100
2020-06-24 02:16:49,seanboi18,"Had To Cartoon my girl @KekePalmer pic.twitter.com/ta4HuHK6eV",https://twitter.com/seanboi18/status/1275613820069859329
2020-06-24 02:16:48,Maryclaire1011,"The drawer also by relation does not exist either- so the missing object remains lost until you no longer have any use for it.pic.twitter.com/U3nYpplTdZ",https://twitter.com/Maryclaire1011/status/1275613818064904196
2020-06-24 02:16:48,vvsteo,"tell me how a 17 yr old is taking a pic of my face form my story and is sharing to his friends",https://twitter.com/vvsteo/status/1275613817444216833
2020-06-24 02:16:48,badgalney_,"I need my girls up in that ASAP",https://twitter.com/badgalney_/status/1275613816559218693
2020-06-24 02:16:48,_oluwatobiiiii,"me too It's just cooler than saying ""By God's grace""",https://twitter.com/_oluwatobiiiii/status/1275613815661445120
2020-06-24 02:16:47,GenieSweetness,"Come and see JulioHeny's LIVE in #BIGOLIVE: PK Time https://slink.bigovideo.tv/SZY0JW pic.twitter.com/fakEcvWxtB",https://twitter.com/GenieSweetness/status/1275613812859777024
2020-06-24 02:16:47,Johhny_Jalepeno,"One of the best fan posters I’ve seen for Zacks JL. Awesome work",https://twitter.com/Johhny_Jalepeno/status/1275613811618181120
2020-06-24 02:16:46,tenkevents,"Come and see CurlQueen's LIVE in #BIGOLIVE: Tasty Tuesday! https://slink.bigovideo.tv/nQUi8N pic.twitter.com/jdyUlxF2XE",https://twitter.com/tenkevents/status/1275613810800328705
2020-06-24 02:16:46,Olfella,"50 years here. Would be lost without her.pic.twitter.com/ceOeJ7Se7B",https://twitter.com/Olfella/status/1275613810120785920
2020-06-24 02:16:46,DENZVANOF,"Code Discount Mo Hein from Namshi Use coupon discount Discount Promo Code كود خصم نمشي DD22 DD33 Deducted for each order OUNASS : F87 Nisnass : BG21 Riva Fashion : BUY73 Bath&Body : K006 DKHOON : DE20 Boohoo : A677 1Zillion : Z120 Faces : CUT992 pic.twitter.com/tlKWxqpIWb",https://twitter.com/DENZVANOF/status/1275613807809720320
2020-06-24 02:16:45,_svufan,"Have y'all seen the newest picture of Judge Lynn Toler looking gorgeous in that dress? #LynnTolerpic.twitter.com/B2cPYnsIkY",https://twitter.com/_svufan/status/1275613806371184652
2020-06-24 02:16:45,critmaster9000,"Lookin fresh af!!",https://twitter.com/critmaster9000/status/1275613806270402561
2020-06-24 02:16:45,Hannah_knight4,"I probably will anyway -laughs-",https://twitter.com/Hannah_knight4/status/1275613805800718336
2020-06-24 02:16:45,mejiaambar,"Amen!https://twitter.com/dominicci13/status/1275613636556394497 …",https://twitter.com/mejiaambar/status/1275613803380686850
2020-06-24 02:16:44,Ceesnation,"Y'all need something to jam too, check out my favorite DJ https://twitter.com/Only1DJSmitty/status/1275605373668425728 …",https://twitter.com/Ceesnation/status/1275613801723854850
2020-06-24 02:16:43,rnbstellar,"Stellar - Till Tomorrow This is my latest song. It’s a fun summer vibe. Peep this shit and tell me what you think. https://youtu.be/QDJdaC6sCVE Btw follow my tik tok @rnbstellar for $CHALLENGES w my song !!!",https://twitter.com/rnbstellar/status/1275613796413956098
2020-06-24 02:16:43,mkayy_901,"Shid we didnt do shit but sleep. Hell all I gotta say is ian goin to class today. Problem solved",https://twitter.com/mkayy_901/status/1275613796153860096
2020-06-24 02:16:43,RKarthik007RKa7,"Good morning. #Master @actorvijay",https://twitter.com/RKarthik007RKa7/status/1275613795881070592
2020-06-24 02:16:43,MvpLovell22,"@TyrionI27 Go Vols",https://twitter.com/MvpLovell22/status/1275613794752921600
2020-06-24 02:16:43,YusufGLen3,"Coupon Sale Awesome from OUNASS Use code discount كود خصم أناس NN58 RN66 Deducted for each order Bath and Body : ESY Vogacloset : KIV American Eagle : B844 Namshi : NAM117 H&M : A723 AJMALL : FUN62 MOTHERCARE : OK38 pic.twitter.com/SrPIRlvZ3p",https://twitter.com/YusufGLen3/status/1275613794648104965
2020-06-24 02:16:42,ScaredBisexual,"This is why I can’t really watch IKWYDLM. I like stories with bad characters if they are written in certain ways. I can’t stand it if there is no complexity to them or if the point isn’t that they are bad.",https://twitter.com/ScaredBisexual/status/1275613791175217152
2020-06-24 02:16:41,Miami_Smoke,"That’s about to be",https://twitter.com/Miami_Smoke/status/1275613786376994816
2020-06-24 02:16:40,tae_corleone,"Somebody gotta put Batista music wit this https://twitter.com/rapcentury_/status/1275608305021394944 …",https://twitter.com/tae_corleone/status/1275613785185759232
2020-06-24 02:16:40,zoelaflame,"What’s you doing tomorrow?",https://twitter.com/zoelaflame/status/1275613781893304326
2020-06-24 02:16:39,AlishaLGordon,"That’s my classmate! https://twitter.com/laurajeantruman/status/1275424060542005249 …",https://twitter.com/AlishaLGordon/status/1275613781243109377
2020-06-24 02:16:39,LaidBackL__,"Almost my time",https://twitter.com/LaidBackL__/status/1275613780651761670
2020-06-24 02:16:39,Cyberdeliq,"Alas it is all cursed",https://twitter.com/Cyberdeliq/status/1275613780647559168
2020-06-24 02:16:39,robert_alderete,"LA is going to get lit https://twitter.com/fxhedgers/status/1275600958752342016 …",https://twitter.com/robert_alderete/status/1275613778088845313
2020-06-24 02:16:39,stayathomeszn,"Gleyber and Sevy can be allowed",https://twitter.com/stayathomeszn/status/1275613777745117184
2020-06-24 02:16:38,soulsocietydg,"Come and see FIREPRINCESS's LIVE in #BIGOLIVE: #dance Hi https://slink.bigovideo.tv/GO0hUd pic.twitter.com/1hvFnDRV8s",https://twitter.com/soulsocietydg/status/1275613776906194944
2020-06-24 02:16:38,gr8ones_,"ALRIGHT! YOU GUYS VOTED AND THE WINNER IS.... THE BLEACH TIE DYE!!! DM TO PRE ORDER! pic.twitter.com/o2zWudJoHc",https://twitter.com/gr8ones_/status/1275613775983521793
2020-06-24 02:16:38,LaylaDaLemon,"I don't think so but my emojis say otherwise lol",https://twitter.com/LaylaDaLemon/status/1275613774293143557
2020-06-24 02:16:37,wintrflower_7,"Obviamente, BTS PAVED THE WAY porque BTS LEGENDS y sí, BTS KINGS , @BTS_twthttps://twitter.com/BTSChartDaily/status/1275613489000861698 …",https://twitter.com/wintrflower_7/status/1275613771852140550
2020-06-24 02:16:37,ENorwood40,"Renni and Rihanna blessed my timeline today wit some",https://twitter.com/ENorwood40/status/1275613771277504512
2020-06-24 02:16:37,ITS_KUSH_,"Not a bad idea actually, seein as I’m pretty surgical wit ah saw, an on tha grill..",https://twitter.com/ITS_KUSH_/status/1275613770241527808
2020-06-24 02:16:36,arn46305068,"Kiss Land is my favorite album...",https://twitter.com/arn46305068/status/1275613768580362241
2020-06-24 02:16:35,MyfireTTV,"This tweet's time is my crowning achivement",https://twitter.com/MyfireTTV/status/1275613764709122048
2020-06-24 02:16:35,JusCallMeNiecey,"I’m definitely in a better place than I was before !!!",https://twitter.com/JusCallMeNiecey/status/1275613762389782529
2020-06-24 02:16:35,__AgentPenguin,"It’s here! @shidahikaru #HolyShida #AEWpic.twitter.com/psmTyhFqFg",https://twitter.com/__AgentPenguin/status/1275613761143889920
2020-06-24 02:16:35,TomAyiti,"Amen https://twitter.com/Rirepourrire_Ix/status/1275590819454619649 …",https://twitter.com/TomAyiti/status/1275613761118900234
2020-06-24 02:16:34,QATlLA,"YESSSSIIIRRRRR",https://twitter.com/QATlLA/status/1275613759877320707
2020-06-24 02:16:34,tesla_raj,"another happy FSD customer Whose next?",https://twitter.com/tesla_raj/status/1275613757884952576
2020-06-24 02:16:33,BigDickInngas,"i need more cars to draw as hooman so i'll only be choosing three cars",https://twitter.com/BigDickInngas/status/1275613754512887809
2020-06-24 02:16:32,SportsCardKing_,"LUIS ROBERT RC ON CARD AUTO 2020 TOPPS TRIBUTE GREEN SP #/99 WHITE SOX… http://rover.ebay.com/rover/1/711-53200-19255-0/1?ff3=2&toolid=10039&campid=5338604427&customid=212%2C213%2C214%20Rookie&item=193533479390&vectorid=229466&lgeo=1&utm_source=dlvr.it&utm_medium=twitter … #AffiliateLink #SportsCards #TradingCards",https://twitter.com/SportsCardKing_/status/1275613751647985664
2020-06-24 02:16:32,ExposingtheDS,"Yea but he poured the gasoline on the fire!",https://twitter.com/ExposingtheDS/status/1275613751463612417
2020-06-24 02:16:32,vminIuvr69,"HELL YEAH",https://twitter.com/vminIuvr69/status/1275613750142386178
2020-06-24 02:16:32,DIKnnYoFace,"Yasss bxtch",https://twitter.com/DIKnnYoFace/status/1275613749806850049
2020-06-24 02:16:32,Techy4Christ,"Here’s another beauty from the other night @Saginaw, Michigan https://www.instagram.com/p/CBzP1XZHkyl/?igshid=4sh9wxrhjw07 …",https://twitter.com/Techy4Christ/status/1275613749500694528
2020-06-24 02:16:31,aiyuk_szn,"You were 3rd last year and now cards have a better team so yeah",https://twitter.com/aiyuk_szn/status/1275613747562770433
2020-06-24 02:16:31,Layd_Carter,"Confirm for Virtual @FDjconference July 17th to 19th @goodiemob Make sure u come out network . Number one networking event ... #FleetDJs #virtualconfernce #FleetEvents #fdjmusicconference #fleetnation https://www.instagram.com/p/CBzP1FKJKXY/?igshid=8t5rlznfhsmb …",https://twitter.com/Layd_Carter/status/1275613746543632385
2020-06-24 02:16:31,817vintagehype,"Tomorrow’s drop 6/24 What time should I do the drop!? Only at http://www.817vintagehype.com https://www.instagram.com/p/CBzP1M2B4rt/?igshid=o3z8h0tcxx9o …",https://twitter.com/817vintagehype/status/1275613746044506112
2020-06-24 02:16:31,GWIILIEActSilly,"This user has hidden this tweet from people who can’t think for themselves. L͟e͟a͟r͟n͟ ͟m͟o͟r͟e͟.",https://twitter.com/GWIILIEActSilly/status/1275613745507708929
2020-06-24 02:16:31,NyaniLatalia,"Lonely Child - NBA Youngboy",https://twitter.com/NyaniLatalia/status/1275613744622641153
2020-06-24 02:16:30,effymxo,"Gonna take some sexy pics tonight to upload to my onlyfans ; effymatthews plz follow and show support pic.twitter.com/8XQdpSWPE7",https://twitter.com/effymxo/status/1275613743095971840
2020-06-24 02:16:30,Blaze_Santiago,"Night ended good af streaking with @EppingerSamari @Trippie_Scoob",https://twitter.com/Blaze_Santiago/status/1275613742168977410
2020-06-24 02:16:30,kthspup,"timbits",https://twitter.com/kthspup/status/1275613741896413185
2020-06-24 02:16:30,BigAdam65094245,"Tomorrow will be more than 500 sats $QLC",https://twitter.com/BigAdam65094245/status/1275613740583596033
2020-06-24 02:16:29,BuildBigMoney1,"Wooooo...that's a good one there! I like that!",https://twitter.com/BuildBigMoney1/status/1275613739832578049
2020-06-24 02:16:29,ASpaceSirenMFC,"I'm online @MyFreeCams! #onmfc http://MFC.im/ASpaceSiren COME AND PLAY! I ALWAYS HAVE SOME SORT OF SHENANIGANS GOING ON! pic.twitter.com/MDLJnWr5ya",https://twitter.com/ASpaceSirenMFC/status/1275613739132137472
2020-06-24 02:16:29,VivianeCndida2,"Primavera GABIMARTINS BY NIGHT",https://twitter.com/VivianeCndida2/status/1275613738398355460
2020-06-24 02:16:29,Badang_top1,"Good job and recommended TFC (TF Coin) #Cash #Airdrop Free 300 TFC+50 refer Rewards can #withdraw directly #Swap TFC to TF on Bitribe now Value: 1 TF = 0.036USDT Telegram Bot: https://t.me/Bitribe_bot #Airdrops #Bounty #BTC #TFC #Cryptocurrency #Exchange",https://twitter.com/Badang_top1/status/1275613738121310210
2020-06-24 02:16:29,pluvia306,"Day 1 of waiting for QN solos preview",https://twitter.com/pluvia306/status/1275613738100391937
2020-06-24 02:16:29,ItsEbonyTaco,"There’s just somethings you just don’t need.",https://twitter.com/ItsEbonyTaco/status/1275613737995640833
2020-06-24 02:16:28,eleni_cherie,"help @BTS_twt win iOS: https://apple.co/37AW419 Android: https://bit.ly/3e6quKZ + http://bit.ly/3etSXL2 (you can download both versions &make 2 accs) Put as recommender: eleni_cherie Collect + mass vote during Hot Time. Rather vote on community posts (at least 100)! pic.twitter.com/xTOl3YKVgc",https://twitter.com/eleni_cherie/status/1275613731574231040
2020-06-24 02:16:27,imalalooya,"rule #713 of the swagnotes Haters Do A Lot Of Barking But They Never Bite",https://twitter.com/imalalooya/status/1275613731427422212
2020-06-24 02:16:27,FreezeSPreston,"But if I can't mention my dick in the opening sentence how is she going to know that I want to have sex with her?",https://twitter.com/FreezeSPreston/status/1275613730592550912
2020-06-24 02:16:27,Barbiesgirl_,"Go hard",https://twitter.com/Barbiesgirl_/status/1275613730278080512
2020-06-24 02:16:26,BookerShow1999,"Is it just me or does #MaskUpUtah sound like the name of a mixtape? No but in all honesty, whatever it takes for peeps to be encouraged to wear em. Really not trying to see another shutdown! #putthatmaskon #coronavirusinutah",https://twitter.com/BookerShow1999/status/1275613726784159744
2020-06-24 02:16:26,CaliGirl2Win93,"The #ApexLegends stream is live on #Twitch! Let’s grind! Come chill with us! http://twitch.tv/CaliGirl2Win93 #retweet @SmallStreamersR @RetweetMixer @LadiesofMixer #SupportAllStreamers #apex #varietystreamer #twitchgirl",https://twitter.com/CaliGirl2Win93/status/1275613723198132224
2020-06-24 02:16:25,PramodPsPk7684,"Guys Make it 500K As Soon As Possible But Aim for 700K #70DaysForEnigmaPSPKBDay #VakeelSaab @PawanKalyan",https://twitter.com/PramodPsPk7684/status/1275613722770206721
2020-06-24 02:16:25,BennieOwen1895,"Camera wasn’t that good. Nearly every boat had a trump flag flying. There were between 6,000 and 18,000 at the Tulsa rally.",https://twitter.com/BennieOwen1895/status/1275613722564800514
2020-06-24 02:16:25,GL17CH_SE18,"Track Entitled- STRAWBERRY MIRINDA Forthcoming on my 1998 EP Dropping this summer on my birthday 27TH AUGUST 2020 #garage #ukgarage #2step #urban #se18 #1998 #producer #riddims #beatsforsale #music #musicproducer #musicforsale #dubz #dubz4dem #experimentalmusicpic.twitter.com/TaYv9pcqeM",https://twitter.com/GL17CH_SE18/status/1275613721914728449
2020-06-24 02:16:25,littleklypsy,"Ooooh vou",https://twitter.com/littleklypsy/status/1275613720903913473
2020-06-24 02:16:25,Dayana98206365,"DAMN #model #fashion #VOGUE #BTS #BTSARMY #JIN #RM #SUGA #JHOPE #JIMIN #V #JUNGKOOK #BTSxVOGUE #WePurpleYouBangTanpic.twitter.com/O5CAhaEMCE",https://twitter.com/Dayana98206365/status/1275613720266158080
2020-06-24 02:16:25,LasJavieras,"Horrible",https://twitter.com/LasJavieras/status/1275613719947591680
2020-06-24 02:16:24,SEBONGERSLOVE,"SEUNGKWAN ON WEVERSE -JUNE 24,2020 11:08 (KST)- @pledis_17pic.twitter.com/xWrzfaBeRg",https://twitter.com/SEBONGERSLOVE/status/1275613717678313472
2020-06-24 02:16:24,MAGAPhantom13,"This is how we know you are not a true conservative. You are nothing but a RINO Nikki. That tweet is an epic fail. We will wait for your apology since the FBI confirmed it was BS today. Stop trying to be woke, nobody fucking cares",https://twitter.com/MAGAPhantom13/status/1275613716973748226
2020-06-24 02:16:24,Cyberdeliq,"https://youtu.be/adDD43CvrUc cursed",https://twitter.com/Cyberdeliq/status/1275613716613038085
2020-06-24 02:16:24,enchantingolcha,"Omg baejin :( get well soon!!https://twitter.com/balloon_wanted/status/1275612973298376706 …",https://twitter.com/enchantingolcha/status/1275613715321311233
2020-06-24 02:16:23,samone_eboni,"everybody who knows me knows how much i love this man @AugustAlsina already know this album will be pic.twitter.com/8plu1mx7W6",https://twitter.com/samone_eboni/status/1275613712460722181
2020-06-24 02:16:23,AwwJimin_ah,"I have focus playlist on Persona too I stream everyday @BTS_twt",https://twitter.com/AwwJimin_ah/status/1275613711093256193
2020-06-24 02:16:23,LoganJohnLocke1,"Making hump day hard for all of us... And I am not mad about it",https://twitter.com/LoganJohnLocke1/status/1275613710950649856
2020-06-24 02:16:22,JustJesse_35,"This man has one of the hardest entrances I’ve ever seen in anime! https://twitter.com/mutekifw/status/1236596853979992064 …",https://twitter.com/JustJesse_35/status/1275613709474205696
2020-06-24 02:16:22,VivianeCndida2,"Inverno GABIMARTINS BY NIGHT",https://twitter.com/VivianeCndida2/status/1275613708840992769
