date,username,to,replies,retweets,favorites,text,geo,mentions,hashtags,id,permalink
2020-06-24 02:21:35,prod_HAMADA,"yge is a company who doesn't know green screen and is very well known for being creative that's why i'm 100% sure treasure's mv will be a bomb that will make a strong impact to many people 트레저 데뷔 TREASURE AND TEUMES FOREVER #TREASURE #트레저 @ygtreasuremaker",https://twitter.com/prod_HAMADA/status/1275615019246317568
2020-06-24 02:21:34,maryleehuertaa,"GIRL SO AM I!",https://twitter.com/maryleehuertaa/status/1275615017921019905
2020-06-24 02:21:34,CherryHBF,"morning pic.twitter.com/z8N2OC49um",https://twitter.com/CherryHBF/status/1275615017426010114
2020-06-24 02:21:34,JustJustan,"I believe we’re also close to 16,000 who have signed a petition for you to resign, as well. Get going, time’s a wasting.",https://twitter.com/JustJustan/status/1275615015861538817
2020-06-24 02:21:34,doujindolll,"im scrolling on her page and the most jarring part is how many supporters she has,they think is all so fun and quirky???",https://twitter.com/doujindolll/status/1275615015471587328
2020-06-24 02:21:34,DaniLeigh,"NO LIMITS ON MADDEN 21 pic.twitter.com/ZYtrRWcm1I",https://twitter.com/DaniLeigh/status/1275615015077175296
2020-06-24 02:21:33,edmsessionsrdio,"Just found this #SirIvanMegaMix entry and it is https://twitter.com/VolaisOfficial/status/1273261893235466240 …",https://twitter.com/edmsessionsrdio/status/1275615013990875136
2020-06-24 02:21:33,unoriginalasf,"michelin @moon_jae_ @jae_moon_",https://twitter.com/unoriginalasf/status/1275615013680476160
2020-06-24 02:21:33,NYCGRIFF,"How 'bout that, indeed! Sometimes people have to get burned before they realize that is hot. Who knows how many people that this idiot has infected?",https://twitter.com/NYCGRIFF/status/1275615013475057664
2020-06-24 02:21:33,f3rNaNdOo1,"Awesome iherb code discount from iherb website use coupon discount code AVE1315 - works for all orders iherb code pic.twitter.com/5dzIR3wp3c",https://twitter.com/f3rNaNdOo1/status/1275615013395288071
2020-06-24 02:21:33,Jaquez_Williams,"Kentucky made an awesome decision, and so did ole miss. Proud for both programs!",https://twitter.com/Jaquez_Williams/status/1275615011960958977
2020-06-24 02:21:32,NorCalAlex,"Holy crap banded Hatfield safety bar squats hit the quads different lmaooooo",https://twitter.com/NorCalAlex/status/1275615009712648193
2020-06-24 02:21:32,DarthDrizzyTV,"Just gonna leave this here. Go @FacebookGaming !pic.twitter.com/HIwKdcjvAM",https://twitter.com/DarthDrizzyTV/status/1275615008009961474
2020-06-24 02:21:32,FlamosFlamini,"Tune into my radio station!! Layo & Bushwacka! - Love Story (Tim Deluxe Remix) . . . . https://streamer.radio.co/s72415ac38/listen …",https://twitter.com/FlamosFlamini/status/1275615007867392000
2020-06-24 02:21:32,JohnJay4040,"Waiting on urs",https://twitter.com/JohnJay4040/status/1275615007410204672
2020-06-24 02:21:32,TheYuseiFan,"whoooo caaaannn saaaayyyy where the roooaaadddd gooooooeeeessss",https://twitter.com/TheYuseiFan/status/1275615007355609092
2020-06-24 02:21:31,ohhDee__,"The Last of Us Part II in its entirety >>>>>>>>>>>> a fuckin masterpiece of not just gaming but any kind of media...great fucking job @Naughty_Dog yall dont miss!!! 10/10",https://twitter.com/ohhDee__/status/1275615006042841095
2020-06-24 02:21:31,block215,"If you ignore the trending topics & dry stick to your time line of like minded people, you're fine. When you reply to major accounts just use the quote reply so the idiots don't see the reply. That's how I operate at least",https://twitter.com/block215/status/1275615004901937153
2020-06-24 02:21:31,Corey_woo,"Yaz is on SF.",https://twitter.com/Corey_woo/status/1275615004784504832
2020-06-24 02:21:31,Kaeyo_AE,"Make living itself a motivation. ^^ Sometimes, things we are finding is only within ourselves. Anyway, I find home workouts and exercises great. :D",https://twitter.com/Kaeyo_AE/status/1275615004574707713
2020-06-24 02:21:30,soukatsu_,"yesss Mamo’s personality is always so BIG very excited to see and hear him talk about FKBU!",https://twitter.com/soukatsu_/status/1275615002066649091
2020-06-24 02:21:30,imravindr,"Game Time Mention ur Fav Cricketer Reply With Tag Mine : MS DHONI #70DaysForEnigmaPSPKBDay #VakeelSaab @PawanKalyan",https://twitter.com/imravindr/status/1275615001441529858
2020-06-24 02:21:30,StevenClarkson,"This is https://twitter.com/ManUtd/status/1275515216747323392 …",https://twitter.com/StevenClarkson/status/1275615001194070016
2020-06-24 02:21:30,TOXX_SICK,"Totes agree with this, fortunately Deng Xiaoping rejected his reform strategy offer. Gorbachev is also d reason of USSR fall.https://twitter.com/AndreVltchek/status/1275518144816259072 …",https://twitter.com/TOXX_SICK/status/1275615000833347585
2020-06-24 02:21:29,SilviaKunaahe,"Nosso Dia GABIMARTINS BY NIGHThttps://twitter.com/_biatuita/status/1275611251742322688 …",https://twitter.com/SilviaKunaahe/status/1275614996521762819
2020-06-24 02:21:29,bubbypham,"The lib.’s land ...",https://twitter.com/bubbypham/status/1275614995791872001
2020-06-24 02:21:28,maiden_head,"gonna post this on main blow it tf up",https://twitter.com/maiden_head/status/1275614992939847681
2020-06-24 02:21:28,_oluwatobiiiii,"yesss 3am is the new 9pm",https://twitter.com/_oluwatobiiiii/status/1275614991601799175
2020-06-24 02:21:28,hellobangpink,"THE QUEENS ARE COMING BACK #BLACKPINK #블랙핑크 #JISOO #지수 #JENNIE #제니 #ROSÉ #로제 #LISA #리사 @ygofficialblinkpic.twitter.com/lqUVykJhVH",https://twitter.com/hellobangpink/status/1275614990888624128
2020-06-24 02:21:28,gutengeekwp,"#GutenGeek - Perfect #Page #Builder #Gutenberg #Blocks #Plugin - #WordPress.org Download: https://wordpress.org/plugins/gtg-advanced-blocks/ … #gutengeek_blocks #gutenberg #gutenberg_wordpress #pagebuilder_gutenberg #wordpress_gutenberg #gutengeekpic.twitter.com/w4lEZkelKB",https://twitter.com/gutengeekwp/status/1275614990163079168
2020-06-24 02:21:27,CagedBirdsCafe,"What kinda idiot would live in one of those?",https://twitter.com/CagedBirdsCafe/status/1275614988959387648
2020-06-24 02:21:27,BUnterwagner,"STOP PLAYINGGGGG https://twitter.com/sportsgamerson/status/1275571251973705728 …",https://twitter.com/BUnterwagner/status/1275614988506464256
2020-06-24 02:21:27,HHere4trump,"Gotcha Patriot",https://twitter.com/HHere4trump/status/1275614987654959109
2020-06-24 02:21:26,ponycide,"im constantly having revelations that things don't have to be as difficult as i make them",https://twitter.com/ponycide/status/1275614984437821441
2020-06-24 02:21:26,tetchpine_bard,"//I’m game. Sounds awesome. Dms or TL",https://twitter.com/tetchpine_bard/status/1275614981506191360
2020-06-24 02:21:25,senoritav76,"Nope, I don’t see it. We watched that scenario crash and burn more than once.",https://twitter.com/senoritav76/status/1275614977278259201
2020-06-24 02:21:24,me_wo_tojite,"AHHHHH THAT WOULD BE AMAZING",https://twitter.com/me_wo_tojite/status/1275614976988737536
2020-06-24 02:21:24,Olfella,"Serkan, is there a story hidden in this data?https://twitter.com/suthernx/status/1275595193324933121?s=20 …",https://twitter.com/Olfella/status/1275614975994683392
2020-06-24 02:21:24,skinnylilweirdo,"i remember right before i deactivated i was feeling SO demotivated art wise and idk what even happened between then and now but ive been drawing almost everyday and im glad my motivation skyrocketed cause my recent on insta has 77 likes so.",https://twitter.com/skinnylilweirdo/status/1275614975608979458
2020-06-24 02:21:24,shootitbetter,"Love when my parents send me videos of my little shooters #Shootitbetter Better!pic.twitter.com/io0Bhz7TnP",https://twitter.com/shootitbetter/status/1275614975604805632
2020-06-24 02:21:24,cspiegs7,"Summer soundtrack Can’t wait for 20/20 @KnucklePuckILpic.twitter.com/YTUXZGtZKK",https://twitter.com/cspiegs7/status/1275614975441190914
2020-06-24 02:21:24,mikeypredsfan,"Sweet mask, Jussie",https://twitter.com/mikeypredsfan/status/1275614975063724034
2020-06-24 02:21:24,iamcarteer,"Boy dont call me angel",https://twitter.com/iamcarteer/status/1275614973616685056
2020-06-24 02:21:23,ZA_Taurus,"https://twitter.com/ZA_Taurus/status/1270812082183823362?s=20 … please check me out",https://twitter.com/ZA_Taurus/status/1275614972987559936
2020-06-24 02:21:23,bellatmark_,"How would you define Zionism?",https://twitter.com/bellatmark_/status/1275614972672966656
2020-06-24 02:21:23,BerbertJoelma,"R GABIMARTINS BY NIGHT",https://twitter.com/BerbertJoelma/status/1275614972341637123
2020-06-24 02:21:23,blanchej85,"@heyzeusxx on IG Live goin’",https://twitter.com/blanchej85/status/1275614972299616256
2020-06-24 02:21:23,Vega10121557,"Vega.new her pls be nice pic.twitter.com/uqMzXpThw7",https://twitter.com/Vega10121557/status/1275614972282880002
2020-06-24 02:21:23,AaronGregg21,"Another absolute jam from LC https://twitter.com/lukecombs/status/1275593441779625985 …",https://twitter.com/AaronGregg21/status/1275614971498561538
2020-06-24 02:21:22,_HaikusGoddess,"I’m in loooove!",https://twitter.com/_HaikusGoddess/status/1275614965588807680
2020-06-24 02:21:21,nyc_jay24,"Pain",https://twitter.com/nyc_jay24/status/1275614963869114368
2020-06-24 02:21:21,BDrew18,"Traveling. Democrats ball... – at Diamond Y Ranch",https://twitter.com/BDrew18/status/1275614961474166785
2020-06-24 02:21:21,VittiRayne,"Oh! Do you prefer cajun seasoning or the standard old bay? I like mine spicey cajun :3",https://twitter.com/VittiRayne/status/1275614961000218624
2020-06-24 02:21:20,McKinnonPhD,"Have a great week Mark.",https://twitter.com/McKinnonPhD/status/1275614959989329921
2020-06-24 02:21:20,LeonaId0,"Lyrics + les paroles m9awdin",https://twitter.com/LeonaId0/status/1275614958529785858
2020-06-24 02:21:20,Drewfacebabyy,"@AggroAstrend @SpencerCUH bro that’d be crazy",https://twitter.com/Drewfacebabyy/status/1275614957997039617
2020-06-24 02:21:20,MadhuReddy2730,"Manavallu Morning Morning Racha Racha Chestunnar ga Tweets And Rts Tho #PowerStar Fans Daa #VakeelSaab @PawanKalyan #70DaysForEnigmaPSPKBDay #70DaysForEnigmaPSPKBDay",https://twitter.com/MadhuReddy2730/status/1275614956981899264
2020-06-24 02:21:20,DQ_iAM,"Even tho I got the looks, personality, and charisma I stg that’s not why females I be associating with be fwm so hard it’s really cause I’m the rawest out . Omm Ian gone lie to no female ima let her know wtf it is and let her decide what she gone do.",https://twitter.com/DQ_iAM/status/1275614956625506305
2020-06-24 02:21:19,ceciliauytiepo,"Although I still can’t get over that Arrow ended that I can’t see my favorite ship Olicity, but Im glad they wrap up before the pandemic or else we can’t see the hot scenes of Olicity",https://twitter.com/ceciliauytiepo/status/1275614955874574336
2020-06-24 02:21:19,TheHelgy,"Reverse SWEEP !!!!!https://twitter.com/thehelgy/status/1275580435700031489 …",https://twitter.com/TheHelgy/status/1275614953039433730
2020-06-24 02:21:19,TENSHINAM0,"shore paps",https://twitter.com/TENSHINAM0/status/1275614952753999872
2020-06-24 02:21:18,FireWindmill,"LRT I'M IN PHYSICAL PAIN",https://twitter.com/FireWindmill/status/1275614951776956418
2020-06-24 02:21:18,Sandile_K1,"@TweezyZA x @ReasonHD- The realist",https://twitter.com/Sandile_K1/status/1275614951743393795
2020-06-24 02:21:18,eduKator7kod,"I see ya Big Guy...",https://twitter.com/eduKator7kod/status/1275614951328055296
2020-06-24 02:21:18,FlxmeRunner,"we cannot forget about those- https://twitter.com/softieindenial/status/1275614633269870593 …",https://twitter.com/FlxmeRunner/status/1275614950560608258
2020-06-24 02:21:18,TheUnicornDemon,"Any One In La Need A Roommate??? I Am Looking To Move Out There",https://twitter.com/TheUnicornDemon/status/1275614948736065537
2020-06-24 02:21:18,thebabyape,"Sometimes this game is a lot of Fun #apexlegends #apexlegendsps4 #apexseason5 #gaming #gamer #youtube #ps4 #twitch #videogames #battleroyale #playstation #instagaming #streamer #videogame #epicgames… https://www.instagram.com/p/CBzQN9nnSmJ/?igshid=1jfbgoo6ng2g …",https://twitter.com/thebabyape/status/1275614948534693888
2020-06-24 02:21:18,AKulp47,"Love the @Phillies in this 60 game season. Here is my Opening Day Lineup: @TheCUTCH22 LF @JTRealmuto C @bryceharper3 RF @rhyshoskins 1B @DidiG18 SS @Jeansegura02 3B @ScottyJetp4x 2B @adamhaseley7 CF I'm all up!",https://twitter.com/AKulp47/status/1275614947863662596
2020-06-24 02:21:17,kimchi029,"Realizing the longer that I'm single, the more I grow, which means that I know my next relationship will be #singlegirlthoughts #litafthoughts",https://twitter.com/kimchi029/status/1275614947456712705
2020-06-24 02:21:17,MatthewDerickx,"Id rather book you at the ranch",https://twitter.com/MatthewDerickx/status/1275614946538033152
2020-06-24 02:21:17,TawniBoyd,"That’s fantastic, you have great family history to be proud of!",https://twitter.com/TawniBoyd/status/1275614946370260993
2020-06-24 02:21:16,PJ34004965,"NO PRAYING! Get it DONE!! What DONT YOU ALL UNDERSTAND!!",https://twitter.com/PJ34004965/status/1275614942540881922
2020-06-24 02:21:16,micara_singh,"Yo, I know it’s deep in the 4ams but are we still going to be naming our future babies according to what our parents and in laws okay with? I don’t have a man but my baby names list is",https://twitter.com/micara_singh/status/1275614942499127297
2020-06-24 02:21:16,Wendy08737951,"I only pay about $7",https://twitter.com/Wendy08737951/status/1275614942289440769
2020-06-24 02:21:16,Cool_Mintz,"A spin off from Vampire diaries, but pure start with vampire diaries and then jump into the originals when the time is right",https://twitter.com/Cool_Mintz/status/1275614940628279302
2020-06-24 02:21:16,peppermintsodas,"still haven't seen The Swimmer or Mommie Dearest but DAMN this is a filmographypic.twitter.com/5gvHXRezPi",https://twitter.com/peppermintsodas/status/1275614940116791299
2020-06-24 02:21:16,jessect6,"Open Sources Ep14: Resignations, Riots and NASCAR Rac(ist)ing https://youtu.be/9Axonp8oEQA",https://twitter.com/jessect6/status/1275614939949027328
2020-06-24 02:21:16,Mrmyers1311,"Very important",https://twitter.com/Mrmyers1311/status/1275614939818921985
2020-06-24 02:21:15,fire,"and please, if I'm following your abuser, please let me know ( my DMs are open ) so I can take out the trash.",https://twitter.com/fire/status/1275614937566474240
2020-06-24 02:21:15,dattebiyos,"CAN YOU PLEASEhttps://twitter.com/midsmmrr/status/1275613747357323264 …",https://twitter.com/dattebiyos/status/1275614936471932928
2020-06-24 02:21:15,stevie2498,"SNAPCHAT THREAD NEED NEW FACES",https://twitter.com/stevie2498/status/1275614935486169088
2020-06-24 02:21:14,AskBoutVic,"Bruh this go hard asf for ur first time https://twitter.com/bully2kyt/status/1275509506785624067 …",https://twitter.com/AskBoutVic/status/1275614935184220161
2020-06-24 02:21:14,MimiWorkx,"#Newmusic I’m hype",https://twitter.com/MimiWorkx/status/1275614933779185664
2020-06-24 02:21:14,yeollieloey,"yaaas this album. this guuuurl https://music.apple.com/ph/album/cuz-i-love-you-super-deluxe/1494981947 …",https://twitter.com/yeollieloey/status/1275614933351202816
2020-06-24 02:21:14,KingDimented,"got myself a new Michael Kors bag and underwear. i love sales",https://twitter.com/KingDimented/status/1275614931329724417
2020-06-24 02:21:14,yas_czguerrero,"afterlife.",https://twitter.com/yas_czguerrero/status/1275614931224801281
2020-06-24 02:21:13,brendhalizz,"ismael",https://twitter.com/brendhalizz/status/1275614928490168320
2020-06-24 02:21:12,johnkim77,"Yo Jason, (not Eric) Hey hey hey hey hey hey hey hey hey Hey hey hey hey hey hey hey hey hey Hey hey hey hey hey hey hey hey hey Hey hey hey hey hey hey hey hey hey Hey hey hey hey hey hey hey hey hey Hey hey hey hey hey hey hey hey hey Hey hey hey hey hey hey hey hey hey!",https://twitter.com/johnkim77/status/1275614926837559297
2020-06-24 02:21:12,Nathanator18,"@AlanHerringtonn did you catch that clip of Beartooth new song being mixed on calebs insta? Sounds different and...heavy",https://twitter.com/Nathanator18/status/1275614924341796864
2020-06-24 02:21:12,RayrrdWp,"thank youuuu po",https://twitter.com/RayrrdWp/status/1275614923419049985
2020-06-24 02:21:12,NisoSux,"Nope",https://twitter.com/NisoSux/status/1275614923113054210
2020-06-24 02:21:11,KingVibes47,"Damn i need some motivation",https://twitter.com/KingVibes47/status/1275614921728888832
2020-06-24 02:21:11,justinibikinii,"Fuck this whole ass show",https://twitter.com/justinibikinii/status/1275614921577754624
2020-06-24 02:21:11,JNK19960116,"No wonder why everyone wants to learn Jennie’s expression! https://twitter.com/souljennie/status/1275595241760780289 …",https://twitter.com/JNK19960116/status/1275614920969613312
2020-06-24 02:21:11,rob_B21,"High Off Life @1future https://twitter.com/taiadanielle/status/1275582964261412864 …",https://twitter.com/rob_B21/status/1275614920583852032
2020-06-24 02:21:11,Sam_undefined,"“Can i get what they are eating “",https://twitter.com/Sam_undefined/status/1275614920147718145
2020-06-24 02:21:10,meqanasty,"i am not ""proud"" to see him do this because it is only performative and will make no material difference. its a slap in the face.",https://twitter.com/meqanasty/status/1275614917152948225
2020-06-24 02:21:10,Seunjiar,"Hello @iHeartRadio I’d like to request #100Ways by @JacksonWang852 thankspic.twitter.com/eEnnzoG2cf",https://twitter.com/Seunjiar/status/1275614916695777280
2020-06-24 02:21:10,SuperRexter,"Un directo tranquilo de pana Check out this clip! rextergamer7u7 streaming Minecraft!https://clips.twitch.tv/ExpensiveSnappyHummingbirdDAESuppy …",https://twitter.com/SuperRexter/status/1275614915542290432
2020-06-24 02:21:10,aKND_,"No don’t go there they nasty asl",https://twitter.com/aKND_/status/1275614915173265408
2020-06-24 02:21:10,austinprimid,"Lucky he got that fucking badge",https://twitter.com/austinprimid/status/1275614914883678209
2020-06-24 02:21:10,ARSONDOER,"when charlie stood up for that juggalo kid ? ally.",https://twitter.com/ARSONDOER/status/1275614914334404608
2020-06-24 02:21:09,GayDreaming1,"If you're into TV series, the actor who plays the dad in Everwood is . pic.twitter.com/MBLh8Mw5nj",https://twitter.com/GayDreaming1/status/1275614914090946560
2020-06-24 02:21:09,leslie_balanay,"Access and Affordable... what an asshole.",https://twitter.com/leslie_balanay/status/1275614913902280704
2020-06-24 02:21:09,kam7horne,"This pic is https://twitter.com/saintvoss/status/1275264591384080384 …",https://twitter.com/kam7horne/status/1275614912677507072
2020-06-24 02:21:08,SandraSteele2,"Atwater Period!",https://twitter.com/SandraSteele2/status/1275614909095649280
2020-06-24 02:21:08,BigGuardNaz,"no bro i listen to REAL rap like NF",https://twitter.com/BigGuardNaz/status/1275614908764377089
2020-06-24 02:21:08,RogueSocialWrkr,"New episode of Rogue Social Worker TV will drop tomorrow 9am! Where are all the #socialworkers for #UBI??? The one is, as the kids say, straight fire with special guest @diane_pagen! Shit gets real in this one folks... #YangGang #SocialJustice #socialwork #socialworkerpic.twitter.com/R5d6PM7sqD",https://twitter.com/RogueSocialWrkr/status/1275614907074056196
2020-06-24 02:21:07,HHere4trump,"Gotcha Patriot",https://twitter.com/HHere4trump/status/1275614905731821568
2020-06-24 02:21:07,PawanKalyanTM,"350K - Before 8:20 AM SHOW SOME RAMPAGE #70DaysForEnigmaPSPKBDay #VakeelSaab | @PawanKalyan",https://twitter.com/PawanKalyanTM/status/1275614905438072832
2020-06-24 02:21:07,kevlos96,"Let’s go @Marlins",https://twitter.com/kevlos96/status/1275614905106866177
2020-06-24 02:21:07,codypd,"When were those protests? How long is the incubation? What is the turnaround on testing?pic.twitter.com/WYZtcCaK4p",https://twitter.com/codypd/status/1275614904569888768
2020-06-24 02:21:07,luvricoo,"Lets go",https://twitter.com/luvricoo/status/1275614904062406656
2020-06-24 02:21:07,JaTakeFlight,"Travis",https://twitter.com/JaTakeFlight/status/1275614902707773443
2020-06-24 02:21:07,ravnplanet,"everytime I watch the seoho cut of it’s okay, I just think about how much he actually like rapping LOL like his “so I can’t rap :((“ —pic.twitter.com/WNN8Yf48UQ",https://twitter.com/ravnplanet/status/1275614902535643137
2020-06-24 02:21:06,ThatBertie,"You heard it here first folks! @realDonaldTrump is now responsible for the weather. https://twitter.com/joebiden/status/1275558250109272064 …",https://twitter.com/ThatBertie/status/1275614900220506112
2020-06-24 02:21:06,LennoxKane007,"Taste",https://twitter.com/LennoxKane007/status/1275614899817897987
2020-06-24 02:21:06,lives_empowered,"If you want to melt away large measures of your surplus fat briskly this unique training explains the wayshttp://blog.warriornetwork.global/what-to-do-if-you-are-a-fat-wobbly-woman-to-get-slender-sexy-again …",https://twitter.com/lives_empowered/status/1275614898433789952
2020-06-24 02:21:05,Papa_Endeavor,"He leaned down once more placing kiss After kiss all over Hoshi's face slowly making his way down to his neck, his hands holding onto his hips tightly. ""I love you.. Never forget that...""https://twitter.com/DarkestLuxure/status/1275614040392433665 …",https://twitter.com/Papa_Endeavor/status/1275614897490071553
2020-06-24 02:21:05,PressHotSpot,"This one is still good. Lol",https://twitter.com/PressHotSpot/status/1275614896500195328
2020-06-24 02:21:05,morrellmade,"Shit... you crazy as hell",https://twitter.com/morrellmade/status/1275614896147714048
2020-06-24 02:21:05,dcelander,"I’ve got your back and you’ve got my back. We’ll beat this RICO charge together! #WeAreInThisTogether",https://twitter.com/dcelander/status/1275614895635984384
2020-06-24 02:21:04,HaveTeef,"Those colors do pop and those look great!!Hope you're recovering well with your back surgery and I'm sure it can be painful and stressful. Hang in there and the fam is always here if you need anything!",https://twitter.com/HaveTeef/status/1275614892091899906
2020-06-24 02:21:04,Urs_SantoshRaj,"CRAZE = POWERSTAR... His Name On Screen Gives GOOSEBUMPS.. #70DaysForEnigmaPSPKBDay #VakeelSaab @PawanKalyan @Harinani_pic.twitter.com/4NdBLiVyVP",https://twitter.com/Urs_SantoshRaj/status/1275614891227836418
2020-06-24 02:21:04,yusufsonmez411,"Working iherb coupon coupon from iherb store use code discount code AVE1315 - works for all orders iherb code pic.twitter.com/qXFYdSMNhB",https://twitter.com/yusufsonmez411/status/1275614890590265346
2020-06-24 02:21:04,rio_westside,"@no_lyrix WITH THE VISUALS. WASTED YOUTH VIDEO COMING SOON pic.twitter.com/8WTFZTzL7p",https://twitter.com/rio_westside/status/1275614889818460162
2020-06-24 02:21:04,momof2buoys,"Brotha K is mad! Have never heard you raise your voice like that. We’ve all had it! Prayers...our country needs God!",https://twitter.com/momof2buoys/status/1275614889202106368
2020-06-24 02:21:03,BerbertJoelma,"B GABIMARTINS BY NIGHT",https://twitter.com/BerbertJoelma/status/1275614888740741120
2020-06-24 02:21:02,mahoganiii__0,"It’s the voice for mehttps://twitter.com/meetthewoo2/status/1275489295462268930 …",https://twitter.com/mahoganiii__0/status/1275614884659630080
2020-06-24 02:21:02,Murtezax,"Lil Baby - Global just hits different for me",https://twitter.com/Murtezax/status/1275614884265328643
2020-06-24 02:21:02,17Manahil,"THANKS BRUH YOU A DOPE BISH TOO",https://twitter.com/17Manahil/status/1275614883510452225
2020-06-24 02:21:02,Muntaha_says,"I missed you",https://twitter.com/Muntaha_says/status/1275614883304914944
2020-06-24 02:21:02,MrsKTolley,"Please! @BobanMarjanovic @tobias31 #lava https://twitter.com/tobias31/status/1275607049863401473 …",https://twitter.com/MrsKTolley/status/1275614882897985537
2020-06-24 02:21:02,GOD1ST_Spade,"Call me a hypocrite, ridicule me, call me a coward, conspiracy theorist .. It's fine, I still love you from the top of my heart.. All I want you to do is REPENT and accept Jesus Christ as your Lord and Savior. You don't have to if you don't want to. Very optional. #GOD1ST",https://twitter.com/GOD1ST_Spade/status/1275614881539072000
2020-06-24 02:21:02,TheIzzyNelly,"I'm following anyone that RT this",https://twitter.com/TheIzzyNelly/status/1275614881094553600
2020-06-24 02:21:01,1RixhFuture_,"toosii be slidin fr https://twitter.com/toosii2x/status/1275597639359148033 …",https://twitter.com/1RixhFuture_/status/1275614879743905793
2020-06-24 02:21:01,vc,"I have burned bridges but never the boats.",https://twitter.com/vc/status/1275614879546667011
2020-06-24 02:21:01,TamburriSandro,"You mean that",https://twitter.com/TamburriSandro/status/1275614876975710210
2020-06-24 02:21:01,TheCultofTayla,"WOW looking sexy tonight",https://twitter.com/TheCultofTayla/status/1275614876577259521
2020-06-24 02:21:00,McBittypaws,"Yeah stay away from them and anyone affiliated. The owner Chris Bryant/Simba Lion has a warrant for his arrest in the UK for blackmailing people to get money, grooming minors and basically making a furry cult....the whole thing is insane",https://twitter.com/McBittypaws/status/1275614876438650881
2020-06-24 02:21:00,rafo2k,"Everyone is ganging up on me",https://twitter.com/rafo2k/status/1275614876044455936
2020-06-24 02:21:00,ms4cnidocyte,"Infiniti Q50 3.7L Fire Map [Fabricated Single Exit Cold Start, How to &amp; ] S9:E11 Mils Garage #YouTubeChannel https://www.youtube.com/watch?v=PJ7PVboO7ec&list=PLb1yla77QSRgCXffqTvHsqXx-9fE8Wfbk … #cars #jdm #automotive #modified #LOUD #youtube #g37 #nissan #skyline",https://twitter.com/ms4cnidocyte/status/1275614875956457472
2020-06-24 02:21:00,cocokjn,"CMON QUEENS GIVE US EVERYTHING #HowYouLikeThat_D2pic.twitter.com/9YZBTQCRpQ",https://twitter.com/cocokjn/status/1275614875260084225
