date,username,to,replies,retweets,favorites,text,geo,mentions,hashtags,id,permalink
2020-06-23 03:44:37,eternallykai_,"ladies and gents the Huening siblings and their signature smirk @TXT_memberspic.twitter.com/bfBNfLx05r",https://twitter.com/eternallykai_/status/1275273527835287552
2020-06-23 03:44:36,JeromeAEpps,"We think alike... :)",https://twitter.com/JeromeAEpps/status/1275273524320653318
2020-06-23 03:44:35,fkapaola,"Y’all believe in right person wrong time?",https://twitter.com/fkapaola/status/1275273519236972544
2020-06-23 03:44:35,msjadaw,"I used to fw my box. Now it’s just my Xbox. Sksk",https://twitter.com/msjadaw/status/1275273518922387456
2020-06-23 03:44:34,tittykawa,"babe wtf we literally just got married",https://twitter.com/tittykawa/status/1275273515793596417
2020-06-23 03:44:29,byulsjen,"also tiddies",https://twitter.com/byulsjen/status/1275273496415948802
2020-06-23 03:44:29,AlexNadii,"LMFAO please stop tweeting https://twitter.com/xarxan_/status/1275195605531402240 …",https://twitter.com/AlexNadii/status/1275273494314586112
2020-06-23 03:44:27,Bandssssssss,"Get here then",https://twitter.com/Bandssssssss/status/1275273488773926915
2020-06-23 03:44:26,DragonOfRias,"""Maybe~""",https://twitter.com/DragonOfRias/status/1275273484956991488
2020-06-23 03:44:21,DJProdigy_809,"RIGHT! Lmao these youngins do not know",https://twitter.com/DJProdigy_809/status/1275273460261031936
2020-06-23 03:44:20,chuucals,"call me mentally ill but my legs kinda look sexy rn theres cuts and bruises on them from my bike ride some of them",https://twitter.com/chuucals/status/1275273456238592000
2020-06-23 03:44:18,naqireo,"feeling kinda unsexy today maybe ill stay off for while yeah yeah",https://twitter.com/naqireo/status/1275273450303574016
2020-06-23 03:44:17,Gorgeous1__Keee,"That part https://twitter.com/_1kierra/status/1274912833893957633 …",https://twitter.com/Gorgeous1__Keee/status/1275273446243667968
2020-06-23 03:44:17,jeonginPD,"sexc",https://twitter.com/jeonginPD/status/1275273444184162310
2020-06-23 03:44:15,NMekonennn,"I do be simpin for someone @dixiedamelio",https://twitter.com/NMekonennn/status/1275273436739383296
2020-06-23 03:44:15,Greatest_Ronin,"Who are you? Where are ya from? Almost every post of yours us somehow related with INDIA-CHINA conflict and every time you mock Chinese by claiming that China is wrong( actually, it is) Its strange, isn't it?",https://twitter.com/Greatest_Ronin/status/1275273435975872518
2020-06-23 03:44:12,missbrinahenson,"Not a comparison it’s a metaphor. Lol I can see why you didn’t understand it though. pic.twitter.com/uRRynt3e6l",https://twitter.com/missbrinahenson/status/1275273424349388800
2020-06-23 03:44:12,MoxeeBeMe,"Yikes! Glad everyone is okay",https://twitter.com/MoxeeBeMe/status/1275273423032250368
2020-06-23 03:44:11,Yeshvini6,"His Intense looks wlcm Mai!! #LBC2photoshoot",https://twitter.com/Yeshvini6/status/1275273422122045440
2020-06-23 03:44:10,Jujuthewizard,"For YOUUUUUU ima let you hit it for free pic.twitter.com/cXzaG8zJH9",https://twitter.com/Jujuthewizard/status/1275273415407083520
2020-06-23 03:44:09,mikko4216,"It was pitiful https://twitter.com/DeadlineWH/status/1275184450205290497 …",https://twitter.com/mikko4216/status/1275273410764058624
2020-06-23 03:44:08,innerchild_neha,"Write ""Taehyung loves your....and let your keyboard complete the rest",https://twitter.com/innerchild_neha/status/1275273406460514305
2020-06-23 03:44:08,danieIpadiIa,"SHE MAH TRAP QUEEN",https://twitter.com/danieIpadiIa/status/1275273406213226496
2020-06-23 03:44:06,linomaid,"exactly",https://twitter.com/linomaid/status/1275273398885715968
2020-06-23 03:44:04,NiqRobinson,"like TACOS for starters",https://twitter.com/NiqRobinson/status/1275273392686596102
2020-06-23 03:44:03,_pupsicle,"of course it's shouto https://twitter.com/cherryredriots/status/1275259719876145153 …",https://twitter.com/_pupsicle/status/1275273384948097025
2020-06-23 03:43:59,yvtadores,"nooo itd be hotter",https://twitter.com/yvtadores/status/1275273371316629507
2020-06-23 03:43:58,tittykawa,"please be friends with me",https://twitter.com/tittykawa/status/1275273365708853249
2020-06-23 03:43:57,cincinati51,"Fav maybe",https://twitter.com/cincinati51/status/1275273362990751747
2020-06-23 03:43:57,fkapaola,"Me smilin thru the pain #SAD pic.twitter.com/QRroSzoEHx",https://twitter.com/fkapaola/status/1275273359924719616
2020-06-23 03:43:56,C0SMICCAM,"whereve u want bae",https://twitter.com/C0SMICCAM/status/1275273359245357057
2020-06-23 03:43:55,PvPkw2,"It's a stick of joy for a certain gender",https://twitter.com/PvPkw2/status/1275273353973153793
2020-06-23 03:43:51,Jsheff001,"Cars don’t come until you on campus unless you a lock",https://twitter.com/Jsheff001/status/1275273336097038338
2020-06-23 03:43:51,djspheres,"unless..",https://twitter.com/djspheres/status/1275273335727968257
2020-06-23 03:43:50,kaeethstallion,"ion always have my pussy on me. sometimes i leave her at the crib.",https://twitter.com/kaeethstallion/status/1275273334306017287
2020-06-23 03:43:49,watermelonie16,"THIS BETTER MEANS SOMETHING OR IM CRYINGhttps://twitter.com/whoisaddison/status/1275272470447001600 …",https://twitter.com/watermelonie16/status/1275273328710897666
2020-06-23 03:43:49,essenceofqueen,"Okay Luke!!!! Thug action #TheChi",https://twitter.com/essenceofqueen/status/1275273327620259841
2020-06-23 03:43:47,OCBo9,"Also unsure what I truly want from a woman long-term. Short-term? Dating (casual or somewhat committed), LTR…tho my body def wants one thing Maybe a more meaningful LTR much later. Re-marriage? Unsure. Possibly, but no clear thoughts on that now, obviously.",https://twitter.com/OCBo9/status/1275273320099835905
2020-06-23 03:43:46,Fadi_Bear,"What about the wrestlers who tell people to ""suck it""? Can they be trusted?",https://twitter.com/Fadi_Bear/status/1275273316836749312
2020-06-23 03:43:43,_BaAkaA_1,"You like it",https://twitter.com/_BaAkaA_1/status/1275273301359722496
2020-06-23 03:43:42,JunlinSong1,"Communists: imma learn how lgbtq stop different ideas",https://twitter.com/JunlinSong1/status/1275273297354162176
2020-06-23 03:43:42,tittykawa,"Hey! I am Mei, and I am new to anitwt! I really love the anime Haikyuu. My favorite character is Miya Atsumu, because he reminds me of my all time favorite character Sangwoo. He is extremely sexy. I look forward to making new friends! Please RT/Like/Follow this tweet!",https://twitter.com/tittykawa/status/1275273296779644928
2020-06-23 03:43:39,JustforJenjen,"Oh a yg stan i am not denying it i mean who's 2ne1?not all people knows about them, its just you have this kind of delulu thinks they're the biggest gg in their generation, where in fact there's snsd, wg,kara, 4minute, fx exist. You are all example of ""i'm a blink but..."" lol",https://twitter.com/JustforJenjen/status/1275273284276285442
2020-06-23 03:43:38,shutupmirtaa,"he so smegsy",https://twitter.com/shutupmirtaa/status/1275273281004765184
2020-06-23 03:43:37,Pookie_52,"Job start training next week",https://twitter.com/Pookie_52/status/1275273278265987072
2020-06-23 03:43:37,TheBiasedBarner,"Or a 9 win Auburn team . Still unbeaten against Sabear.",https://twitter.com/TheBiasedBarner/status/1275273276948955136
2020-06-23 03:43:37,BirdJ713,"White democrats segregating black people....yep, nothing has changed.",https://twitter.com/BirdJ713/status/1275273275766198272
2020-06-23 03:43:36,_E_Van,"Damn sooo hot~~",https://twitter.com/_E_Van/status/1275273274830786560
2020-06-23 03:43:36,fkapaola,"CHANGE THAT PIC BEFORE I BLOCK YO ASS",https://twitter.com/fkapaola/status/1275273272288894976
2020-06-23 03:43:35,sopesandwich,"I’ll call you mine",https://twitter.com/sopesandwich/status/1275273268610678785
2020-06-23 03:43:34,vonnyvonne__,"One day https://twitter.com/vistaearth/status/1275268416836960256 …",https://twitter.com/vonnyvonne__/status/1275273264625942528
2020-06-23 03:43:33,ivett_0127,"Low key was missing my grandpa heavy today",https://twitter.com/ivett_0127/status/1275273260695986176
2020-06-23 03:43:32,daveanderson019,"Your favorite wrestler is Becky Lynch Your name is Mary You're deadly",https://twitter.com/daveanderson019/status/1275273257172832257
2020-06-23 03:43:31,treena_blair,"Not the best thing to co medal in but I'm a pro at it and you probably are too",https://twitter.com/treena_blair/status/1275273250499702788
2020-06-23 03:43:30,watermelonie16,"DONT MAKE ME MISS DECEMBER WHY ARE YOU MAKING ME CRY ADDISON",https://twitter.com/watermelonie16/status/1275273247479730176
2020-06-23 03:43:29,rubecher,"The man can at least afford a decent spray tan",https://twitter.com/rubecher/status/1275273245441179648
2020-06-23 03:43:28,fkapaola,"LMFAOOOOO",https://twitter.com/fkapaola/status/1275273240819036160
2020-06-23 03:43:26,obismiles231,"Both the stud and the b*tch speaking in professional terms tho",https://twitter.com/obismiles231/status/1275273230694191109
2020-06-23 03:43:25,lovely_univrs,"GUESS WHO KAREN IS GONNA GET INTO NEXT",https://twitter.com/lovely_univrs/status/1275273226701148160
2020-06-23 03:43:23,MarcoBacanaya,"Karma is my kind of anime bby",https://twitter.com/MarcoBacanaya/status/1275273220065648641
2020-06-23 03:43:21,ohitskristinaa,"my white vans come in tm and i’m hype",https://twitter.com/ohitskristinaa/status/1275273211371028482
2020-06-23 03:43:21,kman236,"Next time aim for the camera",https://twitter.com/kman236/status/1275273209139679233
2020-06-23 03:43:20,ItsKiprotich1,"Talking of Kenyan Judiciary there is a network of Lawyers working in hand in hand with the judges to defraud and determined cases based on the amount of money you give. We can't operate this way #OmbetaUnMasked",https://twitter.com/ItsKiprotich1/status/1275273207449358338
2020-06-23 03:43:19,DavidHutch,"Make Trump make the deal, it’s his illegitimate legal spawn.",https://twitter.com/DavidHutch/status/1275273203695435776
2020-06-23 03:43:19,estreasays,"And here it is, everyone's favourite question, the family role assignment Eunha doesn't assign anything she just wants to be the family pet so everyone spoils her Yuju thinks Eunha is mom, SinB is dad, lil sis is Sowon, older sis is Yerin, and Umji is her twin",https://twitter.com/estreasays/status/1275273202537648128
2020-06-23 03:43:18,_PrincessSnow_,"Stop playing with meeeee",https://twitter.com/_PrincessSnow_/status/1275273197370433537
2020-06-23 03:43:16,MiiPmt,"hmmm ne",https://twitter.com/MiiPmt/status/1275273190932176902
2020-06-23 03:43:16,dankmgg,"why the universe gassin me doe",https://twitter.com/dankmgg/status/1275273189577256960
2020-06-23 03:43:14,watermelonie16,"THIS CANT BE HAPPENING IS THIS-",https://twitter.com/watermelonie16/status/1275273182329569288
2020-06-23 03:43:14,TheRealJax2,"No idea what that b!tch screaming about but I’d smash.",https://twitter.com/TheRealJax2/status/1275273180245041153
2020-06-23 03:43:11,fineassauntie_,"Moodpic.twitter.com/AsDekorJf7",https://twitter.com/fineassauntie_/status/1275273170241515520
2020-06-23 03:43:11,ghinapalestina,"this emoji is so fucking hilarious LMMMAAOOOOOOOOOO",https://twitter.com/ghinapalestina/status/1275273168920469506
2020-06-23 03:43:08,MaxxPrimeHigh,"Sold.. Ya know, just in cucks",https://twitter.com/MaxxPrimeHigh/status/1275273157461639168
2020-06-23 03:43:06,glycoIysis,"you can send them to me",https://twitter.com/glycoIysis/status/1275273147932180481
2020-06-23 03:43:05,Makayla737821,"Urm nothing, just look at my profile pic, aren’t I cute?",https://twitter.com/Makayla737821/status/1275273142043369473
2020-06-23 03:43:04,itsmona_lisaaa,"I got a Kia but, I treat it like an Audi gotta wash my baby tomorrow",https://twitter.com/itsmona_lisaaa/status/1275273139660914690
2020-06-23 03:43:04,kevinpadilla_08,"Don’t let her disrespect you bro",https://twitter.com/kevinpadilla_08/status/1275273138373189632
2020-06-23 03:43:04,_shradharajput_,"Dude I'm 23",https://twitter.com/_shradharajput_/status/1275273137454641153
2020-06-23 03:43:02,watermelonie16,"OMG GIRL DONT MAKE ME CRY OMG OMG OMG",https://twitter.com/watermelonie16/status/1275273131989569536
2020-06-23 03:43:02,j1nkookr,"put a finger down pic.twitter.com/aSGwsxmhGh",https://twitter.com/j1nkookr/status/1275273131721199617
2020-06-23 03:42:57,amateraslut,"i mean who wouldnt dare",https://twitter.com/amateraslut/status/1275273107989651456
2020-06-23 03:42:56,newb198585,"Gotta do something special for that fan",https://twitter.com/newb198585/status/1275273104118464512
2020-06-23 03:42:55,voraciousvanraj,"Yeah original but not at all durable",https://twitter.com/voraciousvanraj/status/1275273101442351104
2020-06-23 03:42:54,angie_neo,"@wendyy_light hello? What were we talking about last night? https://twitter.com/trendingweibo/status/1275271640218308608 …",https://twitter.com/angie_neo/status/1275273096249761793
2020-06-23 03:42:53,JustinDavids94,"Do tweets like these actually work asking for a friend? https://twitter.com/Ina_Propriette/status/1275172800525938695 …",https://twitter.com/JustinDavids94/status/1275273092236009474
2020-06-23 03:42:51,Henry92605919,"I meannn if you're single, I have a huge preference for older women",https://twitter.com/Henry92605919/status/1275273082974793730
2020-06-23 03:42:49,AGHoee,"congrats to nicki, even though i never heard or stream the song cus i dont want give streams to pdf. nicki deserve this #1 alone https://twitter.com/chartdata/status/1275121741677957122 …",https://twitter.com/AGHoee/status/1275273077232857089
2020-06-23 03:42:49,hottgirlbless,"I be turnin down niccas like I got a nicca",https://twitter.com/hottgirlbless/status/1275273075609591809
2020-06-23 03:42:48,YourGare,"Are you now....",https://twitter.com/YourGare/status/1275273070215823362
2020-06-23 03:42:44,Smileetee16,"Booooooy some tea from high school just made me",https://twitter.com/Smileetee16/status/1275273057062522881
2020-06-23 03:42:44,HarleySin_,"Is there a such thing as black light tattoos that only show up when you have a black light on??? Or maybe even only glow in the dark when the lights are out? I’m asking cuz of reasons...",https://twitter.com/HarleySin_/status/1275273054239801344
2020-06-23 03:42:42,phatbelly,"j ordered tha lil kit new bitch loading",https://twitter.com/phatbelly/status/1275273047583457282
2020-06-23 03:42:42,daphhhhhhh_,"Toss me around a bit",https://twitter.com/daphhhhhhh_/status/1275273047117684736
2020-06-23 03:42:40,animeman18,"Must be a satellite phone.",https://twitter.com/animeman18/status/1275273039740121088
2020-06-23 03:42:39,DJRaveMashupsYT,"#Affinitweet Stolen Kiss stardashie would kiss you around the corner... And you, who would do it? via https://affinitweet.com/stolen-kiss pic.twitter.com/QdmbvZjJ4D",https://twitter.com/DJRaveMashupsYT/status/1275273032760807424
2020-06-23 03:42:38,lesbianstanlon,"they're all like sue deserves more recognition no she doesn't",https://twitter.com/lesbianstanlon/status/1275273030126583810
2020-06-23 03:42:37,TxMolasses,"Before, during, and after is the correct answer my love. https://twitter.com/RachieRach429/status/1275183142362464256 …",https://twitter.com/TxMolasses/status/1275273027840811009
2020-06-23 03:42:36,BessemerGirl_,"guess my love ain’t mean that much to you, fucking these hoes meant too damn much to you",https://twitter.com/BessemerGirl_/status/1275273023319412741
2020-06-23 03:42:36,blingdamelio,"addison knows what's really good",https://twitter.com/blingdamelio/status/1275273020345651201
2020-06-23 03:42:36,69____97,"u wouldn’t be lying so",https://twitter.com/69____97/status/1275273019896758272
2020-06-23 03:42:34,camacholily__,"Exactly, you know what I like",https://twitter.com/camacholily__/status/1275273014146465795
2020-06-23 03:42:31,_killset,"i got it from hot topic",https://twitter.com/_killset/status/1275273002146504705
2020-06-23 03:42:29,Swa99er_J,"See @OfficialDTexada you even got my neice @beautybarrr_ ready for a tattoo.",https://twitter.com/Swa99er_J/status/1275272991094571010
2020-06-23 03:42:28,imthesongbirdy,"Aw. Looky. You’re all caught up in your feels. Careful, now. You need to save all that maladaptive coping fury for the cross burning. Hey. Glass half full...you won’t need your corona virus mask. K. Good talk.",https://twitter.com/imthesongbirdy/status/1275272988930310150
2020-06-23 03:42:28,gloTroy,"I might be tripping but I miss that twin xl mf used be knocked out on that bih",https://twitter.com/gloTroy/status/1275272986677989377
2020-06-23 03:42:27,keslerlim,"I got 0 followers",https://twitter.com/keslerlim/status/1275272984035422208
2020-06-23 03:42:26,beatsme123,"Hmmmmm namorem",https://twitter.com/beatsme123/status/1275272981468647425
2020-06-23 03:42:25,rchllnclld,"Can we all agree that cooking & cleaning is a basic life skill and not a gender role?",https://twitter.com/rchllnclld/status/1275272974652682241
2020-06-23 03:42:24,NiqRobinson,"Same SIS https://twitter.com/the_same_og/status/1275272593382281217 …",https://twitter.com/NiqRobinson/status/1275272973306466309
2020-06-23 03:42:24,AminaAlisafi,"girl",https://twitter.com/AminaAlisafi/status/1275272972031406084
2020-06-23 03:42:20,holly86385150,"160k+ sealed indictments Who’s a Moron?",https://twitter.com/holly86385150/status/1275272955589619713
2020-06-23 03:42:20,ccdoll1,"Lol another day another dollar",https://twitter.com/ccdoll1/status/1275272954159542272
2020-06-23 03:42:16,lTOSHlRlN,"i wanna draw more catboys on whiteboards now pic.twitter.com/ltNUEpGbiw",https://twitter.com/lTOSHlRlN/status/1275272938229383169
2020-06-23 03:42:14,Yvonne_H_,"@linusgsebastian is kind of cute when he's cleaned up! But also the kind of person who thinks using a vacuum on his back is a good idea...pic.twitter.com/UWhviEs7Lc",https://twitter.com/Yvonne_H_/status/1275272930822221824
2020-06-23 03:42:13,halsfilm,"OKAY OMG i’m gonna watch it tomorrow",https://twitter.com/halsfilm/status/1275272926590316546
2020-06-23 03:42:13,_aSTARRisborn_,"God I’ve been so patient. I thank you for everything.",https://twitter.com/_aSTARRisborn_/status/1275272925302710273
2020-06-23 03:42:12,a_hodan_a,"Haveyoueverbeensnakedbyafriendthenjustforthecloutthey’lldoitagain pic.twitter.com/lthGlZdenJ",https://twitter.com/a_hodan_a/status/1275272919707344896
2020-06-23 03:42:11,rhojan,"Peppa pig loves muddy puddles https://twitter.com/buitengebieden_/status/1272148068289449984 …",https://twitter.com/rhojan/status/1275272916985413633
2020-06-23 03:42:11,ionfumble,"she cute ain’t she",https://twitter.com/ionfumble/status/1275272915177607169
2020-06-23 03:42:09,j4maisvus,"WEEEEEE i just think cancer and capricorn make a dream team",https://twitter.com/j4maisvus/status/1275272908118487040
2020-06-23 03:42:07,pdm_j20,"Y’all afraid of breaking a nail tho",https://twitter.com/pdm_j20/status/1275272898911952897
2020-06-23 03:42:04,Josadec_RR,"Beautufull eyes!! And...",https://twitter.com/Josadec_RR/status/1275272888828952577
2020-06-23 03:42:04,LightskinMya_,"My nigga gone think I’m too nonchalant because there is nothing a mf can really do atp to hurt me .",https://twitter.com/LightskinMya_/status/1275272886685708294
2020-06-23 03:42:01,pDk2ZQ8lWHpJOGY,"6 religious leaders of Hong Kong annouced they are support National Security Law for Hong Kong. They’re betrayed #HongKongers and their GOD! None of them worth for respect! https://www.thestandnews.com/politics/%E5%A4%A7%E5%85%AC%E5%A0%B1-%E5%AE%97%E6%95%99%E9%A0%98%E8%A2%96%E6%99%A4%E4%B8%AD%E8%81%AF%E8%BE%A6-%E7%A8%B1%E7%B5%90%E5%90%88%E5%AE%97%E6%95%99%E6%95%99%E7%BE%A9%E9%85%8D%E5%90%88%E5%9C%8B%E5%AE%89%E6%B3%95-%E6%B9%AF%E6%BC%A2-%E9%84%BA%E4%BF%9D%E7%BE%85%E7%AD%89%E5%87%BA%E5%B8%AD/ … #hongKongindependence #HongKongNeedsHelp #BoycottChina #ChinaMustfallpic.twitter.com/3WqW0VtZpU",https://twitter.com/pDk2ZQ8lWHpJOGY/status/1275272875084140545
2020-06-23 03:42:00,_BaAkaA_1,"You pretend you dont see it but in reality you do",https://twitter.com/_BaAkaA_1/status/1275272870260858880
2020-06-23 03:41:59,okayitsSam98,"Its a great day to end careers pic.twitter.com/k0CeLsmxvk",https://twitter.com/okayitsSam98/status/1275272865005223936
2020-06-23 03:41:59,NOOOOOOOOOOOTIZ,"sexy mask",https://twitter.com/NOOOOOOOOOOOTIZ/status/1275272864959213575
2020-06-23 03:41:58,bevsembers,"yes the dolls",https://twitter.com/bevsembers/status/1275272863055044608
2020-06-23 03:41:58,ItsaBTSKink,"I PROMISE you will not regret",https://twitter.com/ItsaBTSKink/status/1275272862207807489
2020-06-23 03:41:57,emily_the_king,"am i into roleplay? you could say that *shuffles into the room wearing full plate armor*",https://twitter.com/emily_the_king/status/1275272857296220166
2020-06-23 03:41:54,whoreskithes,"im josh, 6’2, i’m 20, girls kissing is hot but guys kissing is hit my line send booty pics pic.twitter.com/Qh8gDb4tQR",https://twitter.com/whoreskithes/status/1275272847557083136
2020-06-23 03:41:52,ceciliagomz1,"checa wha",https://twitter.com/ceciliagomz1/status/1275272835821441024
2020-06-23 03:41:52,pawjrart,"Still learning https://twitter.com/HipHopDX/status/1275270150569242624 …",https://twitter.com/pawjrart/status/1275272835515154433
2020-06-23 03:41:52,watermelonie16,"fr lmfao",https://twitter.com/watermelonie16/status/1275272835410415622
2020-06-23 03:41:49,mayoukyun,"SHGKSKD this analogy pic.twitter.com/BddltPe3J4",https://twitter.com/mayoukyun/status/1275272826736558082
2020-06-23 03:41:48,xShiane_,"• my othaaa guy come with itttt, and I got a question?",https://twitter.com/xShiane_/status/1275272821858603009
2020-06-23 03:41:48,urdaddyleecha,"ill bring coke",https://twitter.com/urdaddyleecha/status/1275272821434916866
2020-06-23 03:41:48,MAJTOURE,"It would be great if we all linked up in a few weeks at the LNC. #SolutionarysVsTheStatehttps://twitter.com/libertylockpod/status/1275260398589997061 …",https://twitter.com/MAJTOURE/status/1275272818922528768
2020-06-23 03:41:47,Shathir_N,"No wonder you get confused at that",https://twitter.com/Shathir_N/status/1275272817261473794
2020-06-23 03:41:46,allwork_nooplay,"Who would of knew in this life shit we all wouldn’t make it",https://twitter.com/allwork_nooplay/status/1275272812043939841
2020-06-23 03:41:46,sleeplessgxrl,"Para mi es Take it slow https://www.youtube.com/watch?v=1RGxlvXkPis …",https://twitter.com/sleeplessgxrl/status/1275272810563280896
2020-06-23 03:41:45,tittykawa,"excuse me? if you genuinely believe that me and oikawa tooru aren’t gonna have a destination wedding in the caribbean and then fawk in our private yacht in the middle of the ocean immediately after then you are sick.. absolutely SICK in the head https://twitter.com/ykw0rld/status/1274843870141067264 …",https://twitter.com/tittykawa/status/1275272806415155202
2020-06-23 03:41:43,yalincitalx,"Say less",https://twitter.com/yalincitalx/status/1275272798915588099
2020-06-23 03:41:41,RUSerious67,"That’s also called most people in modern society here in the U S of A",https://twitter.com/RUSerious67/status/1275272791017902083
2020-06-23 03:41:41,littleleah78,"My fav is “I needed this yesterday, so I’m asking for it now ... but I don’t know what I want ... please push everyone else’s jobs aside.” Can lead a horse to water ... pic.twitter.com/1uUq84sG7o",https://twitter.com/littleleah78/status/1275272790933823491
2020-06-23 03:41:41,Gonzalez11Reik,"I have a desire to fuck and finish I have so much milk",https://twitter.com/Gonzalez11Reik/status/1275272789843460096
2020-06-23 03:41:39,yahabakun,"// ADMIN OK I SEE U",https://twitter.com/yahabakun/status/1275272781257682944
2020-06-23 03:41:38,dunesdayas,"everyone in nlc gc is hot as fudge. yeah",https://twitter.com/dunesdayas/status/1275272778275418115
2020-06-23 03:41:35,missray87,"I can only imagine the confrontations https://twitter.com/_tamsey/status/1275271213951209473 …",https://twitter.com/missray87/status/1275272765545820161
2020-06-23 03:41:34,yisooflrt,"yes we very much did",https://twitter.com/yisooflrt/status/1275272762110722049
2020-06-23 03:41:34,brigitalgetdown,"What if we kissed... ...On top of the rubbled remains of Mount Rushmore next week? https://twitter.com/meghanmccain/status/1275171150042214400 …",https://twitter.com/brigitalgetdown/status/1275272760218902528
2020-06-23 03:41:33,whackman777,"He’s not nuthin’...",https://twitter.com/whackman777/status/1275272756926377987
2020-06-23 03:41:32,SweetLady_BBW,"I didn't see it https://twitter.com/TheAlsinaNation/status/1275251564345769984 …",https://twitter.com/SweetLady_BBW/status/1275272755420827648
2020-06-23 03:41:32,boyzwrId,"so messed up!!! troy, jake and reggie fakes i’m looking directly at you https://twitter.com/stcrrships/status/1275271859139985408 …",https://twitter.com/boyzwrId/status/1275272754015735814
2020-06-23 03:41:32,lTOSHlRlN,"HELP I SAW ALL THE DICKS AND I WAS LIKE MAYBE ILL DO SOMETHINT NICE",https://twitter.com/lTOSHlRlN/status/1275272752811786241
2020-06-23 03:41:30,Craigrollins5,"C.B.D. & I ain’t talking about no Cannabinol Ya know what I mean?....",https://twitter.com/Craigrollins5/status/1275272744368668672
2020-06-23 03:41:30,joonsdiminie,"Omg yes I want to. I once got over 1M views for a FMV I did for a tv show. It was just a basic edit that even a kid can do. Oh Filmora I’ve never tried. Maybe I should get it till I find free ones of the advanced apps",https://twitter.com/joonsdiminie/status/1275272743332777985
2020-06-23 03:41:29,MambaCUH,"Nah i’ll talk to you anytime",https://twitter.com/MambaCUH/status/1275272742238064642
2020-06-23 03:41:26,A_Blues4Nala,"Get that bread. Get that head. And leavepic.twitter.com/UYedmc8teH",https://twitter.com/A_Blues4Nala/status/1275272728698904576
2020-06-23 03:41:25,wingerxv,"I’m again",https://twitter.com/wingerxv/status/1275272722763972609
