date,username,to,replies,retweets,favorites,text,geo,mentions,hashtags,id,permalink
2020-06-23 03:23:58,VirusEmpathy,"awesome and I can't compete, I have only two computers running in the background right now",https://twitter.com/VirusEmpathy/status/1275268331013111809
2020-06-23 03:23:55,NanaMadeInChina,"sad nights #keepTalking",https://twitter.com/NanaMadeInChina/status/1275268321919799298
2020-06-23 03:23:55,_BlitzFN_,"because you deserve it",https://twitter.com/_BlitzFN_/status/1275268321655566336
2020-06-23 03:23:53,Ale_Hakala,"And that's why I love Finnish. There's no way to pronounce something wrong. (Or at least in theory)",https://twitter.com/Ale_Hakala/status/1275268311660576768
2020-06-23 03:23:52,saltyconchy,"False and irrelevant considering the majority of welfare recipients are White and living in Red States subsidized by multi ethnic Blue States",https://twitter.com/saltyconchy/status/1275268308049244160
2020-06-23 03:23:51,glvmxo,"ANYTHING FOR LUCAS MY BAE",https://twitter.com/glvmxo/status/1275268304836325376
2020-06-23 03:23:51,JaParisPierre,"GOOD/GREAT CREDIT = ASSET NO/HORRIBLE CREDIT = LIABILITY G/G CREDIT = 2.9% APR N/H CREDIT = 26.99% APR",https://twitter.com/JaParisPierre/status/1275268301380292608
2020-06-23 03:23:50,tinykjoonie,"thank you hauahauha so...I have big dick energy? BLESSED",https://twitter.com/tinykjoonie/status/1275268299207696385
2020-06-23 03:23:50,EkpoUduak4,"Mbah, if you're not gonna do something about it, then it doesn't concern you.",https://twitter.com/EkpoUduak4/status/1275268297320251392
2020-06-23 03:23:49,RaLopezzz,"Looking for beats for my lyrics . So far none calling out to me",https://twitter.com/RaLopezzz/status/1275268294501695488
2020-06-23 03:23:49,SimplyLovesEXO,"I think so too... Spoiler king Sehunnie is @weareoneEXOhttps://twitter.com/sukaihan/status/1275255363047055363 …",https://twitter.com/SimplyLovesEXO/status/1275268293830471680
2020-06-23 03:23:49,manjilock,"tokyo rev stans follow me",https://twitter.com/manjilock/status/1275268293708746755
2020-06-23 03:23:47,fruitytitties,"Sexy or sexy, all girls are sexy* https://twitter.com/ronalucas_/status/1275053267853012992 …",https://twitter.com/fruitytitties/status/1275268286586867713
2020-06-23 03:23:47,dunesdayas,"yeah exactly",https://twitter.com/dunesdayas/status/1275268285542494208
2020-06-23 03:23:45,Corvaire_Wind,"I don't know about 'volunteers' but i'm sure Lobbyist are working the overtime.",https://twitter.com/Corvaire_Wind/status/1275268278135513088
2020-06-23 03:23:45,MickeyMarie1313,"Me in real life vs. me in animation https://twitter.com/ayoo_miss_/status/1275254155393843201 …pic.twitter.com/4Ea7e4C1Mx",https://twitter.com/MickeyMarie1313/status/1275268277393031168
2020-06-23 03:23:41,TheMariaShow_,"I miss Anthony https://twitter.com/phsizemore/status/1275267707059879936 …",https://twitter.com/TheMariaShow_/status/1275268261655965696
2020-06-23 03:23:39,sh060906,"we're good to go",https://twitter.com/sh060906/status/1275268253569384449
2020-06-23 03:23:34,Lil__Jayyyyy,"Y’all out here selling pics 5$really?? only fans going for 3$?? Whew y’all wildn",https://twitter.com/Lil__Jayyyyy/status/1275268232757329924
2020-06-23 03:23:33,Gryfflynn_,"Brows Nails Hair is next",https://twitter.com/Gryfflynn_/status/1275268226092433409
2020-06-23 03:23:33,Tea_lashelle,"Can’t vibe with nobody nomore,I just love being by myself",https://twitter.com/Tea_lashelle/status/1275268225719316482
2020-06-23 03:23:32,_NoTABBS,"Back on my BS wt him",https://twitter.com/_NoTABBS/status/1275268225689882625
2020-06-23 03:23:32,SkepticallyNumb,"I'm not sure what this Fox correspondent realizes what he's getting himself into I'll take the follow, though Not to mention I can't be called rAcIsT anymore #ItsOkayToBeWhitepic.twitter.com/OaltITcn1m",https://twitter.com/SkepticallyNumb/status/1275268224637173760
2020-06-23 03:23:32,BrightWin_Story,"230620 Bright Post Cr: tingnanon #bbrightvc #brightwinpic.twitter.com/7RIrMqdn6s",https://twitter.com/BrightWin_Story/status/1275268224108675072
2020-06-23 03:23:32,LuckyShyft,"I'm on my knees Nicki; praying worshipping begging whatever you want *sniff* so what do you think about that",https://twitter.com/LuckyShyft/status/1275268223525507073
2020-06-23 03:23:32,johnmolina92,"Nunca pensé que alguien pudiese robarme los supiros de esta manera. I never thought someone could steal my sighs like this.",https://twitter.com/johnmolina92/status/1275268222493896709
2020-06-23 03:23:31,_jaquiqui_,"Watching a virtual concert",https://twitter.com/_jaquiqui_/status/1275268220690153473
2020-06-23 03:23:31,lTOSHlRlN,"me too i love being bullied",https://twitter.com/lTOSHlRlN/status/1275268219012395009
2020-06-23 03:23:31,RealSteebieJayy,"Most women fall in love with me off my vibe .. shit ima asshole to be real but shit if you love it here , you’re welcome to stay ..my tongue is a charmin mf in and out",https://twitter.com/RealSteebieJayy/status/1275268218349850631
2020-06-23 03:23:30,dylhlland,"nlc really a gc of hotties",https://twitter.com/dylhlland/status/1275268213287206913
2020-06-23 03:23:28,AaronKoob,"I got a lead on some I’ll hit you up if I get some this weekend",https://twitter.com/AaronKoob/status/1275268206823792640
2020-06-23 03:23:26,sikbf,"@stickybandage omg hey",https://twitter.com/sikbf/status/1275268197684559872
2020-06-23 03:23:26,GoChrissyGo,"Lmaoooo who made that baby Yoda looking like he from Brooklyn",https://twitter.com/GoChrissyGo/status/1275268196724027392
2020-06-23 03:23:24,niniflrt,"oomfs icon is so sexcee",https://twitter.com/niniflrt/status/1275268189782327296
2020-06-23 03:23:22,colormeray3,"Them repeated quotes get more and more aggressive",https://twitter.com/colormeray3/status/1275268180907307008
2020-06-23 03:23:20,FashionabAnon,"Nice memes.",https://twitter.com/FashionabAnon/status/1275268174947053571
2020-06-23 03:23:19,prodbycg,"When?",https://twitter.com/prodbycg/status/1275268170203328513
2020-06-23 03:23:16,alfcnz,"I've never come! I must drop by, sooner or later! Especially if I move to Singapore",https://twitter.com/alfcnz/status/1275268157289254914
2020-06-23 03:23:15,Ali_OO_OOP,"My Yeti is",https://twitter.com/Ali_OO_OOP/status/1275268153254305793
2020-06-23 03:23:14,watermelonie16,"hehe no i was craving it at 4 am yesterday",https://twitter.com/watermelonie16/status/1275268146656686081
2020-06-23 03:23:13,BleuCMR,"I know",https://twitter.com/BleuCMR/status/1275268145650040833
2020-06-23 03:23:11,janellessthan3,"Lol fr but love it when you save a house from years ago and it’s back on the market",https://twitter.com/janellessthan3/status/1275268135323684864
2020-06-23 03:23:06,ggukiess_,"Melonwater",https://twitter.com/ggukiess_/status/1275268113047547909
2020-06-23 03:23:05,AmericanGirl_47,"haha! Hope it wasn’t the last date",https://twitter.com/AmericanGirl_47/status/1275268111793602565
2020-06-23 03:23:05,itslaayybitxh,"Super mehttps://twitter.com/oluwatayomii/status/1275239812631605254 …",https://twitter.com/itslaayybitxh/status/1275268108949880837
2020-06-23 03:23:04,MarisaWard57,"@realDonaldTrump you've been had. https://twitter.com/TheRickWilson/status/1275264199883730945 …",https://twitter.com/MarisaWard57/status/1275268106974367745
2020-06-23 03:23:02,ranman9er,"Yep, and so do her employers, having someone representing such toxic views, unless her business is making those flags...she's finished",https://twitter.com/ranman9er/status/1275268099671879685
2020-06-23 03:23:02,Jorju5,"Both",https://twitter.com/Jorju5/status/1275268098589782016
2020-06-23 03:23:02,mostlyEXO,"he's like that bc suho owns the company https://twitter.com/oshbestboyy/status/1275129076445876224 …",https://twitter.com/mostlyEXO/status/1275268097805479937
2020-06-23 03:22:59,chrispapisweet,"Right now Thiago Silva better than him ? I mean right now ui I don’t know abt that",https://twitter.com/chrispapisweet/status/1275268083926564864
2020-06-23 03:22:56,seungminshoes,"ITS GORE THEY WERE EATING THE OTHER RAT",https://twitter.com/seungminshoes/status/1275268071129825281
2020-06-23 03:22:55,TesiaR,"I know when you texting me you be really wanting me",https://twitter.com/TesiaR/status/1275268068013412352
2020-06-23 03:22:55,Royal3nvyJay,"Hood/ Curious/bisexual nigga with big dicks my dm’s are open pic.twitter.com/75XLnlRTrW",https://twitter.com/Royal3nvyJay/status/1275268066608386053
2020-06-23 03:22:51,NEWMAG1CW4ND,"someone tell jimin bwl is supposed to be cute and wholesome not:",https://twitter.com/NEWMAG1CW4ND/status/1275268053454983169
2020-06-23 03:22:51,yfnlucciwifee__,"the day a nigga post me is when I will settle down & be loyal. Until then .... I’m finna go text yo friends back sorry if ion reply quick .",https://twitter.com/yfnlucciwifee__/status/1275268052167331844
2020-06-23 03:22:50,wayvkill,"omg do u play",https://twitter.com/wayvkill/status/1275268046035185664
2020-06-23 03:22:49,Maison509,"Use your face Put it on a book The result",https://twitter.com/Maison509/status/1275268042939916288
2020-06-23 03:22:49,NukNuk2015,"Lol same. I love that for us",https://twitter.com/NukNuk2015/status/1275268042046361602
2020-06-23 03:22:47,www_dyke_com,"okay b4 u say anything the bitch in the bottom got murdered by the one on top hehe anyways pic.twitter.com/2pDakSourn",https://twitter.com/www_dyke_com/status/1275268035738304514
2020-06-23 03:22:46,lovebrings_war,"Feel Like You’re Feelin’ Me , I Think I Feel You Too",https://twitter.com/lovebrings_war/status/1275268031111991296
2020-06-23 03:22:46,marktease,"wait ask me stuff i’m bored https://curiouscat.qa/marktease",https://twitter.com/marktease/status/1275268029559877632
2020-06-23 03:22:45,CeeCeeLaBella,"Like many things in life, I’ll do it myself lol... I looked up recipes and vendors in Cali and Chicago and boom",https://twitter.com/CeeCeeLaBella/status/1275268025122525184
2020-06-23 03:22:43,TROKNOWS,"It’s been about a year since we implemented our official heat illness prevention policy. I think the final tally was 3 threats from a few state organization reps, after I called their lack of policies gutless sometimes, being a lightning rod is a good thing #AT4ALL https://twitter.com/sabercatsports/status/1275266796929650689 …",https://twitter.com/TROKNOWS/status/1275268019506249728
2020-06-23 03:22:41,ElaineCavasotto,"I wanted to see him do this kind of ""protest"" on the Castro family island ...",https://twitter.com/ElaineCavasotto/status/1275268011209957377
2020-06-23 03:22:41,CH1GIRI,"hey who wants to get closer to me",https://twitter.com/CH1GIRI/status/1275268010798796800
2020-06-23 03:22:38,exoforever2020,"Did i mentioned psy here did i similarize singles and ost?",https://twitter.com/exoforever2020/status/1275267995539869697
2020-06-23 03:22:38,camomileflower1,"I'm dying inside Can't wait for the other members teaser though And the mv of course @CUBE_PTG #PENTAGON #펜타곤https://twitter.com/CUBE_PTG/status/1275262317828034561 …",https://twitter.com/camomileflower1/status/1275267995011395584
2020-06-23 03:22:36,DotardInWaiting,"More likely the chronic",https://twitter.com/DotardInWaiting/status/1275267989252661249
2020-06-23 03:22:35,speculawyer,"You are being offered the practical joke opportunity of a lifetime. You are too nice.",https://twitter.com/speculawyer/status/1275267985318400001
2020-06-23 03:22:35,Kita__Bugg,"@WhitLo__ just wait till I drop that fye tuhmarraw that got approved by my creative director!",https://twitter.com/Kita__Bugg/status/1275267984953692160
2020-06-23 03:22:35,GTCochran88,"She’s the worst kinda racist the kind that uses religion as a tool to discriminate.......Todays Republicons have a lot in common with the Pharisees",https://twitter.com/GTCochran88/status/1275267984332914690
2020-06-23 03:22:31,rickymessi9,"Yes PBR is fine but Black Label is off The list.",https://twitter.com/rickymessi9/status/1275267969417793538
2020-06-23 03:22:30,_tvmia,"This shit not funny at all. But it’s so wild and that’s what makes it funny. Like this is really happening lol",https://twitter.com/_tvmia/status/1275267964468711425
2020-06-23 03:22:29,bookieeb_,"awww thank you Cl2b you know how them Deuces cominggg !",https://twitter.com/bookieeb_/status/1275267957510332416
2020-06-23 03:22:28,Yeshvini6,"Not a lie tho pic.twitter.com/Rlp7Lyp0yN",https://twitter.com/Yeshvini6/status/1275267954783875072
2020-06-23 03:22:28,Ralphhlalele,"""We are human beings""",https://twitter.com/Ralphhlalele/status/1275267953160790016
2020-06-23 03:22:24,cravithic,"hyeongjun the things you’re doing to my heart!!! pic.twitter.com/xxeMAuPsSf",https://twitter.com/cravithic/status/1275267936949694466
2020-06-23 03:22:21,DairreanR,"I know I know it’s okay, I understand",https://twitter.com/DairreanR/status/1275267925369409536
2020-06-23 03:22:20,JOONCLlT,"Thanks bae",https://twitter.com/JOONCLlT/status/1275267923540672513
2020-06-23 03:22:19,duffy2x,"Lil something",https://twitter.com/duffy2x/status/1275267916435468290
2020-06-23 03:22:17,dancingwcherry,"just do it right now for a sneak peak",https://twitter.com/dancingwcherry/status/1275267908638212096
2020-06-23 03:22:16,hyomacore,"wanna play obbys with me ir whatever tf those parkour stuff are",https://twitter.com/hyomacore/status/1275267905131704322
2020-06-23 03:22:15,stone_freed,"imagine owning a mac",https://twitter.com/stone_freed/status/1275267898643304448
2020-06-23 03:22:14,soloeyyy,"bst game of snd by far LMFAOO first time som1 called me their waifu",https://twitter.com/soloeyyy/status/1275267896734711808
2020-06-23 03:22:13,daddyishy7,"bmw 328i",https://twitter.com/daddyishy7/status/1275267892091723776
2020-06-23 03:22:11,lalli817,"I also hate me enough for the both of us",https://twitter.com/lalli817/status/1275267885498347520
2020-06-23 03:22:11,watermelonie16,"dont talk to us. second we already are",https://twitter.com/watermelonie16/status/1275267882100850688
2020-06-23 03:22:10,Mitchel98105731,"Hands around your neck while I do so",https://twitter.com/Mitchel98105731/status/1275267880649719808
2020-06-23 03:22:10,K6LLUAS,"5’2 with some attitude pic.twitter.com/U0PsPjGJ3t",https://twitter.com/K6LLUAS/status/1275267880549068802
2020-06-23 03:22:10,AlbertThrons,"Done",https://twitter.com/AlbertThrons/status/1275267880007811076
2020-06-23 03:22:08,YoungTaeLoyal,"I’m bout to get my soul sucked",https://twitter.com/YoungTaeLoyal/status/1275267871791353857
2020-06-23 03:22:08,hagenista,"Most of Orange County is ignoring the Order except for a few lame sheep who like to drive alone in their car wearing a mask and walk alone on the beach.",https://twitter.com/hagenista/status/1275267871463976966
2020-06-23 03:22:06,Ejaydiditagain,"Hey hey",https://twitter.com/Ejaydiditagain/status/1275267861481533440
2020-06-23 03:22:05,whackman777,"Retweet deserves a retweet...",https://twitter.com/whackman777/status/1275267856867815424
2020-06-23 03:22:04,RebornGypsy,"ima slut u out, u ain’t gotta ask",https://twitter.com/RebornGypsy/status/1275267852484980736
2020-06-23 03:22:03,voguewithjailey,"Party de bc ,a rahe ho main",https://twitter.com/voguewithjailey/status/1275267852010831874
2020-06-23 03:22:02,CollegiateFreak,"Car session was lit I never leave em disappointed pic.twitter.com/VWdMW70VZG",https://twitter.com/CollegiateFreak/status/1275267847892144128
2020-06-23 03:22:01,RyoichiWeirdo,"Of course, that’s my queen.",https://twitter.com/RyoichiWeirdo/status/1275267841474904073
2020-06-23 03:22:00,mzjuicytuchie,"Facts I wasn’t into the ass eating or toe sucking cause i never had it but ummm yea slide I like it !!!!",https://twitter.com/mzjuicytuchie/status/1275267837297377281
2020-06-23 03:22:00,CalculatedMovez,"Definitely need another TV in my room, falling asleep on my couch tryna watch a movie is taking toll on my neck",https://twitter.com/CalculatedMovez/status/1275267836093566977
2020-06-23 03:21:57,AlexxxisE,"Puma by Kuzma (if you know you know) pic.twitter.com/pzoMiJrFki",https://twitter.com/AlexxxisE/status/1275267823502340096
2020-06-23 03:21:57,bookieeb_,"Thank you Sandz",https://twitter.com/bookieeb_/status/1275267823477166080
2020-06-23 03:21:56,ILLUMISBOOBS,"MF STP I WSNT DON W THM YET",https://twitter.com/ILLUMISBOOBS/status/1275267821497233411
2020-06-23 03:21:53,DreamboatAnn9,"All that is needed is 3 well placed bullets: 1 for #tRUMP 1 for #BillBarr & 1 for @senatemajldr #EndOfStory #ProveMeWrong",https://twitter.com/DreamboatAnn9/status/1275267809082249217
2020-06-23 03:21:53,Vladi_OnDaBeat,"This album.. % man. I hope one day to make an album like this! @gryffinofficial tell me the secret! @Nashville, Tennessee https://www.instagram.com/p/CBwyhI7jkp96nRenMT09Mq6oD3Sp407bjLHHNc0/?igshid=1xbcp1n0gj99t …",https://twitter.com/Vladi_OnDaBeat/status/1275267808901955585
2020-06-23 03:21:51,d0llwrld,"sexy",https://twitter.com/d0llwrld/status/1275267801788211202
2020-06-23 03:21:49,seungminshoes,"fr. that’s so fucking disgusting.",https://twitter.com/seungminshoes/status/1275267793458528257
2020-06-23 03:21:48,bettsarchs,"Pick me",https://twitter.com/bettsarchs/status/1275267789322887168
2020-06-23 03:21:48,Atul_Luv_Sana,"Good Morning Bollywood Stars #ShehnaazGill",https://twitter.com/Atul_Luv_Sana/status/1275267788488073217
2020-06-23 03:21:48,bimbo4lenin,"giving me ideas",https://twitter.com/bimbo4lenin/status/1275267785854050305
2020-06-23 03:21:48,stillthehatred,"Them first",https://twitter.com/stillthehatred/status/1275267785468379137
2020-06-23 03:21:46,SB19_Mau,"Better days",https://twitter.com/SB19_Mau/status/1275267780485320705
2020-06-23 03:21:44,1jinkook,"DID U SEE MY ELEPHANT",https://twitter.com/1jinkook/status/1275267770280706048
2020-06-23 03:21:42,SleepyHeadSifu,"Trying to sexy talk with my boyfriend: pic.twitter.com/SiDfXeh9n2",https://twitter.com/SleepyHeadSifu/status/1275267762177228801
2020-06-23 03:21:39,TheFairlyLuvly1,"Ok 2nd act was pretty funny~ Or maybe I lean like @WayneBrady leans on @Mangum1; read into that statement as much or as little as you want; anyways onto Act 3 #WhoseLine #WatchWLIIATonight (3/3)pic.twitter.com/x4bmP7qYtV",https://twitter.com/TheFairlyLuvly1/status/1275267750168948736
2020-06-23 03:21:39,ACNH_Waifu,"i fuck with that suki is bae and mai is a badass",https://twitter.com/ACNH_Waifu/status/1275267749007233033
2020-06-23 03:21:38,hotnifer,"Broda shaggi is funny af and I don't anybody telling me otherwise",https://twitter.com/hotnifer/status/1275267743546314752
2020-06-23 03:21:37,exoforever2020,"Why do we have to? We depends on our pwn decision must we follow u?",https://twitter.com/exoforever2020/status/1275267742233321472
2020-06-23 03:21:36,capricorncub,"i call myself anastasia's bitch but i mean... who makes who suffer for the sake of catharsis",https://twitter.com/capricorncub/status/1275267737435004928
2020-06-23 03:21:35,ciciliaintan18,"insecure!! but i won't stop, sorry dear",https://twitter.com/ciciliaintan18/status/1275267732087291907
2020-06-23 03:21:34,bugbarchiee,"fuckkk",https://twitter.com/bugbarchiee/status/1275267728807510016
2020-06-23 03:21:31,MoOfficialHQ,"Fucking bitches! https://twitter.com/aeduann_maahes/status/1274868546611412992 …",https://twitter.com/MoOfficialHQ/status/1275267716862132229
2020-06-23 03:21:31,jieunree,"Ohhh should i tell him? ㅋㅋㅋㅋ But i don't have any motivational words— lemme find them later ㅋㅋㅋ Oh thank you! I'm gonna sing those high notes live at the first episode, please look forward into it",https://twitter.com/jieunree/status/1275267715968598016
2020-06-23 03:21:31,bdotfromdabakk,"Y’all don’t like aggressive niggas? Y’all buggin “Come here li’daddy slap me across the room again” lolllllll!!",https://twitter.com/bdotfromdabakk/status/1275267714102235137
2020-06-23 03:21:30,miauwgirl,"#Affinitweet Stolen Kiss diorstropical would kiss you around the corner... And you, who would do it? via https://affinitweet.com/stolen-kiss pic.twitter.com/NcBSCA7gYD",https://twitter.com/miauwgirl/status/1275267709991817216
2020-06-23 03:21:29,JennahKuan,"ok thx :))",https://twitter.com/JennahKuan/status/1275267708351680514
2020-06-23 03:21:29,Lil__Jayyyyy,"Indeedhttps://twitter.com/ordinary1world/status/1274818766090559488 …",https://twitter.com/Lil__Jayyyyy/status/1275267708322545664
2020-06-23 03:21:29,DOnyali26,"Still yes Or do you think it's wrong to call a swastika-tatooed, Hitler-worshipping, Jew-hating guy a Nazi just because he doesn't live in the Third Reich?",https://twitter.com/DOnyali26/status/1275267707110187009
2020-06-23 03:21:29,voidwife_,"it sounds like....... RIVALS",https://twitter.com/voidwife_/status/1275267707030700033
2020-06-23 03:21:27,ChefJonalicious,"It would be such a shame to suffocate him again in my hole",https://twitter.com/ChefJonalicious/status/1275267699933958144
2020-06-23 03:21:27,minbeaner,"girl i also started atla again cus i havent seen it in years and man zuko so funny.. cmon angsty teen pic.twitter.com/73ytw0fGKE",https://twitter.com/minbeaner/status/1275267698323316736
2020-06-23 03:21:26,estefaniawar,"July 3rd ? You free ?",https://twitter.com/estefaniawar/status/1275267696284831744
2020-06-23 03:21:26,sensualstormi,"sometimes I gotta block myself no blame here",https://twitter.com/sensualstormi/status/1275267695332724737
2020-06-23 03:21:26,Dartagnan_Llore,"Whitney Elizabeth Houston said it best.... https://twitter.com/stickysweett/status/1275260668615307264 …pic.twitter.com/95appU3gmE",https://twitter.com/Dartagnan_Llore/status/1275267694154133506
2020-06-23 03:21:26,pussyfairyjoo,"lani why are you pulling on my dick",https://twitter.com/pussyfairyjoo/status/1275267693575274497
2020-06-23 03:21:25,ItsaBTSKink,"Aaaaallllrrriiiggghhhtttt!!!!!! Everyone! I have a new request. And it’s a big one! I can’t tell you much now. But I need your help.",https://twitter.com/ItsaBTSKink/status/1275267692887506944
2020-06-23 03:21:24,MightyJoe54,"I should have known that CK would be swinging the sticks.",https://twitter.com/MightyJoe54/status/1275267688806273026
2020-06-23 03:21:24,bokutobe,"look for my message",https://twitter.com/bokutobe/status/1275267688441487361
2020-06-23 03:21:24,C0SMICCAM,"my dad said i cant go anywhere until my eyebrow grows back",https://twitter.com/C0SMICCAM/status/1275267687300694018
2020-06-23 03:21:24,HeartlessWordz,"Damn Man...Looked Up Da Turkey Myth Bout Them Drowning In Da Rain And Dey Said its A Myth .. STILL FUNNY THO ... ...WHERE DID I HEAR DAT SHIT THO???... ANYWAY!... #AightDeahNah ...",https://twitter.com/HeartlessWordz/status/1275267685635559425
2020-06-23 03:21:22,TraBlacc,"Let me find a chick that’s all about us",https://twitter.com/TraBlacc/status/1275267678572351488
2020-06-23 03:21:21,mtprospectcardr,"Build walls around the cities You reap what you sowhttps://twitter.com/zerohedge/status/1275249723662884864 …",https://twitter.com/mtprospectcardr/status/1275267674495311873
2020-06-23 03:21:20,OopsDani_Didit,"Constructive criticism is necessary.",https://twitter.com/OopsDani_Didit/status/1275267668443095040
2020-06-23 03:21:17,lChawh,"more places to sleep",https://twitter.com/lChawh/status/1275267658565300225
2020-06-23 03:21:17,SweetAsRiceCake,"Already did baby",https://twitter.com/SweetAsRiceCake/status/1275267656564854786
2020-06-23 03:21:16,porn_gifs,"Thick White Girl Getting Creampied https://pornrulez.co/node/287508 ##porn #gifs #sex #horny #tits #ass #teens #sexy",https://twitter.com/porn_gifs/status/1275267654245396483
2020-06-23 03:21:15,QueenMsMocha,"Gotta youngin on my radar",https://twitter.com/QueenMsMocha/status/1275267649656807424
2020-06-23 03:21:14,IamLezzter13,"Next single is comingggggg Announcement next week or first week of July. pic.twitter.com/LZgr8YkZa1",https://twitter.com/IamLezzter13/status/1275267645122596864
2020-06-23 03:21:13,KatnissZelda11,"Same",https://twitter.com/KatnissZelda11/status/1275267640941035522
2020-06-23 03:21:13,DaddieDes,"Oh ight bet then you about to hate me now fr",https://twitter.com/DaddieDes/status/1275267639829553158
2020-06-23 03:21:12,bcrchiesapa,"yes join barchie nation",https://twitter.com/bcrchiesapa/status/1275267637258452998
2020-06-23 03:21:11,chrispapisweet,"Football or basket I’m starting to rethink this",https://twitter.com/chrispapisweet/status/1275267630908223490
2020-06-23 03:21:09,maadu410,"#Affinitweet Stolen Kiss httpsrenan would kiss you around the corner... And you, who would do it? via https://affinitweet.com/stolen-kiss pic.twitter.com/SFVUhwxbJo",https://twitter.com/maadu410/status/1275267625187192835
2020-06-23 03:21:09,IJS03422635,"Hey, just imagine if he would have read from a teleprompter again",https://twitter.com/IJS03422635/status/1275267622536384513
2020-06-23 03:21:08,TlNlEKOO,"Can someone send me clips of jimin walking or flipping his hair I want to slo-mo them",https://twitter.com/TlNlEKOO/status/1275267618765541377
2020-06-23 03:21:07,habitscripted,"oh and also my ankle is still swollen from when i sprained it over a year ago",https://twitter.com/habitscripted/status/1275267614994923520
2020-06-23 03:21:05,by_tytus,"https://music.apple.com/us/playlist/passion/pl.u-RRbVVD7s3p1gxd9 … slow•sensual•sexy•sexual",https://twitter.com/by_tytus/status/1275267606874906628
2020-06-23 03:21:01,jOsyOvando,"It's Teresaaaaaaa timeeeeee pic.twitter.com/CSd5Usi09t",https://twitter.com/jOsyOvando/status/1275267592010305546
2020-06-23 03:21:00,crueelzummer_,"Whatever season we're in, spring day is on top",https://twitter.com/crueelzummer_/status/1275267587807383553
2020-06-23 03:21:00,m8rkbit,"Hey babe",https://twitter.com/m8rkbit/status/1275267586868068352
2020-06-23 03:21:00,watermelonie16,"OMG YES QUEEN WTF STUNNING",https://twitter.com/watermelonie16/status/1275267584968065025
2020-06-23 03:21:00,WolxBS,"We should do that hehe",https://twitter.com/WolxBS/status/1275267584305229827
