date,username,to,replies,retweets,favorites,text,geo,mentions,hashtags,id,permalink
2020-06-23 03:54:25,lIamemelu,"Had no idea people were so concerned about my relationship with ryan tho",https://twitter.com/lIamemelu/status/1275275994874740737
2020-06-23 03:54:17,juleebeh,"Temporary people",https://twitter.com/juleebeh/status/1275275960376455170
2020-06-23 03:54:16,miyukiloa,"idk but he fine as hell either way",https://twitter.com/miyukiloa/status/1275275956337496064
2020-06-23 03:54:16,_jaysanders,"sad to say , easily bro",https://twitter.com/_jaysanders/status/1275275955976777729
2020-06-23 03:54:13,gwsdream,"hot asf",https://twitter.com/gwsdream/status/1275275943347617804
2020-06-23 03:54:12,r_dhilipan,"Hagdjsnhs #NonpareilThalaAJITH",https://twitter.com/r_dhilipan/status/1275275940373786626
2020-06-23 03:54:11,Heylove_kee,"Send a wya? U know what that mean",https://twitter.com/Heylove_kee/status/1275275938729807872
2020-06-23 03:54:10,AlexxDavis3,"Ya'll like mirror pics too?? pic.twitter.com/9fgo9K6VS2",https://twitter.com/AlexxDavis3/status/1275275934606770176
2020-06-23 03:54:10,PrincessJade411,"You deserve ALL of it",https://twitter.com/PrincessJade411/status/1275275933088268288
2020-06-23 03:54:09,wlbeattie,"<= LOL - I love a good rhetorical question! AND IMO this is a great one! cheers #PromisesMadePromisesKepthttps://twitter.com/jimcboston/status/1275234248631504899 …",https://twitter.com/wlbeattie/status/1275275927405031425
2020-06-23 03:54:08,chaerclt,"i made someone get into itzy",https://twitter.com/chaerclt/status/1275275923097411584
2020-06-23 03:54:07,walker_stl,"Deal",https://twitter.com/walker_stl/status/1275275922103586817
2020-06-23 03:54:06,SunsetFlowery,"You people should stop i think. Too much fantasy pic.twitter.com/Z53EZRCb1X",https://twitter.com/SunsetFlowery/status/1275275917091172353
2020-06-23 03:54:05,sakataskz,"thank you cat mich pic.twitter.com/HezkelyQoP",https://twitter.com/sakataskz/status/1275275912951427072
2020-06-23 03:54:02,tomlinsongolden,"hahaha thank you",https://twitter.com/tomlinsongolden/status/1275275899236225026
2020-06-23 03:54:02,mukalazikaggwe,"Get it now https://www.facebook.com/102378101508646/posts/124248162654973/ …",https://twitter.com/mukalazikaggwe/status/1275275897411600385
2020-06-23 03:53:58,samantha_aubrey,"Baby and I making dumplings to bard core (you know who you are)",https://twitter.com/samantha_aubrey/status/1275275883461455874
2020-06-23 03:53:58,harr47128951,"Hey, thank you so much. I didn’t do a spell check on this tweet. Your tweets are just packed full of information. Thanks again for the critique. I really appreciate it. When you go LOW...I GO HIGH.",https://twitter.com/harr47128951/status/1275275882307911681
2020-06-23 03:53:57,yenskz,"I LOVE U. I LO VE U",https://twitter.com/yenskz/status/1275275877547466758
2020-06-23 03:53:54,andreamarierrr,"i fell for a man who he eats the booty like high end groceries.",https://twitter.com/andreamarierrr/status/1275275866709397504
2020-06-23 03:53:53,minnieflowxrs,"@BTS_twt How y’all doin",https://twitter.com/minnieflowxrs/status/1275275862687047681
2020-06-23 03:53:52,smprodigie,"peep the Mark Lee shirt pic.twitter.com/jLmlHDUSkP",https://twitter.com/smprodigie/status/1275275856919683073
2020-06-23 03:53:51,DJProdigy_809,"My Vinyl is almost hereeeee Cannot wait to see what my mom and big headed sister put on it! Lol",https://twitter.com/DJProdigy_809/status/1275275851228200962
2020-06-23 03:53:48,kagegamma,"ure easy tho",https://twitter.com/kagegamma/status/1275275838938927104
2020-06-23 03:53:47,BeeTru313,"I am a truth seeker to the fullest. I ALWAYS find the TRUTH ... I do this I am not a fool by any means",https://twitter.com/BeeTru313/status/1275275834727772162
2020-06-23 03:53:45,rinbachi,"i had to create a new zepeto account because i forgot my password TT but drop your codes lets be moots pic.twitter.com/UXhcrKEAvq",https://twitter.com/rinbachi/status/1275275828822069249
2020-06-23 03:53:45,ThiaBallerina,"No truer words have ever been spoken lmao",https://twitter.com/ThiaBallerina/status/1275275825890291712
2020-06-23 03:53:43,GsTheMaster_,"#Affinitweet Stolen Kiss itz_ceci would kiss you around the corner... And you, who would do it? via https://affinitweet.com/stolen-kiss pic.twitter.com/4mHWGnKVN3",https://twitter.com/GsTheMaster_/status/1275275819900907521
2020-06-23 03:53:42,flawlesscusp,"Life goals with her pic.twitter.com/1bl6TAOqYd",https://twitter.com/flawlesscusp/status/1275275815408644096
2020-06-23 03:53:42,belando_mark,"I lost my flirting skill sht",https://twitter.com/belando_mark/status/1275275815161192450
2020-06-23 03:53:41,14g_sung,"did ur bf do this? mine yes pic.twitter.com/VC2gKHQE75",https://twitter.com/14g_sung/status/1275275810580992000
2020-06-23 03:53:38,LYJ_130613,"#ALLLIVESMATER by trending this your doing us a favor...having a reason to post as many fancams as we want pic.twitter.com/fcOUWfRyg0",https://twitter.com/LYJ_130613/status/1275275799906713600
2020-06-23 03:53:36,su_y15,"*sinfully smiling""* ah yes, when the chrysanthemum finally blooms",https://twitter.com/su_y15/status/1275275791308226560
2020-06-23 03:53:36,wuuddadda,"Cause you're the prince. I am your bodyguard.",https://twitter.com/wuuddadda/status/1275275791249534977
2020-06-23 03:53:36,Nychell__,"I can’t leave u aloneeee not for 24hrs",https://twitter.com/Nychell__/status/1275275790834454529
2020-06-23 03:53:35,rvjoohyunnie,"imagine Wendy doing an ig live right after her first public schedule and the first thing she says is “you guys really missed me huh??? ”",https://twitter.com/rvjoohyunnie/status/1275275784991551489
2020-06-23 03:53:34,MoxeeBeMe,"Hah! You must be related to my husband",https://twitter.com/MoxeeBeMe/status/1275275782466580481
2020-06-23 03:53:34,AlexBroome6,"Just say the word when to come get ya",https://twitter.com/AlexBroome6/status/1275275780965236738
2020-06-23 03:53:33,BurrHughes,"I like it when you use those big words on me.",https://twitter.com/BurrHughes/status/1275275779190984704
2020-06-23 03:53:33,yyxyer,"any1 trying 2 b my gf",https://twitter.com/yyxyer/status/1275275777995571201
2020-06-23 03:53:28,RaLopezzz,"Won’t let me post my whole cover",https://twitter.com/RaLopezzz/status/1275275757170851840
2020-06-23 03:53:27,Mikepenisface,"That can be arranged",https://twitter.com/Mikepenisface/status/1275275752703918080
2020-06-23 03:53:27,voteredarnold,"You look better now. Personal opinion.",https://twitter.com/voteredarnold/status/1275275751227621377
2020-06-23 03:53:26,Bengeess,"I got yaaaaa",https://twitter.com/Bengeess/status/1275275749490978817
2020-06-23 03:53:26,tittykawa,"what did eye do",https://twitter.com/tittykawa/status/1275275748996272129
2020-06-23 03:53:26,techcou,"wait i’ll do this too BANGER TWEET https://twitter.com/paperdragun/status/1275128844085673985 …",https://twitter.com/techcou/status/1275275746290917376
2020-06-23 03:53:25,ElSerg5,"My hair be gowning",https://twitter.com/ElSerg5/status/1275275744189407233
2020-06-23 03:53:25,Law_Azure,"Ya know, I do like chastity still. Just being locked up, caged and in padding, not being able to play with yourself at all, it's good~ Have someone hold the key, you're not in control at all, just gotta deal with it~ It's quite hot in my opinion~",https://twitter.com/Law_Azure/status/1275275743673462784
2020-06-23 03:53:23,ayataka_0724,"Wow ahhhhhhh",https://twitter.com/ayataka_0724/status/1275275737411448832
2020-06-23 03:53:22,winism_,"Oh, so it was like that . Lol, we will never know",https://twitter.com/winism_/status/1275275733393235968
2020-06-23 03:53:21,askmerob,"Two Tom Hardys? What will you do!?",https://twitter.com/askmerob/status/1275275729014534146
2020-06-23 03:53:18,larrisangel,"#Affinitweet Stolen Kiss Iarrismiax would kiss you around the corner... And you, who would do it? via https://affinitweet.com/stolen-kiss pic.twitter.com/r1pB6zlvmi",https://twitter.com/larrisangel/status/1275275716620423174
2020-06-23 03:53:15,DanitaZubairu,"...now I know why I muted his tweets",https://twitter.com/DanitaZubairu/status/1275275703790063617
2020-06-23 03:53:15,lucidkjh,"YAAS guess who i’m drawing b4 u pic.twitter.com/W5dDyH2T9j",https://twitter.com/lucidkjh/status/1275275700770045953
2020-06-23 03:53:15,nisses_pieces,"It been u, since 13’",https://twitter.com/nisses_pieces/status/1275275700388466689
2020-06-23 03:53:12,Sneakers4Jona,"It’s sumn bout cooking for somebody you care abt & them telling you it was good. Ik now tip me",https://twitter.com/Sneakers4Jona/status/1275275690913472512
2020-06-23 03:53:10,yuvanvishvamain,"#Affinitweet Stolen Kiss yeman__ would kiss you around the corner... And you, who would do it? via https://affinitweet.com/stolen-kiss pic.twitter.com/NX4lamQ8nN",https://twitter.com/yuvanvishvamain/status/1275275682113781760
2020-06-23 03:53:10,kaayyyoo,"ASC was built off influencing niggas w figures 2 come together",https://twitter.com/kaayyyoo/status/1275275680712974336
2020-06-23 03:53:09,grantwest2020,"#Affinitweet Stolen Kiss namhulbobrov would kiss you around the corner... And you, who would do it? via https://affinitweet.com/stolen-kiss pic.twitter.com/D4FmEgpzRN",https://twitter.com/grantwest2020/status/1275275675918831616
2020-06-23 03:53:08,tittykawa,"what is an oomf",https://twitter.com/tittykawa/status/1275275674337644545
2020-06-23 03:53:05,mistrustme1,"Is it working?",https://twitter.com/mistrustme1/status/1275275662027358208
2020-06-23 03:53:05,notpiscesfinest,"Yess sis I already know the vibes!!",https://twitter.com/notpiscesfinest/status/1275275658860679169
2020-06-23 03:53:04,agentakn,"Now I want brownies",https://twitter.com/agentakn/status/1275275654787813377
2020-06-23 03:53:04,navyyy_,"brent faiyaz?? more like brent FINE ASF",https://twitter.com/navyyy_/status/1275275654238482432
2020-06-23 03:53:03,_troseee,"you better be in for when i get home",https://twitter.com/_troseee/status/1275275653730926593
2020-06-23 03:53:02,SudhirDivyaj,"Who cares for #Toilet_Roll @washingtonpost as well as #ToiletRoll_Holder @BDUTT",https://twitter.com/SudhirDivyaj/status/1275275649519767553
2020-06-23 03:53:02,trucdoann,"Save a horse ride a cowboy",https://twitter.com/trucdoann/status/1275275646319673344
2020-06-23 03:53:02,babyboy214,"Most likely Chrono Trigger & Shawshank",https://twitter.com/babyboy214/status/1275275646139326465
2020-06-23 03:53:02,SIRECHANHYUK,"That smirk https://twitter.com/vrvryoenho/status/1275029058695294976 …",https://twitter.com/SIRECHANHYUK/status/1275275645702922240
2020-06-23 03:53:01,mrdaniel_then,"Oh dang, was waiting on it & still ended up late to the party --gotta catch up so I can read this thread!",https://twitter.com/mrdaniel_then/status/1275275642880360449
2020-06-23 03:52:56,noyaIuvrs,"omgawddd HELLOO hayyy annyeonggg.... the baby sind helpppp let me hug u rn. Googooagaga anf the ocotupus looking thing when my anitwt n kpop oomf has a convowowlsmsmdjdn pic.twitter.com/C5QAgJBMfT",https://twitter.com/noyaIuvrs/status/1275275623540219904
2020-06-23 03:52:53,tomlinsongolden,"yup, and i only have like 3 irls and my mom would call me dumb for not wanting to be friends with her but idc what to do",https://twitter.com/tomlinsongolden/status/1275275608541536262
2020-06-23 03:52:53,SCScoach,"This is me with @hcrenshaw62 @ccalkins_22 @Camden_Witucki @J_Fife15 @MasonST13 @samblack1234 @noah_dooley after training https://twitter.com/DoeBoyOfficial/status/1275213411362779143 …",https://twitter.com/SCScoach/status/1275275607895670784
2020-06-23 03:52:50,CluelessSugar,"Dreaming of hot showers",https://twitter.com/CluelessSugar/status/1275275595778269185
2020-06-23 03:52:49,shannon4t76,"Outrage doesn’t hurt the cause. It actually helps",https://twitter.com/shannon4t76/status/1275275594738085888
2020-06-23 03:52:48,_Mama_87,"Yooo tmwhats going on kid",https://twitter.com/_Mama_87/status/1275275587632934912
2020-06-23 03:52:47,_SeaShells_,"My shoes were supposed to be delivered today. They weren’t...ion like that",https://twitter.com/_SeaShells_/status/1275275585607143424
2020-06-23 03:52:46,bitred,"Damn girl @PressSec you will be the one everyone remembers. Sucks when your kids Google you.",https://twitter.com/bitred/status/1275275578829144064
2020-06-23 03:52:45,cherryb0920,"Who's trying to see a video of me and my friend follow for more content and dm me for prices!",https://twitter.com/cherryb0920/status/1275275575918297088
2020-06-23 03:52:44,Queenlitty_,"@me bitch so I can see your beautiful name pop up on my notifications miss you more !!! Let me know what destination we going on Thursday and I’ll tell mike n jake",https://twitter.com/Queenlitty_/status/1275275573393154049
2020-06-23 03:52:42,K0N4ERU,"OMG YESSS #drinkpandesal nation lets gooo!!! ibabake kita kape WAHAHHAHA gonna make that fil so u don't understand muah",https://twitter.com/K0N4ERU/status/1275275564949975041
2020-06-23 03:52:41,se8ngmin,"how are u",https://twitter.com/se8ngmin/status/1275275560864735234
2020-06-23 03:52:40,__catera,"Mannn stop it",https://twitter.com/__catera/status/1275275555844362240
2020-06-23 03:52:40,salonebadgyal,"For real . They will swear up and down that they are not",https://twitter.com/salonebadgyal/status/1275275554493693952
2020-06-23 03:52:39,YoungRizzle2,"But you playing https://twitter.com/6ahtna_mas/status/1275060159014936576 …",https://twitter.com/YoungRizzle2/status/1275275550249168896
2020-06-23 03:52:38,tatyianalandis,"I wanna impress you but I’m not gonna press you",https://twitter.com/tatyianalandis/status/1275275544830062592
2020-06-23 03:52:37,WeyBoogie,"@TreGarrett3 @_Rob500 rt we was in our baghttps://twitter.com/weyboogie/status/1275275158618607616 …",https://twitter.com/WeyBoogie/status/1275275543429210112
2020-06-23 03:52:37,curvy_tweets,"Where is he wrong on this? ..why wait all these years to glorify something that's so ugly..",https://twitter.com/curvy_tweets/status/1275275542531584008
2020-06-23 03:52:36,QArmyLegion,"#D2MB AS #F2CK (NOT JUDGE MEAN JUST NOW) NO #HORRORBIRDY WE WASNT MEAN THIS NO ONE WAS SAYING IT BUT YOU WAS GIVEN ALL OTHER F2CKING LIES TO @ROYALMRBADNEWS @JOHNTHAW6 TO #SLANDERING AND #DISCREDIT OUR #PEDOHUNTER #THEDRAGONSDEN pic.twitter.com/xr6LE6578s",https://twitter.com/QArmyLegion/status/1275275538056298496
2020-06-23 03:52:32,ilove_bloo,"HE RLY SAID How do i look",https://twitter.com/ilove_bloo/status/1275275521417523202
2020-06-23 03:52:29,dolll_tears,"BSNAJKABAJANA SABRINA PLZ DRESS LIKE GERARD a little trisha paytas moment",https://twitter.com/dolll_tears/status/1275275507534311424
2020-06-23 03:52:27,noooemmma,"“I wAnNa SeE yOu WeAr OnE oF yOuR nAuGhTy RaVe OuTfItS fOr Me ”",https://twitter.com/noooemmma/status/1275275499787505667
2020-06-23 03:52:26,spell_ihop,"How about I play with it for you?",https://twitter.com/spell_ihop/status/1275275494909513729
2020-06-23 03:52:23,je6nglix,"these too",https://twitter.com/je6nglix/status/1275275483547144192
2020-06-23 03:52:23,allthebiwaves,"Does it count if you auditioned for theater, got in and didn’t go?",https://twitter.com/allthebiwaves/status/1275275481873633280
2020-06-23 03:52:19,AbzuIsland,"Nice one",https://twitter.com/AbzuIsland/status/1275275467629699073
2020-06-23 03:52:18,krwsmps,"You love me i know , https://twitter.com/ssjsmps/status/1275275232937480192 …",https://twitter.com/krwsmps/status/1275275464026669058
2020-06-23 03:52:18,_Mama_87,"Nigga what’s this about u good kid",https://twitter.com/_Mama_87/status/1275275461279600641
2020-06-23 03:52:17,cole2blessed,"Y'all talk to much I hit the lottery",https://twitter.com/cole2blessed/status/1275275459182419972
2020-06-23 03:52:16,IWA0IS,"you'll always be my day one day zero when i was no one i'm nothing by myself, you and no one else thankful you're my day one thankful you're my pic.twitter.com/mlz5VpLmNt",https://twitter.com/IWA0IS/status/1275275455977754626
2020-06-23 03:52:15,Iippieluvr,"do u hate it more than hate",https://twitter.com/Iippieluvr/status/1275275451733291009
2020-06-23 03:52:13,bitchwegeekin,"Princessa now my arch nemesis",https://twitter.com/bitchwegeekin/status/1275275442983862272
2020-06-23 03:52:13,austinlfreeze,"Goin in for a performance tune tomorrow pic.twitter.com/nCaBGrNYKV",https://twitter.com/austinlfreeze/status/1275275440907628545
2020-06-23 03:52:11,Iovecr1mes,"Who that",https://twitter.com/Iovecr1mes/status/1275275433450209280
2020-06-23 03:52:10,IrynDawg,"Right now fuck palace",https://twitter.com/IrynDawg/status/1275275431105556480
2020-06-23 03:52:10,DawnGracie_,"Oh baby I just need to start boxing again",https://twitter.com/DawnGracie_/status/1275275430648520704
2020-06-23 03:52:09,RunninOn_13th,"@sexyasstoni I wish you stop playing with me and get at me",https://twitter.com/RunninOn_13th/status/1275275423514009602
2020-06-23 03:52:08,rexvascooo,"anzay SSR pic.twitter.com/T6itCXmBw0",https://twitter.com/rexvascooo/status/1275275418979889152
2020-06-23 03:52:07,koofairyclub,"find mine https://twitter.com/frlendkth/status/1275257679569616896 …",https://twitter.com/koofairyclub/status/1275275415066603520
2020-06-23 03:52:06,needyeth,"does this mean they’re good",https://twitter.com/needyeth/status/1275275413372014592
2020-06-23 03:52:04,yvesyjin,"so Jin https://twitter.com/kthcultt/status/1275275282266550272 …",https://twitter.com/yvesyjin/status/1275275402618056704
2020-06-23 03:52:04,DownWith710,"If you get to the root it won't grow back.",https://twitter.com/DownWith710/status/1275275402450173953
2020-06-23 03:52:02,Thecrownone1,"If you get me the ps5 ill put u on sum shows",https://twitter.com/Thecrownone1/status/1275275397517762560
2020-06-23 03:52:01,JBonner71,"I want to work for you...just because your name is Johnny Cash. So, I can tell people: I worked for the Man in Black. That's it. You can fire me after a day or two. No blood, no foul. Seriously though, I can do this job and will walk the line. (Cue the Mariachi horns...)",https://twitter.com/JBonner71/status/1275275390165147648
2020-06-23 03:52:01,Lyssss69,"Findom IS a fetish KNOW YOUR PLACE! Findom • finD • finsub •",https://twitter.com/Lyssss69/status/1275275389854769152
2020-06-23 03:52:00,blanchette_emma,"I still have it in my notifications",https://twitter.com/blanchette_emma/status/1275275387828875264
2020-06-23 03:51:57,EcurbTheGreat,"Something, something... racial healing",https://twitter.com/EcurbTheGreat/status/1275275375296294912
2020-06-23 03:51:56,Wadiaa0002_,"Karma is realjust wait n see",https://twitter.com/Wadiaa0002_/status/1275275370661470208
2020-06-23 03:51:56,OhJNUELZ,"this is what u like to hear. Tahleur jvais te send des trucs",https://twitter.com/OhJNUELZ/status/1275275370397384708
2020-06-23 03:51:54,kaarllss,"yes mam",https://twitter.com/kaarllss/status/1275275360486273024
2020-06-23 03:51:53,seagzz,"Let’s go in dec https://twitter.com/sosolocaa/status/1275272734491258880 …",https://twitter.com/seagzz/status/1275275358632390656
2020-06-23 03:51:53,seungminshoes,"i should’ve never trusted you. don’t say shit i told u to keep secret in a tweet. you are fucking gross. i hope you burn in hell.https://twitter.com/feiclvt/status/1275270224758046724 …",https://twitter.com/seungminshoes/status/1275275357336358912
2020-06-23 03:51:52,other_world06,"Anyway I’m trying to say you’re f@cking HOT, you’re like so sexy, your photos should be illegal. I feel like I’m sinning just by looking at them. I mean, u know it’s true.",https://twitter.com/other_world06/status/1275275354312069121
2020-06-23 03:51:52,80____Five,"State your ass to bed Nank",https://twitter.com/80____Five/status/1275275353930506241
2020-06-23 03:51:49,KingJun93,"I gotta record my daughter dancing to Savage... I’m in fucking tears rn",https://twitter.com/KingJun93/status/1275275339980210183
2020-06-23 03:51:47,darkhosie,"yeah i am a gleek",https://twitter.com/darkhosie/status/1275275333772558337
2020-06-23 03:51:46,hydra_fares,"I take anything",https://twitter.com/hydra_fares/status/1275275327389020163
2020-06-23 03:51:42,tomlinsongolden,"also the back story is she had been sexualizing harry and is a blue greener",https://twitter.com/tomlinsongolden/status/1275275311136063489
2020-06-23 03:51:42,cum_at_10pm,"anyone horny enough to let my dick slide in their dms? #nudes #dm #horny #wet #buyingcontent",https://twitter.com/cum_at_10pm/status/1275275310376931329
2020-06-23 03:51:41,uzotwit,"You know what to do Lekeisha",https://twitter.com/uzotwit/status/1275275308728451074
2020-06-23 03:51:41,7th_Legionaire,"Can't wait for Wenger's reaction when he notices his own thread isn't about him anymore butt butthurt fefes pic.twitter.com/cYTk3Yi1Xj",https://twitter.com/7th_Legionaire/status/1275275306040020994
2020-06-23 03:51:40,cringesociety_,"imma rider provider",https://twitter.com/cringesociety_/status/1275275303560990720
2020-06-23 03:51:36,Justweeterin,"Ever heard of FIPA, Tool? Whoops I mean MP Toole... FIPA: https://www.cbc.ca/news/canada/fipa-agreement-with-china-what-s-really-in-it-for-canada-1.2770159 …",https://twitter.com/Justweeterin/status/1275275287882641408
2020-06-23 03:51:36,sherpagirlonuke,"Sort of a gasping, moaning Piccolo Pete-type Sound",https://twitter.com/sherpagirlonuke/status/1275275285382836225
2020-06-23 03:51:34,loganspotato,"ik u well fish",https://twitter.com/loganspotato/status/1275275278940467201
2020-06-23 03:51:33,MistasThiccAss,"Yooo what that tongue do tho",https://twitter.com/MistasThiccAss/status/1275275275182489602
2020-06-23 03:51:31,diamond_hefner,"In bag but I been laying back pic.twitter.com/NWWE2BLPYP",https://twitter.com/diamond_hefner/status/1275275264822575104
2020-06-23 03:51:29,markmelonn,"CMON MARK U KNOW U WANT IT COME HERE",https://twitter.com/markmelonn/status/1275275257939722241
2020-06-23 03:51:29,slaveforhyuck,"Send eyebrow pics",https://twitter.com/slaveforhyuck/status/1275275257449000962
2020-06-23 03:51:29,Rlboo22Lang,"Lol not as bad as other people’s comments. A lot of people I guess love my husband he is a very sexy man",https://twitter.com/Rlboo22Lang/status/1275275257209896975
2020-06-23 03:51:25,__synobia,"So you ignoring my text",https://twitter.com/__synobia/status/1275275239564414976
2020-06-23 03:51:24,endloveskyfall,"Because he's been putting one on after the last kid. Cloud is bad at putting it on so Aerith does it for him after getting it out. Then when she's about to put it on him... she throws it to the side. For one night only, he's gonna have a good feel for his gift",https://twitter.com/endloveskyfall/status/1275275236074635264
2020-06-23 03:51:24,Meilei_xx,"Would y'all believe me if I said I actually learned this choreo after watching this in slow motion 10 times? https://twitter.com/MAKNAECHANEL/status/1275209413104631812 …",https://twitter.com/Meilei_xx/status/1275275234602561542
2020-06-23 03:51:23,andtheniroke,"Just now I checked BLACKPINK at #3 with more than 3 MILLIONS gap. Look what happened now I love my timeline now. It’s so peaceful. No akgae fights, no fandom fights. Why? Cause BLINKS are too busy doing this before the cb approach You love to see competitive BLINKS pic.twitter.com/muWYusblUC",https://twitter.com/andtheniroke/status/1275275233591623680
2020-06-23 03:51:23,bdshahab,"That's why ""Herd immunity"" is the best and ""Final Solution""",https://twitter.com/bdshahab/status/1275275233050714112
2020-06-23 03:51:23,DamekaRochelle,"When a MAN wants you he will come get you literally!",https://twitter.com/DamekaRochelle/status/1275275230827679744
2020-06-23 03:51:20,woncIit,"skinny pic.twitter.com/D2JXTjs3fY",https://twitter.com/woncIit/status/1275275217892450306
2020-06-23 03:51:17,Don_Justoh,"Behave",https://twitter.com/Don_Justoh/status/1275275208556007427
2020-06-23 03:51:15,PettiAngi,"How much do you feel weak right now? Kik me: Pettiangi #findom #paypigs @RT4fet @SlaveSilly @rtfindom @RTsubby @RT_Pig @womenruleonly @RTmutt @RTFindomPromo @tonybobo3",https://twitter.com/PettiAngi/status/1275275198648979458
2020-06-23 03:51:15,DaRealELOHES,"#Right #FollowMEhttps://distrokid.com/hyperfollow/yourstrulyelohes/evrry-day-2 …. Here’s my #Spotify profile https://lnkd.in/eCeQeza - #Itunes… https://www.instagram.com/p/CBw14GFpu7y/?igshid=2wwumygmah0a …",https://twitter.com/DaRealELOHES/status/1275275198007316480
2020-06-23 03:51:09,MarieEl01705555,"Some are feeling very 'offended'",https://twitter.com/MarieEl01705555/status/1275275174624010240
2020-06-23 03:51:05,WeyBoogie,"My defense is to much. The LEGEND has 40 extra badges for nothing!!!!!! #PS4sharehttp://youtu.be/f3pQhZ7FsNk",https://twitter.com/WeyBoogie/status/1275275158618607616
2020-06-23 03:51:05,QueenjadeIam,"CEO of http://thebundlebox.co pic.twitter.com/hJ5CHHtMfr",https://twitter.com/QueenjadeIam/status/1275275157146304518
2020-06-23 03:51:05,jbheart131,"for Karma to this Susan asap ! pic.twitter.com/xayw8NTSgt",https://twitter.com/jbheart131/status/1275275155288162304
2020-06-23 03:51:04,bucinyuju,"Yupp,disupport ya gaiss",https://twitter.com/bucinyuju/status/1275275153107116032
2020-06-23 03:51:02,watermelonie16,"YOU AND ADDISON BETTER STOP MESSING WITH MY HEART",https://twitter.com/watermelonie16/status/1275275144550846464
2020-06-23 03:51:00,DJProdigy_809,"Who Church Ladies are these?! Because y’all need some prayerhttps://twitter.com/kollegekidd/status/1274784135211479041 …",https://twitter.com/DJProdigy_809/status/1275275137097621506
2020-06-23 03:50:56,maneshna,"But baby I would never love you like I loved ..... Type this and click the Middle one on the suggestions on your keyboard",https://twitter.com/maneshna/status/1275275118072061955
2020-06-23 03:50:55,lu_kiddphatt,"I’m so bored I know what’s finna come up next on all my apps",https://twitter.com/lu_kiddphatt/status/1275275115803095040
