date,username,to,replies,retweets,favorites,text,geo,mentions,hashtags,id,permalink
2020-06-23 03:54:11,PinkestCyclops,"Me tryna do art on a CHROMEBOOK: This is impossible ;-; Chrome Canvas: I am your savior. Me: Aha, what about the mouse. Chromebook: As you can see, I am not touchscreen. Me: Time to suffer while trying to learn how to draw with a on-keyboard mouse...",https://twitter.com/PinkestCyclops/status/1275275938528444423
2020-06-23 03:54:10,CypresTtv,"I know he’s not going follow pic.twitter.com/bx2oOe78Xs",https://twitter.com/CypresTtv/status/1275275934090829824
2020-06-23 03:54:06,mzqueenbee69,"Bring back LivePD",https://twitter.com/mzqueenbee69/status/1275275913865965568
2020-06-23 03:53:58,Todd45607849,"@jack blocking all videos",https://twitter.com/Todd45607849/status/1275275882781868032
2020-06-23 03:53:30,rykav_,"My forever favorite cards ever. With the same theme (5) and the same class (R) pic.twitter.com/kMP6VJ6JMs",https://twitter.com/rykav_/status/1275275766809260037
2020-06-23 03:53:29,nujhai,"Throw his ass into prison, rape is not funny, its serious and ppl is getting hurt by ppl and he decided to post a video like this, something is serious wrong with his weird ass",https://twitter.com/nujhai/status/1275275761243484160
2020-06-23 03:53:28,Sarah_10190,"I’m so sorry ash. My heart sank when I read this.",https://twitter.com/Sarah_10190/status/1275275756109811713
2020-06-23 03:53:27,TaymanRobert,"I can barely even think of the horror!! I'm a dad....",https://twitter.com/TaymanRobert/status/1275275753232482305
2020-06-23 03:53:18,MartinVallztrem,"Me tooinfo about Tyrell! [Sometimes like right now it just hits me the show is done + this is it no more really Robot-focused interviews, no panels... Hopefully we can keep discovering things tho:/ or the cast will still talk about it:/]",https://twitter.com/MartinVallztrem/status/1275275716653965318
2020-06-23 03:53:18,TemSoeung,"Nobody is genuine nowadays I don’t even know why I try",https://twitter.com/TemSoeung/status/1275275714862952449
2020-06-23 03:53:02,Amzad_Ansari,"Other products it's ohk but how I can boycott Chow mein #BoycottChineseProducts",https://twitter.com/Amzad_Ansari/status/1275275649578496001
2020-06-23 03:52:59,JPKP747,"Amen. Have a granddaughter that ......what's the use.? https://twitter.com/AnthemRespect/status/1275222034004373505 …",https://twitter.com/JPKP747/status/1275275636442116097
2020-06-23 03:52:48,ahmadkarim_1292,"@MA1KSA Dear Respected Sir As-salamu alyekum kindly request to you please help me please help me please notice below attachement please ..... pic.twitter.com/tx5N1OnDe8",https://twitter.com/ahmadkarim_1292/status/1275275589365100548
2020-06-23 03:52:47,jaymeekay_,"I wanna go get my daughter, I miss her",https://twitter.com/jaymeekay_/status/1275275586240417792
2020-06-23 03:52:46,boyzfan1,"She’s 9. She has Covid19. https://twitter.com/sheriawilkinson/status/1275093504830705666 …",https://twitter.com/boyzfan1/status/1275275579751911426
2020-06-23 03:52:44,mhomes_,"I hate to be that guy but android had this since 2012 https://twitter.com/bluefrmcanarsie/status/1275165463169941513 …",https://twitter.com/mhomes_/status/1275275573351395329
2020-06-23 03:52:37,bevzzyy11,"Happy Birthday in heaven Pa.",https://twitter.com/bevzzyy11/status/1275275542279753733
2020-06-23 03:52:37,ailurophilejen,"kind of regret laffing can he come back please",https://twitter.com/ailurophilejen/status/1275275540727951360
2020-06-23 03:52:23,Narisis_,"I had such amazing things, I loved this game",https://twitter.com/Narisis_/status/1275275482305572865
2020-06-23 03:52:22,imavegetable1,"I wish in NY too https://twitter.com/phil_hellmuth/status/1275274789406380033 …",https://twitter.com/imavegetable1/status/1275275480078462978
2020-06-23 03:52:22,Bewater57249897,"I am very upset when he said ""dissapointed "" two Canadians being charged in #CCPChina , even not condemning",https://twitter.com/Bewater57249897/status/1275275478744481792
2020-06-23 03:52:14,politicalelite,"Lost so many homies. RIP. man",https://twitter.com/politicalelite/status/1275275445773139970
2020-06-23 03:52:02,Therealfave1,"I don’t think I could ever do long distance I turn into a monster if I don’t at least get a dam hug or something",https://twitter.com/Therealfave1/status/1275275397454848000
2020-06-23 03:51:52,kimdaquino,"I can't reach your contact center, I waited for more than an hour, but no answer",https://twitter.com/kimdaquino/status/1275275354106589187
2020-06-23 03:51:51,Sanjay10kc,"I'm so tired of this board, I don't think I can hold on to it for 1 more season",https://twitter.com/Sanjay10kc/status/1275275350310699009
2020-06-23 03:51:47,xilix,"Ugh yeah, I thought about Nelsan when I was typing that. He was my FAVORITE!",https://twitter.com/xilix/status/1275275334431227905
2020-06-23 03:51:44,SaiCharan291,"Can i get 10 rts #3YearsForDJSensation",https://twitter.com/SaiCharan291/status/1275275320799580160
2020-06-23 03:51:35,_beIphegors,"evidence #2 , i get bored easily pic.twitter.com/wEHW2xGj8f",https://twitter.com/_beIphegors/status/1275275282958766082
2020-06-23 03:51:19,Watzpoppinz,"Shit why didn't I see this Sure",https://twitter.com/Watzpoppinz/status/1275275213643452416
2020-06-23 03:51:16,cassidyrsimpson,"thinking about stomping on the ground to this song at thunderdome w/ with zoo of course https://twitter.com/chelllllyx/status/1275260313256984576 …",https://twitter.com/cassidyrsimpson/status/1275275203073896448
2020-06-23 03:51:12,FebyKurniya,"when he got sick, and you can't do anything.. Sad",https://twitter.com/FebyKurniya/status/1275275185403265026
2020-06-23 03:51:02,AWindon,"Thank god rod wave is still here",https://twitter.com/AWindon/status/1275275144085360640
2020-06-23 03:51:00,marianananana_,"I need to find some cute plugs soon my holes are starting to close",https://twitter.com/marianananana_/status/1275275137894486024
2020-06-23 03:50:52,huffleshar,"Congratulation morning too",https://twitter.com/huffleshar/status/1275275100254846976
2020-06-23 03:50:35,lovely_keke4,"Me & my baby needs to run away for a while",https://twitter.com/lovely_keke4/status/1275275031443124225
2020-06-23 03:50:28,play_misty_4me,"I cried.",https://twitter.com/play_misty_4me/status/1275275000296046593
2020-06-23 03:50:20,Helianthella,"Megatron's mouth in the new War for Cybertron show pic.twitter.com/baER3OrK5I",https://twitter.com/Helianthella/status/1275274969144913921
2020-06-23 03:50:12,wujus2,"we really hope for an Asia tour that would be cool if we can see y'all in real person #arirang_ASC",https://twitter.com/wujus2/status/1275274935158493186
2020-06-23 03:50:11,SimsFanaticGuy,"Oh I'm so sorry.",https://twitter.com/SimsFanaticGuy/status/1275274931698360323
2020-06-23 03:50:01,bluhckpink,"3rd pic https://twitter.com/oxygjen/status/1275228603710533633 …",https://twitter.com/bluhckpink/status/1275274887695790081
2020-06-23 03:50:00,CailynChaos,"Those are very red eyes,",https://twitter.com/CailynChaos/status/1275274885699211264
2020-06-23 03:49:53,xmusafir,"*glup",https://twitter.com/xmusafir/status/1275274855890317313
2020-06-23 03:49:41,Teae55,"OMG. BLM co-founders drinking their wine, busy training bull Marxism. To them only #MarxistLivesMatter",https://twitter.com/Teae55/status/1275274803650285570
2020-06-23 03:49:40,hisokacx,"Guys I'd never leave I love u all and I could never leave my babies I LOVE TOI SPP TOO KUCH https://twitter.com/hisokacx/status/1275273038079000576 …pic.twitter.com/hDKdTewGTD",https://twitter.com/hisokacx/status/1275274800697466880
2020-06-23 03:49:40,shabbabanks_,"I got this new face wash I been using since Thursday... it smells good and cleared some acne but it made my eye area so dry S.O.S.",https://twitter.com/shabbabanks_/status/1275274798625587201
2020-06-23 03:49:21,Samaher_p,"Thank u",https://twitter.com/Samaher_p/status/1275274719596556289
2020-06-23 03:49:15,lakhi_876,"In Love...?! #Heartbreaking.",https://twitter.com/lakhi_876/status/1275274693822443520
2020-06-23 03:49:10,r_sillar,"REST IN PEACE HON. SIR DAPAR.",https://twitter.com/r_sillar/status/1275274675929657351
2020-06-23 03:49:08,GoofTroop_,"Mom Dey Sad Bro",https://twitter.com/GoofTroop_/status/1275274665884291072
2020-06-23 03:49:05,deobisope,"im a hag sorry",https://twitter.com/deobisope/status/1275274653502668800
2020-06-23 03:49:00,deeiibb,"Forwardmarch and herewe go members ofagencyBakugo Ah *splash*",https://twitter.com/deeiibb/status/1275274631272976384
2020-06-23 03:48:49,chigsu,"say it louder sis.",https://twitter.com/chigsu/status/1275274587983364097
2020-06-23 03:48:49,Gemama07,"Okay i'm listening #ForAMinuteftJAMIE",https://twitter.com/Gemama07/status/1275274587488636929
2020-06-23 03:48:48,TheKronaGuy,"Oh no for real",https://twitter.com/TheKronaGuy/status/1275274582929244161
2020-06-23 03:48:48,httptahjaya,"plant based american style? https://twitter.com/j0samspeaks/status/1275273396578848769 …",https://twitter.com/httptahjaya/status/1275274581696274432
2020-06-23 03:48:48,abqbodywork,"So sad... https://twitter.com/marthamaccallum/status/1275055667951386624 …",https://twitter.com/abqbodywork/status/1275274580739928064
2020-06-23 03:48:42,warofthefire,"Guys please pray for my friend he didn't have enough money for chicken nugget pic.twitter.com/kLTT0uSkId",https://twitter.com/warofthefire/status/1275274556081504256
2020-06-23 03:48:26,edfillingstati1,"This is how we see ourselves these days. pic.twitter.com/xd9VMw3USM",https://twitter.com/edfillingstati1/status/1275274491921412096
2020-06-23 03:48:17,MRJVBLN,"""How can I move on when I'm still inlove with you?""",https://twitter.com/MRJVBLN/status/1275274451739742208
2020-06-23 03:48:15,kimbrownjr88,"Condolences to the family of that precious little girl.",https://twitter.com/kimbrownjr88/status/1275274443758198784
2020-06-23 03:48:08,yorrawr,"Time really do be flying",https://twitter.com/yorrawr/status/1275274412539826176
2020-06-23 03:48:01,razak8299,"@bollywood_life @itsSSR #SushantSinghRajput #SushanthSinghRajput #BollywoodBlockedSushant You Will Born Again You Will Win. Rest in Peace sushant https://youtu.be/NguwlQ8Zu6A pic.twitter.com/iECkbmBIQs",https://twitter.com/razak8299/status/1275274384819683329
2020-06-23 03:48:00,DeepakK55421598,"Sir ek moka dijiye mujhe aur meri zindagi ko plz sir ek baar mil lijiye plz sir one call plz contact me one call plz sir my life is danger plz save the my life and my family plz sir one call my life is danger plz save da my life and my family plz sir one call 8360925392 https://twitter.com/BeingSalmanKhan/status/1274627685730455557 …",https://twitter.com/DeepakK55421598/status/1275274380428423170
2020-06-23 03:47:58,ELLERISHI,"I feel so rejected and neglected.",https://twitter.com/ELLERISHI/status/1275274374476513280
2020-06-23 03:47:57,notf8dd,"how i feel when i hit demon while braindead https://twitter.com/outofcontextev2/status/1275138215339532294 …",https://twitter.com/notf8dd/status/1275274367933583360
2020-06-23 03:47:55,DeepakK55421598,"Sir ek moka dijiye mujhe aur meri zindagi ko plz sir ek baar mil lijiye plz sir one call plz contact me one call plz sir my life is danger plz save the my life and my family plz sir one call my life is danger plz save da my life and my family plz sir one call 8360925392",https://twitter.com/DeepakK55421598/status/1275274358408257536
2020-06-23 03:47:54,iiishmarie,"hopefully next sunday, oww pls",https://twitter.com/iiishmarie/status/1275274355916730370
2020-06-23 03:47:54,chaaibaai,"Long time no see pic.twitter.com/jV7j1TUfXm",https://twitter.com/chaaibaai/status/1275274355690205184
2020-06-23 03:47:50,Cjnog1,"Well spoken... my sympathies once more...",https://twitter.com/Cjnog1/status/1275274340192452610
2020-06-23 03:47:50,DeepakK55421598,"Sir ek moka dijiye mujhe aur meri zindagi ko plz sir ek baar mil lijiye plz sir one call plz contact me one call plz sir my life is danger plz save the my life and my family plz sir one call my life is danger plz save da my life and my family plz sir one call 8360925392 https://twitter.com/BeingSalmanKhan/status/1274404948747235330 …",https://twitter.com/DeepakK55421598/status/1275274338049163270
2020-06-23 03:47:43,DeepakK55421598,"Sir ek moka dijiye mujhe aur meri zindagi ko plz sir ek baar mil lijiye plz sir one call plz contact me one call plz sir my life is danger plz save the my life and my family plz sir one call my life is danger plz save da my life and my family plz sir one call 8360925392",https://twitter.com/DeepakK55421598/status/1275274310626824192
2020-06-23 03:47:39,DeepakK55421598,"Sir ek moka dijiye mujhe aur meri zindagi ko plz sir ek baar mil lijiye plz sir one call plz contact me one call plz sir my life is danger plz save the my life and my family plz sir one call my life is danger plz save da my life and my family plz sir one call 8360925392 https://twitter.com/BeingSalmanKhan/status/1273210153475735554 …",https://twitter.com/DeepakK55421598/status/1275274291207196673
2020-06-23 03:47:37,thestar_atower,"Into the New World playing in this cafe, I'm gonna cry in the cafe",https://twitter.com/thestar_atower/status/1275274283376193537
2020-06-23 03:47:35,tommo_sunflower,"i’m bitches",https://twitter.com/tommo_sunflower/status/1275274275704860672
2020-06-23 03:47:34,mynameisuju,"Ahhh did I come to the wrong wizard? Are you not the one that was just promising disaster and destruction to someone else? See I'm free all week, so your spell will find me easily. Please swear for me too",https://twitter.com/mynameisuju/status/1275274271435169793
2020-06-23 03:47:34,DeepakK55421598,"Sir ek moka dijiye mujhe aur meri zindagi ko plz sir ek baar mil lijiye plz sir one call plz contact me one call plz sir my life is danger plz save the my life and my family plz sir one call my life is danger plz save da my life and my family plz sir one call 8360925392",https://twitter.com/DeepakK55421598/status/1275274270382460928
2020-06-23 03:47:31,Riaz_uop,"RIP... Allah give her high place n heaven.",https://twitter.com/Riaz_uop/status/1275274261146611712
2020-06-23 03:47:18,nayeonijeong,"I... I fucked up... oh God",https://twitter.com/nayeonijeong/status/1275274203009175554
2020-06-23 03:47:16,JuneMar96625522,"i have a all in one potato https://twitter.com/Hyper_kyuun/status/1275115616358236160 …",https://twitter.com/JuneMar96625522/status/1275274195279151112
2020-06-23 03:47:14,DeepakK55421598,"Sir ek moka dijiye mujhe aur meri zindagi ko plz sir ek baar mil lijiye plz sir one call plz contact me one call plz sir my life is danger plz save the my life and my family plz sir one call my life is danger plz save da my life and my family plz sir one call 8360925392 https://twitter.com/BeingSalmanKhan/status/1272175078671699968 …",https://twitter.com/DeepakK55421598/status/1275274187859546115
2020-06-23 03:47:08,emma06686275,"is this THE matty b? #childhoodruined",https://twitter.com/emma06686275/status/1275274164685942784
2020-06-23 03:47:04,DeepakK55421598,"Sir ek moka dijiye mujhe aur meri zindagi ko plz sir ek baar mil lijiye plz sir one call plz contact me one call plz sir my life is danger plz save the my life and my family plz sir one call my life is danger plz save da my life and my family plz sir one call 8360925392",https://twitter.com/DeepakK55421598/status/1275274148017823745
2020-06-23 03:47:02,anicole182,"Makes me miss NOLA can’t wait for my man to take me again https://twitter.com/yphoustontx/status/1208091395086573568 …",https://twitter.com/anicole182/status/1275274137796259840
2020-06-23 03:46:44,_beIphegors,"answers for lucifers stories are sometimes so black and white and whenever i pick the wrong answers i can just FEEL his disappointment thru the screen",https://twitter.com/_beIphegors/status/1275274060381945864
2020-06-23 03:46:41,TylerKingPig,"Oh yeah",https://twitter.com/TylerKingPig/status/1275274048059080705
2020-06-23 03:46:33,ask4ola_,"no b small tin in my family last yr and dis yr... in d space of 7months.. dat experience is d worst ever for me, my mum nd my siblings... #ripbigsis and #dad",https://twitter.com/ask4ola_/status/1275274013951102976
2020-06-23 03:46:23,mackmittens,"@TacoTitsday Say it ain't so!!! The penis part.",https://twitter.com/mackmittens/status/1275273975665483779
2020-06-23 03:46:12,SManamela,"@SAPoliceService do ur thing https://twitter.com/zmngadi/status/1275157493614882816 …",https://twitter.com/SManamela/status/1275273928613801985
2020-06-23 03:46:03,Lizzie17_,"I moved out and bought a house at 21. It feels like that was last year...I'll be turning 26 this year",https://twitter.com/Lizzie17_/status/1275273890558697472
2020-06-23 03:46:00,Kristyg1,"For a starters have a mental health team assigned to an aged care facility. My husband stopped working in aged care because there is only so much they can do without all the other supports. It was too depressing",https://twitter.com/Kristyg1/status/1275273876868497408
2020-06-23 03:45:53,Diego_Playe,"Sticker",https://twitter.com/Diego_Playe/status/1275273849320267777
2020-06-23 03:45:45,fovvsbby1,"Can someone please fill me in on what’s going on with the fandom?? I’m getting it all over my feed and I feel bad I can’t support or nun bc idk what happened",https://twitter.com/fovvsbby1/status/1275273815187238917
2020-06-23 03:45:41,Jushin,"So sad",https://twitter.com/Jushin/status/1275273796740620289
2020-06-23 03:45:20,cloudierosie,"I’ve had my heart broken in a lot of different ways a lot of different times by different people – whether it be a family member, a girlfriend, a friend, just all types of relying on people, making yourself vulnerable to people. -Lil Peep https://twitter.com/christypng/status/1275272995792093185 …",https://twitter.com/cloudierosie/status/1275273708324691968
2020-06-23 03:45:17,offthegridsid,"I miss Sarah more than words can describe I cant keep doing this https://twitter.com/sarahhh_stoffle/status/1103049346868760577 …",https://twitter.com/offthegridsid/status/1275273698262597640
2020-06-23 03:45:17,UmarMusa8959733,"RIP to English pic.twitter.com/xgNAwnzyK2",https://twitter.com/UmarMusa8959733/status/1275273696899477504
2020-06-23 03:45:15,UsagiFen,"Sp we're gonna just ignore the almost 10k RP difference???",https://twitter.com/UsagiFen/status/1275273688955400192
2020-06-23 03:44:57,Daddysimp3,"Till this day I hate how orange is the new black ended",https://twitter.com/Daddysimp3/status/1275273612530978822
2020-06-23 03:44:52,Llyn_n_,"Already full",https://twitter.com/Llyn_n_/status/1275273590888259585
2020-06-23 03:44:50,DeepakK55421598,"Sir ek moka dijiye mujhe aur meri zindagi ko plz sir ek baar mil lijiye plz sir one call plz contact me one call plz sir my life is danger plz save the my life and my family plz sir one call my life is danger plz save da my life and my family plz sir one call 8360925392 https://twitter.com/BeingSalmanKhan/status/1271783453688766464 …",https://twitter.com/DeepakK55421598/status/1275273583317614594
2020-06-23 03:44:46,maxinecallfield,"having to mute people",https://twitter.com/maxinecallfield/status/1275273566020304896
2020-06-23 03:44:45,DeepakK55421598,"Sir ek moka dijiye mujhe aur meri zindagi ko plz sir ek baar mil lijiye plz sir one call plz contact me one call plz sir my life is danger plz save the my life and my family plz sir one call my life is danger plz save da my life and my family plz sir one call 8360925392",https://twitter.com/DeepakK55421598/status/1275273561293426688
2020-06-23 03:44:45,loserjun,"wtf i love it Sm",https://twitter.com/loserjun/status/1275273560928501765
2020-06-23 03:44:32,Nohelss_,"I took like a 2 hour nap so now my head hurts and I don’t know how I’m to going to be able to fall back asleep",https://twitter.com/Nohelss_/status/1275273506750595072
2020-06-23 03:44:20,UsagiFen,"Legitimately everyone but you cares",https://twitter.com/UsagiFen/status/1275273458746785792
2020-06-23 03:44:19,MicheleHelmink,"I’m so sorry",https://twitter.com/MicheleHelmink/status/1275273455563399168
2020-06-23 03:44:00,nojaestars,"on the wayy hshshs",https://twitter.com/nojaestars/status/1275273375481425920
2020-06-23 03:43:51,DhivehiOne,"Actually @navaanavai came out to protest against govt policies, but ended up protesting against police..",https://twitter.com/DhivehiOne/status/1275273337376108546
2020-06-23 03:43:50,mvuyc,"Best video ever and that's COMPLETE FREEDOM, FREEDOM without strings attached let go set free Black people want this https://twitter.com/cctv_idiots/status/1274772410835886082 …",https://twitter.com/mvuyc/status/1275273331525255169
2020-06-23 03:43:47,Itsmewinnie4,"True",https://twitter.com/Itsmewinnie4/status/1275273320330440704
2020-06-23 03:43:32,PETTYMOODQUOTEZ,"' y'all he watched my story and didn't even swipe up.... it's ok his homeboy did though",https://twitter.com/PETTYMOODQUOTEZ/status/1275273255771832320
2020-06-23 03:43:24,winny_atheart,"Can’t believe this is the first thing I see this morning #Laurengermanpic.twitter.com/GfbUhhCmQW",https://twitter.com/winny_atheart/status/1275273222955638785
2020-06-23 03:43:21,crepeer2581,"Can't show my 2nd picture because it's my grandpa's grave stone",https://twitter.com/crepeer2581/status/1275273212524462080
2020-06-23 03:43:16,chantyschalamet,"I made a stupid and serious mistake i regret and now everyone hates me as they should i don't blame people if they hate me i truly don't i should have known better and not say those things i said but the damage is done there's no way i can go back and fix things https://twitter.com/chalamethours/status/1274890059477422080 …",https://twitter.com/chantyschalamet/status/1275273190676275206
2020-06-23 03:43:15,Mamaduck2468,"But my teeny baby forst fots all mugs...",https://twitter.com/Mamaduck2468/status/1275273185856901120
2020-06-23 03:43:14,Todd45607849,"@NBA less disappointed",https://twitter.com/Todd45607849/status/1275273180349857794
2020-06-23 03:43:11,OlumideOluseun,"These people are just trying to be illogical and irrational. Trying to erase history.",https://twitter.com/OlumideOluseun/status/1275273166902964225
2020-06-23 03:43:04,LostSvn,"If only",https://twitter.com/LostSvn/status/1275273139845582848
2020-06-23 03:43:00,Keshaaaa___,"this is the hardest thing i ever had to do",https://twitter.com/Keshaaaa___/status/1275273122468552705
2020-06-23 03:42:59,mharvey816,"They're still not going to be doing facials in the near future for obvious reasons, but they will still begin billing monthly fees again. So I'm probably going to have to cancel my membership. It sucks but I have to do what's best for my health.",https://twitter.com/mharvey816/status/1275273117154398209
2020-06-23 03:42:36,AriW1977,"I'm terribly, terribly sorry for you ...",https://twitter.com/AriW1977/status/1275273023256395777
2020-06-23 03:42:18,RAPDlABLO,"thank you so much u are",https://twitter.com/RAPDlABLO/status/1275272947813548033
2020-06-23 03:42:11,KarlsburgReview,"Thanks hun",https://twitter.com/KarlsburgReview/status/1275272917199306752
2020-06-23 03:42:09,HaetnimJ,"I miss u Eric!! (insert yerim voice)",https://twitter.com/HaetnimJ/status/1275272908114259969
2020-06-23 03:41:43,TinyProtests,"SILENCE IS COMPLIANCE!",https://twitter.com/TinyProtests/status/1275272799825821706
2020-06-23 03:41:39,LouieMohlaka,"Check the comments",https://twitter.com/LouieMohlaka/status/1275272783098982400
2020-06-23 03:41:34,busolomareezz,"Greed... pic.twitter.com/SH9mzePdjW",https://twitter.com/busolomareezz/status/1275272763784208384
2020-06-23 03:41:29,GetzMarco,"He still doesn’t understand the magnitude of what he did...",https://twitter.com/GetzMarco/status/1275272742787481600
2020-06-23 03:41:29,W0705K,"What's with the stealing glances? Can't help but to missed S.K bromance pic.twitter.com/7i6UluC152",https://twitter.com/W0705K/status/1275272742573453312
2020-06-23 03:41:21,Breezy4monstaX,"Ahhh you should see my amazon cart right now. Just waiting on my next paycheck",https://twitter.com/Breezy4monstaX/status/1275272708079726592
2020-06-23 03:41:20,redpilllonlyway,"i feeeel ya spilll the tea on what happened !!",https://twitter.com/redpilllonlyway/status/1275272702295781376
2020-06-23 03:41:18,VickieH65817330,"I moved away and YES, I absolutely regret it!! I missed the last 8 years of my Dads life and I wish I would've stayed",https://twitter.com/VickieH65817330/status/1275272696075517952
2020-06-23 03:41:15,Koan83259751,"Babyyy",https://twitter.com/Koan83259751/status/1275272680908955651
2020-06-23 03:41:14,YoungRoot99,"I been waitin', baby, but you been takin' so long",https://twitter.com/YoungRoot99/status/1275272677176094721
2020-06-23 03:41:03,PAINintoPOWER_,"I swear this shit be the fucking hardest https://twitter.com/robhillsr/status/1275270290352807937 …",https://twitter.com/PAINintoPOWER_/status/1275272630392807424
2020-06-23 03:40:57,MaldonadoXander,"braddison",https://twitter.com/MaldonadoXander/status/1275272606216830976
2020-06-23 03:40:54,B33rdan,"Not looking forward to the weather this week. 32°C or higher, and humid too. At least it's forecast to get fresher at the weekend.",https://twitter.com/B33rdan/status/1275272595693322240
2020-06-23 03:40:52,SuperNovs1,"Food sensitivities",https://twitter.com/SuperNovs1/status/1275272586608312321
2020-06-23 03:40:47,TobyJake_Pug,"Yea. I remember one summer watching baseball and chatting with Cindy on Twitter. The good ol days...",https://twitter.com/TobyJake_Pug/status/1275272565276147713
2020-06-23 03:40:47,miliitevez,"same",https://twitter.com/miliitevez/status/1275272563703320576
2020-06-23 03:40:47,detached_baji,"Need a solid excuse to tell , mjhe aj office nhe Jana Hy",https://twitter.com/detached_baji/status/1275272562994544651
2020-06-23 03:40:35,Choppless69,"A month ?!",https://twitter.com/Choppless69/status/1275272515133280256
2020-06-23 03:40:22,charlif38352715,"what happened",https://twitter.com/charlif38352715/status/1275272459306954752
