date,username,to,replies,retweets,favorites,text,geo,mentions,hashtags,id,permalink
2020-06-23 05:34:07,Mutchy2U,"And yet they are in a nice neighborhood, and likely live there too.",https://twitter.com/Mutchy2U/status/1275301085469646849
2020-06-23 05:34:00,LanncePants,"Been through this https://twitter.com/yikessamira/status/1274940346967846912 …",https://twitter.com/LanncePants/status/1275301057896353794
2020-06-23 05:33:52,UsagiFen,"TBH they dont even need to be rainbowed for the hard events, you can legitimately beat any content in either OPTC or Dokkan without rainbows",https://twitter.com/UsagiFen/status/1275301023373033474
2020-06-23 05:33:45,kihyuntruck,"so I pray for youu",https://twitter.com/kihyuntruck/status/1275300992322605058
2020-06-23 05:33:37,TNTBoysF,"I know. Got teary eyed.",https://twitter.com/TNTBoysF/status/1275300959862718464
2020-06-23 05:33:29,LATEEFofLAENT,"Damn my people we must do better https://www.instagram.com/p/CBxBlCXhDPY9mLp5S9Pl3VNuiW9xvZZCDwDbfY0/?igshid=1hm3558c1h1f2 …",https://twitter.com/LATEEFofLAENT/status/1275300927491190784
2020-06-23 05:33:25,elleontwitch,"I scratch the everliving fuck out of my scalp when I’m anxious or stressed and holy shit my scalp is so raw these past few days",https://twitter.com/elleontwitch/status/1275300911519354881
2020-06-23 05:33:21,pepperpaige20,"ME TOO!! https://twitter.com/tonyschwartz/status/1275156655634817025 …",https://twitter.com/pepperpaige20/status/1275300892099653632
2020-06-23 05:33:18,ValeriaGuti07,"how can anyone be okay with this? https://twitter.com/aclu/status/1033084026893070338 …",https://twitter.com/ValeriaGuti07/status/1275300882188386304
2020-06-23 05:33:18,karmelaserrano,"13 days of vacation left for me",https://twitter.com/karmelaserrano/status/1275300879831166978
2020-06-23 05:33:10,compiledwrong,"Seems totally within the realm of possibility",https://twitter.com/compiledwrong/status/1275300846939463680
2020-06-23 05:33:09,BeWithNoE,"Oh no! Sweetheart I'm so sorry",https://twitter.com/BeWithNoE/status/1275300842296545280
2020-06-23 05:33:01,DorisAnita11,"Pls dont be tired it's his day nd we his fans wish to celebrate him daz all",https://twitter.com/DorisAnita11/status/1275300808129732608
2020-06-23 05:32:59,villuminic,"The hardest/saddest part of being a Christian is to watch the spirit world take hold blatantly in front me (within ppl) and to have them live nonchalantly ab their soul .. Very very stange. Very sad.",https://twitter.com/villuminic/status/1275300798847750146
2020-06-23 05:32:58,JHogashu,"Honestly if the writing for Jaya is bad imagine what they could do to Pixane",https://twitter.com/JHogashu/status/1275300795093856256
2020-06-23 05:32:52,Sehgah,"sorry hard carry",https://twitter.com/Sehgah/status/1275300770754093056
2020-06-23 05:32:48,hidnliftvillage,"So sorry to hear that bro",https://twitter.com/hidnliftvillage/status/1275300756070043650
2020-06-23 05:32:46,DougFoley6,"RIP Yolande, Georges, Marie, and Pierre.",https://twitter.com/DougFoley6/status/1275300746628460546
2020-06-23 05:32:42,miyaworId,"there is no sakusa only brain no there isnt no head thoughts empty only SAKUSA",https://twitter.com/miyaworId/status/1275300727833780225
2020-06-23 05:32:41,UsagiFen,"WOW I got blocked!!! Ayo can I get some likes to help with my pain?",https://twitter.com/UsagiFen/status/1275300723677368321
2020-06-23 05:32:38,matti_wilks,"This https://twitter.com/blekhman/status/1275243184914915331 …",https://twitter.com/matti_wilks/status/1275300712147116032
2020-06-23 05:32:35,BunnyKoo93,"Yes sleep! You need it after today hope you aren't getting sick luv",https://twitter.com/BunnyKoo93/status/1275300700122157063
2020-06-23 05:32:29,ismaelvelez10,"The President",https://twitter.com/ismaelvelez10/status/1275300675682009088
2020-06-23 05:32:27,maahemaha1998,"Actually #Annaatthe game la big I'd daily pannah nallah irukkum #Annaatthe @rajinikanth",https://twitter.com/maahemaha1998/status/1275300666538254336
2020-06-23 05:32:23,Gibbo_2010,"I loved this man. Miss him sana",https://twitter.com/Gibbo_2010/status/1275300648565817345
2020-06-23 05:32:22,hardeymorela,"Mine too",https://twitter.com/hardeymorela/status/1275300645663395840
2020-06-23 05:32:09,DimakatsoMgcina,"Mr van Zyl is doing what government should have demolished long time ago but continues to fail and you don't wanna entertain this outcome of investigation. #blacklivelyhood #wecantbreathe @MYANC @SAHRCommission @SABCNews @HermanMashabahttps://twitter.com/interrec/status/1275284660730413059 …",https://twitter.com/DimakatsoMgcina/status/1275300591229636613
2020-06-23 05:32:06,JasonLightfoot7,"John we all know this and the New Zealand deal are pointless when we lose a deal with 500 million of our neighbours",https://twitter.com/JasonLightfoot7/status/1275300578432876549
2020-06-23 05:32:02,venz_emm,"Are rwts some new currency I know nothing of... https://twitter.com/Jojomuganda/status/1275299406162649088 …",https://twitter.com/venz_emm/status/1275300562704228352
2020-06-23 05:31:54,HappyBakolo,"Sending love to all the people that knew @TamiweKa personally May God comfort you through this tough time It's always heartbreaking to lose friends and family at such a young age. Rest in peace",https://twitter.com/HappyBakolo/status/1275300529393020928
2020-06-23 05:31:43,seatjin,"is it how we will end all of these memories?",https://twitter.com/seatjin/status/1275300480449564672
2020-06-23 05:31:36,anand_wadvat,"@publictvnews yadgir district bandhalli quarantine centre not clean tolats pic.twitter.com/RBGDQ2ZpR8",https://twitter.com/anand_wadvat/status/1275300450984554496
2020-06-23 05:31:18,purpletaekook97,"@vgukayo hey i can't dm u why",https://twitter.com/purpletaekook97/status/1275300375566802946
2020-06-23 05:31:14,Breezy4monstaX,"How well to do my moots know me? Without looking at my pinned twt. What two monsta x songs do I have tattooed on me? Or what three saying do I have tattooed on me? @OfficialMonstaX @official__wonho",https://twitter.com/Breezy4monstaX/status/1275300362124214272
2020-06-23 05:31:13,SerenaIngre,"Siberia reached 100.4 degrees Fahrenheit on Saturday https://www.cbsnews.com/news/arctic-hottest-temperature-ever/ …",https://twitter.com/SerenaIngre/status/1275300354750509056
2020-06-23 05:31:08,tsgmblk,"met siank,, pic.twitter.com/Ns42vAHMSt",https://twitter.com/tsgmblk/status/1275300335930630144
2020-06-23 05:31:05,AshIeyooo,"STOP I DONT KNOW HOW MANY MORE EMOJIS I CAN PUT",https://twitter.com/AshIeyooo/status/1275300321644986368
2020-06-23 05:31:02,popcornpearl,"the propaganda.... whew",https://twitter.com/popcornpearl/status/1275300311184310272
2020-06-23 05:31:01,valeria_sg0409,"Ese feeling de I NEED TO KNOW . BUT HOW AM I SUPPOSE TO ASK??",https://twitter.com/valeria_sg0409/status/1275300304104366080
2020-06-23 05:31:00,kerralian1,"Mind your tongue ezzy....the power of the tongue....nothing happens for no reason...u don't have to confess wrong...be positive have faith",https://twitter.com/kerralian1/status/1275300299872362496
2020-06-23 05:30:55,CRufsvold,"I'm so sorry... How could such a thing happen?",https://twitter.com/CRufsvold/status/1275300279659847680
2020-06-23 05:30:47,Arian25447938,"Hard af again who wants to help? #buyingnudes #horny Lets get a session going Lmk if you're #sellingnudes",https://twitter.com/Arian25447938/status/1275300248274055168
2020-06-23 05:30:28,mjtwitz,"Photo lam pottu than thaniya than wish pannean but some haters replay kkaha dlt pannittean",https://twitter.com/mjtwitz/status/1275300168062193665
2020-06-23 05:30:18,EdwardRSouth,"Not helpful in the slightest, and the person or people who did it know it. There are always a few antagonizers that want others to fight while they stand back in the shadows like cowards. #Truth",https://twitter.com/EdwardRSouth/status/1275300125628399616
2020-06-23 05:30:17,jvkyc,"I never save what I write in apps bc I write it in portal but I wrote something endearing about empathy and I must share (when I find it) lol",https://twitter.com/jvkyc/status/1275300122247618560
2020-06-23 05:30:16,sunnymon_94,"You're gonna make me cry again I don't deserve you I love you so so much",https://twitter.com/sunnymon_94/status/1275300116564455426
2020-06-23 05:30:15,usagi_acnh1213,"Oof you deserve to sleep all day after staying up I’ll sing you a lullaby with my tone deaf voice pic.twitter.com/V656g8qAHv",https://twitter.com/usagi_acnh1213/status/1275300111191588864
2020-06-23 05:30:13,michocollins,"Charlie Kirk wishes Donald Trump would call him on the telephone. Donald Trump is too busy to call Charlie. Donald Trump won't call Charlie because he thinks Charlie is a dumdum. Charlie Kirk is sad because Donald Trump won't call him on the telephone.",https://twitter.com/michocollins/status/1275300106137481216
2020-06-23 05:30:10,umeedforanimals,"We lost Shakti He had his last meal & slept & he never woke up. But yes, since his medical condition wasn't improving, this was to happen some day. Shakti, You will be missed terribly. Rest in Peace boy & run free accross the rainbow bridge pic.twitter.com/tZixaIvRVv",https://twitter.com/umeedforanimals/status/1275300093013315586
2020-06-23 05:30:09,lovebrianaaaa,"they are so cringyyyy",https://twitter.com/lovebrianaaaa/status/1275300086399057921
2020-06-23 05:30:06,JesseW8nmbrs,"I only know one song. And only part of it.",https://twitter.com/JesseW8nmbrs/status/1275300074113785857
2020-06-23 05:30:00,kkhaechan,"lowkey fang",https://twitter.com/kkhaechan/status/1275300048943767552
2020-06-23 05:29:57,bantuafrikan,"Dont please, I did it and I cant undo it now, those flashes will stay on my mind for some time to come",https://twitter.com/bantuafrikan/status/1275300036625211392
2020-06-23 05:29:45,GirdhariSaran3,"Very shameful . We are so merciless . https://twitter.com/ajrajbjp/status/1275298937209905153 …",https://twitter.com/GirdhariSaran3/status/1275299988570910721
2020-06-23 05:29:45,umarwaseem_,"aise kesyyy",https://twitter.com/umarwaseem_/status/1275299986557763584
2020-06-23 05:29:44,vliour,"#ابنة_السفير #اسطنبول_الظالمه Good bye pic.twitter.com/zZ5riUrTqk",https://twitter.com/vliour/status/1275299983642841088
2020-06-23 05:29:43,curlywerm,"if you wanna be closer",https://twitter.com/curlywerm/status/1275299979574140929
2020-06-23 05:29:32,ssunflowerq,"LUV U TOO",https://twitter.com/ssunflowerq/status/1275299933029986306
2020-06-23 05:29:31,GrindrReject,"A Futurama episode just triggered my depression",https://twitter.com/GrindrReject/status/1275299929745997826
2020-06-23 05:29:17,wonsoonwoo,"so... do the albums all have stickers to seal them like this https://twitter.com/wonsoonwoo/status/1275048807827308555 …",https://twitter.com/wonsoonwoo/status/1275299870060904450
2020-06-23 05:29:14,younggoth23,"Same same",https://twitter.com/younggoth23/status/1275299857557667841
2020-06-23 05:29:11,deangloster,"Y'all: 1. Elected Republicans, and 2. Didn't wear masks. Now we're running out of hospital beds while the number of cases is still on a path to keep doubling in AZ, FL, TX. #WearYourMaskhttps://twitter.com/KHOU/status/1275264555321524226 …",https://twitter.com/deangloster/status/1275299844005888000
2020-06-23 05:29:10,martabakteluur,"Mmf emsi",https://twitter.com/martabakteluur/status/1275299841753509888
2020-06-23 05:28:54,sammavs,"The new york Times won't stop till everyone joins their propaganda https://twitter.com/nytimesbusiness/status/1275212486514540544 …",https://twitter.com/sammavs/status/1275299772170199040
2020-06-23 05:28:50,tarynschoeman9,"This is deeply disturbing to see",https://twitter.com/tarynschoeman9/status/1275299755413946375
2020-06-23 05:28:40,petceetah,"fuck",https://twitter.com/petceetah/status/1275299715731599361
2020-06-23 05:28:28,noellegift4,"I was laughing at sum and I slapped my thigh now it’s stinging",https://twitter.com/noellegift4/status/1275299663218958337
2020-06-23 05:28:25,Social_Inc_,"Stay strong",https://twitter.com/Social_Inc_/status/1275299652557037569
2020-06-23 05:28:20,JuliePa05317139,"Not there.",https://twitter.com/JuliePa05317139/status/1275299630536851457
2020-06-23 05:28:18,0GINN,"I'm out of coffee beans...",https://twitter.com/0GINN/status/1275299624090099717
2020-06-23 05:28:11,AmestrisMan,"Apocalypto tho https://twitter.com/jaketapper/status/1275231873803980801 …",https://twitter.com/AmestrisMan/status/1275299594461679616
2020-06-23 05:28:09,ghamkishaam,"what ever did I do to you for you to attack me w this hobi fancam",https://twitter.com/ghamkishaam/status/1275299582415699968
2020-06-23 05:28:07,GirishKS192027,"Our Country is Every Thing. We All Believe that He Is First India, Than Some thing Else. Pls dont use such words for him. Personally he ruined people currier that WRONG WE AGREE. BUT CALLING HIM जिहादी IS VERY WRONG. #ShushantSinghRajput",https://twitter.com/GirishKS192027/status/1275299575012536321
2020-06-23 05:27:56,chlochristiana,"i fucking miss this account hahahahaha i had so many celebrities following me whYYYYY did i delete her!!!!! https://twitter.com/cupkayla_/status/520721567014465536 …",https://twitter.com/chlochristiana/status/1275299528539856896
2020-06-23 05:27:49,TaranaBurke,"You still up? Bc they are all the way LIVE now",https://twitter.com/TaranaBurke/status/1275299498684792833
2020-06-23 05:27:45,MaannostaShines,"I hope that he recovers quickly.",https://twitter.com/MaannostaShines/status/1275299481681092609
2020-06-23 05:27:25,janguarzo,"I think we need some sort of law that will protect the environment from us ma'am. This is heart wrenching",https://twitter.com/janguarzo/status/1275299401330761729
2020-06-23 05:27:24,tembisa_J,"I’m so sorry",https://twitter.com/tembisa_J/status/1275299396381540353
2020-06-23 05:27:24,moreiavent,"ainssss",https://twitter.com/moreiavent/status/1275299395978878977
2020-06-23 05:27:19,gothsuzuya,"Broke up with the gf",https://twitter.com/gothsuzuya/status/1275299375741370368
2020-06-23 05:27:18,cajananana,"Thie is true pic.twitter.com/2zbH4rsmtK",https://twitter.com/cajananana/status/1275299369554608128
2020-06-23 05:27:13,Grandma_Storm,"I've been on Twitter for over 12 years and all of a sudden, MY POSTS have me on invisible status?",https://twitter.com/Grandma_Storm/status/1275299348708864001
2020-06-23 05:27:00,lFWETRIED,"reply if you wanna be closer",https://twitter.com/lFWETRIED/status/1275299294791135235
2020-06-23 05:27:00,mfchalamet,"no u made me",https://twitter.com/mfchalamet/status/1275299293704970240
2020-06-23 05:26:57,ranawaheed3,"@HamidMirPAK Helo,Helo sir Why are you not telling people that PM's had strong fucking intention of getting waiver in loan by showing impact of this fucking pandemic. We need you to tell This truth too. You have courage & medium but we don't.Mir sb our country is sinking .",https://twitter.com/ranawaheed3/status/1275299283437223936
2020-06-23 05:26:56,jymrpscs,"There's something wrong talaga. Sad.",https://twitter.com/jymrpscs/status/1275299278089383937
2020-06-23 05:26:55,Breezy4monstaX,"Not sure why but I get all in @OfficialMonstaX Vibes from this song @CUBE_PTGhttps://youtu.be/aw_g_pURsZU",https://twitter.com/Breezy4monstaX/status/1275299275786903552
2020-06-23 05:26:51,BontiMegan,"Earlier in the week one of my very best friends passed away due to health complications. A few short minutes ago I found out that another one of my very best friends (and coworker) passed away. I can’t believe that either of them are gone. My heart is aching.",https://twitter.com/BontiMegan/status/1275299255779983361
2020-06-23 05:26:41,mohansi56857240,"i dont no who is she pic.twitter.com/vlygbuVOyb",https://twitter.com/mohansi56857240/status/1275299217054015489
2020-06-23 05:26:40,nila3333,"Saddens immensely https://twitter.com/Sachin_vedic/status/1275274783047876609 …",https://twitter.com/nila3333/status/1275299213186748416
2020-06-23 05:26:37,Meghana00641006,"Sorry enduku... Munde cheppanu wrong Ani kadu just a thought Ani.. Nenu starting lo anthe anukunna.. Those are normal human emotions..",https://twitter.com/Meghana00641006/status/1275299198070435841
2020-06-23 05:26:36,NathanYishai,"Not you too TDS",https://twitter.com/NathanYishai/status/1275299195780583424
2020-06-23 05:26:30,serenasalinas_,"stubbing your toe is a different kind of pain",https://twitter.com/serenasalinas_/status/1275299170262417408
2020-06-23 05:26:28,nurmelamali4,"me too https://twitter.com/_nurulatikahhhh/status/1275261583715778560 …",https://twitter.com/nurmelamali4/status/1275299158715326467
2020-06-23 05:26:27,isah_i_fabulous,"3.Sheating and promiscuity The rate of cheating this days is too much, someone knows someone that knows someone,that has bleeped your girlfriend or boyfriend! At the end shaa Just try and make money and spend on ur family !!na him sure pass.",https://twitter.com/isah_i_fabulous/status/1275299155943047170
2020-06-23 05:26:27,_masihsma,"Aww gelii dong",https://twitter.com/_masihsma/status/1275299154827198464
2020-06-23 05:26:15,satisfalied,"itu bodycare bby",https://twitter.com/satisfalied/status/1275299106802462720
2020-06-23 05:26:14,JunicusPublius,"Looks like Soylent Green might become a reality.",https://twitter.com/JunicusPublius/status/1275299103937880064
2020-06-23 05:26:10,Kingnellyboy,"It might be too late for that man",https://twitter.com/Kingnellyboy/status/1275299084828585986
2020-06-23 05:26:05,Mikzels,"Me too i'm scared for my life (*genuinely) https://twitter.com/louandhazownsme/status/1275198340251205634 …",https://twitter.com/Mikzels/status/1275299063072620545
2020-06-23 05:26:03,kaliab09_,"I thought someone sped up @JamesConner_ he moving so fast!! https://twitter.com/blitzvideos/status/1275195607465033728 …",https://twitter.com/kaliab09_/status/1275299054600273921
2020-06-23 05:25:50,Janethewriter1,"I can't believe this happened !!! For future reference, how about people use their hate to battle racism or educate themselves on Yemen. Much more productive. Stop hating on #LaurenGerman Sign this petition #JusticeForBreonnaTaylor https://act.colorofchange.org/sign/justiceforbre-breonna-taylor-officers-fired?source=coc_main_website …https://twitter.com/fee878/status/1275298005135110145 …",https://twitter.com/Janethewriter1/status/1275299001907191810
2020-06-23 05:25:48,MarcSaliba10,"I really hope you will get a friend that will be always there for you if i could i wouldnt say no but i live on the other sad of the world bro",https://twitter.com/MarcSaliba10/status/1275298992482660367
2020-06-23 05:25:35,varosmi,"no it’s because you only have one ball",https://twitter.com/varosmi/status/1275298940020088832
2020-06-23 05:25:33,17h30min,"oh no I hope I don't fall . . . . . . . . . . oh no",https://twitter.com/17h30min/status/1275298929651974144
2020-06-23 05:25:30,IncreaseFriend1,"https://youtu.be/sfVsykPc9GA INCREASE FRIENDSHIP PRESENT RULA KE GAYA ISHQ TERA VIDEO ACHHA LAAGE TOH DIL SE LIKE | COMMENT | SHARE | SUBSCRIBE #BoloGuruji #ArijitSingh #adiza #boycottsalmankhan #BhushanKumar #BoycottSalmanKhanMovies #Chichore #BhulaDunga #AtifAslampic.twitter.com/mnjx0Xl3JY",https://twitter.com/IncreaseFriend1/status/1275298918020993024
2020-06-23 05:25:29,taenajerss_,"windu late night conversation",https://twitter.com/taenajerss_/status/1275298914443251712
2020-06-23 05:25:22,nataliae_a_j41,"Omg, this is terrible. Those poor ppl. If the Dam collapses it will be catastrophic",https://twitter.com/nataliae_a_j41/status/1275298885544615945
2020-06-23 05:25:16,caraduneisbae,"Sorry i didn’t mean to be pessimist",https://twitter.com/caraduneisbae/status/1275298858818396162
2020-06-23 05:25:12,ImAmirAbbas,"Tim Cook: Bring me that Android phone. Employee: Here you are, Sir Tim Cook: Ok, let me see...that's cool...amazing...Ok, Guys ...you have to add these Android features in IOS. Apple team: God bless Steve Jobs #WWDC20",https://twitter.com/ImAmirAbbas/status/1275298844008472577
2020-06-23 05:25:11,teja0317,"Papam hanaah only loves Ulrich",https://twitter.com/teja0317/status/1275298839348445184
2020-06-23 05:25:08,Sierra_jaii,"send help",https://twitter.com/Sierra_jaii/status/1275298823619911680
2020-06-23 05:25:04,gillian_major,"i just watched a video of three babies all cuddled up together on my explore page... cried so hard for like 5 minutes... f my female hormones sos",https://twitter.com/gillian_major/status/1275298807765327874
2020-06-23 05:25:03,JunicusPublius,"Wow. Here I was hoping coronavirus shut down would stem the tide a bit.",https://twitter.com/JunicusPublius/status/1275298802241585152
2020-06-23 05:24:58,yuploey,"GLOBAL FANS???? DID THEY SAY GLOBAL FANS?????? THEY SAID OUR NAMES https://twitter.com/chanyhoney92/status/1275236301634179072 …",https://twitter.com/yuploey/status/1275298783958425602
2020-06-23 05:24:51,realman88888,"Moreover brahmosthavam,spyder is the biggest mistake did by mahesh.okavela aa project success aithe we can see diff Mahesh..adi poye sariki Mahesh okarakamina circle lo padipoye risk taking ane matter daggaraki rakunda chusukuntunnadu..that was d biggest mistake nd muraga",https://twitter.com/realman88888/status/1275298752006221824
2020-06-23 05:24:50,LoneMumtaz2,"And my family call me #Haftha",https://twitter.com/LoneMumtaz2/status/1275298751507099648
2020-06-23 05:24:44,keeletse,"i diagnosed with Pcos too",https://twitter.com/keeletse/status/1275298725565550592
2020-06-23 05:24:41,ovelia95,"Because I have try many GA and never win Bias: Kim Taehyung @BTS_twt @JYPETWICE",https://twitter.com/ovelia95/status/1275298712772734976
2020-06-23 05:24:31,nyenyellowkings,"thankyou! i look up inthe internet and they wrote han so hee’s name with seo",https://twitter.com/nyenyellowkings/status/1275298668489240576
2020-06-23 05:24:25,kkri_sha,"miss u den together with our gin/gsm",https://twitter.com/kkri_sha/status/1275298643906408453
2020-06-23 05:24:23,Moonchild_Monii,"My mom isn’t into that many other kpop groups but she likes Shownu and I remember how genuinely concerned she was when she saw Shownu during Follow",https://twitter.com/Moonchild_Monii/status/1275298637367504896
2020-06-23 05:24:18,shaunsanaa,"he didn’t slide up on my story i can’t breath",https://twitter.com/shaunsanaa/status/1275298615876038656
2020-06-23 05:24:17,maKhuLetz5279,"Sad i dont have cashapps",https://twitter.com/maKhuLetz5279/status/1275298612470181889
2020-06-23 05:24:17,yefatima,"it be like that https://twitter.com/ohjackyyyyy/status/1275104851458916353 …",https://twitter.com/yefatima/status/1275298609593028608
2020-06-23 05:24:15,hopemariaa,"I’m ashamed",https://twitter.com/hopemariaa/status/1275298602492080133
2020-06-23 05:24:14,WlNCORE,"stay safe al",https://twitter.com/WlNCORE/status/1275298597924294656
2020-06-23 05:24:11,KPAX61,"GOD BLESS HER!! https://twitter.com/mmserp/status/1275167272324104192 …",https://twitter.com/KPAX61/status/1275298584800313344
2020-06-23 05:24:10,Zippy_TMS,"Can we tag the good ones? I can tell you that I've been grateful to follow your posts along with work by @jjcoop36 @EvanDrellich @craigjedwards to name a few.",https://twitter.com/Zippy_TMS/status/1275298581897830400
2020-06-23 05:24:06,ShaniDhilloo,"Read",https://twitter.com/ShaniDhilloo/status/1275298564315512832
2020-06-23 05:24:05,nseitodoida,"mds nem tinhs percebido",https://twitter.com/nseitodoida/status/1275298562021232641
2020-06-23 05:24:05,Stevieplotpoint,"Thank you don't make me cry :( As soon as possible!!!",https://twitter.com/Stevieplotpoint/status/1275298560754548737
2020-06-23 05:24:04,__BlaccDiamond,"I could not understand how a bitch feel that she needs a nigga. Whew you hoes built backwards",https://twitter.com/__BlaccDiamond/status/1275298557910675456
2020-06-23 05:24:03,animekidUwU,"Are you going to unfollow me?",https://twitter.com/animekidUwU/status/1275298553095577602
2020-06-23 05:23:41,leechaeriy,"thank you wonyoung",https://twitter.com/leechaeriy/status/1275298461647122432
2020-06-23 05:23:25,Nazomagenge2,"They're dead https://twitter.com/PhieKhanyile/status/1275089793681104896 …",https://twitter.com/Nazomagenge2/status/1275298392290320385
2020-06-23 05:23:23,Colosi,"It is the scripted replies that enrage even more than if they said “we’re not going to refund you until the industry is up and running”. I’d have more respect. I got told to “stay safe”, I’m sensing sarcasm now @Expedia @ExpediaUK",https://twitter.com/Colosi/status/1275298386518908931
2020-06-23 05:23:07,Loniboo11,"I'm just speechless idk what to say but refer them (dont worry they'll be back) hopefully not but the crazy thing is you were protecting them.",https://twitter.com/Loniboo11/status/1275298319028359168
2020-06-23 05:23:02,CvuJapCawe,"The parents https://twitter.com/mefeater/status/1275221321320992768 …",https://twitter.com/CvuJapCawe/status/1275298296999936007
2020-06-23 05:22:45,quantumslime,"All's well and good with cleaning out my childhood bedroom until I have to sort through my stuffed animals and have to confront that I still am afraid of hurting their feelings and separating them from their friends",https://twitter.com/quantumslime/status/1275298225621069824
2020-06-23 05:22:45,leechaeriy,"go sleep oppa",https://twitter.com/leechaeriy/status/1275298223490428928
2020-06-23 05:22:44,gamerbi80,"lmfaoo that’s wack",https://twitter.com/gamerbi80/status/1275298220978077696
2020-06-23 05:22:29,numba1witpoly,"Yo deadass you just shattered my heart bro",https://twitter.com/numba1witpoly/status/1275298157698650113
2020-06-23 05:22:28,Rojas1907,"RE gono..",https://twitter.com/Rojas1907/status/1275298153051426816
