date,username,to,replies,retweets,favorites,text,geo,mentions,hashtags,id,permalink
2020-06-23 07:08:32,hells_bells2207,"Yes I know, it’s been out of stock for ages. And they’ve not been producing the biggest 500g jars for months due to shortage. No jars available in 3 supermarkets near me for last month of normal nor the recently rereleased delicious XO Marmite (mature & stronger) @marmite",https://twitter.com/hells_bells2207/status/1275324848756215808
2020-06-23 07:08:21,RishiCh89983714,"Didi aa gya result. I got... 86 in bst... And my % is 76",https://twitter.com/RishiCh89983714/status/1275324799653273601
2020-06-23 07:08:14,DaminaboEric,"Just add puppi to tolu ... That's Tolupuppi Don't leave me https://twitter.com/instablog9ja/status/1275324369338880000 …",https://twitter.com/DaminaboEric/status/1275324772889571329
2020-06-23 07:08:06,tweet_faze,"STOP PLAYIN Tweet or retweet this tweet and all my other tweets with #FazeAbsorber",https://twitter.com/tweet_faze/status/1275324735690285060
2020-06-23 07:08:02,Aqsa_Abbasi1,"Speed of followers decreased.",https://twitter.com/Aqsa_Abbasi1/status/1275324721383518210
2020-06-23 07:08:00,LethalScorpion2,"woh to theek hai par ab kyun nahin ho sakta ..this is the best time 2 capture Siachen & Kargil! i miss Gen Mush! @ImranKhanPTI",https://twitter.com/LethalScorpion2/status/1275324713766617089
2020-06-23 07:08:00,DaminaboEric,"Just add puppi to tolu ... That's Tolupuppi Don't leave me",https://twitter.com/DaminaboEric/status/1275324713124933632
2020-06-23 07:07:55,RWaysone,"Black and mixed race premier league footballers are racist. None of them date Black girls",https://twitter.com/RWaysone/status/1275324692212133894
2020-06-23 07:07:52,Mburu__,"RIP Kobe Bryant Sorry I have just repaired my phone.",https://twitter.com/Mburu__/status/1275324680413609991
2020-06-23 07:07:50,DebraKi53686485,"so sorry for your loss.",https://twitter.com/DebraKi53686485/status/1275324668585664513
2020-06-23 07:07:46,nateFNBR,"I build out of wood just to know what it feels like to be focused on for once",https://twitter.com/nateFNBR/status/1275324655079809030
2020-06-23 07:07:44,azdedo,"So very sad.",https://twitter.com/azdedo/status/1275324644988350464
2020-06-23 07:07:41,taebycup,"you'll be missed.",https://twitter.com/taebycup/status/1275324631344312322
2020-06-23 07:07:30,ClaireOluchi_,"That feeling when you trynna just fight with bae for no reason but all he does is show more love, really frustrating",https://twitter.com/ClaireOluchi_/status/1275324585085411328
2020-06-23 07:07:28,ahsanrauf456,"its a hell https://twitter.com/UN/status/1275322949990363136 …",https://twitter.com/ahsanrauf456/status/1275324578991087617
2020-06-23 07:07:19,Trish8082,"#1, I NEED to get my hair dine at a salonBut making the best of my afro lol",https://twitter.com/Trish8082/status/1275324539615019008
2020-06-23 07:07:14,dr_khalidz,"Oh my! Just when we hear the Nigerian Army is winning, we also hear this. https://twitter.com/KoloKennethK/status/1275195048100061186 …",https://twitter.com/dr_khalidz/status/1275324520933490688
2020-06-23 07:07:14,OrionCreations_,"Wow restock please",https://twitter.com/OrionCreations_/status/1275324519717187584
2020-06-23 07:07:14,Gulmoha99443364,"We believed you, you betrayed us... cute animals. pic.twitter.com/HdVS2B0BwF",https://twitter.com/Gulmoha99443364/status/1275324517506854918
2020-06-23 07:07:13,TarynJules,"My sincerest condolences for your precious loss.",https://twitter.com/TarynJules/status/1275324515606650880
2020-06-23 07:07:13,shrimanjii,"Sir i was about to invest 5lakh but invested 5k only , Feeling FOMO .",https://twitter.com/shrimanjii/status/1275324513371054081
2020-06-23 07:06:50,eliuskip,"Dr. Joyce we miss you mama",https://twitter.com/eliuskip/status/1275324418978385921
2020-06-23 07:06:47,Nwachi_Jr70,"Am I legit too",https://twitter.com/Nwachi_Jr70/status/1275324408362668032
2020-06-23 07:06:41,FrancisElecha,"Just help us make the boy understand that women are scum",https://twitter.com/FrancisElecha/status/1275324382991339521
2020-06-23 07:06:33,kidloverjoke,"I know ur pined down by another guy but i still got to wait i still got to follow u but now i just lost it",https://twitter.com/kidloverjoke/status/1275324348744769543
2020-06-23 07:06:27,TugBoatPropa,"Bro I just want to play this new Minecraft update already pic.twitter.com/jXbd54QUEg",https://twitter.com/TugBoatPropa/status/1275324321536151552
2020-06-23 07:06:25,RobertTourish,"My Mental health at the moment",https://twitter.com/RobertTourish/status/1275324313986629632
2020-06-23 07:06:20,prabhasups,"Ohh Sad to see.",https://twitter.com/prabhasups/status/1275324291005865984
2020-06-23 07:06:03,SherinVictoria,"Miss you very badly dear, pic.twitter.com/Dnyf6VR6iG",https://twitter.com/SherinVictoria/status/1275324221560729604
2020-06-23 07:06:03,Thembel47960723,"Shame, this is not ryt. Women let’s have each other’s back not fight with each other. Hope she’s ok. Shame.",https://twitter.com/Thembel47960723/status/1275324219849662464
2020-06-23 07:05:59,selsgurl,"bass kar ab don’t expose me yaha par",https://twitter.com/selsgurl/status/1275324206725521408
2020-06-23 07:05:51,LoxleyOwl,"As my first car mine lasted just 2 weeks.",https://twitter.com/LoxleyOwl/status/1275324171246075905
2020-06-23 07:05:49,cashkissedyou,"I build out of wood just to know what it feels like to be focused on for once",https://twitter.com/cashkissedyou/status/1275324161196355584
2020-06-23 07:05:48,Crypto3032,"Wow. really?",https://twitter.com/Crypto3032/status/1275324158147100672
2020-06-23 07:05:48,thumbelinababy,"yhhh satu server a",https://twitter.com/thumbelinababy/status/1275324157392084994
2020-06-23 07:05:46,DAISUKEPRINT,"Ah yes, their annual meeting of how toxic the fandom is and how bts' music jUst Isn'T thE sAmE AnYMoRe pic.twitter.com/XHnNDijogt",https://twitter.com/DAISUKEPRINT/status/1275324151960485890
2020-06-23 07:05:34,legallyxdolan,"I don’t like waking up before 7am every day now because it means I have to wait for the podcast to go live.. I can’t just wake up and listen to it",https://twitter.com/legallyxdolan/status/1275324099389161472
2020-06-23 07:05:31,adominique__,"Sis ion think it’s in em https://twitter.com/tyanag_/status/1275252221127659520 …",https://twitter.com/adominique__/status/1275324089230675968
2020-06-23 07:05:30,Angella91818422,"This is unacceptable. Approximately 22 veterans per day commit suicide. Would at least 22 of my Twitter friends PLEASE copy and tweet? (Not RT) Veterans Crisis Line US 800-273-8255 UK 0800 138 1619 Canada 18334564566",https://twitter.com/Angella91818422/status/1275324084679835648
2020-06-23 07:05:28,GCPaulM,"I can't listen to this - it looks as though I'd have to have a premium Spotify account.",https://twitter.com/GCPaulM/status/1275324076408569857
2020-06-23 07:05:22,FateAspect,"What about sausage",https://twitter.com/FateAspect/status/1275324049745498113
2020-06-23 07:05:18,HudaLaiba,"Best of luck bro! May u stay consistent",https://twitter.com/HudaLaiba/status/1275324034331402241
2020-06-23 07:05:06,_kri5hna,"PRABHAS FANS SITUATION pic.twitter.com/Zwzm8d5G3n",https://twitter.com/_kri5hna/status/1275323982065987584
2020-06-23 07:04:56,qtktxoxo,"Some people actually have enough patience to heat up pop tarts",https://twitter.com/qtktxoxo/status/1275323939288281089
2020-06-23 07:04:55,Hullbok,"Sad times https://twitter.com/BBCNews/status/1274699792699068416 …",https://twitter.com/Hullbok/status/1275323938315403264
2020-06-23 07:04:49,wallowstimothee,"why she speaking for all of us",https://twitter.com/wallowstimothee/status/1275323911039627266
2020-06-23 07:04:45,Am_Stronger09,"AmEN.. I calm it. Sorry to disturb you sir. Pls sir can I get a token ? Am really down",https://twitter.com/Am_Stronger09/status/1275323894535204865
2020-06-23 07:04:36,nayeontion,"what now",https://twitter.com/nayeontion/status/1275323856685690881
2020-06-23 07:04:29,Aniketk11730994,"Whenevr I am sad...I watch rohit' s innings...It helps me come out from sadness.. Love you @ImRo45 nd Missing u too much We all wish you play more 13 year for india #13YearsofHitman",https://twitter.com/Aniketk11730994/status/1275323825983352832
2020-06-23 07:04:28,akeemgeorge6,"This could be us, but when I told you that 'I love you', you say 'MAD O' pic.twitter.com/fleLiZZLdt",https://twitter.com/akeemgeorge6/status/1275323823156531201
2020-06-23 07:04:23,JenDoc3,"Fearmongering to black women now! Planned Parenthood kills way more babies than the environment could ever do! Also research what PP does with those precious babies that get aborted at 5-6 mos under no anesthesia! Under special circumstances babies can be aborted even later https://twitter.com/ewarren/status/1274785352541245440 …",https://twitter.com/JenDoc3/status/1275323802541608960
2020-06-23 07:04:12,LionsDynasty19,"And it's about to get worse: My wife's school district is looking at $8 million in budget cuts for each of the next two years. Initial budget proposal includes ELIMINATING ALL MIDDLE SCHOOL SPORTS. This virus has crippled us",https://twitter.com/LionsDynasty19/status/1275323755804442625
2020-06-23 07:04:04,tarma0522,"YesI Have Buy Apple Care on December 2019",https://twitter.com/tarma0522/status/1275323722098831362
2020-06-23 07:04:03,FullenEileen,"Mornins Nigel - agree Phil was our shining star last night....as for my man Sergio could be out 4-8 weeks if rumours are true have a tip top day take care",https://twitter.com/FullenEileen/status/1275323717615222784
2020-06-23 07:04:00,mishmxmxlxbx,"Alabyou",https://twitter.com/mishmxmxlxbx/status/1275323704826662912
2020-06-23 07:03:53,FrauleinPflaume,"Right, artists posting mature content or nsfw is never an invitation for strangers to overstep boundaries and be intrusive. It’s very uncomfortable to read these overly familiar and sexual replies",https://twitter.com/FrauleinPflaume/status/1275323675487723520
2020-06-23 07:03:47,mozero_ug,"And how did this get to pass me...... now I have to wait for next year. pic.twitter.com/l3PrsbGeMp",https://twitter.com/mozero_ug/status/1275323651051618305
2020-06-23 07:03:43,VenuSpeak,"#NewProfilePic #HappyChildrensaDay Miss you Camels I'm lucky to have 2 mothers. Camels as I called her, my late Sister Kamala Menon, was more than a mother to me. For me she was more dependable than I myself. I miss her terribly. No Amma, No Achhan, N0 Camels. Alone pic.twitter.com/QEFUBN4wDS",https://twitter.com/VenuSpeak/status/1275323636249849856
2020-06-23 07:03:42,Angella91818422,"This is unacceptable. Approximately 22 veterans per day commit suicide. Would at least 22 of my Twitter friends PLEASE copy and tweet? (Not RT) Veterans Crisis Line US 800-273-8255 UK 0800 138 1619 Canada 18334564566",https://twitter.com/Angella91818422/status/1275323631942451200
2020-06-23 07:03:33,mohamadka3ki,"Haha That's why I was saying GOOD coffee!",https://twitter.com/mohamadka3ki/status/1275323592172060678
2020-06-23 07:03:31,rsfltr,"*carrot",https://twitter.com/rsfltr/status/1275323586304266241
2020-06-23 07:03:29,Stevemulwa9,"You will not see heaven",https://twitter.com/Stevemulwa9/status/1275323576141459457
2020-06-23 07:03:29,RRindro,"My poor family I've got to hustle",https://twitter.com/RRindro/status/1275323574711193600
2020-06-23 07:03:23,Pathaan,"Such a shame ! I had the pleasure of playing there once",https://twitter.com/Pathaan/status/1275323549448888321
2020-06-23 07:03:19,oozeman27,"Sad news https://twitter.com/ICC/status/1275284959696125953 …",https://twitter.com/oozeman27/status/1275323534739464192
2020-06-23 07:03:16,Breezy4monstaX,"Awww I also have be happy, stay happy, life is c between b and d and I am what I am.",https://twitter.com/Breezy4monstaX/status/1275323521644859392
2020-06-23 07:03:12,ExtraHighMarx,"Oh noooo did you get your membership back?",https://twitter.com/ExtraHighMarx/status/1275323506079735808
2020-06-23 07:03:11,Pnebjtm,"Today's French exam will beat me, I can feel it",https://twitter.com/Pnebjtm/status/1275323499415027713
2020-06-23 07:03:08,HFrommann,"But he's right... Under this conditions you'll never end the first wave...",https://twitter.com/HFrommann/status/1275323489474564096
2020-06-23 07:03:07,moncartoons,"This is CANADA! https://twitter.com/HelenErrington1/status/1275313459631017985 …",https://twitter.com/moncartoons/status/1275323485145960448
2020-06-23 07:03:06,Mysterio192,"Had a weird dream lastnight",https://twitter.com/Mysterio192/status/1275323478128852993
2020-06-23 07:02:39,Mz_Lady_M,"This is unacceptable. Approximately 22 veterans per day commit suicide. Would at least 22 of my Twitter friends PLEASE copy and tweet? (Not RT) Veterans Crisis Line US 800-273-8255 UK 0800 138 1619 Canada 18334564566",https://twitter.com/Mz_Lady_M/status/1275323367239741440
2020-06-23 07:02:37,rsfltr,"night night sleep well",https://twitter.com/rsfltr/status/1275323356317986817
2020-06-23 07:02:36,GeeJayGill1,"Mick Fuller? ... more hysterical laughter !",https://twitter.com/GeeJayGill1/status/1275323355172765697
2020-06-23 07:02:35,ChuboyFranklin,"De goey and ""man and Superman"" did me bad",https://twitter.com/ChuboyFranklin/status/1275323347732180995
2020-06-23 07:02:31,Iv0nnetP,"BRO, YOU GAME IS HACKED",https://twitter.com/Iv0nnetP/status/1275323334289481729
2020-06-23 07:02:30,SushmaTweets__,"I know",https://twitter.com/SushmaTweets__/status/1275323327448354817
2020-06-23 07:02:24,Naod63180185,"Even Canada didn't included",https://twitter.com/Naod63180185/status/1275323304874610688
2020-06-23 07:02:15,rsfltr,"i bark u",https://twitter.com/rsfltr/status/1275323263640580099
2020-06-23 07:02:14,elleontwitch,"shit’s heavy but we’re doing our best. Thank you for being you",https://twitter.com/elleontwitch/status/1275323260046114831
2020-06-23 07:02:08,rsfltr,"ur the cutest in the wrld",https://twitter.com/rsfltr/status/1275323236763553792
2020-06-23 07:01:53,athaT__T,"this changmin and jacob.. pic.twitter.com/lDLf5FUcZF",https://twitter.com/athaT__T/status/1275323171898396672
2020-06-23 07:01:47,wolvin30,"pictures anymore or framed photo,s to scared that my account wil be blocked again",https://twitter.com/wolvin30/status/1275323147844190208
2020-06-23 07:01:34,NieseJ1,"I hate you going through this @urfavsheed praying.",https://twitter.com/NieseJ1/status/1275323093381189633
2020-06-23 07:01:31,a_deyss,"If you think I hurt ya, Put me underwater Take me to court, I don't need a lawyer https://twitter.com/problem_tic/status/1275322674710032384 …",https://twitter.com/a_deyss/status/1275323082329161728
2020-06-23 07:01:31,Ahmed_v2_,"Nice avi tho. I know it's completely off topic.",https://twitter.com/Ahmed_v2_/status/1275323079393112064
2020-06-23 07:01:25,Breezy4monstaX,"@OfficialMonstaX Can someone please bring back @official__wonho So i can stop crying now http://youtu.be/isaX9EiVulU Please!?!?!?",https://twitter.com/Breezy4monstaX/status/1275323055309574150
2020-06-23 07:01:23,ILogicianI,"But I want Thomas Wayne Flashpoint https://twitter.com/CultureCrave/status/1275158425966505985 …",https://twitter.com/ILogicianI/status/1275323049189863424
2020-06-23 07:01:02,EnvyNival,"Emojis should be banned",https://twitter.com/EnvyNival/status/1275322957628407809
2020-06-23 07:01:00,GoalNews,"Not good news for Sergio Aguero and Man City",https://twitter.com/GoalNews/status/1275322949810061313
2020-06-23 07:00:59,arnold_manayay,"I love u queen",https://twitter.com/arnold_manayay/status/1275322946857263105
2020-06-23 07:00:59,alsnrvra,"my judgemental ass tryna judge them https://twitter.com/UGHBARBlE/status/1275084895128256514 …",https://twitter.com/alsnrvra/status/1275322946215706624
2020-06-23 07:00:50,being_khan1010,"I took sum sabbaticals in my past which turned out to be disaster ! I should have kept the thing going !",https://twitter.com/being_khan1010/status/1275322909951655937
2020-06-23 07:00:49,SanakhanHappyMe,"Same here he the last hope for me",https://twitter.com/SanakhanHappyMe/status/1275322903009964033
2020-06-23 07:00:47,94FAIRYTAEIL,"need new phone",https://twitter.com/94FAIRYTAEIL/status/1275322896273956865
2020-06-23 07:00:46,herrmansen,"Excuse me where the @_$&$dingo$&@- is the PC and Switch announcements? I thought we were finally past those obnoxious console exclusivity deals with ole Crash.",https://twitter.com/herrmansen/status/1275322891366776832
2020-06-23 07:00:42,poessunflower,"I KNOW THAT THE OG CAST IS GONNA BE IN IT BUT I DIDNT KNOW ZACH AND GRAY WERE!! THE GOOGLE CAST LIST DOESNT HAVE THEIR NAMES",https://twitter.com/poessunflower/status/1275322877127069697
2020-06-23 07:00:42,BonnieLoni,"My mind is like a freewaythat’s leading no where",https://twitter.com/BonnieLoni/status/1275322874958471170
2020-06-23 07:00:41,ArtyFarty87,"That is one way to put it into perspective #priorities",https://twitter.com/ArtyFarty87/status/1275322870772543488
2020-06-23 07:00:20,Shivamg17881744,"#postponeneetjee heartly request",https://twitter.com/Shivamg17881744/status/1275322783015358464
2020-06-23 07:00:15,Wahala65055706,"That's ghana weaving? It removes front hairline",https://twitter.com/Wahala65055706/status/1275322761724952576
2020-06-23 07:00:11,DiogenesMan,"Why does the Left honor a criminal and ignore the innocent victim? Because their hearts have hardened, they've become reprobates and have lost their souls. If you don't believe me, talk to them and see if you can detect any love https://twitter.com/KathySoltani/status/1275203783874797568 …",https://twitter.com/DiogenesMan/status/1275322744339603458
2020-06-23 07:00:08,04Kevoh,"Study Engineering they said. https://twitter.com/xysist/status/1275317558850269184 …",https://twitter.com/04Kevoh/status/1275322734709485568
2020-06-23 07:00:00,EGOKOROC0RE,"ily bae and im always here for you — ilyt https://curiouscat.qa/egokorocore/post/1114445729 …",https://twitter.com/EGOKOROC0RE/status/1275322700614033410
2020-06-23 06:59:53,zkaechan,"what time is it anwww",https://twitter.com/zkaechan/status/1275322667835351040
2020-06-23 06:59:49,DrMukhashaf,"Me: video call hi kr lo yar She: pic.twitter.com/EAWzweXpd2",https://twitter.com/DrMukhashaf/status/1275322651691671552
2020-06-23 06:59:48,sparkleHannie,"My album not arrive yet",https://twitter.com/sparkleHannie/status/1275322650059890688
2020-06-23 06:59:44,qistinaraidahh,"Im being unproductive for these few days also watched few keroro movie",https://twitter.com/qistinaraidahh/status/1275322633110740992
2020-06-23 06:59:44,Paht_rick,"This woman's death was really felt by all her staff & every menial job man she had... Just look at how her driver is crying uncontrollably, someone that drove her to the hospital & was quarantined by NCDC cos he had malaria & tested positive to Covid-19...",https://twitter.com/Paht_rick/status/1275322632326524928
2020-06-23 06:59:35,msree9796,"This is very very wrong",https://twitter.com/msree9796/status/1275322593281785856
2020-06-23 06:59:20,Nish86,"Seen ""Jeffrey Epstein: Filthy Rich"" on Netflix yet? https://www.netflix.com/title/80224905?s=a&trkid=13747225&t=twt …",https://twitter.com/Nish86/status/1275322532443422721
2020-06-23 06:59:17,KarenKook15,"I Need plis",https://twitter.com/KarenKook15/status/1275322519503769601
2020-06-23 06:59:13,EJ_ODG,"That baby looks terrified https://twitter.com/BBBlack_3/status/1275083445375557634 …",https://twitter.com/EJ_ODG/status/1275322501002821634
2020-06-23 06:59:09,stafford10ho,"Ikr be appreciative",https://twitter.com/stafford10ho/status/1275322485785780225
2020-06-23 06:59:07,PatelSaloni7,"Right",https://twitter.com/PatelSaloni7/status/1275322475614810112
2020-06-23 06:58:59,MrSabbirHossai3,"@Chandpur, Bangladesh https://www.instagram.com/p/CBxLI0IDu96/?igshid=y9k90u8bpbhx …",https://twitter.com/MrSabbirHossai3/status/1275322441980674052
2020-06-23 06:58:58,Arpit_535,"Correct yourself he didn't brought such changes but only boasted about this..",https://twitter.com/Arpit_535/status/1275322438897688580
2020-06-23 06:58:54,ManishS99592006,"Miss u undertaker @undertakerpic.twitter.com/OQNEOcCGII",https://twitter.com/ManishS99592006/status/1275322422296797184
2020-06-23 06:58:53,GeorgieOshman,"STOP THEM Mr President you promised to protect us!",https://twitter.com/GeorgieOshman/status/1275322416642875392
2020-06-23 06:58:48,khomottso,"Country in a country they also have their own president by the way",https://twitter.com/khomottso/status/1275322397470740480
2020-06-23 06:58:22,tempoo18,"Goodroku is working tho on some project ssk is filming outlaw2 now, only that it will take a while to be out",https://twitter.com/tempoo18/status/1275322287420399616
2020-06-23 06:58:16,babyfoxjeongin,"how do you guys send 3 hearts at once to your friend in Choeaedol app? or... is it 1 heart per 10 minutes? sooo 3 times per day=3 hearts Anyway, add me as friend ^^ id: agippang01",https://twitter.com/babyfoxjeongin/status/1275322261977751552
2020-06-23 06:58:15,Tomcziooooox,"Around silver or gold propably #RTXOn",https://twitter.com/Tomcziooooox/status/1275322257972346880
2020-06-23 06:58:09,DpsHeals,"This was very sad but defunding the police is not the answer. I remember watching this a few years ago.",https://twitter.com/DpsHeals/status/1275322234211577856
2020-06-23 06:58:06,MikaTamika85,"I miss listening to Art Laboe, Pocos Pero Locos on Sunday nights",https://twitter.com/MikaTamika85/status/1275322219959181313
2020-06-23 06:58:05,SSAli000,"Oh noo so sad",https://twitter.com/SSAli000/status/1275322214955520000
2020-06-23 06:57:57,MirMoves621,"Awwww maaaan. Pace yourself now",https://twitter.com/MirMoves621/status/1275322183049531392
2020-06-23 06:57:57,hells_bells2207,"I appreciate he’s feral, but can you keep him in @night Sylvia? And only let him out in day after dawn & in before dusk? This is the very reason I could not have cats again. I’ve had many rescue cats in the past but not for the past 15 years for this very reason.",https://twitter.com/hells_bells2207/status/1275322181577314305
2020-06-23 06:57:55,GeeJayGill1,"Really? He said that knowing what judges were getting up to? I’m flabbergasted and disgusted ... my little world is crumbling ...",https://twitter.com/GeeJayGill1/status/1275322174207741953
2020-06-23 06:57:54,Gimba_TheFatOne,"I gotta have this mix np Maze & Frank Beverly - Before I Let Go",https://twitter.com/Gimba_TheFatOne/status/1275322171162796032
2020-06-23 06:57:47,ChicKKlepto,"This show Pose",https://twitter.com/ChicKKlepto/status/1275322141613965313
2020-06-23 06:57:46,herrmansen,"Oh noooo Hope he pulls through and you get some quality time with him post quarantine.",https://twitter.com/herrmansen/status/1275322137943986177
2020-06-23 06:57:35,Valeria63880093,"At 3am come with me I have insomnia",https://twitter.com/Valeria63880093/status/1275322090044952577
2020-06-23 06:57:30,a_deyss,"Burna and drake I just fell in love with you https://twitter.com/shank_comics/status/1275191991127719943 …",https://twitter.com/a_deyss/status/1275322070352699397
2020-06-23 06:57:30,sebi0315,"Guys help me @2020iskindaepic is bullying me wahhh",https://twitter.com/sebi0315/status/1275322069266268160
2020-06-23 06:57:25,princeofbusan,"Sorry pic.twitter.com/jbYD9BFAfO",https://twitter.com/princeofbusan/status/1275322047153844224
2020-06-23 06:57:20,606wrld,"ur not annoying",https://twitter.com/606wrld/status/1275322026660638720
2020-06-23 06:57:18,earlellicortez,"I think i need someone! To stop me from breaking!",https://twitter.com/earlellicortez/status/1275322018867503104
2020-06-23 06:57:15,poodlejjun,"You're too far away! We need upgrade, I guess?",https://twitter.com/poodlejjun/status/1275322006146170881
2020-06-23 06:57:10,mingi_way,"I feel so bad for my other ults but I know they already had their wins while Ateez are rookies and just starting @ATEEZofficial #ATEEZ #에이티즈",https://twitter.com/mingi_way/status/1275321987670274052
2020-06-23 06:57:03,irmahany_,"are u still keep thinking of your problem?don't let the problem take over your mind until u sick. are u ready for thankful today? am just say it for my self",https://twitter.com/irmahany_/status/1275321956049403904
2020-06-23 06:56:56,Blessin50870672,"This is sad thou. To see females doing that to they own kind.",https://twitter.com/Blessin50870672/status/1275321926198661122
2020-06-23 06:56:48,polcubs,"newwie please breath imy",https://twitter.com/polcubs/status/1275321894099496961
2020-06-23 06:56:44,itsPulsator,"Depressing to be delivering so much vibes musically, but no shows. Waze wamosha Cori. We would have killed so many countries by now.",https://twitter.com/itsPulsator/status/1275321878379446273
2020-06-23 06:56:42,Alistar_Grove,"I asked him a questiom about Conor and I got this . pic.twitter.com/2VfjUIvpj3",https://twitter.com/Alistar_Grove/status/1275321867533004801
2020-06-23 06:56:41,_ota4,"We dont even spell his name correctly, we're sinner",https://twitter.com/_ota4/status/1275321863682523136
2020-06-23 06:56:40,revephile,"username strawberry lip kemana",https://twitter.com/revephile/status/1275321862252158977
2020-06-23 06:56:39,MelisaB39884862,"Don't remind me.",https://twitter.com/MelisaB39884862/status/1275321857030275074
2020-06-23 06:56:26,travis_paola,"And the animals",https://twitter.com/travis_paola/status/1275321803515330560
2020-06-23 06:56:26,innerchild08,"Oh my #SuperStarBTSpic.twitter.com/fj6r6gvgmL",https://twitter.com/innerchild08/status/1275321802760192000
2020-06-23 06:56:23,nickyjshand,"It's very sad that as restrictions are relaxing in relation to the pandemic, there seems to be those that will come out and stab and kill someone",https://twitter.com/nickyjshand/status/1275321789418295297
2020-06-23 06:56:22,zaeemkhan411,"Unfortunately many people are going through this",https://twitter.com/zaeemkhan411/status/1275321786792579072
2020-06-23 06:56:18,govind_ajhana,"Miss you shushant sir pic.twitter.com/Ck9D6cZjCf",https://twitter.com/govind_ajhana/status/1275321769771978752
