date,username,to,replies,retweets,favorites,text,geo,mentions,hashtags,id,permalink
2020-06-23 08:33:57,Fofoza_Junior,"What can you do? pic.twitter.com/O4u3vpcLWI",https://twitter.com/Fofoza_Junior/status/1275346341783375872
2020-06-23 08:33:54,Peta18417596,"This retired judge should betaken to task regardless of how far back it goes.In this case, the events in question go back eight to 10 years. So one of the big issues for the Human Rights Commission is whether it is prepared to deal with these complaints of sexual harassment",https://twitter.com/Peta18417596/status/1275346327895826435
2020-06-23 08:33:53,vigneshkrish13,"Sad Truth",https://twitter.com/vigneshkrish13/status/1275346326268424192
2020-06-23 08:33:46,Mhizdambells,"As much as I always love the sight of this, bread and beans is a no for me",https://twitter.com/Mhizdambells/status/1275346296656867328
2020-06-23 08:33:40,dandelionkyu,"so cute pic.twitter.com/biOUwj3iUa",https://twitter.com/dandelionkyu/status/1275346269360099328
2020-06-23 08:33:20,lungile_hlophe,"Bruh",https://twitter.com/lungile_hlophe/status/1275346187550363649
2020-06-23 08:33:19,yvngfob,"RIP fuck this day",https://twitter.com/yvngfob/status/1275346184190652416
2020-06-23 08:33:18,kvnggcoco,"Haven’t seen the streets of Chicago in so long",https://twitter.com/kvnggcoco/status/1275346178679492608
2020-06-23 08:32:54,Manuel51470011,"She so big amber pic.twitter.com/u2BLAJgz6W",https://twitter.com/Manuel51470011/status/1275346076908822528
2020-06-23 08:32:41,ploydzn,"I'm not weired",https://twitter.com/ploydzn/status/1275346025138585600
2020-06-23 08:32:41,Vijaykumar_0722,"Post Ante Idhi. Like Hero @AlluArjun Like Fan @Vijaykumar_0722 _Reel Police_&_Real Police_ Sorry I cant share Uniform Photo. #DuvvadaJagannadham #Pushpa @alluarjun #3YearsForDJSensation @imsarathchandra @harish2you @ThisIsDSP @hegdepoojapic.twitter.com/H66D1Vuu6H",https://twitter.com/Vijaykumar_0722/status/1275346024542789632
2020-06-23 08:32:38,PitUShaRMa3,"@realmemobiles thanks you sir realme c3 book ho gya kal raat par 4/64 wale ka rate thoda jaada ho gya h sir 9999₹",https://twitter.com/PitUShaRMa3/status/1275346012480040960
2020-06-23 08:32:28,Marlenes777,"makes me so sad",https://twitter.com/Marlenes777/status/1275345970646020096
2020-06-23 08:32:16,apaancimah,"really frightening",https://twitter.com/apaancimah/status/1275345917432827905
2020-06-23 08:32:15,MickyJo98017844,"Change the word 'fat' for 'cuddly' and I'm in. My wife is very sensitive about these matters and won't hesitate to spank me with a cricket bat if she feels slighted in any way https://twitter.com/SystolicThe/status/1275343329534885890 …",https://twitter.com/MickyJo98017844/status/1275345915453341696
2020-06-23 08:31:50,Mars84734689,"Its hard for me. They were a big part of my life I hate this",https://twitter.com/Mars84734689/status/1275345810067083266
2020-06-23 08:31:49,XStephenElliott,"Probably wont be me that does anything physical, I don't need an assault charge NZ isn't like the U.S.A where I could just blow there brains out for even thinking about stepping on my grass",https://twitter.com/XStephenElliott/status/1275345804476047361
2020-06-23 08:31:43,Saalliieeyy,"I told my sister this same thing yesterday https://twitter.com/Muhd_Gombi/status/1275341690342199304 …",https://twitter.com/Saalliieeyy/status/1275345779641778177
2020-06-23 08:31:38,JGelens1,"They deliberately ignored federal guidlines. When are you going to wake up people....they murderd your elderly . #Liberal #DemocratsTheEnemyWithin #WWG1GWA #QAnons #AllLivesMatterhttps://www.breitbart.com/politics/2020/06/22/exclusive-seema-verma-cuomo-other-democrat-governors-coronavirus-nursing-home-policies-contradicted-federal-guidance/ …",https://twitter.com/JGelens1/status/1275345761258127363
2020-06-23 08:31:38,Shubham65595612,"Fc today I was badly hurt not for sana but I feel very hurt",https://twitter.com/Shubham65595612/status/1275345758288359424
2020-06-23 08:31:31,Yetanothermind2,"hope they survive",https://twitter.com/Yetanothermind2/status/1275345731138846720
2020-06-23 08:31:23,Charbrevolution,"Love you but can't pay",https://twitter.com/Charbrevolution/status/1275345694644146178
2020-06-23 08:31:12,kimijimin,"I'm sorry for the late reply cause I fell asleep last night",https://twitter.com/kimijimin/status/1275345650188611584
2020-06-23 08:31:11,mrsheatherwelsh,"Gracie loved watching this. So special thank you. Very emotional now",https://twitter.com/mrsheatherwelsh/status/1275345645403021312
2020-06-23 08:30:41,ShellyStem,"Something I think we can do that's managable to counteract this insanity is to ask research institutes and universities to remove the strict only certain amount of years after PhD graduation rule to apply for postdocs etc.a lot of ppl will fall through the cracks now pic.twitter.com/7PBNRk7yNh",https://twitter.com/ShellyStem/status/1275345522396737536
2020-06-23 08:30:35,7inthebldg,"midterms let's go ☆ pic.twitter.com/5MAnAO0cNI",https://twitter.com/7inthebldg/status/1275345495842381825
2020-06-23 08:30:32,9iceralph,"Whose head? I'm single to stupor bro",https://twitter.com/9iceralph/status/1275345481896464384
2020-06-23 08:30:27,thembel88,"people got anger nowadays and it’s really getting worse",https://twitter.com/thembel88/status/1275345463475085313
2020-06-23 08:30:27,Vicihuoma515,"My brother is not an easy thing ooo, this App is over addictive",https://twitter.com/Vicihuoma515/status/1275345462070063104
2020-06-23 08:30:24,ecoevoenviro,"big thanks to @miffythegamer for this honest thread on radicalisation to the polemics in UK politics - I hope more #mums #mumsnet #dads #grandparents get to read this - as there clearly is a generation gaphttps://twitter.com/miffythegamer/status/1275148961268056073 …",https://twitter.com/ecoevoenviro/status/1275345450577649664
2020-06-23 08:30:16,alexisjenner7,"Omg so sad!! https://twitter.com/lanieloncae/status/1275076997220188161 …",https://twitter.com/alexisjenner7/status/1275345415760564225
2020-06-23 08:30:11,SamLFCYNWA,"One of the office dogs has been put down so sad",https://twitter.com/SamLFCYNWA/status/1275345394051026944
2020-06-23 08:30:06,incognit0o0o,"Sir @DrRPNishank ab kab aap kuch bolenge neet or jee , we are depressed #HealthOverExams #NoExamsInCovid #postponeneet",https://twitter.com/incognit0o0o/status/1275345375294099456
2020-06-23 08:30:00,rowing_freak,"indeed anyone born a dalit...his/her life is destined to have no hope for a better future but there are legit ngo that are providing food and education to children of these families to bring them out of their caste cycle.",https://twitter.com/rowing_freak/status/1275345348110639104
2020-06-23 08:29:49,Femme_Fatale305,"Oooohhh ok! Whew lord I didn’t know how to feel about that picture.",https://twitter.com/Femme_Fatale305/status/1275345302615142400
2020-06-23 08:29:48,oanamp11,"Me dead Cuteness overloadhttps://twitter.com/OfficialMonstaX/status/1275341487073423360 …",https://twitter.com/oanamp11/status/1275345297682677761
2020-06-23 08:29:47,Olerato_Moche,"I know i have the least followers but please please Twitter do your thing pic.twitter.com/eREKObZWl5",https://twitter.com/Olerato_Moche/status/1275345292011978752
2020-06-23 08:29:20,oanamp11,"I have no wordspic.twitter.com/DMcYC2LYWr",https://twitter.com/oanamp11/status/1275345180389003264
2020-06-23 08:29:19,serafyine,"True",https://twitter.com/serafyine/status/1275345175141892098
2020-06-23 08:29:17,NareshS08409988,"Legends never die",https://twitter.com/NareshS08409988/status/1275345168418263040
2020-06-23 08:29:14,KwenadiThobeja3,"Serious?? Nlate lakeside",https://twitter.com/KwenadiThobeja3/status/1275345154002636800
2020-06-23 08:29:13,MendoKC,"Marry them.",https://twitter.com/MendoKC/status/1275345152383451136
2020-06-23 08:28:43,bngtnd,"""i unstanned bts and i am an ex-army!!!!!!! "" ""please give me validation for unstanning i want clout "" https://twitter.com/eatvope/status/1275288344671420416 …",https://twitter.com/bngtnd/status/1275345023781834753
2020-06-23 08:28:40,Atemop,"#supportsmallbusiness This is no way to encourage would be entrepreneurs (read: future taxpayers) https://twitter.com/wangeci_gk/status/1275334750383808512 …",https://twitter.com/Atemop/status/1275345013262745601
2020-06-23 08:28:38,rocketgrls,"these being the last lines too",https://twitter.com/rocketgrls/status/1275345005339541504
2020-06-23 08:28:31,yvngfob,"!!!! What Am I Gonna Do With A Love Like Thishttps://twitter.com/acciolostgirl/status/1275343153906630662 …",https://twitter.com/yvngfob/status/1275344973966106631
2020-06-23 08:28:19,robsmith791,"I'm not there",https://twitter.com/robsmith791/status/1275344926860025856
2020-06-23 08:28:11,IGnolimitdex,"Poppin that shit but they don't want the smoke RIP #popsmoke",https://twitter.com/IGnolimitdex/status/1275344890986184704
2020-06-23 08:28:03,LemonCabe,"Dinosaur egg, please come out! pic.twitter.com/jMl1ijZBKx",https://twitter.com/LemonCabe/status/1275344856001306624
2020-06-23 08:27:59,Chrstne3025,"Miss you",https://twitter.com/Chrstne3025/status/1275344840062930944
2020-06-23 08:27:56,shetheselena,"Yeah international fans are so poor",https://twitter.com/shetheselena/status/1275344827887104002
2020-06-23 08:27:46,SarveshBalkaran,"Luckily I’m relatively fine. Just fever/myalgia/headache at this point. But it’s been terrifying seeing colleagues who are really ill. One of our nurses died in ICU a few weeks ago",https://twitter.com/SarveshBalkaran/status/1275344787357515776
2020-06-23 08:27:42,seokjinieoow,"does anyone feel thristy like i did? #Jinpic.twitter.com/WYx6oDlskR",https://twitter.com/seokjinieoow/status/1275344769523171328
2020-06-23 08:27:40,mosadoluwa__,"I knew you never liked me",https://twitter.com/mosadoluwa__/status/1275344759205355522
2020-06-23 08:27:34,CruiseMiss,"All of my 6 newly sprouted peanuts have been STOLEN!! I'm guessing by a field mouse that is creeping into the greenhouse at night. Gutted!! #MyPeanutsGetYourOwn #StuartLittleIsAThief #NonCruiseRelatedProblems",https://twitter.com/CruiseMiss/status/1275344736434388995
2020-06-23 08:27:21,FAlRlEBUN,"wbk.... its okay we accept u",https://twitter.com/FAlRlEBUN/status/1275344681967087616
2020-06-23 08:27:17,Lumiembatsha,"Bro! The impact is even worse coming from your parent",https://twitter.com/Lumiembatsha/status/1275344666653835270
2020-06-23 08:27:15,Muhamma65058658,"What is this behaviour",https://twitter.com/Muhamma65058658/status/1275344656067248129
2020-06-23 08:27:09,AcullaKevin,"Tan real pic.twitter.com/dylhFxd1RJ",https://twitter.com/AcullaKevin/status/1275344633116196865
2020-06-23 08:27:00,Riquelm18684794,"The day I jumped into conclusion that NIGERIA is dead was the day I saw NEPA office using GENERATOR at their working place To get capital self is not easy in this country",https://twitter.com/Riquelm18684794/status/1275344591743586304
2020-06-23 08:26:56,bbymelllz,"finally planning going to disney thizz year! hopefully da virus clears out soon",https://twitter.com/bbymelllz/status/1275344578208387074
2020-06-23 08:26:51,DADDYFUCKATION,"Cockwarming, dream of many guys",https://twitter.com/DADDYFUCKATION/status/1275344556939067392
2020-06-23 08:26:49,felixblondhair,"we love you, stay strong stay positive, miracle will come to you sooner or later! seboong and carats loves you!",https://twitter.com/felixblondhair/status/1275344545702539265
2020-06-23 08:26:41,brittandrews_x,"never felt so much of a bad person in my life and it’s not even my fault",https://twitter.com/brittandrews_x/status/1275344513331015694
2020-06-23 08:26:41,oanamp11,"I love him with this hair colour too What can I do I think all hair colours look amazing on Wonho @OfficialMonstaX @official__wonhohttps://twitter.com/wonhonthisday/status/1275342208716111882 …",https://twitter.com/oanamp11/status/1275344512617979904
2020-06-23 08:26:34,RizkyDowney,"it's not even funny humans are schewpid! https://twitter.com/9GAG/status/1275292753740681217 …",https://twitter.com/RizkyDowney/status/1275344482515316737
2020-06-23 08:26:30,KojoDuedu,"it's not like that but it is what it is",https://twitter.com/KojoDuedu/status/1275344467940302848
2020-06-23 08:26:28,mantilove,"Sounds familiar",https://twitter.com/mantilove/status/1275344460520599555
2020-06-23 08:26:28,Chanddlerrbingg,"@TaimoorGhick where r u?? I can bear anyone ignoring me but not u This isn't fair",https://twitter.com/Chanddlerrbingg/status/1275344460126224389
2020-06-23 08:26:24,chaerytomato,"Sooo cuteee",https://twitter.com/chaerytomato/status/1275344444049354753
2020-06-23 08:26:24,DADDYFUCKATION,"Lucky Daddy but you don't have any",https://twitter.com/DADDYFUCKATION/status/1275344443260854272
2020-06-23 08:26:22,hornyfics,"Does anyone know where they went?",https://twitter.com/hornyfics/status/1275344434918539266
2020-06-23 08:26:11,conroy25462283,"Amazing !! The best DJ @robin_schulz Why ?? Don't they do the same to us in France !! #RobinSchulzpic.twitter.com/qPnxxhbqah",https://twitter.com/conroy25462283/status/1275344388839833601
2020-06-23 08:26:04,vianiverseee,"how to be not annoying",https://twitter.com/vianiverseee/status/1275344360289304576
2020-06-23 08:25:41,Brill_Brum,"Yup - everywhere it seems , unless you’re lucky enough to have a friend with pups, has a huuuuuge waiting list. Ours will arrive Xmas or early 2021",https://twitter.com/Brill_Brum/status/1275344262998130689
2020-06-23 08:25:40,LubwamaStella,"This is not funny at all",https://twitter.com/LubwamaStella/status/1275344259764432896
2020-06-23 08:25:37,DennyLive,"THIS JUST IN! #ExclusiveHoodNews LOW-LIFE COMEDIAN @DennyLive USES GRANDDAUGHTER TO SECURE MOVIE DEAL WITH @kevinhart4real #DennyLivePresents #ToughTimes #PLEASEHelpUSMrKevin… https://www.instagram.com/p/Bx45Kh_BCRV/?igshid=uho5pbuvukot …",https://twitter.com/DennyLive/status/1275344246967500802
2020-06-23 08:25:31,MEDJAI64844376,"Those spicy noodles got me up cant sleep. Waiting for my stomach to do what it do",https://twitter.com/MEDJAI64844376/status/1275344221487144961
2020-06-23 08:25:25,BikeLimerick,"The dialogue around biking/walking/driving in Limerick has become so divisive; we all know how division is going in the States #citybikelimerick #citybikecastletroy #limerickpic.twitter.com/Io97Ec7Bes",https://twitter.com/BikeLimerick/status/1275344193590878208
2020-06-23 08:25:24,legallyxdolan,"You have no idea how jealous I am of you right now",https://twitter.com/legallyxdolan/status/1275344189904031744
2020-06-23 08:25:22,TheT0wnFloozie,"AZ monsoon...",https://twitter.com/TheT0wnFloozie/status/1275344181867581440
2020-06-23 08:25:02,mercymm99,"Ohhhh Noo",https://twitter.com/mercymm99/status/1275344100338937857
2020-06-23 08:24:57,auragold__,"Didn’t know you would have to do so much to release a product",https://twitter.com/auragold__/status/1275344077001830400
2020-06-23 08:24:53,DuckShiba,"23k for scepter?",https://twitter.com/DuckShiba/status/1275344059410731009
2020-06-23 08:24:51,Thesunsetgod,"Waywardness became the order of the day",https://twitter.com/Thesunsetgod/status/1275344050669977603
2020-06-23 08:24:49,Jose27370859,"I wish bro #absorberyt is the best and he won’t follow me",https://twitter.com/Jose27370859/status/1275344042969137155
2020-06-23 08:24:47,PollenlsBeeCoke,"I'd rather have fast heal than D.O.C. healing teammates",https://twitter.com/PollenlsBeeCoke/status/1275344037071880194
2020-06-23 08:24:44,EmmaRichards72,"these comments are so depressing. How the hell do we fix our country?",https://twitter.com/EmmaRichards72/status/1275344022425518081
2020-06-23 08:24:42,fivesosbucky,"Ofc!! Stay safe",https://twitter.com/fivesosbucky/status/1275344014946926592
2020-06-23 08:24:37,Christo23627600,"So sorry to hear",https://twitter.com/Christo23627600/status/1275343995640692736
2020-06-23 08:24:37,SEXSIXTOLS,"Hahaaa, I know right? That's pathetic lmao [ Looks Away ] https://twitter.com/A_Golden_Dream/status/1275343472837476352 …",https://twitter.com/SEXSIXTOLS/status/1275343994692739073
2020-06-23 08:24:34,Mrityun21392915,"@kpsharmaoli @KTnepal @thapagk @A_ProudIndian_ @Real__Akash @AlphaWo40963407 @6711Anumit @AbirDat13612765 @manoj_jai_hind @love_for_nation @aajtak @n China has occupied a village in Nepal for three years pic.twitter.com/QJ2uBxBJL8",https://twitter.com/Mrityun21392915/status/1275343980260016130
2020-06-23 08:24:29,muckeryz,"ayah aku pernah cerita ada sorang ni tak pernah miss naik flight schedule mh370. that day something happened that made him miss the flight. after he found out that mh370 went missing, completely dia rebah menangis bersujud . Allah loves us https://twitter.com/mirraass/status/1274259228136361984 …",https://twitter.com/muckeryz/status/1275343960739688448
2020-06-23 08:24:25,tkyomanji,"no hurry nd catch up so u can suffer w me while waiting for the new chapters to come out",https://twitter.com/tkyomanji/status/1275343943253671937
2020-06-23 08:24:20,danmintophoto,"RIP Soldiers https://twitter.com/keysersosse/status/1275319417967185920 …",https://twitter.com/danmintophoto/status/1275343921477029888
2020-06-23 08:24:19,oanamp11,"OMG Joohoney wants me to die today Who is the cutest man alive? @OfficialMonstaX @official__wonhopic.twitter.com/8sLIayIRZ7",https://twitter.com/oanamp11/status/1275343919195267072
2020-06-23 08:24:10,Melaniethebest3,"Bro I actually tough you did",https://twitter.com/Melaniethebest3/status/1275343881006198784
2020-06-23 08:24:05,IamShegale,"This had me teared up y’all. https://twitter.com/exavierpope/status/1275150149870903298 …",https://twitter.com/IamShegale/status/1275343858726043650
2020-06-23 08:24:04,anonymousysl,"I have been a huge fan of mavin .i pray for your success... The Mavin office at v.i is so so beautiful...Nice one sir. My dream and wish is to work here pic.twitter.com/IQSgPSOMDT",https://twitter.com/anonymousysl/status/1275343856859598848
2020-06-23 08:23:55,GreenEtty,"Hello Maximus. I was sorry to hear that Bob the Cat had passed away",https://twitter.com/GreenEtty/status/1275343818330533888
2020-06-23 08:23:42,soodicted,"Hope so !!",https://twitter.com/soodicted/status/1275343764031025153
2020-06-23 08:23:42,NIGHTMARECRIPT,"I'm so sorry for your loss. RIP.",https://twitter.com/NIGHTMARECRIPT/status/1275343763582246912
2020-06-23 08:23:34,Reesmuit,"I'm having a problem, I don't drink water",https://twitter.com/Reesmuit/status/1275343730694934528
2020-06-23 08:23:31,LadyLeo2019,"It's waaaay past my bedtime & I can't fall sleep. Tossing & turning for a couple of hours now. Hate nights when insomnia shows up. pic.twitter.com/AriXfi3e6Z",https://twitter.com/LadyLeo2019/status/1275343718929686530
2020-06-23 08:23:27,aryxari,"And have you seen the gemma chan and katherine langford interview? Cuz gurl",https://twitter.com/aryxari/status/1275343700529303552
2020-06-23 08:23:26,LeeFMc83,"Looking forward to a knock later on with @barry_sherlock at @LeasoweGolfClub got a feeling I’m going to get my arse kicked",https://twitter.com/LeeFMc83/status/1275343694632292352
2020-06-23 08:23:26,wazzusrkian1,"Still i want the Answer of 2nd one or wants to talk to him or her",https://twitter.com/wazzusrkian1/status/1275343694292385792
2020-06-23 08:23:22,tea_melanie,"I’m sorry",https://twitter.com/tea_melanie/status/1275343677271965699
2020-06-23 08:23:14,jumypearl,"And this becking stock is eyeing me . https://twitter.com/Tokstouch_/status/1275156499501846529 …",https://twitter.com/jumypearl/status/1275343645097549824
2020-06-23 08:23:13,JuliaMarklund1,"@EASPORTSNHL Still waits for NHL 21 for Switch. You are going to release FIFA 21 to switch way not NHL?. It is discriminatory to us hockey Lovers.",https://twitter.com/JuliaMarklund1/status/1275343643461779456
2020-06-23 08:23:02,puppyandpocky,"#Affinitweet Emoji Mood , , , , , , , , , ... via https://affinitweet.com/emoji-mood pic.twitter.com/FwyX9Q4iez",https://twitter.com/puppyandpocky/status/1275343597051809793
2020-06-23 08:23:02,jadeurogamnida,"Lee Jooheon is the epitome of cuteness and that's on period.",https://twitter.com/jadeurogamnida/status/1275343596581867520
2020-06-23 08:23:01,Osiemo_Cyn,"1. WALK AWAY 2. Silent 3. Cry (in private...sometimes I get caught ) https://twitter.com/Akosuahmay/status/1274750987153158144 …",https://twitter.com/Osiemo_Cyn/status/1275343592341606400
2020-06-23 08:22:55,lincoln_ngomana,"Bruh imagine",https://twitter.com/lincoln_ngomana/status/1275343567469400065
2020-06-23 08:22:52,NicoleBondoc11,"meeee pleaseee.",https://twitter.com/NicoleBondoc11/status/1275343553531482113
2020-06-23 08:22:48,UsamaSheraz10,"You are my corona",https://twitter.com/UsamaSheraz10/status/1275343537228349440
2020-06-23 08:22:46,RogerHare6,"- definitely important we not sideline these experiences; that telling final line really sums up the tragedy",https://twitter.com/RogerHare6/status/1275343526771994624
2020-06-23 08:22:31,Yetanothermind2,"Oh no then just give them something to eat",https://twitter.com/Yetanothermind2/status/1275343467061919746
2020-06-23 08:22:28,Rein_Fahad,"Yoongi’s voice pic.twitter.com/2MQoyoQcKX",https://twitter.com/Rein_Fahad/status/1275343454177038348
2020-06-23 08:22:25,saintwoobin,"pinterest",https://twitter.com/saintwoobin/status/1275343440859901952
2020-06-23 08:22:23,Arsalan10__,"My biggest fear https://twitter.com/kweeniris/status/1274690598956666880 …",https://twitter.com/Arsalan10__/status/1275343430319775744
2020-06-23 08:22:19,imandydenver,"I gave you the space so you could breathe I kept my distance so you would be free In hope that you find the missing piece To bring you back to me Why don't you remember... https://twitter.com/kbomolina/status/1275323701425172482 …",https://twitter.com/imandydenver/status/1275343416457457664
2020-06-23 08:22:19,lelongubane1995,"I need a job",https://twitter.com/lelongubane1995/status/1275343414905667587
2020-06-23 08:22:14,VeryVixi,"I accidentally deleted this from earlier pic.twitter.com/gDaIk35VuB",https://twitter.com/VeryVixi/status/1275343394705825793
2020-06-23 08:22:10,regular2015,"Our leaders, from the least to the top are the ones ruining Africa and making it's citizens go into all manner of corrupt acts to survive. very pathetic and disheartening",https://twitter.com/regular2015/status/1275343377303822336
2020-06-23 08:22:04,Prakriti_99,"Truth - Other than Sid () one guy u wud like Rashami with onscreen/offscreen and why",https://twitter.com/Prakriti_99/status/1275343352943140865
2020-06-23 08:22:00,mi_neko13,"Deserves to be no.1",https://twitter.com/mi_neko13/status/1275343333825449984
2020-06-23 08:21:53,UsamaSheraz10,"Ok Shukria",https://twitter.com/UsamaSheraz10/status/1275343306701131782
2020-06-23 08:21:46,iyakirag,"Uuummm and me",https://twitter.com/iyakirag/status/1275343277189980160
2020-06-23 08:21:37,Keep_Short,"Looks like Rhea was aware of this crime to happen and left the house a day b4",https://twitter.com/Keep_Short/status/1275343238656741376
2020-06-23 08:21:34,yomamabinsewing,"I'm absent",https://twitter.com/yomamabinsewing/status/1275343227277754368
2020-06-23 08:21:30,babiloncatt,"that ne sonnim skshsjs it's too cute re i cant",https://twitter.com/babiloncatt/status/1275343210651332608
2020-06-23 08:21:30,Queen_Nitah_,"2209163364 Eze-david Nita Chinonyerem Zenith Bank I know God will use you to bless me this morning",https://twitter.com/Queen_Nitah_/status/1275343210202750981
2020-06-23 08:21:25,Mohamed94869514,"Ok myself in de skills in the Egyptian national teamhttps://twitter.com/premierleague/status/1275192339099779075 …",https://twitter.com/Mohamed94869514/status/1275343187478032384
2020-06-23 08:21:24,UsamaSheraz10,"Nope",https://twitter.com/UsamaSheraz10/status/1275343184034500608
2020-06-23 08:21:14,sconshell,"scary",https://twitter.com/sconshell/status/1275343143236300800
2020-06-23 08:21:09,abrantepa_deuce,"The gnashing be too much brov",https://twitter.com/abrantepa_deuce/status/1275343122780880897
2020-06-23 08:21:06,clynalchca,"Send Foodss!!!",https://twitter.com/clynalchca/status/1275343107832246274
2020-06-23 08:20:59,UsamaSheraz10,"Ge Jee",https://twitter.com/UsamaSheraz10/status/1275343078774247425
2020-06-23 08:20:58,dansatty,"Her name is Apinke... @AdebesinZ please help me talk to her",https://twitter.com/dansatty/status/1275343073883623425
2020-06-23 08:20:55,mosadoluwa__,"Forever",https://twitter.com/mosadoluwa__/status/1275343060906491904
2020-06-23 08:20:52,legallyxdolan,"I wanna know the exact same thing",https://twitter.com/legallyxdolan/status/1275343050403962883
2020-06-23 08:20:50,UsamaSheraz10,"Nimaz Time.",https://twitter.com/UsamaSheraz10/status/1275343042577391617
2020-06-23 08:20:45,Smazy3,"na the lockdown cause am no money",https://twitter.com/Smazy3/status/1275343022234927104
2020-06-23 08:20:41,siyasibiya_,"The most disappointing is the one where you find the shop no longer exists https://twitter.com/thenettayvette/status/1275242066310844416 …",https://twitter.com/siyasibiya_/status/1275343004111429632
2020-06-23 08:20:34,VertuVirilite,"This could be us but you didn’t wear your mask and you’re dead now pic.twitter.com/uVhCC0RZdE",https://twitter.com/VertuVirilite/status/1275342973467799559
2020-06-23 08:20:09,ellen__watson__,"This time last year I’d have just got to Ibiza",https://twitter.com/ellen__watson__/status/1275342870057189382
2020-06-23 08:20:08,Khalipher_Jr,"just thinking..",https://twitter.com/Khalipher_Jr/status/1275342866500419584
2020-06-23 08:19:46,meowbokie,"they gave me: 15 i am: otw 15 ntar they gave me: garut i am: bandungggg they gave me: 169 i am: 155 they gave me: gemini i am: scorpio they gave me: Single i am: btul, tapi udah sama @Stray_Kids drop an emoji and i'll tell u what i think based on ur profile",https://twitter.com/meowbokie/status/1275342774536044544
