date,username,to,replies,retweets,favorites,text,geo,mentions,hashtags,id,permalink
2020-06-23 07:59:14,cloudsbesson,"why the homescreen https://twitter.com/bluefrmcanarsie/status/1275165463169941513 …",https://twitter.com/cloudsbesson/status/1275337606369128448
2020-06-23 07:59:11,chewMycrown,"And every fucking day I thank god your still here https://twitter.com/kinngmofo/status/1275337186066477057 …",https://twitter.com/chewMycrown/status/1275337591299231745
2020-06-23 07:59:09,AshBanks0,"I need .... https://twitter.com/_havocdream/status/1275090214860525568 …",https://twitter.com/AshBanks0/status/1275337586064732162
2020-06-23 07:59:04,uncool_seun,"What are you deleting?",https://twitter.com/uncool_seun/status/1275337565739024387
2020-06-23 07:59:02,amore_mokone,"Why did I press update on my laptop now I’m waiting",https://twitter.com/amore_mokone/status/1275337555978997760
2020-06-23 07:59:00,RJL204607org1,"Thank you Undertaker! You are The Best in WWE at ANY ERA and you have MY RESPECT as a WWE Fan! #RestInPeace!!!pic.twitter.com/lbhgtjKm2U",https://twitter.com/RJL204607org1/status/1275337548408086528
2020-06-23 07:58:50,Kirsty4418,"I feel your pain soph hope it doesn’t last too much longer",https://twitter.com/Kirsty4418/status/1275337505085194246
2020-06-23 07:58:49,renareirei,"Ur right",https://twitter.com/renareirei/status/1275337500295233537
2020-06-23 07:58:46,s_sapphireb,"AHAAAA SHE BLOCKED MEE LMAOOO @MuammarSarah Thanks for being my source of entertainment pic.twitter.com/toNWQVqGZ8",https://twitter.com/s_sapphireb/status/1275337486479196161
2020-06-23 07:58:41,lizzyolayinka_,"They kicked me out the regiment I can’t breathhmy hearttt",https://twitter.com/lizzyolayinka_/status/1275337468317966348
2020-06-23 07:58:40,Weasel3071,"I know",https://twitter.com/Weasel3071/status/1275337462710181889
2020-06-23 07:58:37,empressTanja,"Hmmmm yes yes yes... these gang are the ‘stars’ I’m just salty",https://twitter.com/empressTanja/status/1275337451209277441
2020-06-23 07:58:36,KudzaisheL,"Zolani needs a me. swear I’ll do right by you.",https://twitter.com/KudzaisheL/status/1275337446004273153
2020-06-23 07:58:32,paulinaaaaav,"craving a chocolate lava cake rn",https://twitter.com/paulinaaaaav/status/1275337428941729792
2020-06-23 07:58:31,finenaked,"You have to try and car-ry horn because some of horse are having crush on you.",https://twitter.com/finenaked/status/1275337424038760448
2020-06-23 07:58:30,IamJussjo,"Up home alone all week with no entertainment or dick",https://twitter.com/IamJussjo/status/1275337421597663232
2020-06-23 07:58:26,MilahMilonna,"@bertola_mauro thank you Sorry to bother. Im just young Man. Will love to do&stay positive. Please help its FREE!.Subscribe pleasehelp me get to 1k.its FREE!. https://youtu.be/8fjHuWgSWTY",https://twitter.com/MilahMilonna/status/1275337405088911361
2020-06-23 07:58:25,juicyyyy_a,"Now I gotta wake her up just to fall asleep with me",https://twitter.com/juicyyyy_a/status/1275337398172426241
2020-06-23 07:58:22,duhhangge,"I planned all my classes accordingly to transfer on time but barely realized a mistake that will affect my future admission ugh",https://twitter.com/duhhangge/status/1275337387166457858
2020-06-23 07:58:22,achaleey,"Someone take amazon away from me. It’s taking all my money",https://twitter.com/achaleey/status/1275337386994499585
2020-06-23 07:58:19,davemthwsbanned,"Oh my god of course he’s from FFX take Nabra’s name out of your fucking mouthhttps://twitter.com/scottpresler/status/1132061406231244805 …",https://twitter.com/davemthwsbanned/status/1275337375049289730
2020-06-23 07:58:19,yazebin,"bro i want to go on a road trip with a bunch of friends i don’t have just to go",https://twitter.com/yazebin/status/1275337374076153857
2020-06-23 07:58:19,keajpil,"Thursday>>DOPIL Friday>>YBC",https://twitter.com/keajpil/status/1275337373048549376
2020-06-23 07:58:18,EzraLabita,"craving for calbee honey butter chips",https://twitter.com/EzraLabita/status/1275337371504934912
2020-06-23 07:58:18,WroveFN,"Just trolling but lemme get that follow back",https://twitter.com/WroveFN/status/1275337369579859968
2020-06-23 07:58:17,kittikatkidd510,"Nooo !!! He’s my bestfriend . He’s just being a butthole right now",https://twitter.com/kittikatkidd510/status/1275337366908141568
2020-06-23 07:58:17,issaprofilee,"bro i want to go on a road trip with a bunch of friends i don’t have just to go",https://twitter.com/issaprofilee/status/1275337366803083265
2020-06-23 07:58:13,KEEPUPWITHMANII,"Why would he wake me up",https://twitter.com/KEEPUPWITHMANII/status/1275337349594058752
2020-06-23 07:58:13,ElizabethLovatt,"trying to get running again by walking J to the station twice a week and running back but honestly fitness is a con! I did a half marathon a couple of years ago and now I can hardly run for 5mins",https://twitter.com/ElizabethLovatt/status/1275337347928928256
2020-06-23 07:58:09,MilahMilonna,"@JackConor18 thanks Sorry to bother. Im just young Man. Will love to do&stay positive. Please help its FREE!.Subscribe pleasehelp me get to 1k.its FREE!. https://youtu.be/8fjHuWgSWTY",https://twitter.com/MilahMilonna/status/1275337331298504704
2020-06-23 07:58:08,4misspinkypink4,"@DizzeeRascal gutted!! Wednesday 12th of August @9pm schools are back in Scotland that day so I can’t take my son it’s too late please remember Scotlands holidays are different from England",https://twitter.com/4misspinkypink4/status/1275337330522574849
2020-06-23 07:58:08,Shalynda_jai_,"I’m hearing loud ass explosions https://twitter.com/orinary/status/1275313788649041920 …",https://twitter.com/Shalynda_jai_/status/1275337329025019905
2020-06-23 07:58:07,MasterOfNootART,"Yeah he would be lost at hyper most definitely and the optimism would drive him insane",https://twitter.com/MasterOfNootART/status/1275337326420525057
2020-06-23 07:58:06,jikookchai,"Everyone in the comment section of Hyunjin's mv is so soft. That song make me want to have a cat so bad",https://twitter.com/jikookchai/status/1275337318656667648
2020-06-23 07:57:55,KiburiH_,"Agency life feels like law firm life",https://twitter.com/KiburiH_/status/1275337272892821504
2020-06-23 07:57:54,shortyy_lesliee,"I miss getting my nails done",https://twitter.com/shortyy_lesliee/status/1275337270606757889
2020-06-23 07:57:54,AqeelMcr,"The cylinder on my right eye -0.25 all these websites start on -0.75",https://twitter.com/AqeelMcr/status/1275337268211994624
2020-06-23 07:57:46,MilesDago,"Looks like I’m going to have to take Aguero out my @OfficialFPL team any tips to replace him? I’ve got aubameyang and jimenez already",https://twitter.com/MilesDago/status/1275337236108673025
2020-06-23 07:57:45,OGil2014,"sadly",https://twitter.com/OGil2014/status/1275337231553658881
2020-06-23 07:57:40,MelodyB_BTS,"When will we get the second season of My Engineer ? They legit left us on a fatass cliffhanger. What happens to King and Ram (Talay and Perth) now tht King tried to play off wht happened? I need these answers damn it",https://twitter.com/MelodyB_BTS/status/1275337212339662848
2020-06-23 07:57:40,mosimilechrist1,"Amen in Jesus name!!",https://twitter.com/mosimilechrist1/status/1275337211437867011
2020-06-23 07:57:40,satanssspawnn,"Ong i took my ass right to rite aid & they had a buy one get one free bought cones too",https://twitter.com/satanssspawnn/status/1275337209869037569
2020-06-23 07:57:39,brimst0ne_,"I don't follow you so I can't say anything",https://twitter.com/brimst0ne_/status/1275337209072234497
2020-06-23 07:57:39,DreamAugur,"Next year then?",https://twitter.com/DreamAugur/status/1275337206647754753
2020-06-23 07:57:38,miratriarch,"The bigger the fandom gets the worse the takes become",https://twitter.com/miratriarch/status/1275337202856230912
2020-06-23 07:57:38,PhillipsTobi,"#thinkaboutit This Life Na Like SeeSaw Jangolover e no just balance Sha Jangolover epo moto — jingle over like a motor #love #mindfulness #yoga #yogapractice #fitness #fit #fitnessmotivation #fitfam #zen… https://www.instagram.com/p/CBxSEn1HzrP/?igshid=1nzes6amzpajn …",https://twitter.com/PhillipsTobi/status/1275337201627418624
2020-06-23 07:57:34,zen0602,"It is sad not to listen when it is a foreign territory",https://twitter.com/zen0602/status/1275337186599002113
2020-06-23 07:57:32,gublersgoof,"I GODDAMN HATE IT HEREpic.twitter.com/TkIMky1YiO",https://twitter.com/gublersgoof/status/1275337179741343744
2020-06-23 07:57:30,YTMFboss,"I really need a rick and morty type adventure this morning, una matter for earth don tire me.",https://twitter.com/YTMFboss/status/1275337170098835456
2020-06-23 07:57:23,babeeb0o,"First i know this couple,i love this cute fanservice and P’Boun!!! and even this couple isn’t real i think it’s fine.... BUT NOW!!! I WANT THIS COUPLE BEING REAL!!!! LOL look at them!! They have their own necklace and they bought this!!! #BetweenUStheserieshttps://twitter.com/bb0un/status/1275049387828187144 …",https://twitter.com/babeeb0o/status/1275337141304692737
2020-06-23 07:57:18,kaareennxl,"“get that money sis”",https://twitter.com/kaareennxl/status/1275337121272741889
2020-06-23 07:57:17,Cvstt_,"i miss smelling the lotion she uses",https://twitter.com/Cvstt_/status/1275337116034035712
2020-06-23 07:57:16,sfgacuna,"YALL IM SO PROUD ALJOMAS BE THRIVIN ACADEMICALLY",https://twitter.com/sfgacuna/status/1275337109461581826
2020-06-23 07:57:11,ncity_ty,"all my packages from usps be doing something weird lately its either taking 3+ weeks to arrive or they taking it somewhere else",https://twitter.com/ncity_ty/status/1275337091757588480
2020-06-23 07:57:03,TheRealLinda,"Aww poops! Missed the Dizzie interview!! worth it on catch up?? #GMB",https://twitter.com/TheRealLinda/status/1275337054663118848
2020-06-23 07:57:01,ayMeiMei,"Viper could step on me and I’d thank her https://twitter.com/7bpictures/status/1272679559125745667 …",https://twitter.com/ayMeiMei/status/1275337047293571073
2020-06-23 07:56:58,iszzy90,"Since was too busy repressing his feelings. the fool. But yeah s2 his mom will prolly keep on nagging him. Until it becomes an issue with Gyeoul.",https://twitter.com/iszzy90/status/1275337036484886534
2020-06-23 07:56:47,segodi_chuene,"The graph just going up up https://twitter.com/ndala_ka/status/1275314718270504962 …",https://twitter.com/segodi_chuene/status/1275336990997823490
2020-06-23 07:56:42,an0nymousstan,"I HAVEN’T SLEPT IN DAYS HELPPPPP!",https://twitter.com/an0nymousstan/status/1275336967375503360
2020-06-23 07:56:42,dillpickleeeee,"Honestly I really have been essential wearing this shit everyday for months https://twitter.com/gabbygoos/status/1274436535790653440 …",https://twitter.com/dillpickleeeee/status/1275336966758756352
2020-06-23 07:56:40,Mimi_nje,"1pm is too far https://twitter.com/lasizwe/status/1275028509648236546 …",https://twitter.com/Mimi_nje/status/1275336960509386753
2020-06-23 07:56:39,CraneRaziya,"And I’m Sleeping By Myself https://twitter.com/alexisslayss21/status/1275336622695952384 …",https://twitter.com/CraneRaziya/status/1275336957544083456
2020-06-23 07:56:36,daniel_cokeboy,"Can’t topup...",https://twitter.com/daniel_cokeboy/status/1275336941957812224
2020-06-23 07:56:35,AqeelMcr,"If you guys have astigmatism where do you order your contacts from don’t air me please",https://twitter.com/AqeelMcr/status/1275336938371850240
2020-06-23 07:56:33,helladventurers,"Valstrax, I freaking love me that nyoom falcon dragon they're so cool",https://twitter.com/helladventurers/status/1275336929094045696
2020-06-23 07:56:33,mellchanelll,"All you bitches be doing pretty up here! I love it",https://twitter.com/mellchanelll/status/1275336928926318592
2020-06-23 07:56:32,ameilsheridan,"Imagine if the whole world is muslims or one based religion..what whould happen? Is it gonna be better to have mono-interest or is it better to have differences between human that have variety of complexity mind",https://twitter.com/ameilsheridan/status/1275336926250196993
2020-06-23 07:56:29,Ndu_madubela,"My morning started like this. Im not ok send help pic.twitter.com/mflcPEoySy",https://twitter.com/Ndu_madubela/status/1275336915718455298
2020-06-23 07:56:29,katy37593577,"hey daddy",https://twitter.com/katy37593577/status/1275336911872307206
2020-06-23 07:56:24,Swaggerifickaye,"I mean....... https://twitter.com/thefamouschink/status/1274937562096951296 …",https://twitter.com/Swaggerifickaye/status/1275336893849165824
2020-06-23 07:56:22,OnlyTheBrave28_,"I MISS LOUIS",https://twitter.com/OnlyTheBrave28_/status/1275336885343186944
2020-06-23 07:56:15,MajaZ__,"When I learned German, I thought German grammar sooo difficult. But when I learn Japanese, I know I was wrong, Japanese grammar is more confusing! Especially the teacher speaks hard-understanding English.",https://twitter.com/MajaZ__/status/1275336855333015553
2020-06-23 07:56:11,unique_tomboy,"That’s why I rather not https://twitter.com/_bushkk/status/1274904863206408198 …",https://twitter.com/unique_tomboy/status/1275336838530695168
2020-06-23 07:56:05,hcneyhaechan,"5 more minutes before anyone does menpa",https://twitter.com/hcneyhaechan/status/1275336813813485568
2020-06-23 07:56:04,just_breezyyyy,"this all I want https://twitter.com/azianwitswag/status/1275175790758551552 …",https://twitter.com/just_breezyyyy/status/1275336809917173761
2020-06-23 07:56:04,Mystic1O,"God I wish I got the Ellie statue #TLOU2",https://twitter.com/Mystic1O/status/1275336809556455424
2020-06-23 07:56:02,_1realchica,"I knowwwwww I’m tired saf but then what’s the next choice https://twitter.com/sediinam/status/1275336036403621890 …",https://twitter.com/_1realchica/status/1275336800001720320
2020-06-23 07:55:58,yogurtrene,"shane dawson whenever he fucks up: i hAvE anXiEtY",https://twitter.com/yogurtrene/status/1275336782326816768
2020-06-23 07:55:57,CFCGARYG,"Yes of course all lives matter. Some people are completely missing the point of the black lives matter thing ain't they",https://twitter.com/CFCGARYG/status/1275336781416841230
2020-06-23 07:55:54,exoticforeignn_,"Daughter me https://twitter.com/bossty_/status/1274855392661700608 …",https://twitter.com/exoticforeignn_/status/1275336768699555842
2020-06-23 07:55:53,Super_Spotter,"Omo ! I fit finish one full tray without remorse https://twitter.com/doughnuts_by_M/status/1275019319768952832 …",https://twitter.com/Super_Spotter/status/1275336760885723138
2020-06-23 07:55:42,5UM3DH,"Teach me this power sensei Whenever I listen to a particular artist, it always reminds of that particular person who introduced me to that music",https://twitter.com/5UM3DH/status/1275336716358873091
2020-06-23 07:55:42,lex_coupe,"bet y’all stop flashing them $1000 bills now pic.twitter.com/vqcg75byKC",https://twitter.com/lex_coupe/status/1275336715872468993
2020-06-23 07:55:38,redunga_,"bloated af",https://twitter.com/redunga_/status/1275336698503680000
2020-06-23 07:55:34,gwendecena,"I’m a new moot and yes you deserve the world",https://twitter.com/gwendecena/status/1275336681730629637
2020-06-23 07:55:29,gublersgoof,"NESSSSSSSJWJS WHpic.twitter.com/JGhMoR2G5Z",https://twitter.com/gublersgoof/status/1275336663376396289
2020-06-23 07:55:28,NoLove_Brit,"Waiting on bae to get off workkk I miss her",https://twitter.com/NoLove_Brit/status/1275336657831673856
2020-06-23 07:55:27,dange_apex,"Easy...I have lost my appetite due to this lack of table mane you just displayed",https://twitter.com/dange_apex/status/1275336655646396417
2020-06-23 07:55:27,cicakmniesz,"auto keyboard",https://twitter.com/cicakmniesz/status/1275336651594596353
2020-06-23 07:55:25,zaynshotline,"Why do guys get so mad when girls find something they enjoy??? and don’t get me started on those “pick me” girls https://twitter.com/luffiesbabie/status/1275162175158521861 …",https://twitter.com/zaynshotline/status/1275336645907222528
2020-06-23 07:55:24,kevi_barbie,"Me looking all these follower/following circles knowing I’m new and no one knows me pic.twitter.com/NrTOfLuIuJ",https://twitter.com/kevi_barbie/status/1275336640265887744
2020-06-23 07:55:21,ColourMeFiji,"Wahhhhhh!!!!!!!! When will I immerse my body in Kadavu waters again #BubbleShit #FijiForeverhttps://twitter.com/dylan_kava/status/1275333903348187136 …",https://twitter.com/ColourMeFiji/status/1275336628051931136
2020-06-23 07:55:14,JamelAfrica,"Why am I seeing only your pics on my TL . Is too early oo https://twitter.com/itz_shugaberry/status/1275297532332003328 …",https://twitter.com/JamelAfrica/status/1275336600319393793
2020-06-23 07:55:14,kittycat_xx_,"I want to be spoiled pic.twitter.com/DnyRfH8omq",https://twitter.com/kittycat_xx_/status/1275336599824367622
2020-06-23 07:55:10,syarahtasnim,"Omfg https://twitter.com/lavieestbelie/status/1275072250492751879 …",https://twitter.com/syarahtasnim/status/1275336583290339328
2020-06-23 07:55:08,Evinyo1,"All this is done by the Communist Party of China!",https://twitter.com/Evinyo1/status/1275336574557777921
2020-06-23 07:55:08,Just_Stunz,"Everybody for WhatsApp don dey go site oo",https://twitter.com/Just_Stunz/status/1275336573773545477
2020-06-23 07:55:07,___BrownBeauti,"I saw this at the perfect time it’s about that that time to show my potential https://twitter.com/snobb_universe/status/1275144457608978432 …",https://twitter.com/___BrownBeauti/status/1275336568560025602
2020-06-23 07:55:02,Li_Yungin,"i got work i know its ooo/w for me",https://twitter.com/Li_Yungin/status/1275336547412455426
2020-06-23 07:54:53,beckyg504,"Winter the door is open bc my room gets too hot. Summer it’s closed for the AC. Also closed bc my 15 y/o is loud and stays up late since quarantine. *I live in nyc so no central air/heat. Window units and radiators",https://twitter.com/beckyg504/status/1275336513107132416
2020-06-23 07:54:51,aadlinn__,"or 111 penat gile ah nak breakdown. https://twitter.com/aadlinn__/status/1275336434350616579 …",https://twitter.com/aadlinn__/status/1275336501551751168
2020-06-23 07:54:48,Hows_The_Josh,"Once I wanted him to be single. Now I want him to get married! @vickykaushal09",https://twitter.com/Hows_The_Josh/status/1275336489979838464
2020-06-23 07:54:45,DIAMOONC,"uGh memories",https://twitter.com/DIAMOONC/status/1275336479355650049
2020-06-23 07:54:43,TumeloMatshela,"Ke re I was just gonna mind my business ka bona this tweet like pic.twitter.com/th2H1mhkBK",https://twitter.com/TumeloMatshela/status/1275336471122268162
2020-06-23 07:54:38,khhstan04,"He looks so good I can't pic.twitter.com/epz1Bl5J0h",https://twitter.com/khhstan04/status/1275336448602931200
2020-06-23 07:54:33,Kirsty4418,"Same I don’t know how it gets you when your inside but it does",https://twitter.com/Kirsty4418/status/1275336428000591873
2020-06-23 07:54:30,PaulMcGarraghy,"That’s another good one. It’s disheartening that they’re still so many people who still don’t get it, or worse don’t want too",https://twitter.com/PaulMcGarraghy/status/1275336413437997056
2020-06-23 07:54:28,mansaerrr_,"I'M SOFT https://twitter.com/spoiledcarat/status/1275073743211999234 …",https://twitter.com/mansaerrr_/status/1275336405959442432
2020-06-23 07:54:26,TurnUpGvngstar,"Value Meat",https://twitter.com/TurnUpGvngstar/status/1275336399559036928
2020-06-23 07:54:26,fabiagalietti,"The night I get a full nights sleep will be the best day of my life sick of not being able to sleep even though I am SOOO tired!!!",https://twitter.com/fabiagalietti/status/1275336399433216001
2020-06-23 07:54:24,fluffysockjin,"will never forget this, prince energy https://twitter.com/h0petv/status/1275288798440468481 …",https://twitter.com/fluffysockjin/status/1275336391287865353
2020-06-23 07:54:24,its_michalyn,"Why am I up",https://twitter.com/its_michalyn/status/1275336391115800576
2020-06-23 07:54:20,MiYVKO,"I feel like shitttt",https://twitter.com/MiYVKO/status/1275336372916645888
2020-06-23 07:54:18,diortoten,"are you trying to get cancelled",https://twitter.com/diortoten/status/1275336364393926656
2020-06-23 07:54:15,mellchanelll,"dawgggggg https://twitter.com/gunnaboy127/status/1275289774471905280 …",https://twitter.com/mellchanelll/status/1275336350313656320
2020-06-23 07:54:05,kittikatkidd510,"I don’t lie. it’s the truth pic.twitter.com/IVvyX4jVoH",https://twitter.com/kittikatkidd510/status/1275336310471999488
2020-06-23 07:54:00,Shanwiliams_,"Same what’s up mate? X",https://twitter.com/Shanwiliams_/status/1275336290117050368
2020-06-23 07:53:53,luvrgirlmichele,"take painkillers or Advil or just sleep that’s what I did",https://twitter.com/luvrgirlmichele/status/1275336259515191296
2020-06-23 07:53:53,onlyoonie_,"i know right it’s been too long",https://twitter.com/onlyoonie_/status/1275336258512961539
2020-06-23 07:53:46,vkkf11090,"I look nothing like my age. It's a set up ah swear . Soon leaving my 20's pic.twitter.com/84McDR0uNz",https://twitter.com/vkkf11090/status/1275336230964801537
2020-06-23 07:53:43,chewMycrown,"It’s daddiii szn cancers check tf in (RT) , my bae bday 07|21",https://twitter.com/chewMycrown/status/1275336217807241224
2020-06-23 07:53:40,OGil2014,"Imagine",https://twitter.com/OGil2014/status/1275336205761208320
2020-06-23 07:53:36,Cierriaxo_,"I don’t be having no one to talk when I’m at work everybody be sleep",https://twitter.com/Cierriaxo_/status/1275336188069646336
2020-06-23 07:53:33,ang3lbaby11,"i felt that. heart been brokenso many times",https://twitter.com/ang3lbaby11/status/1275336176275263489
2020-06-23 07:53:32,val3nt1a,"You just dragged me https://twitter.com/anelisa_tuswa/status/1275134044385271811 …",https://twitter.com/val3nt1a/status/1275336169266581504
2020-06-23 07:53:27,thedamilola_,"My all time favvvv scripture",https://twitter.com/thedamilola_/status/1275336151952474121
2020-06-23 07:53:21,zuesha_,"1 week till teiki",https://twitter.com/zuesha_/status/1275336127222673413
2020-06-23 07:53:12,MelChayse,"I still don't understand why iPhone users think they are superior to Android users...even my own son thinks he's better than me cos he has an iPhone, that I pay for...",https://twitter.com/MelChayse/status/1275336086823239682
2020-06-23 07:53:09,vickybartlettx,"Noooooo enjoy lovely! xx",https://twitter.com/vickybartlettx/status/1275336074781491200
2020-06-23 07:53:06,queteehee,"I felt this",https://twitter.com/queteehee/status/1275336060499681280
2020-06-23 07:53:05,LoveMayaLV,"look at the way benji is grabbing victors hair and the way victor goes from benjis back to his hair https://twitter.com/luvvenji/status/1275285223639519232 …",https://twitter.com/LoveMayaLV/status/1275336059241426949
2020-06-23 07:53:03,devthemenace,"All 4 of these are top tier https://twitter.com/animesvns/status/1275075177382993922 …",https://twitter.com/devthemenace/status/1275336048915161094
2020-06-23 07:53:03,Swaggerifickaye,"I got soooo much to be thankful for..... Everybody crying bout da heat n I'm out here being ungrateful with this cold weather..... Father forgive mi",https://twitter.com/Swaggerifickaye/status/1275336047665147905
2020-06-23 07:52:53,Shifframarvins1,"Eeeh this day seems to be so boring I gat no content even I think lemmi jct take some selfies",https://twitter.com/Shifframarvins1/status/1275336006451986433
2020-06-23 07:52:51,yokuch4n,"Day 18 of chloe tin. Once again im bloated I hate it and I hate myself feel so disgusting when I'm bloated . pic.twitter.com/V8NpUPFHRE",https://twitter.com/yokuch4n/status/1275336000110198786
2020-06-23 07:52:47,HerbivorePrill,"What the actual fuck. Prayers sent your way! What has this world come to",https://twitter.com/HerbivorePrill/status/1275335982393384960
2020-06-23 07:52:42,heatley21,"I know right, we were all meant to catch up in march. Once we can, we can do a social distance catch up or whatever",https://twitter.com/heatley21/status/1275335961149353984
2020-06-23 07:52:41,rsjsole,"So fucking prettyyyyy y’all wanted her to be ugly without makeup sooo baddddd. pic.twitter.com/OEEDmnW60L",https://twitter.com/rsjsole/status/1275335957085110277
2020-06-23 07:52:40,gublersgoof,"is ness trying to tell me somethingpic.twitter.com/gZ0hgHIePb",https://twitter.com/gublersgoof/status/1275335953364553735
2020-06-23 07:52:35,geowogie,"god i am leaking. peg me already",https://twitter.com/geowogie/status/1275335931499737088
2020-06-23 07:52:34,monisweeteyes,"How can sweet girl like me wake up with headache",https://twitter.com/monisweeteyes/status/1275335929448796160
2020-06-23 07:52:34,anjalit03,"I don't like Snickers",https://twitter.com/anjalit03/status/1275335927993208833
2020-06-23 07:52:30,svt_horangi,"can we all talk about This dino pic.twitter.com/US9M78cMqJ",https://twitter.com/svt_horangi/status/1275335910540734464
2020-06-23 07:52:29,libramoondust,"DONT DO IT!!! HOWEVER I DO SUGGEST AUTUMN",https://twitter.com/libramoondust/status/1275335905398546432
2020-06-23 07:52:28,KP5iscominggg,"I can't imagine when Babycats grown up and she told her mom, how many months did she give birth and Katy said: Katy: 18 months honey.....",https://twitter.com/KP5iscominggg/status/1275335901346848769
2020-06-23 07:52:23,jimf14_,"that melee rollback netcode got me actin strange",https://twitter.com/jimf14_/status/1275335881302454277
2020-06-23 07:52:22,confettidnp,"morning! thinking of ordering a shirt but i don’t know which size as i don’t want to order one for it to be too small or too big i know there’s a size guide but idk pic.twitter.com/i7ZT5zPQEj",https://twitter.com/confettidnp/status/1275335878404190209
2020-06-23 07:52:21,_KeefSweat,"Sheeeesh summ ain’t right",https://twitter.com/_KeefSweat/status/1275335874700607488
2020-06-23 07:52:20,val3nt1a,"This is me I try put it back...but I’m upset because last yr ngenze iMess https://twitter.com/anelisa_tuswa/status/1275116630943715333 …",https://twitter.com/val3nt1a/status/1275335867712835584
