date,username,to,replies,retweets,favorites,text,geo,mentions,hashtags,id,permalink
2020-06-23 05:54:52,kwiyeoms,"deekay im tryna sleep",https://twitter.com/kwiyeoms/status/1275306308829188096
2020-06-23 05:54:50,MattyOnTwitch,"My back is absolutely fried rn",https://twitter.com/MattyOnTwitch/status/1275306297999585281
2020-06-23 05:54:49,Les_Dj_,"I dont wanna go around Bongi Dube Mxm I'm switching this off, @LamiezHolworthy Has me by my Balls ... Moer ongketsang Ngwanyana o @METROFMSA @Pearl_Shongwe",https://twitter.com/Les_Dj_/status/1275306295827083264
2020-06-23 05:54:48,sky2484,"It’s to late to be eating , but I’m hungry as heck",https://twitter.com/sky2484/status/1275306293142708225
2020-06-23 05:54:44,legen_daryanime,"Shit is shit",https://twitter.com/legen_daryanime/status/1275306276063531008
2020-06-23 05:54:42,venisshhh,"Donepic.twitter.com/oerfpYz78n",https://twitter.com/venisshhh/status/1275306266672246786
2020-06-23 05:54:41,KayKianaa,"my first born he 4 y'all https://twitter.com/kayyroses/status/1275304175858061317 …",https://twitter.com/KayKianaa/status/1275306262641721345
2020-06-23 05:54:40,ravnsome,"we're just stubborn thats why we die easily.",https://twitter.com/ravnsome/status/1275306258342350849
2020-06-23 05:54:35,GuyNamedBrent,"It’s just the Kremlin activating the sleeper agents nbd",https://twitter.com/GuyNamedBrent/status/1275306237983248384
2020-06-23 05:54:30,altewale,"God when",https://twitter.com/altewale/status/1275306213920641030
2020-06-23 05:54:24,camboykook,"i hate when ppl reply with ‘ok’ to everyrhing like r u trying to make me feel studpid",https://twitter.com/camboykook/status/1275306192072400896
2020-06-23 05:54:24,LoveMayaLV,"I thought this was talking about Benji Campbell I-pic.twitter.com/FWnmUNVfaf",https://twitter.com/LoveMayaLV/status/1275306191321620480
2020-06-23 05:54:23,ReynoldsonLk,"From 7 to 5 kakya just now scored 10/15 yallah.. Why cant i get all correct",https://twitter.com/ReynoldsonLk/status/1275306186972119047
2020-06-23 05:54:19,naecobleu,"Vanessa sweetie she tryin tho she tryin https://twitter.com/syreride/status/1275094971910160390 …",https://twitter.com/naecobleu/status/1275306170077544449
2020-06-23 05:54:19,Fuertesgwen,"Y’all wouldn’t believe who ordered from me",https://twitter.com/Fuertesgwen/status/1275306169603686400
2020-06-23 05:54:16,lipspink24_joy,"Everyday somebody getting shot",https://twitter.com/lipspink24_joy/status/1275306157217681408
2020-06-23 05:54:14,OhThatsKingA,"Having a house party in H Town bitch",https://twitter.com/OhThatsKingA/status/1275306146866266112
2020-06-23 05:54:07,lupitaherloz,"beautiful",https://twitter.com/lupitaherloz/status/1275306120404328450
2020-06-23 05:54:07,_fromAtoyou,"Somebody said “Think y’all done seen a riot? Lemme find out this nigga talk to somebody else”",https://twitter.com/_fromAtoyou/status/1275306118676389888
2020-06-23 05:54:05,speakin_factz,"Conversations on the phone hit different",https://twitter.com/speakin_factz/status/1275306108794466304
2020-06-23 05:54:03,jeonhyeonmu1997,"My baby...stopp",https://twitter.com/jeonhyeonmu1997/status/1275306101165023232
2020-06-23 05:54:01,alisha_naveed,"Yes all the time",https://twitter.com/alisha_naveed/status/1275306095314173952
2020-06-23 05:54:00,LaSoPrettty,". I spoiled tf outta my niece i never put her down man everybody hated me for it c/ she really thought i was her mama",https://twitter.com/LaSoPrettty/status/1275306091308597249
2020-06-23 05:54:00,lilbit_russell,"I really have cabin fever",https://twitter.com/lilbit_russell/status/1275306089056256001
2020-06-23 05:53:56,KarinaA00736378,"Exactly! Would have been so much better then what we got . How can you ruin an already established story .",https://twitter.com/KarinaA00736378/status/1275306072761266176
2020-06-23 05:53:55,DinoDotta,"MY BABYYYYYYYY https://twitter.com/armoniejay/status/1275142378513264641 …",https://twitter.com/DinoDotta/status/1275306068587905024
2020-06-23 05:53:54,mekaa34,"Exactly, lol idk which I’d choose",https://twitter.com/mekaa34/status/1275306063965945856
2020-06-23 05:53:51,alisa20066,"I am your hardcore from Myanmar! We are supporting u guys from here and hope to see and take the photos with u guysNo more high five again pleasePls come and visit to Myanmarwe all are waiting the time u guys will come We always miss u every Friday night #BrightWinInbox",https://twitter.com/alisa20066/status/1275306052716658689
2020-06-23 05:53:50,Juniee_Bee,"I want some nasty sex",https://twitter.com/Juniee_Bee/status/1275306048941961216
2020-06-23 05:53:50,rdequena1919,"You can't hide the incompetence of the current President w/ the past!!! 4 years have proven this current Admin is all words (yabang at paasa) lack of actions & achievements",https://twitter.com/rdequena1919/status/1275306048623013888
2020-06-23 05:53:48,JC_Vrbs,"that isnt a sport on it’s own",https://twitter.com/JC_Vrbs/status/1275306039382949888
2020-06-23 05:53:45,ashleytearra,"A KING! https://twitter.com/aniyahl8ter/status/1274958227814440960 …",https://twitter.com/ashleytearra/status/1275306026108170240
2020-06-23 05:53:44,ValleyBoyEru,"That’s probably my limit to driving to a mf https://twitter.com/eastsidetc/status/1274546894383927296 …",https://twitter.com/ValleyBoyEru/status/1275306021112762379
2020-06-23 05:53:42,paperchasinnnv,"I’ve got sunshiinneeee on a cloudyyy dayyy",https://twitter.com/paperchasinnnv/status/1275306015152410624
2020-06-23 05:53:41,Matakovsky,"God when",https://twitter.com/Matakovsky/status/1275306010723352576
2020-06-23 05:53:36,DDBmoney,"Back to work smh ima miss you unemployment checks",https://twitter.com/DDBmoney/status/1275305989315735552
2020-06-23 05:53:36,ewcassandra,"they see “men” and automatically think we’re talking about how terrible they ALL are a hit dog will holler",https://twitter.com/ewcassandra/status/1275305988183199744
2020-06-23 05:53:31,changguYEO0ne,"Blackpink I promise ! I will stream #바스키아 more since blackpink is the big groups . Act im universe and i also blink... https://twitter.com/giant_seok/status/1275263890427834370 …",https://twitter.com/changguYEO0ne/status/1275305969052905472
2020-06-23 05:53:25,Toram967,"I worked for Comcast in a sitel and I can guarantee it's the worst telecommunication company ever",https://twitter.com/Toram967/status/1275305944872869889
2020-06-23 05:53:23,sawadeekrubb,"we get it shane you have a long legs, now close it pic.twitter.com/vDSJxoTVxb",https://twitter.com/sawadeekrubb/status/1275305936178024448
2020-06-23 05:53:22,petitethaang,"All I crave is sweets sweets & sweets I need some Sour Xtreme’s rn , just don’t wanna go to the gas station",https://twitter.com/petitethaang/status/1275305930083774464
2020-06-23 05:53:18,chalametkoo,"i will never be as pretty as jc",https://twitter.com/chalametkoo/status/1275305913411416064
2020-06-23 05:53:17,KBXCIX,"I really just wanna shake back",https://twitter.com/KBXCIX/status/1275305910953562112
2020-06-23 05:53:13,thatgirldedi,"I’m a Pisces. My MB personality type is Extroverted Intuition Feeling & Preception. My love languages are quality time and physical touch. And I’m an empath. In conclusion, I’m fucked.",https://twitter.com/thatgirldedi/status/1275305892884484096
2020-06-23 05:53:11,Mosa_Daisy,"My wallpaper",https://twitter.com/Mosa_Daisy/status/1275305884848177152
2020-06-23 05:53:11,courtneybias,"def bringing the light hair back pic.twitter.com/u5cNs17Ft5",https://twitter.com/courtneybias/status/1275305883807989760
2020-06-23 05:53:02,x_malaylayROZAY,"My sleep schedule is fucked lol! Im wide awake up doing stuff",https://twitter.com/x_malaylayROZAY/status/1275305848307421185
2020-06-23 05:53:00,3ve01,"I’m crushing HARD",https://twitter.com/3ve01/status/1275305839402704897
2020-06-23 05:53:00,TvSparkie,"Help",https://twitter.com/TvSparkie/status/1275305837670662146
2020-06-23 05:52:58,TumiDM1,"Goodness",https://twitter.com/TumiDM1/status/1275305829093330944
2020-06-23 05:52:58,Thekingjay295,"NAOMI SHOULD HAVE TOOKEN HER TITLE IMAGINE NAOMI VS SASHA BUT NO INSTEAD WE GET A REPEAT OF 2015 But WHATEVER",https://twitter.com/Thekingjay295/status/1275305828761788416
2020-06-23 05:52:58,onceszn,"a year ago today.. @normascxven I miss you everyday baby pic.twitter.com/aIx332MAzA",https://twitter.com/onceszn/status/1275305828434788352
2020-06-23 05:52:48,_jennydidthat_,"How I’m obsessed when you’re out here following MY FRIENDS!? And steady on my page stalking me. Someone make that make sense",https://twitter.com/_jennydidthat_/status/1275305789356298240
2020-06-23 05:52:46,SynergyAce_,"Find a better duo i bet u couldn’t https://twitter.com/murfs___/status/1275232922065387521 …",https://twitter.com/SynergyAce_/status/1275305777302048768
2020-06-23 05:52:45,LuvWodney,"i’m fighting for my life on this toilet",https://twitter.com/LuvWodney/status/1275305774726742016
2020-06-23 05:52:41,pastafrutti,"sorry to hari and mik for making my whiteboard drawings so damn big.. I always overestimate the amount of space I need",https://twitter.com/pastafrutti/status/1275305759752876032
2020-06-23 05:52:39,oriekllspttd,"mannn.. konz cracked my iPad screen so I got it fixed and he cracked it again. A day before the iPad case came in the mail I should just buy a new one at this point",https://twitter.com/oriekllspttd/status/1275305751700017153
2020-06-23 05:52:39,deshaurna,"Me too",https://twitter.com/deshaurna/status/1275305750148059139
2020-06-23 05:52:38,atinynot,"Ugh I’m so tired can this semester end quickly",https://twitter.com/atinynot/status/1275305746398195712
2020-06-23 05:52:35,_YafknHighnesss,"Y’all not grown WTF",https://twitter.com/_YafknHighnesss/status/1275305732032757762
2020-06-23 05:52:33,Rheezyxx,"Ya’ll rose tattoos be lookin like CABBAGES",https://twitter.com/Rheezyxx/status/1275305724818661377
2020-06-23 05:52:32,mattersofdedrea,"Nearly 9hrs, morale is low and I'm tired . Also wondering if I'm imagining this article in the first place",https://twitter.com/mattersofdedrea/status/1275305718992834561
2020-06-23 05:52:29,zzzeyloouu,"i miss this kiddooo",https://twitter.com/zzzeyloouu/status/1275305707793813505
2020-06-23 05:52:28,LauraKaindi,"The ghetto but I guess there are people who like that? I'm the aw thanks kinda person.",https://twitter.com/LauraKaindi/status/1275305704472162304
2020-06-23 05:52:27,urcupofwater,"This Benadryl not hitting right now",https://twitter.com/urcupofwater/status/1275305700202348545
2020-06-23 05:52:26,bmsc31,"That Marine TikTok tho... that woman received crazy amount of death threats n memes we still waiting on an army version",https://twitter.com/bmsc31/status/1275305694724370432
2020-06-23 05:52:25,eruomaa_,"I remember I said he looked so good he said look me in my eyes then when I say that sex hit different >>>>>>>>>>>",https://twitter.com/eruomaa_/status/1275305690635153408
2020-06-23 05:52:22,mscrysss,"I love my man to death but he sucks at capturing moments because, he doesn’t capture them at all! there are countless pics of him & the kids in the moment having fun because when I see a beautiful memory I have to capture it. but there’s not much of me & my kids.",https://twitter.com/mscrysss/status/1275305678219833344
2020-06-23 05:52:22,youngkbroadback,"i really want to know more bout jungwoo",https://twitter.com/youngkbroadback/status/1275305677628379136
2020-06-23 05:52:20,cassysanchez_,"I high key miss you and shit and I can’t ever tell you you irritated my soul with your craziness but I would give everything to have you back Justice for you pic.twitter.com/LjgcuuG69t",https://twitter.com/cassysanchez_/status/1275305671899086848
2020-06-23 05:52:19,VadeLukeypoo,"I would but I need sleep now I dream of different ways to shatter knee caps",https://twitter.com/VadeLukeypoo/status/1275305667822157825
2020-06-23 05:52:19,Aggie_arie,"I feel great rn....y’all think if I did the everyday I’ll be an alcoholic?",https://twitter.com/Aggie_arie/status/1275305664668196865
2020-06-23 05:52:17,LakruwanSaumya,"Annabelle",https://twitter.com/LakruwanSaumya/status/1275305656828878850
2020-06-23 05:52:13,Sumay1005,"Malang songs never fail to give me a unique sense of peace",https://twitter.com/Sumay1005/status/1275305640634662913
2020-06-23 05:52:11,onlyone_drob,"Finna get me one and sell Obama Runtz in the fall",https://twitter.com/onlyone_drob/status/1275305632221089793
2020-06-23 05:52:09,baekhyien,"if they are I don’t think im ready either",https://twitter.com/baekhyien/status/1275305625593901056
2020-06-23 05:52:04,miiamourpiee,"she should just make me her Mrs . Already",https://twitter.com/miiamourpiee/status/1275305603049697280
2020-06-23 05:52:03,prettynik2,"How do I even get myself back on track to this early ass schedule",https://twitter.com/prettynik2/status/1275305597341257729
2020-06-23 05:51:59,joonlurv,"BIG HIT I WANT NAMJOON CLENCHING HIS JAW IN ONE OF THOSE PHOTOCARDS FOR MEMORIES 2019",https://twitter.com/joonlurv/status/1275305583864762368
2020-06-23 05:51:59,sbbrnqt,"i dreamt about you again",https://twitter.com/sbbrnqt/status/1275305583738937344
2020-06-23 05:51:55,shinsfilm,"EVERYONE THINKS THAT IM JUST ANOTHER VAL STANNING SUJU i think it took everyone some time",https://twitter.com/shinsfilm/status/1275305566424887296
2020-06-23 05:51:54,arletteeev,"If you do sum n it makes me mad be happy I’m mad bc that’s how Yk I care bc i don’t be gaf abt nun",https://twitter.com/arletteeev/status/1275305559776845825
2020-06-23 05:51:52,ChxrryPeaches,"MY DREAM PET IS either the NFR bat dragon or FR golden uni!!!!",https://twitter.com/ChxrryPeaches/status/1275305554303315969
2020-06-23 05:51:50,kmilladam,"WELL DANG THIS WOULDVE BEEN GOOD TO KNOW ABOUT 3 WEEKS AGO https://twitter.com/beachu_tv/status/1274905664012169216 …",https://twitter.com/kmilladam/status/1275305543574274049
2020-06-23 05:51:49,denmulk,"I am so devastated to know that my phone will arrive in the span of 3 fuckin weeks, because there is no commercial flight so the only courier is by ship which takes to loooong",https://twitter.com/denmulk/status/1275305540952850432
2020-06-23 05:51:47,DeniseAlexei,"wasted",https://twitter.com/DeniseAlexei/status/1275305534023856129
2020-06-23 05:51:44,AZangamomma,"Clorox wipes have been outta my life for too long",https://twitter.com/AZangamomma/status/1275305517565399042
2020-06-23 05:51:40,SparinNoFeelins,"Think about this everyday https://twitter.com/_badass_2x/status/1275297551080718336 …",https://twitter.com/SparinNoFeelins/status/1275305504017874944
2020-06-23 05:51:33,AppleMokoena,"There’s a PMB men promo and I’m not interested in it",https://twitter.com/AppleMokoena/status/1275305473282015232
2020-06-23 05:51:29,cheriemorte,"I’m sorry to have given you homework when you were dealing with this.",https://twitter.com/cheriemorte/status/1275305456303517697
2020-06-23 05:51:22,JayJin_twt,"I relate so much",https://twitter.com/JayJin_twt/status/1275305427538866176
2020-06-23 05:51:22,n4ddd_,"androids already have this for years and even tho i love android so much, i gotta stay to iphone for my igstory quality https://twitter.com/bluefrmcanarsie/status/1275165463169941513 …",https://twitter.com/n4ddd_/status/1275305425664000001
2020-06-23 05:51:20,sugascrocs,"he's just so pic.twitter.com/NV2BfWis4D",https://twitter.com/sugascrocs/status/1275305418240204802
2020-06-23 05:51:19,DzulRamzan,"After i saw it. I really really hate golf now. #TheLastofUsPart2",https://twitter.com/DzulRamzan/status/1275305413236252674
2020-06-23 05:51:18,pineapplezra__,"sis why https://twitter.com/bluefrmcanarsie/status/1275165463169941513 …",https://twitter.com/pineapplezra__/status/1275305412389031936
2020-06-23 05:51:16,DomiiDoe,"i need a wood",https://twitter.com/DomiiDoe/status/1275305400720592898
2020-06-23 05:51:09,ijustwannanapOK,"I can’t keep them OFF EACH other to stop horseplay or wrestling. Kids gravitate to each other to touch, talk, & play. My mind doesn’t understand how they want this to work. I personally think @GregAbbott_TX needs to teach a Kinder class for a week to understand our struggle",https://twitter.com/ijustwannanapOK/status/1275305371641536512
2020-06-23 05:51:08,RonoTheeDon,"Unasema baptism by water,,,this country is baptising us! By fire",https://twitter.com/RonoTheeDon/status/1275305366885224450
2020-06-23 05:51:01,CortesAleksandr,"Serious? He just wants to win the UCL",https://twitter.com/CortesAleksandr/status/1275305338195984384
2020-06-23 05:51:00,annabmelito,"there is nothing more attractive than a man who acknowledges their faults and actually works towards fixing them",https://twitter.com/annabmelito/status/1275305335717163009
2020-06-23 05:50:58,FirestormZack,"Just imagine if she did but I know it won’t be me",https://twitter.com/FirestormZack/status/1275305327026733056
2020-06-23 05:50:58,ronysdreamz,"World cup gela",https://twitter.com/ronysdreamz/status/1275305324858097664
2020-06-23 05:50:53,6lu3_,"If anything me n gang was da principal Vince principal n da mf receptionist of dat schoothem kids didn’t listen to y’all,they did wtv we saidy’all still expelled us thofuck dem kids.",https://twitter.com/6lu3_/status/1275305303584714752
2020-06-23 05:50:51,AurumMeddle,"...I don't know",https://twitter.com/AurumMeddle/status/1275305296626401280
2020-06-23 05:50:49,melswhore_,"how seggsy",https://twitter.com/melswhore_/status/1275305287134650368
2020-06-23 05:50:48,sharanicole12,"iloveyouumoreee and moree bbyyyy pic.twitter.com/8hVyjkbiqW",https://twitter.com/sharanicole12/status/1275305284504883200
2020-06-23 05:50:46,mireumisj,"pinky blinders",https://twitter.com/mireumisj/status/1275305276074110977
2020-06-23 05:50:37,aRMy_mingEr,"Tho they're doing a cameo I want them to have a healthy relationship",https://twitter.com/aRMy_mingEr/status/1275305239806009344
2020-06-23 05:50:35,JayBreezy_242,"Best One!! pic.twitter.com/CGpriGW7WF",https://twitter.com/JayBreezy_242/status/1275305231623106563
2020-06-23 05:50:24,chengzheng6ixz,"Omg pls https://twitter.com/xiaoquis/status/1275293080682262528 …",https://twitter.com/chengzheng6ixz/status/1275305185611403264
2020-06-23 05:50:23,diiinasma,"i really don’t know how to properly express my love to ppl, it literally makes me uncomfortable. i hate that about me & i wish i knew how to combat that feeling",https://twitter.com/diiinasma/status/1275305181366845440
2020-06-23 05:50:19,JUICYandJAYS,"Ohh I see! she’s 20, but which one is more accurate? I got mines done at Stanford , hers was at kaiser and my mom work at Sutter and theirs is also different",https://twitter.com/JUICYandJAYS/status/1275305161892573185
2020-06-23 05:50:18,softxbam,"aaaa period cramps sux",https://twitter.com/softxbam/status/1275305158482685956
2020-06-23 05:50:18,Tomboi_Daedae,"I need a tatt man in Houston ASAP I need my back and neck hit",https://twitter.com/Tomboi_Daedae/status/1275305158436696071
2020-06-23 05:50:16,me_atlifern,"sokka is literally my dream boy like COME ON",https://twitter.com/me_atlifern/status/1275305150031122432
2020-06-23 05:50:12,thatopmalatsi,"And black tax dudethis isht is jus killing us",https://twitter.com/thatopmalatsi/status/1275305134428426241
2020-06-23 05:50:10,hacezolanski,"Lmfaooo I be getting drunk and sleepy as hell",https://twitter.com/hacezolanski/status/1275305126639656960
2020-06-23 05:50:10,hirxcane,"Just a crumb of your attention ma’am",https://twitter.com/hirxcane/status/1275305124399919106
2020-06-23 05:50:09,isisrosaless,"i need my mf feet rubbed",https://twitter.com/isisrosaless/status/1275305120834580482
2020-06-23 05:50:06,cumthecreator,"1 has to go...CHOOSE pic.twitter.com/XGA5KMHWau",https://twitter.com/cumthecreator/status/1275305108054532096
2020-06-23 05:50:06,fullsunnflowerr,"omg finally got a clearer version of chenji hugging pic.twitter.com/rzGqogBUvt",https://twitter.com/fullsunnflowerr/status/1275305106506801152
2020-06-23 05:50:04,realifecitygirl,"luckily someone from the senior leadership muted me before all of that was heard . Everyone laughed as well and 4 people messages me to tell me I wasnt muted",https://twitter.com/realifecitygirl/status/1275305101591101440
2020-06-23 05:50:03,arisfromtsubaki,"Precious and must be protected - got it",https://twitter.com/arisfromtsubaki/status/1275305094704033792
2020-06-23 05:49:59,chaeisgay,"i feel like those girls that be hanging out in the store together see me and be talkin about me https://twitter.com/ughbarble/status/1275084895128256514 …",https://twitter.com/chaeisgay/status/1275305077327179778
2020-06-23 05:49:58,ysvbbelly,"just paid for our passports today buying our plane tickets next month and it’ll be for japan/korea 2021",https://twitter.com/ysvbbelly/status/1275305072943984642
2020-06-23 05:49:55,NeonAU2,"Horrible",https://twitter.com/NeonAU2/status/1275305062948986881
2020-06-23 05:49:55,__ytxx__,"Oh wow",https://twitter.com/__ytxx__/status/1275305062928171009
2020-06-23 05:49:54,shazymnisi,"Wena",https://twitter.com/shazymnisi/status/1275305057370738690
2020-06-23 05:49:53,veerodriguez__,"I’ll probably incorporate both I have like a month and I don’t have a big enough place might have to do it at the park",https://twitter.com/veerodriguez__/status/1275305054510055424
2020-06-23 05:49:48,_Jakaylaaa,"I really cannot stop watching the last two episodes of 13 reasons why",https://twitter.com/_Jakaylaaa/status/1275305033450622983
2020-06-23 05:49:48,waystofly,"Customers really be complaining about anything and everything",https://twitter.com/waystofly/status/1275305032489918469
2020-06-23 05:49:46,jaquemery,"We are bored in the house laughing tf out @0daliiss",https://twitter.com/jaquemery/status/1275305025900703744
2020-06-23 05:49:46,bby_nho,"i’m turning 18",https://twitter.com/bby_nho/status/1275305024420225026
2020-06-23 05:49:43,emptywlltsash,"Fuck I’m so anxious about my exam...",https://twitter.com/emptywlltsash/status/1275305012923695104
2020-06-23 05:49:43,Bigmacbryce,"Bruh these fireworks are outta pocket.!! NIGGAS GOT WORK IN THE MORNING",https://twitter.com/Bigmacbryce/status/1275305012017553408
2020-06-23 05:49:41,anacmacho,"fr thooo",https://twitter.com/anacmacho/status/1275305005306830854
2020-06-23 05:49:37,Jaycee_Hower,"Lockjaw is something SERIOUSSS",https://twitter.com/Jaycee_Hower/status/1275304988361797632
2020-06-23 05:49:37,Royalt2001,"Brent Faiyaz is a whole vibe",https://twitter.com/Royalt2001/status/1275304986243747852
2020-06-23 05:49:37,Zoyamilena,"Job come but good gone Can't we have old can friends good https://twitter.com/Gonghive24/status/1275302818136522754 …",https://twitter.com/Zoyamilena/status/1275304984788086784
2020-06-23 05:49:32,ohitsyawna,"lil durk - broke up in Miami, been my favorite song for a min",https://twitter.com/ohitsyawna/status/1275304965100232704
2020-06-23 05:49:30,andreu_k,"Uryuu was too pretty for those peasants",https://twitter.com/andreu_k/status/1275304956820627457
2020-06-23 05:49:30,TimahJ_,"I work at target. They are right! Lol",https://twitter.com/TimahJ_/status/1275304955314872320
2020-06-23 05:49:28,apeksha008,"can someone from Pakistan just marry me already so that I can visit Pakistan and buy all the aesthetic stuff.",https://twitter.com/apeksha008/status/1275304949543366658
2020-06-23 05:49:27,smartmouthlayy,"it’s hard to say fuck dat nigga when you wanna fuck dat nigga",https://twitter.com/smartmouthlayy/status/1275304945676365825
2020-06-23 05:49:26,ttarx_,"Heartbuuuuurn",https://twitter.com/ttarx_/status/1275304940106383361
2020-06-23 05:49:24,Anastasiaviviii,"Inget",https://twitter.com/Anastasiaviviii/status/1275304933563105281
2020-06-23 05:49:21,middlechildsy,"@AugustAlsina said give me all your flaws, don't care you're beautiful.. Work on me, ima work on you please #worktodo",https://twitter.com/middlechildsy/status/1275304919738863616
2020-06-23 05:49:20,JerbearFreeman,"Wait stop I told myself earlier that I’d pay attention to her because she stopped acting up but nvm",https://twitter.com/JerbearFreeman/status/1275304914697089029
2020-06-23 05:49:19,mutebiijesse,"You won't be laughing when I've acquired it boss!",https://twitter.com/mutebiijesse/status/1275304911266332672
2020-06-23 05:49:18,aja0811_,"we need to find something we good at",https://twitter.com/aja0811_/status/1275304908741206016
2020-06-23 05:49:18,imyourhwall,"THIS MAN https://twitter.com/snoopywooshin/status/1273151740343472128 …",https://twitter.com/imyourhwall/status/1275304908716154882
2020-06-23 05:49:18,lifeasamaya,"i need some gas",https://twitter.com/lifeasamaya/status/1275304905981538304
2020-06-23 05:49:12,H_neyyB,"I know i shouldn’t be jealous of a cat but my cat just ditches me when he sees his gf.",https://twitter.com/H_neyyB/status/1275304883676016640
2020-06-23 05:49:12,xyasmineee,"Currently my fav song https://twitter.com/xyasmineee/status/1275299094324482054 …",https://twitter.com/xyasmineee/status/1275304882925375488
2020-06-23 05:49:06,MrYoungPoe,"I love them yellas!!!",https://twitter.com/MrYoungPoe/status/1275304856283238400
2020-06-23 05:49:04,_iJanae,"Mother Nature",https://twitter.com/_iJanae/status/1275304847621926912
2020-06-23 05:49:00,Nahleelah,"Idk but I really hate when people wear 13’s especially boys. Anybody really",https://twitter.com/Nahleelah/status/1275304830165106688
2020-06-23 05:48:58,pndgetsmewet1,"Funniest shit I done seen but also very sad",https://twitter.com/pndgetsmewet1/status/1275304821407600641
2020-06-23 05:48:57,macaylanicole3,"I might have to fuck around and empty a whole tube of orajel into my mouth",https://twitter.com/macaylanicole3/status/1275304818265985026
2020-06-23 05:48:53,thetitsgc,"wo woman",https://twitter.com/thetitsgc/status/1275304802948395009
2020-06-23 05:48:48,rurusama9,"I got a problem with qipao cosplays recently..... I love it and I want all of them",https://twitter.com/rurusama9/status/1275304782735925248
